rank,uri,artist_names,track_name,source,peak_rank,previous_rank,weeks_on_chart,streams
1,"spotify:track:0LTwdL5yZ6YOTEGUQPFuSN","Tito Double P","ROSONES","Double P Records",1,1,5,"13342533"
2,"spotify:track:63EQbNhgaih4yg5412usWG","Neton Vega","Loco","Josa Records",2,9,3,"11192503"
3,"spotify:track:7sd6zMrgGpEa7NkQm9TRrg","Tito Double P","NADIE","Double P Records",2,4,7,"11131505"
4,"spotify:track:4OLT65TRsOx3Iv1TlCcQVb","Gabito Ballesteros, Natanael Cano, Luis R Conriquez, Neton Vega","Presidente","Los CT Records",2,2,12,"10764383"
5,"spotify:track:0hfXHqWhOpbR9YQmQojDMN","Peso Pluma","gervonta","Double P Records",5,7,5,"10103746"
6,"spotify:track:1cOboCuWYI2osTOfolMRS6","Oscar Maydon, Fuerza Regida","Tu Boda","Rancho Humilde/Sony Music Latin",1,3,15,"9871633"
7,"spotify:track:5lKFO0PrOC9jmOlPEdjHsL","Tito Double P, Peso Pluma","DOS DÍAS","2024 Double P Records",2,5,20,"9593608"
8,"spotify:track:3D24ErT1MMmUfXWotSj2A2","Fuerza Regida, Grupo Frontera","ME JALO","Rancho Humilde/Streetmob Records/Grupo Frontera/Sony Music Latin",8,13,3,"8345981"
9,"spotify:track:6X6m4xmdFcz31p1h7Qg68c","Tito Double P","EL LOKERON","2024 Double P Records",1,6,20,"7992102"
10,"spotify:track:6x59lSlNU7TvsJZy7134uC","Jorsshh, Fuerza Regida","ROSONES","Street Mob Records",9,12,8,"7612882"
11,"spotify:track:0NsGFMIo2aNbAkJu48ndaf","Chino Pacas","Morena Canela","Street Mob Records/PFL/Geffen Records",7,11,10,"7090197"
12,"spotify:track:3sK8wGT43QFpWrvNQsrQya","Bad Bunny","DtMF","Rimas Entertainment LLC.",12,-1,1,"6633315"
13,"spotify:track:43558Td2trz7O0chZYohEE","Natanael Cano, Nueva H","Amapola","WEA Latina",8,8,5,"6499554"
14,"spotify:track:3IEvQ1CzszUJtTRLmmMJ2X","Tito Double P, Junior H","5-7","2024 Double P Records",10,17,20,"6382221"
15,"spotify:track:6HrALJOMsfPCCbUo5cJCON","Tito Double P, Chino Pacas","ESCAPATE","2024 Double P Records",3,10,20,"6253947"
16,"spotify:track:2lAUq68F2bt7Kc218n9FPp","Tito Double P, Grupo Frontera","AY MAMÁ","2024 Double P Records",7,15,20,"6095040"
17,"spotify:track:6YOfGIE6iFxC7G8OlGGvzW","Junior H","ROCKSTAR","WEA Latina",7,14,66,"5933417"
18,"spotify:track:2aYZaN5SmkRDLsrrV8GkBQ","Peso Pluma, Neton Vega","LA PATRULLA","2024 Double P Records",1,16,29,"5515784"
19,"spotify:track:0iKo4pNNjHHdKUcFARlfCa","Bad Bunny","EL CLúB","Rimas Entertainment LLC.",19,62,5,"5459664"
20,"spotify:track:2lTm559tuIvatlT1u0JYG2","Bad Bunny","BAILE INoLVIDABLE","Rimas Entertainment LLC.",20,-1,1,"5399997"
21,"spotify:track:0l0vcZMU7AOeQmUIREoI2U","Rauw Alejandro, Bad Bunny","Qué Pasaría...","Sony Music Latin/Duars Entertainment",9,19,8,"5349644"
22,"spotify:track:5LhI8m7n8xlQmNe3b7Rwis","Natanael Cano, Oscar Maydon","Madonna","WEA Latina",1,18,44,"5024829"
23,"spotify:track:5TFD2bmFKGhoCRbX61nXY5","Bad Bunny","NUEVAYoL","Rimas Entertainment LLC.",23,-1,1,"4955479"
24,"spotify:track:1YYfyJ2yCvGFCxwjsIqEK9","Rauw Alejandro, Romeo Santos","Khé?","Sony Music Latin/Duars Entertainment",11,23,8,"4846131"
25,"spotify:track:59D4DOkspUbWyMmbAPQkxZ","Bad Bunny","VOY A LLeVARTE PA PR","Rimas Entertainment LLC.",25,-1,1,"4721354"
26,"spotify:track:2Oj3iCVLQgwjwRF9VHo7gt","Clave Especial, Fuerza Regida","No Pasa Nada","WEA Latina",20,20,12,"4521828"
27,"spotify:track:4Ndjd6DhKIC5IPoBIrMQuX","Carin Leon, Gabito Ballesteros","Ese Vato No Te Queda","Socios Music, LLC",27,27,11,"4495997"
28,"spotify:track:5GTBdEjZe7zEDp1N0eCZE4","Peso Pluma, Estevan Plazola","HOLLYWOOD","2024 Double P Records",16,29,29,"4440067"
29,"spotify:track:1Q9Efnm5csdCMFynISxL2x","Bad Bunny, RaiNao","PERFuMITO NUEVO","Rimas Entertainment LLC.",29,-1,1,"4309444"
30,"spotify:track:41EOhpn50qvd8iZSKw531W","Peso Pluma, Tito Double P","LOS CUADROS","2024 Double P Records",6,25,22,"4248783"
31,"spotify:track:1C84d9abZVKWHT2YYpoean","Luis R Conriquez, Neton Vega","Si No Quieres No","Kartel Music",1,21,43,"4188865"
32,"spotify:track:7AysIqSEDiwP4CUsAXJwrk","Tito Double P, Natanael Cano","PRIMO","2024 Double P Records",11,26,27,"4148323"
33,"spotify:track:7qXptgpZGo8AFPhJCBVLFE","Tito Double P, Neton Vega","LINDA","2024 Double P Records",11,31,32,"4142663"
34,"spotify:track:6WatFBLVB0x077xWeoVc2k","KAROL G","Si Antes Te Hubiera Conocido","Bichota/Interscope Records",3,33,29,"4070683"
35,"spotify:track:4wJ5Qq0jBN4ajy7ouZIV1c","ROSÉ, Bruno Mars","APT.","Atlantic Records",33,41,12,"4010719"
36,"spotify:track:2ss1LK5Kfnjo5EUaCbsgZM","Clave Especial, Luis R Conriquez","No Son Doritos","WEA Latina",23,32,14,"4005068"
37,"spotify:track:5WEF0icHWmAZBBMglBd599","Bad Bunny, Chuwi","WELTiTA","Rimas Entertainment LLC.",37,-1,1,"3985622"
38,"spotify:track:2plbrEY59IikOBgBGLjaoe","Lady Gaga, Bruno Mars","Die With A Smile","Interscope",25,38,21,"3982417"
39,"spotify:track:7d6yK8v8J484SWH5prIQiE","Bad Bunny, Omar Courtz, Dei V","VeLDÁ","Rimas Entertainment LLC.",39,-1,1,"3964438"
40,"spotify:track:5AH31dDNgxCMGDdxubNNn4","Fuerza Regida","NEL","Rancho Humilde/Street Mob Records",2,34,24,"3936355"
41,"spotify:track:6RcAHyC5sAUIbPTkhOQwd8","Junior H","Y LLORO","WEA Latina",5,24,66,"3845976"
42,"spotify:track:6J5kc12BW5HuP3d7C3vvx8","Bad Bunny","EoO","Rimas Entertainment LLC.",42,-1,1,"3803728"
43,"spotify:track:0O3U5iwTbiXCREMkvotJuN","Grupo Frontera, Grupo Firme","EL AMOR DE SU VIDA","Grupo Frontera",5,22,75,"3778601"
44,"spotify:track:1cZHUhGz7xJ8c4szDipipd","Victor Mendivil, Oscar Maydon","Mejores Jordans","Rico o Muerto Music LLC",9,37,23,"3694669"
45,"spotify:track:4ZOkfHC38nxSeSqzGE5HFr","Junior H","PIÉNSALO","WEA Latina",9,36,28,"3666031"
46,"spotify:track:14QaXYIK3K3QPtezqxRRPN","Bad Bunny","PIToRRO DE COCO","Rimas Entertainment LLC.",46,89,2,"3607714"
47,"spotify:track:02cRoSfWU3RJNFyU3o4lhV","Peso Pluma, Oscar Maydon","SANTAL 33","2024 Double P Records",8,35,29,"3588854"
48,"spotify:track:2CshODtf7iwe3pKlPmEWF5","Junior H","TRES BOTELLAS","WEA Latina",26,83,66,"3586599"
49,"spotify:track:1wsDxqEDpsvNCatbXHjOje","Tito Double P","BLANCA ROSITA Y MARIA","2024 Double P Records",20,39,16,"3575580"
50,"spotify:track:51qYdMBxt9mFbtZBzq1Yfi","Julión Álvarez y su Norteño Banda","Regalo De Dios","UMLE - Fonovisa",3,30,54,"3514672"
51,"spotify:track:0zLA16D7GXoT8K7XFaiCv3","Tito Double P, Armenta","TU SI","2024 Double P Records",43,46,12,"3489233"
52,"spotify:track:0BiDnJFB3TlRB6aji7jUz3","Julión Álvarez y su Norteño Banda","Rey Sin Reina","Copar Music, Inc",2,28,18,"3482898"
53,"spotify:track:5E3T0hZ77NXXUtXJocRIOc","Victor Valverde, JR Torres","El Mayor de los Ranas","Vim Music",47,47,9,"3475348"
54,"spotify:track:1haJsMtoBhHfvuM7XWuT3W","Junior H, Peso Pluma","El Azul","WEA Latina",3,67,100,"3401313"
55,"spotify:track:4MUrUT38U98olfnyzMBCzm","Bad Bunny","KLOuFRENS","Rimas Entertainment LLC.",55,-1,1,"3333915"
56,"spotify:track:4c2Pc0NrfkesPR0jff6q3F","Bad Bunny","KETU TeCRÉ","Rimas Entertainment LLC.",56,-1,1,"3287288"
57,"spotify:track:3s0rq0VmyDLZKjAnEjrQIZ","Fuerza Regida, Grupo Frontera, Oscar Maydon, Armenta","AURORA (feat. Armenta)","Rancho Humilde/Streetmob Records/Grupo Frontera/Sony Music Latin",35,44,3,"3227939"
58,"spotify:track:1PREzVLuDT6PSE9sej4wnV","Fuerza Regida, Grupo Frontera","COQUETA","Rancho Humilde/Streetmob Records/Grupo Frontera/Sony Music Latin",38,40,3,"3161484"
59,"spotify:track:79x7xtoCLpf6l32Zz6mWo4","Bad Bunny","BOKeTE","Rimas Entertainment LLC.",59,-1,1,"3086082"
60,"spotify:track:7tCuCjhxzjX2XCz4JiiAsp","Bad Bunny","TURiSTA","Rimas Entertainment LLC.",60,-1,1,"3034385"
61,"spotify:track:3FqUPvubYeRCMsdJ02QyZR","Fuerza Regida","TÚ NAME","Rancho Humilde/Street Mob Records",4,42,48,"2933309"
62,"spotify:track:7bywjHOc0wSjGGbj04XbVi","Feid, ATL Jacob","LUNA","UMLE - Latino",13,59,58,"2901931"
63,"spotify:track:2HSqF98IZ3OIGVUHHUwGdV","LEGADO 7, Kane Rodriguez","On D Gas","Sony Music Latin/Columbia/Lumbre Music",37,51,13,"2779748"
64,"spotify:track:7l3UuUZEqvxjhKYD2QBxOU","Bellakath, El Malilla, El Bogueto, Andres Castillo, La Dinastia, Riky Produce","Vaquero - Remix","DCM Records",13,53,21,"2773790"
65,"spotify:track:2a8yglXvNw07OWu4lO2ByG","Junior H","LA CHERRY","WEA Latina",30,96,53,"2768128"
66,"spotify:track:127UT7AiWflJwjXWUBBVTQ","Natanael Cano","O Me Voy O Te Vas","WEA Latina",12,55,65,"2738103"
67,"spotify:track:1yxwBHV8dqJw4tCw6hlyMw","Victor Mendivil, El Padrinito Toys","Un Pacto","Rico o Muerto Music LLC",48,60,6,"2728259"
68,"spotify:track:4Nf5EZ40JenjMUKXOiyRU5","Peso Pluma","NUEVA VIDA","Double P Records",35,52,81,"2726720"
69,"spotify:track:6fKvGaO8Dfntvx4thaXtak","Natanael Cano, Uriel Gaxiola, Ganggy, Victor Mendivil","Kamikaze (feat. Victor Mendivil)","WEA Latina",19,65,8,"2712291"
70,"spotify:track:6dOtVTDdiauQNBQEDOtlAB","Billie Eilish","BIRDS OF A FEATHER","Darkroom/Interscope Records",40,74,34,"2637853"
71,"spotify:track:0zNMdrDEs5N0JPQ7RYQZln","Ryan Castro, Peso Pluma, SOG","QUEMA","Sony Music Entertainment",21,61,62,"2474677"
72,"spotify:track:31REg67eoHJSvMLUcEmGNj","La Arrolladora Banda El Limón De Rene Camacho","El Final De Nuestra Historia","Universal Music Mexico",30,45,82,"2467282"
73,"spotify:track:6UiEpvKXPmLzi7UDMGzxeK","Herencia De Grandes","No Regreses","Rancho Humilde",73,95,2,"2467118"
74,"spotify:track:0qeIFEGRQqHoaJtLCl0U73","Myke Towers, benny blanco","DEGENERE 👑 (feat. benny blanco)","WEA Latina",40,56,11,"2461081"
75,"spotify:track:0fea68AdmYNygeTGI4RC18","J Balvin, Bad Bunny","LA CANCIÓN","Universal Music Latino / Rimas",1,120,289,"2459700"
76,"spotify:track:0JDrG1g5HXbfgGtRKT0ofH","Natanael Cano","Diamantes","WEA Latina",34,58,70,"2445231"
77,"spotify:track:29vIEdxgMT9H1fnBMecWjA","Julión Álvarez y su Norteño Banda","Lo Tienes Todo","UMLE - Fonovisa",15,48,59,"2423484"
78,"spotify:track:3G7agPwWfcORnWCAGMDOpm","Bad Bunny","LA MuDANZA","Rimas Entertainment LLC.",78,-1,1,"2389011"
79,"spotify:track:6VNXmo59yDYgcwLS17UNAW","Bad Bunny, Los Pleneros de la Cresta","CAFé CON RON","Rimas Entertainment LLC.",79,-1,1,"2375678"
80,"spotify:track:1jIirpaACmgb4nTYfywys4","Peso Pluma, Tito Double P","BELANOVA","2024 Double P Records",34,75,29,"2357198"
81,"spotify:track:2yzshFeBIwH8tWIqHEFLeD","Grupo Frontera, Bad Bunny","un x100to","Grupo Frontera",2,80,91,"2354709"
82,"spotify:track:0Jps9bc30C1BCr0UUAXUlc","Fuerza Regida, Grupo Frontera","SOS","Rancho Humilde/Streetmob Records/Grupo Frontera/Sony Music Latin",37,54,3,"2333054"
83,"spotify:track:5ozZHuU1nWqq2UaFM9xa5A","Leo Dan","Cómo Te Extraño Mi Amor","Columbia",83,148,7,"2314663"
84,"spotify:track:2UkVLIGCGNuyMDPM4hz6dQ","Victor Mendivil, Luis R Conriquez","Un Scar","Rico o Muerto Music LLC",38,90,8,"2313071"
85,"spotify:track:2ieCamPuL76ipKH1cLH7tH","Luis R Conriquez, Tito Double P","Sin Tanto Royo","Kartel Music",56,73,45,"2310619"
86,"spotify:track:4jhDnHwl6llj46pzUuaON3","El Malilla, Maury","Mami Tú","El Malilla",65,84,7,"2296696"
87,"spotify:track:03MqlviAY1kvFqdaGl5Mhg","Julión Álvarez y su Norteño Banda","Cero Empatía","Copar Music, Inc",27,66,11,"2285974"
88,"spotify:track:61vlMpyFxXmxvahvA7Bi3z","Calle 24, Chino Pacas, Fuerza Regida","QUE ONDA","WEA Latina",1,78,71,"2280314"
89,"spotify:track:25anKrtqXPngMi3IoF5UhC","Julión Álvarez y su Norteño Banda","Vibra Perfecta","Copar Music, Inc",48,64,11,"2260050"
90,"spotify:track:7oJ3N7oVSwoa5sdpg6NCE6","La Receta","Lo Que Hay X Aquí","DALE PLAY Records / Solido Records",13,63,25,"2256317"
91,"spotify:track:7pdV3v2uiSdhryajFIeLJJ","Grupo Los Chavalos","Con Todo Respetillo","Rancho Humilde",91,140,7,"2227313"
92,"spotify:track:33Nj9AdncSmHbCN3QeSZTL","Oscar Maydon, Junior H","Volver Al Futuro","Rancho Humilde",1,77,32,"2226193"
93,"spotify:track:3fJHbMUnzceimOnNjp63fF","Carin Leon","Primera Cita","Socios Music, LLC",2,76,89,"2212990"
94,"spotify:track:0R23grfg7MaNE9TUpNNQUU","Tito Double P, Eslabon Armado","LA TROKA","2024 Double P Records",65,82,15,"2205031"
95,"spotify:track:24teIhDYO2RocTA2v5dY0r","Junior H","Extssy Model","WEA Latina",23,49,117,"2182604"
96,"spotify:track:7xJ1scIZpc33lZ7HpcrjCY","Grupo Firme","El Beneficio De La Duda","Music VIP Entertainment Presenta Grupo Firme",5,71,32,"2157921"
97,"spotify:track:6KOnLTb1xLfKDAjMC43I76","Natanael Cano, Oscar Maydon","Giza","WEA Latina",5,50,26,"2138730"
98,"spotify:track:1OZpgVRQKkxcoeEocqTMRZ","Julión Álvarez y su Norteño Banda","Pongámonos De Acuerdo","UMLE - Fonovisa",27,68,122,"2101666"
99,"spotify:track:3dpBkXMbRdDQ6ZhcxFufQp","Jasiel Nuñez, Peso Pluma, Tito Double P","AMIRI","Double P Records",25,87,9,"2098719"
100,"spotify:track:1Q4IBp6DOLrLiakvcuobnT","Fuerza Regida, Grupo Frontera","0 SENTIMIENTOS","Rancho Humilde/Streetmob Records/Grupo Frontera/Sony Music Latin",42,69,3,"2047295"
101,"spotify:track:6Z0ybnsUBhbZ9ZjPW64eoF","Belanova","Rosa Pastel","Universal Music Mexico",22,88,112,"2032731"
102,"spotify:track:0hkoQgoqic1qQtxPOudmrx","emmanuellcortess_","Amor","Emmanuel Cortes",20,79,31,"2032626"
103,"spotify:track:4JLZyyWuvvse6xKiZqRdau","Neton Vega","Todo a Su Tiempo","Josa Records",103,118,4,"2028798"
104,"spotify:track:3w1h7uNU1Dfk2tOaHiIGat","Fuerza Regida","PERO NO TE ENAMORES","Rancho Humilde/Street Mob Records",40,94,22,"2024508"
105,"spotify:track:1Hg0e997pObvZ91w1FCPFk","Bad Bunny","LO QUE LE PASÓ A HAWAii","Rimas Entertainment LLC.",105,-1,1,"2017254"
106,"spotify:track:1EZk1gal98tb4lNI862KzO","Natanael Cano","Pacas De Billetes","WEA Latina",18,81,78,"2003481"
107,"spotify:track:179TZwPk0txEvjkraVTVKo","Alfredo Olivas","El Precio De La Soledad","Camiolvi",42,57,122,"2001955"
108,"spotify:track:5CE77TLqLjOQ2qgAobzPds","Victor Mendivil","GOET","Rico o Muerto Music LLC",56,91,30,"1998002"
109,"spotify:track:1uGUbgZuO1kD1JZ0UeFupN","Grupo Frontera","Hecha Pa' Mí","Grupo Frontera",24,72,14,"1977938"
110,"spotify:track:4zbEItKoaRId1vRZkoO0Uh","Danny Ocean, Kapo","Imagínate","Atlantic Records",110,-1,1,"1948782"
111,"spotify:track:6oCQOBXMHc1z2JRx1Dv6tG","Grupo Frontera, Oscar Maydon","¿Qué Te Parece?","Grupo Frontera",54,92,7,"1927077"
112,"spotify:track:4JWJ5BFdXnyV7BzTLj7dfJ","Tito Double P, Los Dareyes De La Sierra","MR INTERNACIONAL","2024 Double P Records",68,111,20,"1920414"
113,"spotify:track:2awKQgW88iq9jFM54VaCAp","La Quinta Estacion","El Sol No Regresa","Ariola",87,-1,110,"1906935"
114,"spotify:track:6TBzRwnX2oYd8aOrOuyK1p","Oscar Maydon, Junior H","Fin de Semana","Rancho Humilde",4,102,91,"1902880"
115,"spotify:track:7iQXYTyuG13aoeHxGG28Nh","Bad Bunny, Feid","PERRO NEGRO","Rimas Entertainment LLC",4,128,65,"1894166"
116,"spotify:track:2eQFYGegTZaObk2kuBz83Z","Rauw Alejandro","Tú Con Él","Sony Music Latin/Duars Entertainment",37,108,8,"1891987"
117,"spotify:track:0OG0qjJ9gN85kWZtIzW5uS","Junior H","LOKERON X AMOR","WEA Latina",73,86,18,"1878393"
118,"spotify:track:0dJ8BG6MjGBX2RwJbJOVGV","Los Gemelos De Sinaloa","AMOR","Rancho Humilde",112,125,6,"1872086"
119,"spotify:track:0KHDthR0XvPoeJaqBc7Sg5","La Arrolladora Banda El Limón De Rene Camacho","Ya Te Perdí La Fe","UMLE - Disa",86,93,14,"1848991"
120,"spotify:track:3KZCP2StVGdWkOKyRZNWA4","Plan B","Es un Secreto","Pina Records",34,109,148,"1835034"
121,"spotify:track:6hA12wp8wT93WpLwNYUmOq","Fuerza Regida, Bellakath","FRESITA","Rancho Humilde/Street Mob Records",36,110,22,"1821813"
122,"spotify:track:3GSMdtJphymHEsR8K9jT5Q","León Larregui","Locos","Universal Music Mexico",56,162,353,"1818678"
123,"spotify:track:25VVwcwK5OKa4XMsVmsmJ0","La Arrolladora Banda El Limón De Rene Camacho","Aquí Hay Para Llevar","Disa",93,107,7,"1816379"
124,"spotify:track:1GOvdGVrasTEG5JfDs8V5f","Cardenales De Nuevo León","Mi Cómplice","Universal Music Mexico",70,70,27,"1796236"
125,"spotify:track:4ZplewvZRLFcfBa5uyBbhd","Cardenales De Nuevo León","Belleza De Cantina","Universal Music Mexico",43,43,243,"1794191"
126,"spotify:track:0lbDzTINTToToBpkrnQT2t","Fuerza Regida, Manuel Turizo","UNA CERVEZA","Rancho Humilde/Street Mob Records",20,117,55,"1790995"
127,"spotify:track:0SRddBTphQwQcfqw4Br1uX","León Larregui","Brillas","EMI México",43,167,409,"1781787"
128,"spotify:track:3kx21xR6IboC9HVdajgBoc","Fuerza Regida","SABOR FRESA","Rancho Humilde/Street Mob Records",2,113,81,"1780476"
129,"spotify:track:4NUt1fcnO9aQAELBgXq3Kr","Alejandro Fernández","Me Dediqué a Perderte","Columbia",73,158,353,"1778341"
130,"spotify:track:1xgWArLVFD1AKsLzftZYc2","Oscar Maydon, Gabito Ballesteros, Chino Pacas","Elvira","Rancho Humilde",5,98,55,"1767300"
131,"spotify:track:6CRRlfXDdhsL6vih3J5xco","Alfredo Olivas","En Definitiva","Camiolvi",78,133,137,"1763083"
132,"spotify:track:3d0er23tJIl1H2j8ZvtDww","El Bogueto, Yung Beef","Cuando No Era Cantante","Candela Music",131,131,2,"1759881"
133,"spotify:track:7MmrcXVA7A5zZ2CbDuGHNa","Rels B","A Mí","DALE PLAY Records / Flakk Team",68,150,307,"1738773"
134,"spotify:track:1IzGf1RLpHuImi5lsCD3T9","Duelo","Puño De Diamantes","LA BONITA MUSIC",87,112,68,"1736032"
135,"spotify:track:5RqSsdzTNPX1uzkmlHCFvK","KAROL G, Peso Pluma","QLONA","Bichota/Interscope Records",2,139,74,"1716511"
136,"spotify:track:3UIENhLRdFIOuRan92cAQu","Duncan Dhu","En algún lugar","DRO/EastWest Spain",123,-1,25,"1706706"
137,"spotify:track:3lCxAT7Q8VOxL39y3H62hF","Herencia De Grandes","Como Duele El Amor","Rancho Humilde",137,174,2,"1703180"
138,"spotify:track:3GWUv0TDO5E3cHfsxYeptt","Peso Pluma, Kenia OS","TOMMY & PAMELA","2024 Double P Records",5,136,29,"1701699"
139,"spotify:track:64my6WOkrygcpXKMLxxpi9","La Arrolladora Banda El Limón De Rene Camacho","Ya Es Muy Tarde","Universal Music Mexico",81,85,24,"1700962"
140,"spotify:track:1GtIK8iINes4gNt06F60NU","Alfredo Olivas","Vete","Fonovisa",28,99,80,"1699710"
141,"spotify:track:3qGkFQOEJ0w0SqnAXFeG2v","La Adictiva","Después de Ti, ¿Quién?","Sony Music Latin",114,114,33,"1699419"
142,"spotify:track:4DnrAI8WyUY6gkOwl8GlPN","Alleh, Yorghaki","capaz (merengueton)","CONMUER LLC",142,-1,1,"1683194"
143,"spotify:track:4bw8mcDUSRWfQo63ZTYRnU","Maluma, Carin Leon","Según Quién","Sony Music Latin",6,103,73,"1663197"
144,"spotify:track:6CvTEtGagmzQvkUzzyKR9k","Fuerza Regida, Marshmello","HARLEY QUINN","Rancho Humilde/Street Mob Records",1,130,64,"1662415"
145,"spotify:track:2Nk3gXgekore0lfB7PCnub","Alfredo Olivas","El Paciente","Camiolvi",59,100,236,"1662214"
146,"spotify:track:0Sr7ssScx54yxdM2ols7nW","Omar Courtz, De La Rose","Q U E V A S H A C E R H O Y ?","Mr. 305 Records / Rimas Entertainment",24,165,15,"1658578"
147,"spotify:track:0fKK51bU6lcCCwdNnv64t3","Blessd, Anuel AA, Ovy On The Drums","DEPORTIVO","WEA Latina",147,-1,1,"1658021"
148,"spotify:track:2V9pPYbtIaxI4canNxsDrJ","Colmillo Norteño","Sueño Guajiro","Colmillo Norteño",104,123,5,"1655587"
149,"spotify:track:3IQU5PZDEIKayRyB0txMdC","Neton Vega, Luis R Conriquez","El Plumas","Josa Records",31,132,21,"1650567"
150,"spotify:track:46YjJXVXWHlQ21odKktg5e","Tainy, Bad Bunny","MOJABI GHOST","NEON16, LLC",15,-1,68,"1636330"
151,"spotify:track:2UW7JaomAMuX9pZrjVpHAU","Yng Lvcas, Peso Pluma","La Bebe - Remix","WM Mexico",2,-1,86,"1622506"
152,"spotify:track:2esZG2XFtuoWWA9AfDvSxy","FloyyMenor, Cris Mj","Gata Only","FloyyMenor under exclusive license to UnitedMasters LLC",3,149,48,"1617654"
153,"spotify:track:5HR7yfhSCeoOHRQN05XnZQ","Grupo Frontera, Carin Leon","QUE VUELVAS","Grupo Frontera",2,101,109,"1602349"
154,"spotify:track:7mXuWTczZNxG5EDcjFEuJR","Peso Pluma, Gabito Ballesteros, Junior H","LADY GAGA","Double P Records",1,121,81,"1602168"
155,"spotify:track:3rdAz1fbUfZxYgaCviYhRo","Rauw Alejandro","Todo De Ti","Sony Music Latin/Duars Entertainment",1,157,158,"1587142"
156,"spotify:track:6b6qi0ObycTK8hdrkgU21Y","Tito Double P, Neton Vega","CHINO","2024 Double P Records",49,142,20,"1576881"
157,"spotify:track:2TJKY0WSFufZOzbRNgl6zE","Alex Favela, Grupo Marca Registrada, Joaquin Medina","ELOVRGA","Rios Music/ Outerspace Music/ Boba Records Corporation",3,116,73,"1576360"
158,"spotify:track:4xv5AneqR0bTokomIPfGyT","Peso Pluma, Chino Pacas","MAMI","2024 Double P Records",26,155,29,"1560680"
159,"spotify:track:6j5LtifAnuTjTYvml61yFZ","Vicente Fernández","Un Millón de Primaveras","Columbia",29,106,36,"1549301"
160,"spotify:track:4HCtPbPSpUWCs96j8pcHBP","Cachirula, LOOJAN, El Malilla","BEIBY - Remix","Fabrika",160,181,2,"1546565"
161,"spotify:track:54zcJnb3tp9c5OVKREZ1Is","KAROL G","MI EX TENÍA RAZÓN","Bichota/Interscope Records",13,153,74,"1544956"
162,"spotify:track:6981hdSOqG8tP6xTqaySa1","Julión Álvarez y su Norteño Banda","Ojos Verdes","UMLE - Fonovisa",37,152,97,"1534721"
163,"spotify:track:1MGm3zOE0Ql0WWcU5ZvjOx","Xavi","La Diabla","Interscope Records",1,135,57,"1521043"
164,"spotify:track:2O3V4meZv0bEc1LPITGvcC","Eden Muñoz, COSME TADEO","La Nena","EMC Music / Sony Music Mexico",97,97,5,"1519816"
165,"spotify:track:35ISBknsCeZQtq66xABI9g","Lola Young","Messy","Universal-Island Records Ltd.",165,-1,1,"1519005"
166,"spotify:track:5SHXikmjPwChjvpVIeYkMf","Oscar Maydon, Junior H, Gabito Ballesteros","Skin de Bandida","Rancho Humilde",14,119,68,"1514575"
167,"spotify:track:6aommJFM8i3iT4inKuDSXh","Jósean Log","Chachachá","Jósean Log",119,-1,86,"1510388"
168,"spotify:track:4PpuZIMmeng6qPicveSI22","Jósean Log","Beso","Jósean Log",167,-1,4,"1507683"
169,"spotify:track:3HgvO4B5LLmdPOT2d8cSZd","LAGOS, Danny Ocean","Mónaco","WM Mexico",12,105,185,"1507016"
170,"spotify:track:0lpxDRCONr2FJRqcM3Q74z","Victor Cibrian, Gabito Ballesteros","Porque Te Vas","Rancho Humilde",15,143,38,"1506053"
171,"spotify:track:7tI8dRuH2Yc6RuoTjxo4dU","Jimin","Who","BIGHIT MUSIC",34,170,25,"1504868"
172,"spotify:track:6Z7f0BXDLI8k4CHR9KJdAD","La Arrolladora Banda El Limón De Rene Camacho","Mi Segunda Vida","UMLE - Disa",131,160,17,"1503780"
173,"spotify:track:3OJDtCdYs8QJnui708tEU3","Shakira","Soltera","Sony Music Latin",33,156,15,"1502166"
174,"spotify:track:6DUdDIRgLqCGq1DwkNWQTN","Maluma","Borro Cassette","Sony Music Latin",17,159,119,"1482643"
175,"spotify:track:0FxtC8uFapbpDBliAU3sd6","Natanael Cano, Peso Pluma, Gabito Ballesteros","AMG","WEA Latina",1,138,101,"1481806"
176,"spotify:track:4H6o1bxKRGzmsE0vzo968m","Yuridia, Ángela Aguilar","Qué Agonía","Sony Music México",5,-1,105,"1477679"
177,"spotify:track:5LHPcY9yd0hWVFIW4yfOCJ","Chuyin, Fuerza Regida, Jorsshh, Calle 24","Pika Pika","Street Mob Records",177,-1,1,"1477009"
178,"spotify:track:7gG2xMiojQrsTUGa7qeQoo","El Bogueto, Yeri Mua, Uzielito Mix","Nena Moxita","Candela Music",40,145,8,"1462904"
179,"spotify:track:1UL2Sn9KX8StSDOp8ZEAOC","Doble ONE Flow Letal","Mi Kryptonita","CUELLO BLANCO",25,194,40,"1462165"
180,"spotify:track:1yoMvmasuxZfqHEipJhRbp","Maluma","Hawái","Sony Music Latin",1,193,137,"1459131"
181,"spotify:track:6lDEa9p8HbnxiCMaj9YGUy","Neton Vega","El Gerry","Josa Records",181,-1,1,"1458435"
182,"spotify:track:5Uptvz6j1sjDKxidAcnH2L","Cris Mj","SI NO ES CONTIGO","Sonar LLC.",15,163,33,"1458043"
183,"spotify:track:62clthR0fZmLbxeqxVJatQ","Sin Bandera","Que Lloro","Epic",160,-1,4,"1449906"
184,"spotify:track:6Q2UhuLaPUlC9VANQOjPxo","Gabito Ballesteros, Junior H","Neta","Los CT Records",20,176,33,"1449013"
185,"spotify:track:1EKZmfqveHKe78Isfk07w4","Grupo Frontera, Junior H","EN ALTAVOZ","Grupo Frontera",58,126,45,"1448488"
186,"spotify:track:7fdGqeuvSLVNMwFb6mDbXp","Gera MX","Nunca Te Pude Alcanzar","Gera MX",186,-1,1,"1439938"
187,"spotify:track:6Pur3hWy6Nzc27ilmsp5HA","Los Enanitos Verdes","Lamento Boliviano","EMI Latin",84,196,263,"1436869"
188,"spotify:track:3E8xyYdIPpiH2wNEozE68I","Standly","Pégate","Standly",147,-1,5,"1435406"
189,"spotify:track:1lKI9y1DL6QnYTZguVmACX","Luis Miguel","La Media Vuelta","WEA Latina",71,137,134,"1434732"
190,"spotify:track:505v13epFXodT9fVAJ6h8k","KAROL G","AMARGURA","BICHOTA RECORDS / INTERSCOPE RECORDS / UNIVERSAL MUSIC LATINO",38,186,86,"1428489"
191,"spotify:track:42wdz3j7gstgUuhoFLCXqd","FloyyMenor","PELIGROSA","FloyyMenor under exclusive license to UnitedMasters LLC",65,188,20,"1424679"
192,"spotify:track:4ygQ5wSuzzNRevVjup1qV2","Luis R Conriquez, Tony Aguirre, Peso Pluma","El Gavilán","Kartel Music / Prajin Music",12,178,99,"1423834"
193,"spotify:track:1JSTJqkT5qHq8MDJnJbRE1","The Police","Every Breath You Take","Polydor Records",119,180,158,"1418496"
194,"spotify:track:5g7sDjBhZ4I3gcFIpkrLuI","Bruno Mars","Locked out of Heaven","Atlantic Records",115,-1,12,"1408174"
195,"spotify:track:76kelNDs1ojicx1s6Urvck","Grupo Frontera","NO SE VA - EN VIVO","Grupo Frontera",1,122,115,"1407511"
196,"spotify:track:1uFW6czrHk5PsK3s6gOI7C","Rauw Alejandro, Laura Pausini","Se Fue","Sony Music Latin/Duars Entertainment",25,161,8,"1406742"
197,"spotify:track:4MAv7MqIlcaTBHGiUXIWiw","Cris Mj, Kali Uchis, JHAYCO","SI NO ES CONTIGO - REMIX","SONAR LLC",103,-1,10,"1404410"
198,"spotify:track:1RzjXhgnzqb3dMa5852itx","Peso Pluma, Tito Double P","LA PEOPLE","Double P Records",8,173,74,"1404301"
199,"spotify:track:0eeX8L0DWvGth1F6xVkvv7","Myke Towers, Bad Bunny","ADIVINO","WEA Latina",17,-1,21,"1395172"
200,"spotify:track:4OwhwvKESFtuu06dTgct7i","Marc Seguí, Rauw Alejandro, Pol Granch","Tiroteo - Remix","WEA Latina",10,-1,102,"1392607"
