rank,uri,artist_names,track_name,source,peak_rank,previous_rank,weeks_on_chart,streams
1,"spotify:track:5LhI8m7n8xlQmNe3b7Rwis","Natanael Cano, Oscar Maydon","Madonna","WEA Latina",1,1,6,"15692042"
2,"spotify:track:2DbV9TSdeGr5FobCFDRzvq","Bizarrap, Natanael Cano","Natanael Cano: Bzrp Music Sessions, Vol. 59","DALE PLAY Records",2,2,3,"12849243"
3,"spotify:track:0dEAiKNbHt4mrjjoiL0loc","Xavi","Corazón de Piedra","Interscope Records",2,3,4,"11660800"
4,"spotify:track:6XjDF6nds4DE2BBbagZol6","FloyyMenor, Cris Mj","Gata Only","FloyyMenor under exclusive license to UnitedMasters LLC",4,5,10,"10405661"
5,"spotify:track:61OsemtnuPJ5R0LMEkw60S","Bizarrap, Natanael Cano","Entre las de 20","DALE PLAY Records",5,6,3,"9158321"
6,"spotify:track:7EWtB4NKYY3NqBl31PVip9","Peso Pluma, Tito Double P, Joel De La P","LA PEOPLE II","Double P Records",3,4,4,"8999557"
7,"spotify:track:0R6NfOiLzLj4O5VbYSJAjf","Xavi","La Diabla","Interscope Records",1,7,20,"8549602"
8,"spotify:track:3FqUPvubYeRCMsdJ02QyZR","Fuerza Regida","TÚ NAME","Rancho Humilde/Street Mob Records",7,8,10,"8167986"
9,"spotify:track:6YOfGIE6iFxC7G8OlGGvzW","Junior H","ROCKSTAR","WEA Latina",7,9,28,"7744721"
10,"spotify:track:51qYdMBxt9mFbtZBzq1Yfi","Julión Álvarez y su Norteño Banda","Regalo De Dios","UMLE - Fonovisa",3,13,16,"7456427"
11,"spotify:track:6RcAHyC5sAUIbPTkhOQwd8","Junior H","Y LLORO","WEA Latina",5,14,28,"7184178"
12,"spotify:track:4L1iecYPJR1qc9tz5Zjkw9","Gabito Ballesteros, Natanael Cano","El Boss","Los CT Records",8,10,3,"6905414"
13,"spotify:track:5XVdHRf4CAJ2Jm0uMIy5qY","Xavi","La Víctima","Interscope Records",2,11,30,"6745593"
14,"spotify:track:1C84d9abZVKWHT2YYpoean","Luis R Conriquez, Neton Vega","Si No Quieres No","Kartel Music",14,16,5,"6511474"
15,"spotify:track:6uIIdjYTxxpWOyWuVXrKQO","Calle 24, Chino Pacas, Fuerza Regida","Que Onda","Street Mob Records",1,12,33,"6418395"
16,"spotify:track:1xgWArLVFD1AKsLzftZYc2","Oscar Maydon, Gabito Ballesteros, Chino Pacas","Elvira","Rancho Humilde",9,15,17,"5980165"
17,"spotify:track:7bywjHOc0wSjGGbj04XbVi","Feid, ATL Jacob","LUNA","UMLE - Latino",13,17,20,"5495694"
18,"spotify:track:3QQAeMQbbjZXVFbF8DgFWT","Oscar Ortiz, Edgardo Nuñez","FIRST LOVE","Badsin Records, LLC",3,18,17,"5089253"
19,"spotify:track:4t46soaqA758rbukTO5pp1","Natanael Cano","Mi Bello Angel","WEA Latina",4,19,42,"5084444"
20,"spotify:track:29vIEdxgMT9H1fnBMecWjA","Julión Álvarez y su Norteño Banda","Lo Tienes Todo","UMLE - Fonovisa",17,25,21,"5064828"
21,"spotify:track:127UT7AiWflJwjXWUBBVTQ","Natanael Cano","O Me Voy O Te Vas","WEA Latina",12,22,27,"4802123"
22,"spotify:track:6CvTEtGagmzQvkUzzyKR9k","Fuerza Regida, Marshmello","HARLEY QUINN","Rancho Humilde/Street Mob Records",1,24,26,"4780776"
23,"spotify:track:0O3U5iwTbiXCREMkvotJuN","Grupo Frontera, Grupo Firme","EL AMOR DE SU VIDA","Grupo Frontera",5,29,37,"4683205"
24,"spotify:track:0lbDzTINTToToBpkrnQT2t","Fuerza Regida, Manuel Turizo","UNA CERVEZA","Rancho Humilde/Street Mob Records",24,30,17,"4464842"
25,"spotify:track:4bw8mcDUSRWfQo63ZTYRnU","Maluma, Carin Leon","Según Quién","Sony Music Latin",6,20,35,"4263409"
26,"spotify:track:4loIMejzvt11s97SGVEat8","Xavi, Los Dareyes De La Sierra","Poco A Poco","Interscope Records",7,23,29,"4256480"
27,"spotify:track:3kx21xR6IboC9HVdajgBoc","Fuerza Regida","SABOR FRESA","Rancho Humilde/Street Mob Records",2,21,43,"4248098"
28,"spotify:track:2GxrNKugF82CnoRFbQfzPf","Artemas","i like the way you kiss me","Artemas",28,50,3,"4226363"
29,"spotify:track:5RqSsdzTNPX1uzkmlHCFvK","KAROL G, Peso Pluma","QLONA","Bichota/Interscope Records",2,27,36,"4043789"
30,"spotify:track:7iUtQNMRB8ZkKC4AmEuCJC","Myke Towers","LA FALDA","WEA Latina",26,26,18,"4032625"
31,"spotify:track:4U20gQcVcjzY12xhLsXwXy","Luis R Conriquez, Jasiel Nuñez","GTA","Kartel Music",31,54,4,"4019559"
32,"spotify:track:1sXr6moCwVxwKEgSPxhVvF","Calle 24, Chino Pacas","Apaga El Cel","Street Mob Records",8,32,16,"3943792"
33,"spotify:track:4zfQER4owi8q6NL8Gg63Ya","Fuerza Regida","CRAZYZ","Rancho Humilde/Street Mob Records",20,33,22,"3833839"
34,"spotify:track:7mXuWTczZNxG5EDcjFEuJR","Peso Pluma, Gabito Ballesteros, Junior H","LADY GAGA","Double P Records",1,39,43,"3748642"
35,"spotify:track:6XaJfhwof7qIgbbXO5tIQI","Kali Uchis, Peso Pluma","Igual Que Un Ángel (with Peso Pluma)","Geffen Records",3,28,14,"3714985"
36,"spotify:track:7iQXYTyuG13aoeHxGG28Nh","Bad Bunny, Feid","PERRO NEGRO","Rimas Entertainment LLC",4,37,27,"3679422"
37,"spotify:track:1GtIK8iINes4gNt06F60NU","Alfredo Olivas","Vete","Fonovisa",28,47,42,"3474923"
38,"spotify:track:2TJKY0WSFufZOzbRNgl6zE","Alex Favela, Grupo Marca Registrada, Joaquin Medina","ELOVRGA","Rios Music/ Outerspace Music/ Boba Records Corporation",3,36,35,"3470325"
39,"spotify:track:4GvEuYAfJlICR2SpMDaBxQ","Jere Klein, Gittobeatz","ANDO","Jere Klein",37,40,22,"3392469"
40,"spotify:track:2y3TKxJAaIauybiS3GKHon","Yahir Saldivar","SC-9","DEL Records",34,34,5,"3377401"
41,"spotify:track:68viiGZoRbLCjsy5xD4VrU","Shakira, Grupo Frontera","(Entre Paréntesis)","Sony Music Latin",35,35,4,"3337070"
42,"spotify:track:1LfsvLFQprosUmrEtGPHAe","Remp, Oscar Maydon, Victor Mendivil","Don Dimadon","Rico o Muerto Music LLC",30,31,5,"3331403"
43,"spotify:track:4Nf5EZ40JenjMUKXOiyRU5","Peso Pluma","NUEVA VIDA","Double P Records",35,42,43,"3304530"
44,"spotify:track:05tGmdz9dVZ4yGqz4YJdPK","Christian Nodal, Peso Pluma","La Intención","Producciones Ladon, S.A de C.V.",9,41,12,"3303131"
45,"spotify:track:2DRGyAlo0ht15FGLTQPCCt","Adrian L Santos, Joaquin Medina","Ya No Estoy Dolido","Rancho Humilde",32,43,14,"3275872"
46,"spotify:track:5cWgwbui8BasfjCXvBZ7UA","Carin Leon, Grupo Frontera","Alch Si","SOCIOS MUSIC LLC",36,38,20,"3184357"
47,"spotify:track:0UbesRsX2TtiCeamOIVEkp","Fuerza Regida, Natanael Cano","Ch y la Pizza","Rancho Humilde/Street Mob Records",6,59,72,"3179836"
48,"spotify:track:2OWv3lRR8PtOVuHWzQNRs2","Peso Pluma, Junior H, Oscar Maydon","ROMPE LA DOMPE","2023 Double P Records",4,49,16,"3178418"
49,"spotify:track:3fJHbMUnzceimOnNjp63fF","Carin Leon","Primera Cita","Socios Music, LLC",2,45,51,"3096457"
50,"spotify:track:1RzjXhgnzqb3dMa5852itx","Peso Pluma, Tito Double P","LA PEOPLE","Double P Records",8,51,36,"3047147"
51,"spotify:track:05WVKTdZhlIMX4qqMLuo0f","Peso Pluma, Anitta","BELLAKEO","Double P Records",7,48,19,"2919825"
52,"spotify:track:1rXxK89X0XGpIdTB6CwiFu","Gabito Ballesteros","A Puro Dolor","Los CT Records",13,46,20,"2918143"
53,"spotify:track:1haJsMtoBhHfvuM7XWuT3W","Junior H, Peso Pluma","El Azul","WEA Latina",3,67,62,"2897544"
54,"spotify:track:3FvTHuefYV6TxE3Kseqno8","Gabito Ballesteros, Natanael Cano","LOU LOU","Los CT Records",3,44,26,"2878755"
55,"spotify:track:1OZpgVRQKkxcoeEocqTMRZ","Julión Álvarez y su Norteño Banda","Pongámonos De Acuerdo","UMLE - Fonovisa",27,69,84,"2863395"
56,"spotify:track:3zFLlF1SvWCt9oZUVPZehW","Clave Especial","Kalashnikov","Street Mob Records",49,65,12,"2780090"
57,"spotify:track:3RauwC9sLKjxVN7uNw0vAH","Fuerza Regida","Enculado","Rancho Humilde/Street Mob Records",42,56,10,"2744128"
58,"spotify:track:5HR7yfhSCeoOHRQN05XnZQ","Grupo Frontera, Carin Leon","QUE VUELVAS","Grupo Frontera",2,66,71,"2737373"
59,"spotify:track:6Z0ybnsUBhbZ9ZjPW64eoF","Belanova","Rosa Pastel","Universal Music Mexico",22,79,74,"2632734"
60,"spotify:track:505v13epFXodT9fVAJ6h8k","KAROL G","AMARGURA","BICHOTA RECORDS / INTERSCOPE RECORDS / UNIVERSAL MUSIC LATINO",38,63,49,"2613845"
61,"spotify:track:6j3PRPNWLutE3CutDzH4uI","Chencho Corleone, Peso Pluma","HUMO","Cerco LLC",52,52,2,"2603392"
62,"spotify:track:1y8Zz3ES0jCL0F6jOSUSoW","Dani Flow, Kevin AMF","PUTAS Y MOET","Dani Flow",54,84,8,"2599530"
63,"spotify:track:3tt9i3Hhzq84dPS8H7iSiJ","Manuel Turizo","La Bachata","Sony Music Latin/La Industria",1,62,93,"2599324"
64,"spotify:track:3KZCP2StVGdWkOKyRZNWA4","Plan B","Es un Secreto","Pina Records",42,74,110,"2593064"
65,"spotify:track:24teIhDYO2RocTA2v5dY0r","Junior H","Extssy Model","WEA Latina",37,76,79,"2587067"
66,"spotify:track:2BMlaVJaHDGd3ODSyrB2VK","Fuerza Regida","Brillarosa","Rancho Humilde/Street Mob Records",66,81,10,"2572457"
67,"spotify:track:6TBzRwnX2oYd8aOrOuyK1p","Oscar Maydon, Junior H","Fin de Semana","Rancho Humilde",4,70,66,"2560809"
68,"spotify:track:2UW7JaomAMuX9pZrjVpHAU","Yng Lvcas, Peso Pluma","La Bebe - Remix","WM Mexico",2,72,57,"2553022"
69,"spotify:track:6ED7qim1NAX1HjNU8039WS","Eugenio Esquivel, Grupo Marca Registrada, Sebastian Esquivel, Los Esquivel","Alucin","WKMX, División of WK Records / RB Records",7,58,22,"2501611"
70,"spotify:track:6icPJycbKyxzR3RAbXxjj1","Sebastian Esquivel, Blessd, Eugenio Esquivel, Los Esquivel","EXCESO","WKMX, a division of WK Records LLC",55,55,5,"2476316"
71,"spotify:track:3kf0WdFOalKWBkCCLJo4mA","Chino Pacas","El Gordo Trae El Mando","Street Mob Records/PFL/Geffen Records",6,61,63,"2448240"
72,"spotify:track:3wlIAXSDtlD9iU8ysld06Z","Peso Pluma, Jasiel Nuñez, Junior H","BIPOLAR","Double P Records",13,77,32,"2447572"
73,"spotify:track:3xkHsmpQCBMytMJNiDf3Ii","Benson Boone","Beautiful Things","Night Street Records, Inc./Warner Records Inc.",38,57,9,"2417854"
74,"spotify:track:2CshODtf7iwe3pKlPmEWF5","Junior H","TRES BOTELLAS","WEA Latina",43,80,28,"2410685"
75,"spotify:track:1TEKUj8c5iyRNUUxo9SdSD","Xavi, Tony Aguirre","Modo DND","Interscope Records",13,64,25,"2375698"
76,"spotify:track:7slBlaUuSCgADZBuTQDYBB","Ela Taubert","¿Cómo Pasó?","Universal Music Latino",75,75,3,"2367415"
77,"spotify:track:5SHXikmjPwChjvpVIeYkMf","Oscar Maydon, Junior H, Gabito Ballesteros","Skin de Bandida","Rancho Humilde",14,73,30,"2355757"
78,"spotify:track:4UkUxO2WlKLc0Q1iEutGGh","KAROL G, Tiësto","CONTIGO (with Tiësto)","Bichota/Interscope Records",30,71,9,"2325769"
79,"spotify:track:6UtWwuheJr5LLDeVypPNx7","Fuerza Regida","EXCESOS","Rancho Humilde/Street Mob Records",38,87,26,"2296332"
80,"spotify:track:0UXlu64mDLvfzR8IXMz06J","Christian Nodal","Ya No Somos Ni Seremos","Producciones Ladon, S.A de C.V.",1,88,101,"2287242"
81,"spotify:track:1UL2Sn9KX8StSDOp8ZEAOC","Doble ONE Flow Letal","Mi Kryptonita","CUELLO BLANCO",25,90,25,"2280427"
82,"spotify:track:4H6o1bxKRGzmsE0vzo968m","Yuridia, Ángela Aguilar","Qué Agonía","Sony Music México",5,60,78,"2270418"
83,"spotify:track:2yzshFeBIwH8tWIqHEFLeD","Grupo Frontera, Bad Bunny","un x100to","Grupo Frontera",2,82,53,"2266494"
84,"spotify:track:3PdxzrKH2jVQwAYWe0OMK8","Gabito Ballesteros, Natanael Cano","Proyecto X","Los CT Records",31,53,11,"2266119"
85,"spotify:track:71V6u8mPSydvEokO7XYqG6","Alfredo Olivas","El Vals Del Olvido","Camiolvi",57,96,79,"2215823"
86,"spotify:track:2O223PoYCkIPSsE4cmnr9v","Fuerza Regida","TQM","Rancho Humilde/Street Mob Records",1,93,48,"2172839"
87,"spotify:track:179TZwPk0txEvjkraVTVKo","Alfredo Olivas","El Precio De La Soledad","Camiolvi",42,91,84,"2161423"
88,"spotify:track:54zcJnb3tp9c5OVKREZ1Is","KAROL G","MI EX TENÍA RAZÓN","Bichota/Interscope Records",13,85,36,"2156750"
89,"spotify:track:5Ei8EK2uXNkqqVSe2QYsFp","Julión Álvarez y su Norteño Banda","Que Te Vaya Bien","UMLE - Fonovisa",21,104,87,"2137545"
90,"spotify:track:51ZQ1vr10ffzbwIjDCwqm4","Ariana Grande","we can't be friends (wait for your love)","Republic Records",29,68,6,"2126504"
91,"spotify:track:5YZgFW1hURKX02zTayrpGI","Fuerza Regida","BARBIEZ","Rancho Humilde/Street Mob Records",70,98,13,"2103751"
92,"spotify:track:3RA55zrRkyPK8Fd86hrMy8","Peso Pluma, Junior H","LUNA","Double P Records",4,112,43,"2081179"
93,"spotify:track:4waqcUQWdj0yH26STWl2Rq","La Oreja de Van Gogh","Rosas","Columbia",83,83,94,"2053106"
94,"spotify:track:1hZsWUnLbqRw09jLAMQSsb","Feid, Young Miko","CLASSY 101","UMLE - Latino",18,103,55,"2017602"
95,"spotify:track:2500EpUpryOBJX0rO8fDuB","Junior H, Peso Pluma","A Tu Manera","WEA Latina",13,89,9,"2011482"
96,"spotify:track:3HEsgWS7O1kpNkNMwRA3Kg","El Bogueto, Brand Randall","Si La Mami","Candela Music",49,78,5,"2007714"
97,"spotify:track:100Tm6z29RfHTdUQ6NIs0s","Julieta Venegas","Me Voy","Ariola",94,94,23,"1991254"
98,"spotify:track:492zkdiUa0CECUDyiG3d35","Clave Especial","Rápido Soy","Street Mob Records",62,97,16,"1988331"
99,"spotify:track:2fQrrBtuNVMWOHqLyk4EfO","Alfredo Olivas","Yo Todo Lo Doy","Fonovisa",45,92,80,"1985071"
100,"spotify:track:0xGZjxYqcNQ8WqxyeZ4eSN","Peso Pluma","RUBICON","Double P Records",18,109,43,"1975041"
101,"spotify:track:1nCXy1RQQYMgt97DO8uCSI","Peso Pluma, Arcángel","PESO COMPLETO","Double P Records",101,-1,1,"1953412"
102,"spotify:track:5u9W6O6RiCRbJIOhE4Nmzy","Adrian L Santos, Oscar Maydon","Pal Amor Soy Malo - Remix","WM Mexico",101,101,20,"1950319"
103,"spotify:track:14k3Rb7Xgte9fsndjdenmq","Kany García, Carin Leon","Te Lo Agradezco","5020 Records",77,107,37,"1949473"
104,"spotify:track:3dNLpNsPJ3zvlVu8s5vll0","Grupo Frontera, Christian Nodal","Ya Pedo Quién Sabe","Grupo Frontera",39,86,6,"1912828"
105,"spotify:track:6Sq7ltF9Qa7SNFBsV5Cogx","Bad Bunny, Chencho Corleone","Me Porto Bonito","Rimas Entertainment LLC",1,153,102,"1864714"
106,"spotify:track:7MmrcXVA7A5zZ2CbDuGHNa","Rels B","A Mí","DALE PLAY Records / Flakk Team",68,133,269,"1861491"
107,"spotify:track:7s4emXHJwAuo5VvGBXmnBL","Young Miko, Feid","offline","Wave Music Group",107,178,2,"1860660"
108,"spotify:track:3HOKxuTDmNVmIlCIpBiD8m","Peso Pluma, Jasiel Nuñez","LAGUNAS","Double P Records",12,127,43,"1856705"
109,"spotify:track:7CyPwkp0oE8Ro9Dd5CUDjW","The Weeknd, JENNIE, Lily-Rose Depp","One Of The Girls (with JENNIE, Lily Rose Depp)","XO / Republic Records",91,110,17,"1847724"
110,"spotify:track:1PTgQ0HyfwbXRKapVPNKxI","Oscar Maydon, Natanael Cano, Gabito Ballesteros","Tipo Gatsby","Rancho Humilde",26,100,17,"1845622"
111,"spotify:track:0cNSq9T5l8gZnpY14rsTR2","Peso Pluma, Natanael Cano","PRC","Double P Records",1,106,65,"1829655"
112,"spotify:track:2NQZVzSRRatbbPWD5IfadH","Xavi","Sin Pagar Renta","Interscope Records",32,99,19,"1827859"
113,"spotify:track:0DWdj2oZMBFSzRsi2Cvfzf","KAROL G, Shakira","TQG","BICHOTA RECORDS / INTERSCOPE RECORDS / UNIVERSAL MUSIC LATINO",1,111,60,"1815441"
114,"spotify:track:671fHUAB2n0MocazS1bMB8","Rels B, Kenia OS","Por Dentro","DALE PLAY Records / Flakk Team",20,105,21,"1812413"
115,"spotify:track:5aJ1M43pinROpwaPnO8KRj","Natanael Cano","Amor Tumbado","Rancho Humilde",30,115,134,"1805516"
116,"spotify:track:49Zc3sEJHADPoVDM4jNKgs","Grupo Frontera, Manuel Turizo","DE LUNES A LUNES","Grupo Frontera",42,102,34,"1801480"
117,"spotify:track:5BTibB0lM8fExn033QebZJ","Julión Álvarez y su Norteño Banda","Casi Completa","UMLE - Fonovisa",90,143,18,"1799217"
118,"spotify:track:0lpxDRCONr2FJRqcM3Q74z","Victor Cibrian, Gabito Ballesteros","Porque Te Vas","Rancho Humilde",118,-1,1,"1786509"
119,"spotify:track:26Fvbip1soBIK5RWJYco05","Danna Paola","ATARI","Universal Music Mexico",119,-1,1,"1776486"
120,"spotify:track:4OyzSXRSadNQt5EMwASdap","Camila","Todo Cambió","Columbia",95,95,3,"1765258"
121,"spotify:track:2Nk3gXgekore0lfB7PCnub","Alfredo Olivas","El Paciente","Camiolvi",59,117,198,"1760718"
122,"spotify:track:4Zx0yrZwW4uNpd1FhIrOV5","Natanael Cano","Mas Altas Que Bajadas","WEA Latina",12,124,42,"1759607"
123,"spotify:track:6981hdSOqG8tP6xTqaySa1","Julión Álvarez y su Norteño Banda","Ojos Verdes","UMLE - Fonovisa",37,131,61,"1750154"
124,"spotify:track:2hn2zOA2XFlv6DSmesylrL","Ryan Castro, Peso Pluma, SOG","QUEMA","Sony Music Latin",31,191,37,"1739198"
125,"spotify:track:0zhymr6RqNuvp0RMIvdpdA","Código FN, Gabito Ballesteros","Mood Malandro","Al Millon Music",13,125,34,"1730062"
126,"spotify:track:3GSMdtJphymHEsR8K9jT5Q","León Larregui","Locos","Universal Music Mexico",56,199,316,"1729389"
127,"spotify:track:48lxT5qJF0yYyf2z4wB4xW","Jaxomy, Agatino Romero, Raffaella Carrà","Pedro","Columbia/B1 Recordings/Ultra Records",127,-1,1,"1729201"
128,"spotify:track:17js0w8GTkTUFGFM6PYvBd","Fuerza Regida, Peso Pluma","Igualito a Mi Apá","Rancho Humilde/Street Mob Records",19,138,63,"1716274"
129,"spotify:track:46FdwGMcgz6gik4RCpWBAW","Oscar Maydon, El Padrinito Toys","Los Collares","Rancho Humilde",13,119,80,"1711178"
130,"spotify:track:2CeKVsFFXG4QzA415QygGb","Feid","Feliz Cumpleaños Ferxxo","UMLE - Latino",23,147,87,"1707471"
131,"spotify:track:5rAnfPGKZGyRBzI5kcAaqB","Oscar Maydon, Grupo Marca Registrada","Anda Bien el Nene","Rancho Humilde",50,116,10,"1704728"
132,"spotify:track:0JDrG1g5HXbfgGtRKT0ofH","Natanael Cano","Diamantes","WEA Latina",72,141,35,"1703493"
133,"spotify:track:31REg67eoHJSvMLUcEmGNj","La Arrolladora Banda El Limón De Rene Camacho","El Final De Nuestra Historia","Universal Music Mexico",111,121,44,"1692689"
134,"spotify:track:3KTExsIhHiqNHW9XBbTTZd","Natanael Cano, Dan Sanchez","Como Es Arriba Es Abajo","WEA Latina",26,122,48,"1683635"
135,"spotify:track:3HqcNJdZ2seoGxhn0wVNDK","KAROL G","PROVENZA","BICHOTA RECORDS / INTERSCOPE RECORDS / UNIVERSAL MUSIC LATINO",1,132,104,"1681459"
136,"spotify:track:5rcnAHBclBs0OGV4rATEnR","HUMBE","fantasmas","Sony Music México",72,145,14,"1678199"
137,"spotify:track:3qQbCzHBycnDpGskqOWY0E","Eslabon Armado, Peso Pluma","Ella Baila Sola","DEL Records",1,118,57,"1669503"
138,"spotify:track:3k3NWokhRRkEPhCzPmV8TW","Bad Bunny, Bomba Estéreo","Ojitos Lindos","Rimas Entertainment LLC",1,144,102,"1667706"
139,"spotify:track:46XNO42jaQNr5DdEWINdpL","Luis R Conriquez, Edgardo Nuñez, Los Dareyes De La Sierra","De Fresa y Coco","Kartel Music",61,123,22,"1667551"
140,"spotify:track:1tzj4DDVNp6X2ltpdTGtZW","Javier Rosas Y Su Artillería Pesada, Lupe Borbon y su Blindaje 7","La Suma","Rosas Music",28,126,13,"1667034"
141,"spotify:track:0fea68AdmYNygeTGI4RC18","J Balvin, Bad Bunny","LA CANCIÓN","Universal Music Latino / Rimas",1,128,251,"1660853"
142,"spotify:track:6ifUES3keWjwXgae8pXI3o","Danny Ocean","Me Rehúso","Atlantic Records",1,171,377,"1659895"
143,"spotify:track:2QrU43HoJRNBrbo2XLI9DS","Alfredo Olivas","No","Fonovisa",73,148,60,"1645803"
144,"spotify:track:6fplYq951Ltp6nIiTFcnCY","Carin Leon","No Es Por Acá","Socios Music, LLC",25,-1,92,"1644790"
145,"spotify:track:2jPufybqAAmiF16Jirt9Ez","Julión Álvarez y su Norteño Banda","Te Hubieras Ido Antes","UMLE - Fonovisa",57,165,37,"1643948"
146,"spotify:track:4WefXOf8I4gMjdj2kBJgkl","LATIN MAFIA, HUMBE","Patadas de Ahogado","Home Made Records",26,135,24,"1643020"
147,"spotify:track:3HgvO4B5LLmdPOT2d8cSZd","LAGOS, Danny Ocean","Mónaco","WM Mexico",12,161,147,"1639603"
148,"spotify:track:3lGMtkONrZdJ8kTCg6KIFf","Natalia Lafourcade","Hasta la Raíz","RCA Records Label",15,120,219,"1637954"
149,"spotify:track:3qhlB30KknSejmIvZZLjOD","Djo","End of Beginning","Djo",129,129,6,"1636658"
150,"spotify:track:5bi0gh89wRuH2OgjdAKFsb","Rvssian, Rauw Alejandro, Ayra Starr","Santa","Sony Music Latin",150,-1,1,"1629691"
151,"spotify:track:6VsqdsaY4oV06NODea0L0J","Becky G, Ángela Aguilar, Leonardo Aguilar","POR EL CONTRARIO (with Angela Aguilar & Leonardo Aguilar)","Kemosabe Records/RCA Records/Sony Music Latin",109,140,12,"1626317"
152,"spotify:track:69Ej1xrGjOcHvIMtMKxK0G","Don Omar","Dile","UMLE - Machete",90,108,77,"1621308"
153,"spotify:track:1Wrzhfa5bNlqvsnCztz190","Hombres G","Devuélveme a mi chica","WM Spain",72,174,320,"1618124"
154,"spotify:track:2SqUfIOD0VDJirHTVIdn4F","El Malilla, Yeyo, Dj Rockwel Mx","B de Bellako","El Malilla",81,160,17,"1612695"
155,"spotify:track:0FxtC8uFapbpDBliAU3sd6","Natanael Cano, Peso Pluma, Gabito Ballesteros","AMG","WEA Latina",1,130,73,"1607132"
156,"spotify:track:6mmPpaltUZK7xjNlBPQQ0p","Rauw Alejandro, Chencho Corleone","Desesperados","Sony Music Latin/Duars Entertainment",3,134,96,"1601229"
157,"spotify:track:4ZplewvZRLFcfBa5uyBbhd","Cardenales De Nuevo León","Belleza De Cantina","Universal Music Mexico",65,114,206,"1592809"
158,"spotify:track:775hCSePn3GW4h9nZ636kq","Peso Pluma, Tito Double P","GAVILÁN II","Double P Records",43,149,43,"1581389"
159,"spotify:track:7bPp2NmpmyhLJ7zWazAXMu","Peso Pluma, Grupo Frontera","TULUM","Double P Records",4,155,42,"1578047"
160,"spotify:track:2kz1YOhJiNubjigR1gB1VX","Rauw Alejandro","DILUVIO","Sony Music Latin/Duars Entertainment",68,157,24,"1563272"
161,"spotify:track:46YjJXVXWHlQ21odKktg5e","Tainy, Bad Bunny","MOJABI GHOST","NEON16, LLC",15,154,42,"1557163"
162,"spotify:track:1Aa54YEL20kiDPI6f4XGdS","Uzielito Mix, Yeri Mua, El Jordan 23, Dj Kiire","Linea Del Perreo","Candela Music",23,152,19,"1555797"
163,"spotify:track:7yIIeKUxTpn36X6CFJhgEi","Bellakath, Dani Flow","Reggaeton Champagne","La Mafia del Perreo",9,156,28,"1555470"
164,"spotify:track:4OVpyR6yhYyVoRj9D7CERz","Banda MS de Sergio Lizárraga, Carin Leon","Ojos Cerrados","Lizos Music",44,150,119,"1554415"
165,"spotify:track:1TPAAS0YvLKzmDMAGrRd6i","Victor Mendivil, Kevin AMF","Punta Cana","Rico o Muerto Music LLC",165,-1,1,"1547720"
166,"spotify:track:2ieCamPuL76ipKH1cLH7tH","Luis R Conriquez, Tito Double P","Sin Tanto Royo","Kartel Music",56,142,26,"1546487"
167,"spotify:track:1uKjQoh8JZj9ryuYRhpd7E","Luis Miguel","Ahora Te Puedes Marchar","WM Mexico",21,170,382,"1541543"
168,"spotify:track:0KSwFEkVh0KCBR0TwqBVen","Jasiel Nuñez, DannyLux","Corazón Frío","Double P Records",168,184,8,"1538496"
169,"spotify:track:1l77YWrGUp3qX3NS1rz7lq","Banda MS de Sergio Lizárraga","El Color de Tus Ojos","Lizos Music",24,173,257,"1531854"
170,"spotify:track:0qCPD6ilr9nXkI4KVZgcns","Eden Muñoz, Junior H","Abcdario","Lizos Music",7,186,49,"1524704"
171,"spotify:track:1RGlfmdvcfatN0ZLOmzanS","Junior H","El Hijo Mayor","WEA Latina",22,190,92,"1523214"
172,"spotify:track:5qbQNw7iaPJPnhN4gyGjoX","Legion RG, Enigma Norteño, Neton Vega","Haganse A Un Lado","Poker Music",154,180,10,"1521040"
173,"spotify:track:6CRRlfXDdhsL6vih3J5xco","Alfredo Olivas","En Definitiva","Camiolvi",78,159,110,"1518428"
174,"spotify:track:2kvpHbQHp9QmcG9WhyLwco","Cris Mj","Daytona","Sonar LLC.",174,-1,1,"1512528"
175,"spotify:track:7ABLbnD53cQK00mhcaOUVG","Myke Towers","LALA","WEA Latina",3,183,42,"1509041"
176,"spotify:track:1aUq8rjW1EwkAkMri4VfJy","Rauw Alejandro, Lyanno, Brray","LOKERA","Sony Music Latin/Duars Entertainment",15,-1,60,"1503843"
177,"spotify:track:4SHTLje9c6RLnx6kOPt9L6","Alfredo Olivas","El Sillón","Camiolvi",85,158,41,"1502087"
178,"spotify:track:7LLBONqWyX3MoBvIVPu5fj","Tiagz, Fuerza Regida, El Alfa","Tacata (Remix)","Street Mob Records",47,189,16,"1499852"
179,"spotify:track:2ctjDCCg1wHoQSjIJ8p6U4","Plan B","Candy","Pina Records",140,-1,41,"1498786"
180,"spotify:track:4DnhYGcizQepwr7vvvntih","Alex Favela, Código FN, Oscar Ortiz","ALVRGZO","Rios Music / Badsin Records / Al Millon Music",45,162,20,"1493640"
181,"spotify:track:0SRddBTphQwQcfqw4Br1uX","León Larregui","Brillas","EMI México",43,137,373,"1491980"
182,"spotify:track:5Eax0qFko2dh7Rl2lYs3bx","Bad Bunny","Efecto","Rimas Entertainment LLC",2,188,102,"1487975"
183,"spotify:track:6Pur3hWy6Nzc27ilmsp5HA","Los Enanitos Verdes","Lamento Boliviano","EMI Latin",84,136,252,"1481926"
184,"spotify:track:1EZk1gal98tb4lNI862KzO","Natanael Cano","Pacas De Billetes","WEA Latina",18,176,51,"1476033"
185,"spotify:track:32hCeeK3ayPux4UauNPsgA","Arcángel, Grupo Frontera","ALV","Rimas Entertainment LLC.",59,172,22,"1473281"
186,"spotify:track:4Dvkj6JhhA12EX05fT7y2e","Harry Styles","As It Was","Columbia",1,-1,106,"1473087"
187,"spotify:track:7IJph8SanpysMOFmXQCJth","El Malilla, Maury","Dime","El Malilla",187,-1,1,"1466885"
188,"spotify:track:1ULnQ2yn5LeQX4LrROm1RD","Junior H, Ovi","COLOGNE","WEA Latina",19,194,59,"1448807"
189,"spotify:track:3rdAz1fbUfZxYgaCviYhRo","Rauw Alejandro","Todo De Ti","Sony Music Latin/Duars Entertainment",1,177,120,"1446591"
190,"spotify:track:1IzGf1RLpHuImi5lsCD3T9","Duelo","Puño De Diamantes","LA BONITA MUSIC",131,196,33,"1443170"
191,"spotify:track:5XeFesFbtLpXzIVDNQP22n","Arctic Monkeys","I Wanna Be Yours","Domino Recording Co",119,-1,77,"1441747"
192,"spotify:track:2tTmW7RDtMQtBk7m2rYeSw","Bizarrap, Quevedo","Quevedo: Bzrp Music Sessions, Vol. 52","DALE PLAY Records",1,-1,88,"1428401"
193,"spotify:track:6F9yAYUaNbUhdlQyt5uZ3b","Luis Miguel","La Incondicional","WEA Latina",26,169,248,"1406967"
194,"spotify:track:69vlMrzHwATKzupwNcUPyK","Bad Bunny, Daddy Yankee","La Santa","Rimas Entertainment LLC",5,-1,176,"1394317"
195,"spotify:track:55ZATsjPlTeSTNJOuW90pW","Cartel De Santa, La Kelly","Shorty Party","Babilonia Music, S.A. De C.V.",1,-1,57,"1389852"
196,"spotify:track:7uuqrSuCjWxPTCVyOeGMyt","Michelle Maciel, Eden Muñoz","CCC","DALE PLAY Records / Solido Records",14,179,48,"1387172"
197,"spotify:track:7chTH3GBjjAyagf0SPCZDL","Blessd, Feid","SI SABE FERXXO","WEA Latina",152,167,7,"1385322"
198,"spotify:track:0ItgotO5txriRAp6lXMHJ7","Junior H","A TU NOMBRE","WEA Latina",75,-1,7,"1383505"
199,"spotify:track:6aommJFM8i3iT4inKuDSXh","Jósean Log","Chachachá","Jósean Log",156,195,59,"1380977"
200,"spotify:track:1J2oUHUEhtReLHOuzFIKCO","Victor Mendivil, El Padrinito Toys, Kevin AMF, Victor Rivera Y Su Nuevo Estilo","KLK","Rico o Muerto Music LLC",84,113,10,"1376107"
