rank,uri,artist_names,track_name,source,peak_rank,previous_rank,weeks_on_chart,streams
1,"spotify:track:5LhI8m7n8xlQmNe3b7Rwis","Natanael Cano, Oscar Maydon","Madonna","WEA Latina",1,1,5,"16894549"
2,"spotify:track:2DbV9TSdeGr5FobCFDRzvq","Bizarrap, Natanael Cano","Natanael Cano: Bzrp Music Sessions, Vol. 59","DALE PLAY Records",2,41,2,"15248133"
3,"spotify:track:0dEAiKNbHt4mrjjoiL0loc","Xavi","Corazón de Piedra","Interscope Records",2,2,3,"13171965"
4,"spotify:track:7EWtB4NKYY3NqBl31PVip9","Peso Pluma, Tito Double P, Joel De La P","LA PEOPLE II","Double P Records",3,3,3,"10017081"
5,"spotify:track:6XjDF6nds4DE2BBbagZol6","FloyyMenor, Cris Mj","Gata Only","FloyyMenor under exclusive license to UnitedMasters LLC",4,5,9,"9942132"
6,"spotify:track:61OsemtnuPJ5R0LMEkw60S","Bizarrap, Natanael Cano","Entre las de 20","DALE PLAY Records",6,92,2,"9921805"
7,"spotify:track:0R6NfOiLzLj4O5VbYSJAjf","Xavi","La Diabla","Interscope Records",1,4,19,"9584909"
8,"spotify:track:3FqUPvubYeRCMsdJ02QyZR","Fuerza Regida","TÚ NAME","Rancho Humilde/Street Mob Records",7,7,9,"8088241"
9,"spotify:track:6YOfGIE6iFxC7G8OlGGvzW","Junior H","ROCKSTAR","WEA Latina",7,11,27,"7835048"
10,"spotify:track:4L1iecYPJR1qc9tz5Zjkw9","Gabito Ballesteros, Natanael Cano","El Boss","Los CT Records",8,8,2,"7787406"
11,"spotify:track:5XVdHRf4CAJ2Jm0uMIy5qY","Xavi","La Víctima","Interscope Records",2,6,29,"7209393"
12,"spotify:track:6uIIdjYTxxpWOyWuVXrKQO","Calle 24, Chino Pacas, Fuerza Regida","Que Onda","Street Mob Records",1,9,32,"7124008"
13,"spotify:track:51qYdMBxt9mFbtZBzq1Yfi","Julión Álvarez y su Norteño Banda","Regalo De Dios","UMLE - Fonovisa",3,10,15,"7074262"
14,"spotify:track:6RcAHyC5sAUIbPTkhOQwd8","Junior H","Y LLORO","WEA Latina",5,12,27,"6923165"
15,"spotify:track:1xgWArLVFD1AKsLzftZYc2","Oscar Maydon, Gabito Ballesteros, Chino Pacas","Elvira","Rancho Humilde",9,13,16,"6419480"
16,"spotify:track:1C84d9abZVKWHT2YYpoean","Luis R Conriquez, Neton Vega","Si No Quieres No","Kartel Music",16,19,4,"5842612"
17,"spotify:track:7bywjHOc0wSjGGbj04XbVi","Feid, ATL Jacob","LUNA","UMLE - Latino",13,15,19,"5699147"
18,"spotify:track:3QQAeMQbbjZXVFbF8DgFWT","Oscar Ortiz, Edgardo Nuñez","FIRST LOVE","Badsin Records, LLC",3,16,16,"5509225"
19,"spotify:track:4t46soaqA758rbukTO5pp1","Natanael Cano","Mi Bello Angel","WEA Latina",4,22,41,"5223976"
20,"spotify:track:4bw8mcDUSRWfQo63ZTYRnU","Maluma, Carin Leon","Según Quién","Sony Music Latin",6,21,34,"4719779"
21,"spotify:track:3kx21xR6IboC9HVdajgBoc","Fuerza Regida","SABOR FRESA","Rancho Humilde/Street Mob Records",2,20,42,"4629332"
22,"spotify:track:127UT7AiWflJwjXWUBBVTQ","Natanael Cano","O Me Voy O Te Vas","WEA Latina",12,17,26,"4610330"
23,"spotify:track:4loIMejzvt11s97SGVEat8","Xavi, Los Dareyes De La Sierra","Poco A Poco","Interscope Records",7,18,28,"4582618"
24,"spotify:track:6CvTEtGagmzQvkUzzyKR9k","Fuerza Regida, Marshmello","HARLEY QUINN","Rancho Humilde/Street Mob Records",1,14,25,"4541619"
25,"spotify:track:29vIEdxgMT9H1fnBMecWjA","Julión Álvarez y su Norteño Banda","Lo Tienes Todo","UMLE - Fonovisa",17,23,20,"4293938"
26,"spotify:track:7iUtQNMRB8ZkKC4AmEuCJC","Myke Towers","LA FALDA","WEA Latina",26,28,17,"4248680"
27,"spotify:track:5RqSsdzTNPX1uzkmlHCFvK","KAROL G, Peso Pluma","QLONA","Bichota/Interscope Records",2,24,35,"4153876"
28,"spotify:track:6XaJfhwof7qIgbbXO5tIQI","Kali Uchis, Peso Pluma","Igual Que Un Ángel (with Peso Pluma)","Geffen Records",3,25,13,"4049759"
29,"spotify:track:0O3U5iwTbiXCREMkvotJuN","Grupo Frontera, Grupo Firme","EL AMOR DE SU VIDA","Grupo Frontera",5,26,36,"3994239"
30,"spotify:track:0lbDzTINTToToBpkrnQT2t","Fuerza Regida, Manuel Turizo","UNA CERVEZA","Rancho Humilde/Street Mob Records",30,31,16,"3982936"
31,"spotify:track:1LfsvLFQprosUmrEtGPHAe","Remp, Oscar Maydon, Victor Mendivil","Don Dimadon","Rico o Muerto Music LLC",30,30,4,"3978441"
32,"spotify:track:1sXr6moCwVxwKEgSPxhVvF","Calle 24, Chino Pacas","Apaga El Cel","Street Mob Records",8,27,15,"3973053"
33,"spotify:track:4zfQER4owi8q6NL8Gg63Ya","Fuerza Regida","CRAZYZ","Rancho Humilde/Street Mob Records",20,29,21,"3901921"
34,"spotify:track:2y3TKxJAaIauybiS3GKHon","Yahir Saldivar","SC-9","DEL Records",34,48,4,"3886214"
35,"spotify:track:68viiGZoRbLCjsy5xD4VrU","Shakira, Grupo Frontera","(Entre Paréntesis)","Sony Music Latin",35,40,3,"3810078"
36,"spotify:track:2TJKY0WSFufZOzbRNgl6zE","Alex Favela, Grupo Marca Registrada, Joaquin Medina","ELOVRGA","Rios Music/ Outerspace Music/ Boba Records Corporation",3,39,34,"3758246"
37,"spotify:track:7iQXYTyuG13aoeHxGG28Nh","Bad Bunny, Feid","PERRO NEGRO","Rimas Entertainment LLC",4,34,26,"3737420"
38,"spotify:track:5cWgwbui8BasfjCXvBZ7UA","Carin Leon, Grupo Frontera","Alch Si","SOCIOS MUSIC LLC",36,52,19,"3691702"
39,"spotify:track:7mXuWTczZNxG5EDcjFEuJR","Peso Pluma, Gabito Ballesteros, Junior H","LADY GAGA","Double P Records",1,33,42,"3615906"
40,"spotify:track:4GvEuYAfJlICR2SpMDaBxQ","Jere Klein, Gittobeatz","ANDO","Jere Klein",37,38,21,"3543411"
41,"spotify:track:05tGmdz9dVZ4yGqz4YJdPK","Christian Nodal, Peso Pluma","La Intención","Producciones Ladon, S.A de C.V.",9,45,11,"3392280"
42,"spotify:track:4Nf5EZ40JenjMUKXOiyRU5","Peso Pluma","NUEVA VIDA","Double P Records",35,35,42,"3383537"
43,"spotify:track:2DRGyAlo0ht15FGLTQPCCt","Adrian L Santos, Joaquin Medina","Ya No Estoy Dolido","Rancho Humilde",32,47,13,"3346610"
44,"spotify:track:3FvTHuefYV6TxE3Kseqno8","Gabito Ballesteros, Natanael Cano","LOU LOU","Los CT Records",3,32,25,"3300889"
45,"spotify:track:25OeKzcqakFPaJlXHPE5lm","Carin Leon","Primera Cita","Socios Music, LLC",2,43,50,"3272066"
46,"spotify:track:1rXxK89X0XGpIdTB6CwiFu","Gabito Ballesteros","A Puro Dolor","Los CT Records",13,46,19,"3196586"
47,"spotify:track:1GtIK8iINes4gNt06F60NU","Alfredo Olivas","Vete","Fonovisa",28,42,41,"3190551"
48,"spotify:track:05WVKTdZhlIMX4qqMLuo0f","Peso Pluma, Anitta","BELLAKEO","Double P Records",7,51,18,"3145321"
49,"spotify:track:2OWv3lRR8PtOVuHWzQNRs2","Peso Pluma, Junior H, Oscar Maydon","ROMPE LA DOMPE","2023 Double P Records",4,37,15,"3110818"
50,"spotify:track:2GxrNKugF82CnoRFbQfzPf","Artemas","i like the way you kiss me","Artemas",50,82,2,"2992739"
51,"spotify:track:1RzjXhgnzqb3dMa5852itx","Peso Pluma, Tito Double P","LA PEOPLE","Double P Records",8,36,35,"2988386"
52,"spotify:track:6j3PRPNWLutE3CutDzH4uI","Chencho Corleone, Peso Pluma","HUMO","Cerco LLC",52,-1,1,"2976711"
53,"spotify:track:3PdxzrKH2jVQwAYWe0OMK8","Gabito Ballesteros, Natanael Cano","Proyecto X","Los CT Records",31,50,10,"2943615"
54,"spotify:track:4U20gQcVcjzY12xhLsXwXy","Luis R Conriquez, Jasiel Nuñez","GTA","Kartel Music",54,59,3,"2923285"
55,"spotify:track:6icPJycbKyxzR3RAbXxjj1","Sebastian Esquivel, Blessd, Eugenio Esquivel, Los Esquivel","EXCESO","WKMX, a division of WK Records LLC",55,57,4,"2790092"
56,"spotify:track:3RauwC9sLKjxVN7uNw0vAH","Fuerza Regida","Enculado","Rancho Humilde/Street Mob Records",42,56,9,"2759076"
57,"spotify:track:3xkHsmpQCBMytMJNiDf3Ii","Benson Boone","Beautiful Things","Night Street Records, Inc./Warner Records Inc.",38,54,8,"2742622"
58,"spotify:track:6ED7qim1NAX1HjNU8039WS","Eugenio Esquivel, Grupo Marca Registrada, Sebastian Esquivel, Los Esquivel","Alucin","WKMX, División of WK Records / RB Records",7,61,21,"2699933"
59,"spotify:track:0UbesRsX2TtiCeamOIVEkp","Fuerza Regida, Natanael Cano","Ch y la Pizza","Rancho Humilde/Street Mob Records",6,69,71,"2693191"
60,"spotify:track:4H6o1bxKRGzmsE0vzo968m","Yuridia, Ángela Aguilar","Qué Agonía","Sony Music México",5,85,77,"2662840"
61,"spotify:track:3kf0WdFOalKWBkCCLJo4mA","Chino Pacas","El Gordo Trae El Mando","Street Mob Records/PFL/Geffen Records",6,55,62,"2656027"
62,"spotify:track:3tt9i3Hhzq84dPS8H7iSiJ","Manuel Turizo","La Bachata","Sony Music Latin/La Industria",1,65,92,"2613513"
63,"spotify:track:505v13epFXodT9fVAJ6h8k","KAROL G","AMARGURA","BICHOTA RECORDS / INTERSCOPE RECORDS / UNIVERSAL MUSIC LATINO",38,63,48,"2571891"
64,"spotify:track:1TEKUj8c5iyRNUUxo9SdSD","Xavi, Tony Aguirre","Modo DND","Interscope Records",13,44,24,"2556789"
65,"spotify:track:3zFLlF1SvWCt9oZUVPZehW","Clave Especial","Kalashnikov","Street Mob Records",49,67,11,"2536904"
66,"spotify:track:5HR7yfhSCeoOHRQN05XnZQ","Grupo Frontera, Carin Leon","QUE VUELVAS","Grupo Frontera",2,49,70,"2533779"
67,"spotify:track:1haJsMtoBhHfvuM7XWuT3W","Junior H, Peso Pluma","El Azul","WEA Latina",3,53,61,"2510647"
68,"spotify:track:51ZQ1vr10ffzbwIjDCwqm4","Ariana Grande","we can't be friends (wait for your love)","Republic Records",29,60,5,"2510514"
69,"spotify:track:1OZpgVRQKkxcoeEocqTMRZ","Julión Álvarez y su Norteño Banda","Pongámonos De Acuerdo","UMLE - Fonovisa",27,58,83,"2496367"
70,"spotify:track:6TBzRwnX2oYd8aOrOuyK1p","Oscar Maydon, Junior H","Fin de Semana","Rancho Humilde",4,64,65,"2493381"
71,"spotify:track:4UkUxO2WlKLc0Q1iEutGGh","KAROL G, Tiësto","CONTIGO (with Tiësto)","Bichota/Interscope Records",30,70,8,"2484613"
72,"spotify:track:2UW7JaomAMuX9pZrjVpHAU","Yng Lvcas, Peso Pluma","La Bebe - Remix","WM Mexico",2,68,56,"2430757"
73,"spotify:track:5SHXikmjPwChjvpVIeYkMf","Oscar Maydon, Junior H, Gabito Ballesteros","Skin de Bandida","Rancho Humilde",14,66,29,"2412004"
74,"spotify:track:3KZCP2StVGdWkOKyRZNWA4","Plan B","Es un Secreto","Pina Records",42,71,109,"2386640"
75,"spotify:track:7slBlaUuSCgADZBuTQDYBB","Ela Taubert","¿Cómo Pasó?","Universal Music Latino",75,101,2,"2374372"
76,"spotify:track:24teIhDYO2RocTA2v5dY0r","Junior H","Extssy Model","WEA Latina",37,72,78,"2354255"
77,"spotify:track:3wlIAXSDtlD9iU8ysld06Z","Peso Pluma, Jasiel Nuñez, Junior H","BIPOLAR","Double P Records",13,73,31,"2349315"
78,"spotify:track:3HEsgWS7O1kpNkNMwRA3Kg","El Bogueto, Brand Randall","Si La Mami","Candela Music",49,74,4,"2336526"
79,"spotify:track:6Z0ybnsUBhbZ9ZjPW64eoF","Belanova","Rosa Pastel","Universal Music Mexico",22,77,73,"2285134"
80,"spotify:track:2CshODtf7iwe3pKlPmEWF5","Junior H","TRES BOTELLAS","WEA Latina",43,75,27,"2261356"
81,"spotify:track:2BMlaVJaHDGd3ODSyrB2VK","Fuerza Regida","Brillarosa","Rancho Humilde/Street Mob Records",81,90,9,"2254253"
82,"spotify:track:2yzshFeBIwH8tWIqHEFLeD","Grupo Frontera, Bad Bunny","un x100to","Grupo Frontera",2,81,52,"2236678"
83,"spotify:track:4waqcUQWdj0yH26STWl2Rq","La Oreja de Van Gogh","Rosas","Columbia",83,108,93,"2227176"
84,"spotify:track:1y8Zz3ES0jCL0F6jOSUSoW","Dani Flow, Kevin AMF","PUTAS Y MOET","Dani Flow",54,80,7,"2204054"
85,"spotify:track:54zcJnb3tp9c5OVKREZ1Is","KAROL G","MI EX TENÍA RAZÓN","Bichota/Interscope Records",13,86,35,"2199955"
86,"spotify:track:3dNLpNsPJ3zvlVu8s5vll0","Grupo Frontera, Christian Nodal","Ya Pedo Quién Sabe","Grupo Frontera",39,62,5,"2199570"
87,"spotify:track:6UtWwuheJr5LLDeVypPNx7","Fuerza Regida","EXCESOS","Rancho Humilde/Street Mob Records",38,76,25,"2183498"
88,"spotify:track:0UXlu64mDLvfzR8IXMz06J","Christian Nodal","Ya No Somos Ni Seremos","Producciones Ladon, S.A de C.V.",1,124,100,"2183286"
89,"spotify:track:2500EpUpryOBJX0rO8fDuB","Junior H, Peso Pluma","A Tu Manera","WEA Latina",13,91,8,"2151944"
90,"spotify:track:1UL2Sn9KX8StSDOp8ZEAOC","Doble ONE Flow Letal","Mi Kryptonita","CUELLO BLANCO",25,97,24,"2149266"
91,"spotify:track:179TZwPk0txEvjkraVTVKo","Alfredo Olivas","El Precio De La Soledad","Camiolvi",42,78,83,"2133267"
92,"spotify:track:2fQrrBtuNVMWOHqLyk4EfO","Alfredo Olivas","Yo Todo Lo Doy","Fonovisa",45,87,79,"2108383"
93,"spotify:track:2O223PoYCkIPSsE4cmnr9v","Fuerza Regida","TQM","Rancho Humilde/Street Mob Records",1,84,47,"2105659"
94,"spotify:track:100Tm6z29RfHTdUQ6NIs0s","Julieta Venegas","Me Voy","Ariola",94,137,22,"2100099"
95,"spotify:track:4OyzSXRSadNQt5EMwASdap","Camila","Todo Cambió","Columbia",95,197,2,"2075502"
96,"spotify:track:71V6u8mPSydvEokO7XYqG6","Alfredo Olivas","El Vals Del Olvido","Camiolvi",57,79,78,"2061670"
97,"spotify:track:492zkdiUa0CECUDyiG3d35","Clave Especial","Rápido Soy","Street Mob Records",62,89,15,"2040040"
98,"spotify:track:5YZgFW1hURKX02zTayrpGI","Fuerza Regida","BARBIEZ","Rancho Humilde/Street Mob Records",70,88,12,"2036353"
99,"spotify:track:2NQZVzSRRatbbPWD5IfadH","Xavi","Sin Pagar Renta","Interscope Records",32,94,18,"2001935"
100,"spotify:track:1PTgQ0HyfwbXRKapVPNKxI","Oscar Maydon, Natanael Cano, Gabito Ballesteros","Tipo Gatsby","Rancho Humilde",26,96,16,"1987777"
101,"spotify:track:5u9W6O6RiCRbJIOhE4Nmzy","Adrian L Santos, Oscar Maydon","Pal Amor Soy Malo - Remix","WM Mexico",101,156,19,"1936178"
102,"spotify:track:49Zc3sEJHADPoVDM4jNKgs","Grupo Frontera, Manuel Turizo","DE LUNES A LUNES","Grupo Frontera",42,144,33,"1896543"
103,"spotify:track:1hZsWUnLbqRw09jLAMQSsb","Feid, Young Miko","CLASSY 101","UMLE - Latino",18,109,54,"1888497"
104,"spotify:track:5Ei8EK2uXNkqqVSe2QYsFp","Julión Álvarez y su Norteño Banda","Que Te Vaya Bien","UMLE - Fonovisa",21,103,86,"1884164"
105,"spotify:track:671fHUAB2n0MocazS1bMB8","Rels B, Kenia OS","Por Dentro","DALE PLAY Records / Flakk Team",20,133,20,"1867385"
106,"spotify:track:0cNSq9T5l8gZnpY14rsTR2","Peso Pluma, Natanael Cano","PRC","Double P Records",1,100,64,"1864803"
107,"spotify:track:14k3Rb7Xgte9fsndjdenmq","Kany García, Carin Leon","Te Lo Agradezco","5020 Records",77,113,36,"1861246"
108,"spotify:track:69Ej1xrGjOcHvIMtMKxK0G","Don Omar","Dile","UMLE - Machete",90,122,76,"1846724"
109,"spotify:track:0xGZjxYqcNQ8WqxyeZ4eSN","Peso Pluma","RUBICON","Double P Records",18,98,42,"1845916"
110,"spotify:track:7CyPwkp0oE8Ro9Dd5CUDjW","The Weeknd, JENNIE, Lily-Rose Depp","One Of The Girls (with JENNIE, Lily Rose Depp)","XO / Republic Records",91,140,16,"1836776"
111,"spotify:track:0DWdj2oZMBFSzRsi2Cvfzf","KAROL G, Shakira","TQG","BICHOTA RECORDS / INTERSCOPE RECORDS / UNIVERSAL MUSIC LATINO",1,105,59,"1834645"
112,"spotify:track:3RA55zrRkyPK8Fd86hrMy8","Peso Pluma, Junior H","LUNA","Double P Records",4,107,42,"1825220"
113,"spotify:track:1J2oUHUEhtReLHOuzFIKCO","Victor Mendivil, El Padrinito Toys, Kevin AMF, Victor Rivera Y Su Nuevo Estilo","KLK","Rico o Muerto Music LLC",84,149,9,"1808278"
114,"spotify:track:4ZplewvZRLFcfBa5uyBbhd","Cardenales De Nuevo León","Belleza De Cantina","Universal Music Mexico",65,83,205,"1807537"
115,"spotify:track:5aJ1M43pinROpwaPnO8KRj","Natanael Cano","Amor Tumbado","Rancho Humilde",30,106,133,"1806997"
116,"spotify:track:5rAnfPGKZGyRBzI5kcAaqB","Oscar Maydon, Grupo Marca Registrada","Anda Bien el Nene","Rancho Humilde",50,99,9,"1804909"
117,"spotify:track:2Nk3gXgekore0lfB7PCnub","Alfredo Olivas","El Paciente","Camiolvi",59,93,197,"1777958"
118,"spotify:track:3qQbCzHBycnDpGskqOWY0E","Eslabon Armado, Peso Pluma","Ella Baila Sola","DEL Records",1,117,56,"1774962"
119,"spotify:track:46FdwGMcgz6gik4RCpWBAW","Oscar Maydon, El Padrinito Toys","Los Collares","Rancho Humilde",13,102,79,"1771075"
120,"spotify:track:3lGMtkONrZdJ8kTCg6KIFf","Natalia Lafourcade","Hasta la Raíz","RCA Records Label",15,167,218,"1762138"
121,"spotify:track:31REg67eoHJSvMLUcEmGNj","La Arrolladora Banda El Limón De Rene Camacho","El Final De Nuestra Historia","Universal Music Mexico",111,116,43,"1742790"
122,"spotify:track:3KTExsIhHiqNHW9XBbTTZd","Natanael Cano, Dan Sanchez","Como Es Arriba Es Abajo","WEA Latina",26,161,47,"1733523"
123,"spotify:track:46XNO42jaQNr5DdEWINdpL","Luis R Conriquez, Edgardo Nuñez, Los Dareyes De La Sierra","De Fresa y Coco","Kartel Music",61,112,21,"1733003"
124,"spotify:track:4Zx0yrZwW4uNpd1FhIrOV5","Natanael Cano","Mas Altas Que Bajadas","WEA Latina",12,111,41,"1726366"
125,"spotify:track:0zhymr6RqNuvp0RMIvdpdA","Código FN, Gabito Ballesteros","Mood Malandro","Al Millon Music",13,95,33,"1722783"
126,"spotify:track:1tzj4DDVNp6X2ltpdTGtZW","Javier Rosas Y Su Artillería Pesada, Lupe Borbon y su Blindaje 7","La Suma","Rosas Music",28,104,12,"1710977"
127,"spotify:track:3HOKxuTDmNVmIlCIpBiD8m","Peso Pluma, Jasiel Nuñez","LAGUNAS","Double P Records",12,120,42,"1708785"
128,"spotify:track:0fea68AdmYNygeTGI4RC18","J Balvin, Bad Bunny","LA CANCIÓN","Universal Music Latino / Rimas",1,119,250,"1670974"
129,"spotify:track:3qhlB30KknSejmIvZZLjOD","Djo","End of Beginning","Djo",129,143,5,"1668700"
130,"spotify:track:0FxtC8uFapbpDBliAU3sd6","Natanael Cano, Peso Pluma, Gabito Ballesteros","AMG","WEA Latina",1,125,72,"1665501"
131,"spotify:track:6981hdSOqG8tP6xTqaySa1","Julión Álvarez y su Norteño Banda","Ojos Verdes","UMLE - Fonovisa",37,110,60,"1664361"
132,"spotify:track:3HqcNJdZ2seoGxhn0wVNDK","KAROL G","PROVENZA","BICHOTA RECORDS / INTERSCOPE RECORDS / UNIVERSAL MUSIC LATINO",1,123,103,"1663834"
133,"spotify:track:7MmrcXVA7A5zZ2CbDuGHNa","Rels B","A Mí","DALE PLAY Records / Flakk Team",68,129,268,"1657277"
134,"spotify:track:6mmPpaltUZK7xjNlBPQQ0p","Rauw Alejandro, Chencho Corleone","Desesperados","Sony Music Latin/Duars Entertainment",3,148,95,"1656153"
135,"spotify:track:4WefXOf8I4gMjdj2kBJgkl","LATIN MAFIA, HUMBE","Patadas de Ahogado","Home Made Records",26,168,23,"1651358"
136,"spotify:track:6Pur3hWy6Nzc27ilmsp5HA","Los Enanitos Verdes","Lamento Boliviano","EMI Latin",84,127,251,"1649621"
137,"spotify:track:0SRddBTphQwQcfqw4Br1uX","León Larregui","Brillas","EMI México",43,135,372,"1646028"
138,"spotify:track:17js0w8GTkTUFGFM6PYvBd","Fuerza Regida, Peso Pluma","Igualito a Mi Apá","Rancho Humilde/Street Mob Records",19,118,62,"1643681"
139,"spotify:track:6VciS3dRMpZhJiDxT8ArFi","Bizarrap, Young Miko","Young Miko: Bzrp Music Sessions, Vol. 58","DALE PLAY Records",21,160,13,"1630617"
140,"spotify:track:6VsqdsaY4oV06NODea0L0J","Becky G, Ángela Aguilar, Leonardo Aguilar","POR EL CONTRARIO (with Angela Aguilar & Leonardo Aguilar)","Kemosabe Records/RCA Records/Sony Music Latin",109,-1,11,"1626698"
141,"spotify:track:0JDrG1g5HXbfgGtRKT0ofH","Natanael Cano","Diamantes","WEA Latina",72,126,34,"1612027"
142,"spotify:track:2ieCamPuL76ipKH1cLH7tH","Luis R Conriquez, Tito Double P","Sin Tanto Royo","Kartel Music",56,153,25,"1611351"
143,"spotify:track:5BTibB0lM8fExn033QebZJ","Julión Álvarez y su Norteño Banda","Casi Completa","UMLE - Fonovisa",90,145,17,"1608215"
144,"spotify:track:3k3NWokhRRkEPhCzPmV8TW","Bad Bunny, Bomba Estéreo","Ojitos Lindos","Rimas Entertainment LLC",1,134,101,"1605017"
145,"spotify:track:5rcnAHBclBs0OGV4rATEnR","HUMBE","fantasmas","Sony Music México",72,180,13,"1598935"
146,"spotify:track:3Ih990MdWvxRHhdOBZd4gK","Polo Gonzalez","Amiri","Ligas Mayores Records",136,159,4,"1595589"
147,"spotify:track:2CeKVsFFXG4QzA415QygGb","Feid","Feliz Cumpleaños Ferxxo","UMLE - Latino",23,138,86,"1587495"
148,"spotify:track:2QrU43HoJRNBrbo2XLI9DS","Alfredo Olivas","No","Fonovisa",73,132,59,"1583232"
149,"spotify:track:775hCSePn3GW4h9nZ636kq","Peso Pluma, Tito Double P","GAVILÁN II","Double P Records",43,131,42,"1575421"
150,"spotify:track:4OVpyR6yhYyVoRj9D7CERz","Banda MS de Sergio Lizárraga, Carin Leon","Ojos Cerrados","Lizos Music",44,154,118,"1573319"
151,"spotify:track:2Ga1FnYssxRlMukIDI0f0y","Lasso","Ojos Marrones","Universal Music Mexico",9,198,84,"1572911"
152,"spotify:track:1Aa54YEL20kiDPI6f4XGdS","Uzielito Mix, Yeri Mua, El Jordan 23, Dj Kiire","Linea Del Perreo","Candela Music",23,141,18,"1572646"
153,"spotify:track:6Sq7ltF9Qa7SNFBsV5Cogx","Bad Bunny, Chencho Corleone","Me Porto Bonito","Rimas Entertainment LLC",1,121,101,"1568873"
154,"spotify:track:46YjJXVXWHlQ21odKktg5e","Tainy, Bad Bunny","MOJABI GHOST","NEON16, LLC",15,150,41,"1568297"
155,"spotify:track:7bPp2NmpmyhLJ7zWazAXMu","Peso Pluma, Grupo Frontera","TULUM","Double P Records",4,147,41,"1562468"
156,"spotify:track:7yIIeKUxTpn36X6CFJhgEi","Bellakath, Dani Flow","Reggaeton Champagne","La Mafia del Perreo",9,146,27,"1562388"
157,"spotify:track:2kz1YOhJiNubjigR1gB1VX","Rauw Alejandro","DILUVIO","Sony Music Latin/Duars Entertainment",68,163,23,"1553186"
158,"spotify:track:4SHTLje9c6RLnx6kOPt9L6","Alfredo Olivas","El Sillón","Camiolvi",85,128,40,"1544355"
159,"spotify:track:6CRRlfXDdhsL6vih3J5xco","Alfredo Olivas","En Definitiva","Camiolvi",78,130,109,"1540989"
160,"spotify:track:2SqUfIOD0VDJirHTVIdn4F","El Malilla, Yeyo, Dj Rockwel Mx","B de Bellako","El Malilla",81,175,16,"1539042"
161,"spotify:track:3HgvO4B5LLmdPOT2d8cSZd","LAGOS, Danny Ocean","Mónaco","WM Mexico",12,170,146,"1531672"
162,"spotify:track:4DnhYGcizQepwr7vvvntih","Alex Favela, Código FN, Oscar Ortiz","ALVRGZO","Rios Music / Badsin Records / Al Millon Music",45,183,19,"1529396"
163,"spotify:track:6wprSQTo6JpzI2bGiWVThv","Los mismos De La M, Oscar Ortiz","ICE CREAM","Afinarte Music",49,114,7,"1527699"
164,"spotify:track:0QoaFLmBJyuVuzOIGy6iCS","The Academy: Segunda Misión, Sech, Justin Quiles, Lenny Tavárez, Dalex, Dímelo Flow, Myke Towers","LA RANGER (feat. Myke Towers)","WEA Latina",151,151,2,"1524269"
165,"spotify:track:2jPufybqAAmiF16Jirt9Ez","Julión Álvarez y su Norteño Banda","Te Hubieras Ido Antes","UMLE - Fonovisa",57,139,36,"1516773"
166,"spotify:track:0zCOT028cU3DeCqN1G18wE","Inspector","Amargo Adiós","Universal Music Mexico",110,174,137,"1515173"
167,"spotify:track:7chTH3GBjjAyagf0SPCZDL","Blessd, Feid","SI SABE FERXXO","WEA Latina",152,-1,6,"1507576"
168,"spotify:track:5sgXFYthNSatpAyZ64QVs2","Kenia OS","Tortura","Sony Music México / 5020 RCRDS",86,185,4,"1507314"
169,"spotify:track:6F9yAYUaNbUhdlQyt5uZ3b","Luis Miguel","La Incondicional","WEA Latina",26,-1,247,"1503990"
170,"spotify:track:1uKjQoh8JZj9ryuYRhpd7E","Luis Miguel","Ahora Te Puedes Marchar","WM Mexico",21,165,381,"1503513"
171,"spotify:track:6ifUES3keWjwXgae8pXI3o","Danny Ocean","Me Rehúso","Atlantic Records",1,164,376,"1485449"
172,"spotify:track:32hCeeK3ayPux4UauNPsgA","Arcángel, Grupo Frontera","ALV","Rimas Entertainment LLC.",59,157,21,"1481059"
173,"spotify:track:1l77YWrGUp3qX3NS1rz7lq","Banda MS de Sergio Lizárraga","El Color de Tus Ojos","Lizos Music",24,172,256,"1478467"
174,"spotify:track:1Wrzhfa5bNlqvsnCztz190","Hombres G","Devuélveme a mi chica","WM Spain",72,177,319,"1476262"
175,"spotify:track:1TUEXG5qBYH9f6smXUe5Y0","Eden Muñoz, Fuerza Regida","MONEY EDITION","EMC Music / Sony Music Mexico",115,115,5,"1472207"
176,"spotify:track:1EZk1gal98tb4lNI862KzO","Natanael Cano","Pacas De Billetes","WEA Latina",18,152,50,"1467901"
177,"spotify:track:3rdAz1fbUfZxYgaCviYhRo","Rauw Alejandro","Todo De Ti","Sony Music Latin/Duars Entertainment",1,181,119,"1453054"
178,"spotify:track:7s4emXHJwAuo5VvGBXmnBL","Young Miko, Feid","offline","Wave Music Group",178,-1,1,"1452183"
179,"spotify:track:7uuqrSuCjWxPTCVyOeGMyt","Michelle Maciel, Eden Muñoz","CCC","DALE PLAY Records / Solido Records",14,187,47,"1447661"
180,"spotify:track:5qbQNw7iaPJPnhN4gyGjoX","Legion RG, Enigma Norteño, Neton Vega","Haganse A Un Lado","Poker Music",154,179,9,"1442887"
181,"spotify:track:64my6WOkrygcpXKMLxxpi9","La Arrolladora Banda El Limón De Rene Camacho","Ya Es Muy Tarde","Universal Music Mexico",181,-1,3,"1439663"
182,"spotify:track:1SwY9YgXVgRbZM6uzxS4vU","El Chapo De Sinaloa","Le Hace Falta Un Beso","Paloma Records",155,-1,8,"1438729"
183,"spotify:track:7ABLbnD53cQK00mhcaOUVG","Myke Towers","LALA","WEA Latina",3,155,41,"1434418"
184,"spotify:track:0KSwFEkVh0KCBR0TwqBVen","Jasiel Nuñez, DannyLux","Corazón Frío","Double P Records",176,190,7,"1424085"
185,"spotify:track:7ctRhcAiTBQLsH64s93sN4","Natanael Cano, Peso Pluma","Pancake","WEA Latina",33,178,12,"1414999"
186,"spotify:track:0qCPD6ilr9nXkI4KVZgcns","Eden Muñoz, Junior H","Abcdario","Lizos Music",7,182,48,"1407615"
187,"spotify:track:2yS8aYWXEWJ1NlZ7VPDroT","Banda MS de Sergio Lizárraga","Me Vas a Extrañar","Lizos Music",60,-1,138,"1405506"
188,"spotify:track:5Eax0qFko2dh7Rl2lYs3bx","Bad Bunny","Efecto","Rimas Entertainment LLC",2,184,101,"1405135"
189,"spotify:track:7LLBONqWyX3MoBvIVPu5fj","Tiagz, Fuerza Regida, El Alfa","Tacata (Remix)","Street Mob Records",47,166,15,"1401990"
190,"spotify:track:1RGlfmdvcfatN0ZLOmzanS","Junior H","El Hijo Mayor","WEA Latina",22,142,91,"1399542"
191,"spotify:track:2hn2zOA2XFlv6DSmesylrL","Ryan Castro, Peso Pluma, SOG","QUEMA","Sony Music Latin",31,-1,36,"1389671"
192,"spotify:track:0TUW9faHNaBmi89wsYGp9y","Trueno, Nicki Nicole, Bizarrap, Taiu, TATOOL","Mamichula - con Nicki Nicole","NEUEN",18,186,35,"1383838"
193,"spotify:track:2yHmyqLvinMYOiOsJagAYK","La Adictiva","Disfruté Engañarte","Sony Music Latin",189,-1,3,"1373417"
194,"spotify:track:1ULnQ2yn5LeQX4LrROm1RD","Junior H, Ovi","COLOGNE","WEA Latina",19,-1,58,"1373099"
195,"spotify:track:6aommJFM8i3iT4inKuDSXh","Jósean Log","Chachachá","Jósean Log",156,-1,58,"1369099"
196,"spotify:track:1IzGf1RLpHuImi5lsCD3T9","Duelo","Puño De Diamantes","LA BONITA MUSIC",131,173,32,"1363603"
197,"spotify:track:0akyEssGRVHstqCSWXusJL","Ed Maverick","Fuentes de Ortiz","Universal Music Mexico",21,199,251,"1352220"
198,"spotify:track:4MNfkZ8dtva3cjJ2biqnDS","Los Temerarios","Ven Porque Te Necesito","Universal Music Mexico",188,188,2,"1351898"
199,"spotify:track:3GSMdtJphymHEsR8K9jT5Q","León Larregui","Locos","Universal Music Mexico",56,-1,315,"1351717"
200,"spotify:track:76kelNDs1ojicx1s6Urvck","Grupo Frontera","NO SE VA - EN VIVO","Grupo Frontera",1,136,89,"1348931"
