rank,uri,artist_names,track_name,source,peak_rank,previous_rank,weeks_on_chart,streams
1,"spotify:track:3GD6eImRvT0zgr8cQnokUq","Bhavi, Seven Kayne, Milo j, Tiago PZK, KHEA, Neo Pistea","BESAME (feat. Tiago PZK, Khea & Neo Pistea) - Remix","GMR",1,1,5,"3240288"
2,"spotify:track:5rQSQlZXXjMcevPGoAfE1z","Salastkbron, Diel Paris","Un Besito Más","WEA Latina",2,2,9,"2309844"
3,"spotify:track:4wS0TnQzVkY9ML1BPKpOk1","Tiago PZK, Ke Personajes","Piel","WEA Latina",2,5,15,"2135552"
4,"spotify:track:0GVPemmAwkXhFlYimhdDr3","El Turko, Mandale Flow","30 Grados","FLOW BR",2,3,14,"2047703"
5,"spotify:track:7bywjHOc0wSjGGbj04XbVi","Feid, ATL Jacob","LUNA","UMLE - Latino",5,7,23,"2013884"
6,"spotify:track:6XjDF6nds4DE2BBbagZol6","FloyyMenor, Cris Mj","Gata Only","FloyyMenor under exclusive license to UnitedMasters LLC",1,4,15,"1964427"
7,"spotify:track:7JKptWv4YXmievid0HajID","Luck Ra, KHEA","HOLA PERDIDA","Sony Music Entertainment Chile S.A",1,8,19,"1891320"
8,"spotify:track:5bi0gh89wRuH2OgjdAKFsb","Rvssian, Rauw Alejandro, Ayra Starr","Santa","Sony Music Latin",8,10,4,"1842131"
9,"spotify:track:0mJRX0WnqWlu8Boe7gpQ1P","Salastkbron, Omar Varela","Tal Para Cual","WEA Latina",4,6,18,"1740500"
10,"spotify:track:2eV3pmYGM1bm1vWHc0t8WF","DobleP, Salastkbron, Gusty dj","UH LA LA LA","DALE PLAY Records / Wesaisons Records",9,9,8,"1726459"
11,"spotify:track:2RmtEc2ZNDCzAU3vH0AbKx","Nicki Nicole","Ojos Verdes","Sony Music Latin/DALE PLAY Records",11,26,3,"1644921"
12,"spotify:track:5Ywg69AnG1CLLGEXne1MVy","Thomy DJ","Tumba","Thomy DJ",12,45,2,"1578420"
13,"spotify:track:6Es8Sk3xe1HiJ2MXCfHHwR","Emilia, TINI","La_Original.mp3","Sony Music Latin",1,11,28,"1549260"
14,"spotify:track:1905loqmX0pSFPMbA9rc1f","Ponte Perro, Kaleb Di Masi","GAFITA Y CHOMBA","GOAT Records",11,14,11,"1461508"
15,"spotify:track:43PiEypaceH339CSNiggyj","iZaak, JHAYCO, Anuel AA","BBY BOO - REMIX","WEA Latina",15,16,7,"1440332"
16,"spotify:track:5f4mOETLngamMDTJnbF9s7","Emilia","Exclusive.mp3","Sony Music Latin",3,13,28,"1416891"
17,"spotify:track:1TyBUtMxdmRfXhW3MmbxtQ","Luck Ra, Abel Pintos","QUE ME FALTE TODO","Sony Music Entertainment Chile S.A",3,15,29,"1381826"
18,"spotify:track:4jn3R3KF5hx2fCiXlj89yE","YSY A, Bhavi, Milo j","FLECHAZO EN EL CENTRO","Ysy A",12,17,36,"1373883"
19,"spotify:track:1kqH58eGh2ZTOHwqBIB2tM","Mesita, Nicki Nicole, Tiago PZK, Emilia","Una Foto Remix (feat. Emilia)","Mesita",1,12,19,"1361862"
20,"spotify:track:42mrOMjkQb7jRKatu0bqg4","Q' Lokura, Luck Ra","Mil Preguntas","Q' Lokura",20,22,5,"1356065"
21,"spotify:track:4YntVuBqggRsASIbBoWT3F","The La Planta, Luana","Mil Preguntas","TLP Records",10,18,10,"1336737"
22,"spotify:track:7s4emXHJwAuo5VvGBXmnBL","Young Miko, Feid","offline","Wave Music Group",17,21,6,"1252502"
23,"spotify:track:35ttE4t8lQZA2vuCYDg4G7","Milo j","M.A.I","DALE PLAY Records",11,20,24,"1224682"
24,"spotify:track:2xbH0CuDbid800YW5nMPzR","Emanero, Karina, j mena, Angela Torres","SINVERGÜENZA - con Angela Torres","Fifty One",14,23,23,"1205861"
25,"spotify:track:4uf8Ts4gpz1s9Q4FVdgrMT","DobleP, Pereiraremix, VERNAZ","FIESTA PUNKY","DALE PLAY Records / Wesaisons Records",25,27,15,"1091104"
26,"spotify:track:1NVBLZ63QLBjBoh5Tf0pKj","Eze Remix, Matt Sebastian","Cierre Rkt","Eze Remix",26,37,3,"1072163"
27,"spotify:track:10zSgbysU2KyVTrcRmtu62","Airbag","Por Mil Noches","DALE PLAY Records / Airbag",27,32,226,"1069000"
28,"spotify:track:490e7PHsxkzMot8qCO36Bt","TINI","pa","5020 Records",6,19,7,"1060627"
29,"spotify:track:5wcghdKONQcc5TKx9jCcns","DJ Tao, Roze Oficial","ROZE | DJ TAO Turreo Sessions #22","WM Chile",5,25,24,"1047471"
30,"spotify:track:7irTyPzSyqSbeUXbYsTR5j","The Academy: Segunda Misión, Dalex, Lenny Tavárez, Sech, Justin Quiles, Dímelo Flow, Maria Becerra","LATTE (feat. Maria Becerra)","WEA Latina",26,29,7,"1029864"
31,"spotify:track:6vRQqxOhUFd78p5tL8jXr7","Luck Ra, BM","La Morocha","Sony Music Entertainment Chile S.A",1,28,45,"1026845"
32,"spotify:track:3eNenN5eoBwMRNPkmoyk81","TINI","buenos aires","5020 Records",11,24,6,"994007"
33,"spotify:track:2kvpHbQHp9QmcG9WhyLwco","Cris Mj","Daytona","Sonar LLC.",29,31,18,"988316"
34,"spotify:track:6PMapQ7YSxkhAgNOvvoiWs","Sayian Jimmy, Nysix Music, CamiMusic","Bad Boy","sayian jimmy / nysix music",9,34,30,"973404"
35,"spotify:track:0kVpyCPMT52a05026zHGiq","Fer Vazquez, Flor Alvarez","Sin Querer","Fermazel LLC",12,30,22,"966414"
36,"spotify:track:6gV8ALkSHfJi7Bprabr1FC","Roze Oficial, Peipper","Inocente","Sony Music Uruguay",5,36,23,"916974"
37,"spotify:track:08809bzGs69SfjOFdeyssu","Omar Varela, El negro tecla","EL NEGRO TECLA | Omar Algo Anda Mal #9","WM Argentina",18,33,20,"907513"
38,"spotify:track:4GLmfc26LRlW5otKs6TewR","Luck Ra, Ulises Bueno","QUE SED","Sony Music Entertainment Chile S.A",12,35,8,"844315"
39,"spotify:track:4sl3IoHskl2Kbdy27gZ4yn","Mesita","Una Foto","Turbo Diesel Records",4,39,38,"837364"
40,"spotify:track:4IJWhehNLXru5WfS71EWSx","Cris Mj, Dei V","Diabólica","Sonar LLC.",39,40,9,"815464"
41,"spotify:track:7iUtQNMRB8ZkKC4AmEuCJC","Myke Towers","LA FALDA","WEA Latina",11,41,25,"813126"
42,"spotify:track:3tiJUOfAEqIrLFRQgGgdoY","Big One, FMK, Ke Personajes","Un Finde | CROSSOVER #2","Fifty One",1,46,59,"808566"
43,"spotify:track:1tMG67mMQCsculYUqJR5RC","ORO600, Pablo Chill-E, 0-600, Orodembow","Nena Sad","I NEED SPONSORS",18,38,15,"800394"
44,"spotify:track:1dtFrIzrr4DJZOHHESVwbt","Gusty dj, Salastkbron, Callejero Fino, Alejo Isakk, R Jota, L-Gante, Lolo OG, DobleP, Lauty Gram","El Super Junte Rkt","GUSTY DJ",20,42,24,"793558"
45,"spotify:track:0LZy30mVmxqUpdQmaXKXBd","Myke Towers, Bad Bunny","ADIVINO","WEA Latina",39,43,3,"786396"
46,"spotify:track:28v5fIoIa2Y07nqAXgBcXC","Q' Lokura","Cuarteto Sessions #3","Q' Lokura",24,44,16,"782359"
47,"spotify:track:0u6JsFiEEXb6kaF0oqyeFi","Luck Ra, La K'onga, Ke Personajes","Ya No Vuelvas (Versión Cuarteto)","Sony Music Entertainment Chile S.A",1,51,76,"764638"
48,"spotify:track:6MuJUSYCqA4FpMogUHzb2R","No Te Va Gustar","Ese Maldito Momento","Elefante Blanco",48,50,130,"761090"
49,"spotify:track:3oNnzH6hmqIGIhJ1NcHlrh","Maria Becerra","CORAZÓN VACÍO","WEA Latina",1,48,47,"743723"
50,"spotify:track:4mnpgUTLYMs3XFpqTWxVyA","Pablo Chill-E, Bryartz","Gitana (feat. Bryartz)","G STARR ENT",50,92,2,"703116"
51,"spotify:track:7MVIfkyzuUmQ716j8U7yGR","Milo j, Taiu","Rara Vez","Universal Music Argentina S.A.",3,49,66,"696955"
52,"spotify:track:4zgEanSngHa5vqehDVlY8x","Lolo OG, Axel Caram","Para el Tiktok","Symproducciones365",52,73,2,"673690"
53,"spotify:track:3tt9i3Hhzq84dPS8H7iSiJ","Manuel Turizo","La Bachata","Sony Music Latin/La Industria",1,58,101,"671326"
54,"spotify:track:3lqs3nTdYAbX4iQV6JBehz","YSY A, Rei, Obie Wanshot","YA NI YO ME ENTIENDO","Ysy A",54,62,3,"665786"
55,"spotify:track:2OzhQlSqBEmt7hmkYxfT6m","Taylor Swift, Post Malone","Fortnight (feat. Post Malone)","Taylor Swift",20,47,4,"651087"
56,"spotify:track:1Hs1uUl8o2VtDp1DABFq0O","LIT killah, Tiago PZK, Maria Becerra, Duki, Emilia, Rusherking, Big One, FMK","Los del Espacio","WEA Latina",1,57,50,"648151"
57,"spotify:track:3pCkC3Ahgl7MShJbafchZz","Los Ángeles Azules, Maria Becerra","El Amor de Mi Vida","OCESA Seitrack",11,66,39,"644266"
58,"spotify:track:6EWPFLaVPVmuhmA7J3ASP8","Maria Becerra, Ivy Queen","PRIMER AVISO","WEA Latina",19,55,11,"631153"
59,"spotify:track:7HrgGbnNKZKhBL70aFKpXk","Marka Akme, DJ Tao, Lauty Gram, Migrantes, Peipper","Linda - Remix","NES Play",3,54,33,"630034"
60,"spotify:track:3KZCP2StVGdWkOKyRZNWA4","Plan B","Es un Secreto","Pina Records",60,65,79,"618545"
61,"spotify:track:04ndZkbKGthTgYSv3xS7en","TINI","Cupido","5020 Records",4,75,66,"618101"
62,"spotify:track:4eiXf3HZDlrMxDNB1ahhpa","TINI","tinta 90","5020 Records",39,52,5,"609492"
63,"spotify:track:7In4Lnz4mpkFkG5zOAzLuE","LIT killah, Milo j, RONNY J","Carta de Despedida","Mawz Records",21,53,7,"604881"
64,"spotify:track:0CgpCtEPvyDizcg2p47VrU","No Te Va Gustar","A las Nueve","Elefante Blanco",64,64,281,"602772"
65,"spotify:track:6ebo7CQn4ILLGvXRmXHhQz","TINI, Maria Becerra","Miénteme","5020 Records",1,71,158,"595697"
66,"spotify:track:16flcJEZHzqoSRv7Ku5gjJ","Renn, Yexel","Maquillaje","WEA Latina",66,79,9,"589987"
67,"spotify:track:305U3q7GpuywzXIUrSGHqC","Alejo Isakk, DobleP, VERNAZ","PONTE SATA","Wapeo",56,67,18,"583156"
68,"spotify:track:0H9WU0OIXPpbOVgzzOanXb","BM","Ni Una Ni Dos","DALE PLAY Records / Wesaisons Records",2,70,46,"579732"
69,"spotify:track:00THZGfbizNvMUkJsQs74K","KHEA, Emilia","TU Y YO","Interscope Records",31,59,13,"570073"
70,"spotify:track:2n0NCtkvHx1oPqgiAvexiB","Tan Bionica","Loca","Pirca Records",70,87,32,"569669"
71,"spotify:track:2qSkIjg1o9h3YT9RAgYN75","Sabrina Carpenter","Espresso","Island Records",71,76,4,"562547"
72,"spotify:track:2AYwLOhXlychZgVXonufSN","Fer Vazquez, Flor Alvarez","TE AMO ♡","Fermazel LLC",72,191,2,"552737"
73,"spotify:track:7iQXYTyuG13aoeHxGG28Nh","Bad Bunny, Feid","PERRO NEGRO","Rimas Entertainment LLC",8,77,31,"552675"
74,"spotify:track:6Z28dALKtAgZ7AZRfjMQjY","Big One, Ulises Bueno, Rusherking","Mentiras | CROSSOVER #3","Fifty One",5,72,43,"547038"
75,"spotify:track:4kGGnJmqYqn6RQ9LMfvPcv","elaggume, Fauna Music, Coco Palmer","TATTOO","Fauna Music",75,-1,1,"544218"
76,"spotify:track:60Mgo3LnlAMy7TzhvVZUHA","TINI","posta","5020 Records",24,60,6,"541432"
77,"spotify:track:1p7m9H4H8s0Y7SgRm7j3ED","Andrés Calamaro","Flaca","DRO/EastWest Spain",77,84,296,"536626"
78,"spotify:track:6VciS3dRMpZhJiDxT8ArFi","Bizarrap, Young Miko","Young Miko: Bzrp Music Sessions, Vol. 58","DALE PLAY Records",3,68,19,"534039"
79,"spotify:track:5RqSsdzTNPX1uzkmlHCFvK","KAROL G, Peso Pluma","QLONA","Bichota/Interscope Records",15,69,39,"531547"
80,"spotify:track:7jDYmAWdghEWmQyqwLpriE","YSY A, Duki, ONIRIA, Yesan 雪山","NO DA MÁS","Ysy A",23,85,27,"525971"
81,"spotify:track:0TUW9faHNaBmi89wsYGp9y","Trueno, Nicki Nicole, Bizarrap, Taiu, TATOOL","Mamichula - con Nicki Nicole","NEUEN",1,74,133,"520022"
82,"spotify:track:5oYVxFt2k4SkVp6wzVsFWN","Sevdaliza, Villano Antillano, Tokischa","Ride Or Die, Pt. 2 (with Villano Antillano & Tokischa)","Twisted Elegance",63,63,4,"519513"
83,"spotify:track:0QoaFLmBJyuVuzOIGy6iCS","The Academy: Segunda Misión, Sech, Justin Quiles, Lenny Tavárez, Dalex, Dímelo Flow, Myke Towers","LA RANGER (feat. Myke Towers)","WEA Latina",57,80,7,"515908"
84,"spotify:track:3xkHsmpQCBMytMJNiDf3Ii","Benson Boone","Beautiful Things","Night Street Records, Inc./Warner Records Inc.",56,78,13,"515270"
85,"spotify:track:2bNCiY24Eh4saMcc23bvUN","Maria Becerra","ADIÓS","300 Entertainment",4,90,75,"510384"
86,"spotify:track:4dWzA1JJ0QOTUNBrYv8K9N","DJ Tao, DobleP","DOBLE P | DJ TAO Turreo Sessions #21","WM Chile",86,119,7,"499217"
87,"spotify:track:0RD94y2DlYTzEePb4WuVbU","Nicki Nicole, Rels B","qué le pasa conmigo?","Sony Music Latin/DALE PLAY Records",27,99,43,"495483"
88,"spotify:track:2kz1YOhJiNubjigR1gB1VX","Rauw Alejandro","DILUVIO","Sony Music Latin/Duars Entertainment",46,105,29,"484756"
89,"spotify:track:11PV8CaPqlto9Uejx92C35","Grupo Frontera, Ke Personajes","OJITOS ROJOS","Grupo Frontera",4,98,43,"483637"
90,"spotify:track:44m9PAUZYeOEGeaTYh6NAl","No Te Va Gustar, Juan Casanova","Tan Lejos","Elefante Blanco",82,103,94,"481706"
91,"spotify:track:6hv8hai0yo19JF2c6pppj6","Emilia","GTA.mp3","Sony Music Latin",2,86,36,"475082"
92,"spotify:track:0T3BndJOoSWYkPXcPLMH9B","The La Planta, Pushi","A PRUEBA DE BALAS","TLP Records",92,104,6,"474289"
93,"spotify:track:3ezO8gfskSWM3rk0GTfhFl","Emanero, Ulises Bueno, Migrantes, Los Palmeras","ATORRANTE - con Los Palmeras","Fifty One",15,91,45,"473989"
94,"spotify:track:4q5YezDOIPcoLr8R81x9qy","Taylor Swift","I Can Do It With a Broken Heart","Taylor Swift",49,109,4,"473552"
95,"spotify:track:65DBZofI0b79kfHTcWWDuU","Soda Stereo","Trátame Suavemente - Remasterizado 2007","Columbia",84,120,346,"472527"
96,"spotify:track:1smRP4zRit7A6ZDQXkFJWC","El Joan, Celso El Potente","Le Gustan Lo' Flaites","El Joan",22,82,26,"471789"
97,"spotify:track:10VrAhS6QQKA2mdf2NpreW","TINI","ángel","5020 Records",25,61,5,"471006"
98,"spotify:track:2df5CkXBJO7jTGXm54dFJy","Emilia, LUDMILLA, ZECCA","No_se_ve.mp3","2023 WK Records",5,89,54,"470687"
99,"spotify:track:0uFRDicafe9Gto0v2pk3kT","Dillom","Cirugía","Bohemian Groove",42,56,3,"467765"
100,"spotify:track:14rcLGX83RpsORAIzC4U4g","Patricio Rey y sus Redonditos de Ricota","Un Poco de Amor Francés","Patricio Rey Discos",82,116,159,"466388"
101,"spotify:track:0iVcmJx7r74F7mTf7M6s0v","DobleP, Lauty Gram, Gusty dj","Me Escapé","DALE PLAY Records / Wesaisons Records",31,100,33,"464311"
102,"spotify:track:3oqWr0jDWNXxWufNogGREp","Gustavo Cerati","Crimen","Ariola",88,112,375,"459840"
103,"spotify:track:4Dvkj6JhhA12EX05fT7y2e","Harry Styles","As It Was","Columbia",6,127,100,"452709"
104,"spotify:track:1hZsWUnLbqRw09jLAMQSsb","Feid, Young Miko","CLASSY 101","UMLE - Latino",5,97,59,"451717"
105,"spotify:track:6q6aChVJ5LLXFUSfakwpxW","Maria Becerra, Chencho Corleone, Ovy On The Drums","Piscina","WEA Latina",21,88,27,"451144"
106,"spotify:track:505v13epFXodT9fVAJ6h8k","KAROL G","AMARGURA","BICHOTA RECORDS / INTERSCOPE RECORDS / UNIVERSAL MUSIC LATINO",97,102,52,"448642"
107,"spotify:track:54zcJnb3tp9c5OVKREZ1Is","KAROL G","MI EX TENÍA RAZÓN","Bichota/Interscope Records",34,108,40,"448314"
108,"spotify:track:1gAPIjqunPXRA4y1kYZi0q","Rusherking, Marama","Besos con Fernet","Rusherking",8,95,27,"446992"
109,"spotify:track:6XbtvPmIpyCbjuT0e8cQtp","Quevedo","Columbia","Quevedo",1,126,45,"445536"
110,"spotify:track:41XmmKJHx1ZAH0Iykgjxfx","The Academy: Segunda Misión, Sech, Lenny Tavárez, Justin Quiles, Dalex, Dímelo Flow, Yandel, Jay Wheeler","QUÍTENME EL TELÉFONO (feat. Yandel, Jay Wheeler)","WEA Latina",87,107,6,"445525"
111,"spotify:track:7w7BrPbOjF5OxChs2dxFve","Big One, Emilia, Callejero Fino","En La Intimidad | CROSSOVER #1","Fifty One",1,94,67,"444906"
112,"spotify:track:4SW9gHnW8NfKOdqmh0ij45","Bizarrap, Milo j","Fruto","DALE PLAY Records",2,93,33,"438161"
113,"spotify:track:4ZXZub1pPCWib6xlSHiTj6","Luck Ra, La T y La M, Rusherking","Quiero Creer","Sony Music Entertainment Chile S.A",11,106,67,"434027"
114,"spotify:track:0T2pB7P1VdXPhLdQZ488uH","Feid","Normal","UMLE - Latino",31,144,97,"429425"
115,"spotify:track:0ZAJ660VP57lLK4U7NlGOy","Intoxicados","Nunca quise","Pop Art",68,113,381,"429071"
116,"spotify:track:2CeKVsFFXG4QzA415QygGb","Feid","Feliz Cumpleaños Ferxxo","UMLE - Latino",20,121,89,"428204"
117,"spotify:track:61qPUnazSdkvua4wgA4L8C","Babasonicos","Como Eran Las Cosas","Universal Music Argentina S.A.",70,115,61,"426808"
118,"spotify:track:1LiN0Z98FkR1t0m8KmLcAH","Anuel AA, Haze","Amanece","House of Haze",10,129,97,"422869"
119,"spotify:track:4p2Q6Tv4Nvkmczss8QtW3I","DobleP, Lauty Gram, Matt Sebastian","NO SE VE NA","DALE PLAY Records / Wesaisons Records",119,-1,1,"420832"
120,"spotify:track:6CIMoDfTsvFVGhFi3v9Izn","Alan Gomez, Luck Ra","Luck Ra | Mission 15","WM Chile",18,122,48,"420811"
121,"spotify:track:2qBirMakpTdz9ymxrZEyzg","Luis Alberto Spinetta","Seguir Viviendo Sin Tu Amor","EMI Argentina",58,136,330,"419067"
122,"spotify:track:37o3TuM0nRPMa9f9qpUKlo","WOS, Indio Solari","QUEMARÁS","DOGUITO Records / DALE PLAY Records",19,101,9,"418022"
123,"spotify:track:5gx39tUko6htjixWpIMqzM","Emanero, La K'onga, Antonio Rios","ADICTO","Fifty One",63,125,29,"417005"
124,"spotify:track:1xxtsuafCIJm7WPQ1tdDDi","Marama, MYA, Robleis","Bronceado - Remix","Montevideo Music Group",10,110,22,"416710"
125,"spotify:track:6abr2lKyMZTy21gSPWm7aG","Ke Personajes","Entre Beso y Beso","Ke Personajes",35,140,37,"416295"
126,"spotify:track:33ggWc1Nai6fcNb2qM4lJ7","Enrique Iglesias, Maria Becerra","ASI ES LA VIDA","Sony Music Latin",41,138,33,"416076"
127,"spotify:track:17phhZDn6oGtzMe56NuWvj","Teddy Swims","Lose Control","Warner Records",127,155,8,"411288"
128,"spotify:track:2pmHBQiIjVfTyn3p1rRbSB","Intoxicados","Esta Saliendo El Sol","Universal Music Argentina S.A.",128,142,13,"406686"
129,"spotify:track:29iIRrSuANyjnwag69PHOJ","Charly García","Demoliendo Hoteles","Universal Music Argentina S.A.",116,124,16,"405776"
130,"spotify:track:4waqcUQWdj0yH26STWl2Rq","La Oreja de Van Gogh","Rosas","Columbia",130,145,6,"404364"
131,"spotify:track:57WroSoheS9bWCtALlXA1t","YSY A, Bhavi, DrefQuila","TUUUYO","Ysy A",57,118,32,"403485"
132,"spotify:track:636kfKOcca5RtrRPhAk5y6","El Kuelgue, Zoe Gotusso","Carta Para No Llorar","Discos Crack",132,134,9,"403187"
133,"spotify:track:5286CIWA8QpRrpCr9x7BbQ","Las Pastillas del Abuelo, Ke Personajes","Loco Por Volverla a Ver","Altafonte under exclusive distributed to Discos Crack",85,96,5,"402106"
134,"spotify:track:2nBOPYRoAYOwv6go12SQDs","Airbag","Cae el Sol","DALE PLAY Records / Airbag",122,147,26,"394302"
135,"spotify:track:7qIw4D1PcDHigDohKkLB0W","Andrés Calamaro","Te quiero igual","DRO/EastWest Spain",135,172,5,"393343"
136,"spotify:track:6wZJCPyhix2WOglxGWlIfb","Trueno","THE ROOF IS ON FIRE","Sony Music Latin",136,-1,1,"393040"
137,"spotify:track:7Ho0Xbf3vHdBJiTbQocuxQ","Emanero, Rusherking, Angel Lopez","A PURO DOLOR","Fifty One",47,154,11,"389899"
138,"spotify:track:2YNMRnIJMCxDQWYfXRxJmB","Tan Bionica","Obsesionario en La Mayor","Pirca Records",86,146,51,"389807"
139,"spotify:track:6mmPpaltUZK7xjNlBPQQ0p","Rauw Alejandro, Chencho Corleone","Desesperados","Sony Music Latin/Duars Entertainment",1,157,87,"389074"
140,"spotify:track:1rh4kDY9T4fHVDum8Foi5k","Gustavo Cerati","Adiós","Ariola",119,164,94,"384380"
141,"spotify:track:67Q93kXygxCskeQiIP0V0j","Ciro y los Persas","Me Gusta","300 Producciones",71,162,377,"384374"
142,"spotify:track:5irZOI6fACizSRid2rgHqC","TINI","ni de ti","5020 Records",23,83,5,"381235"
143,"spotify:track:2RGb1i12SiuWVU2EcVHY3G","Trueno","TRANKY FUNKY","Sony Music Latin",36,159,40,"381063"
144,"spotify:track:6LH7FdWPmuPphhCQfPkiwq","Dillom","Muñecas","Bohemian Groove",56,81,3,"379841"
145,"spotify:track:0aPs3kmiqmt9QG7gWXdefA","Bizarrap, Milo j","No soy Eterno","DALE PLAY Records",13,111,32,"379092"
146,"spotify:track:6r0TaoZh1Oc1KkuL4rC1kB","Nicki Nicole, Milo j","DISPARA ***","Sony Music Latin/DALE PLAY Records",9,132,52,"379030"
147,"spotify:track:6TI490muJ6RgFsYJc626BZ","YSY A, CLUB HATS","#Ysya2020 Vol. 5 - Silbando","Ysy A",66,123,32,"378922"
148,"spotify:track:7upAH0ezzsThyvr33YKn4u","Turf","Pasos Al Costado","Pop Art",105,161,308,"378814"
149,"spotify:track:2PkTjm1QAJCZbJ9MqC4RqA","Fito Paez","11 Y 6","EMI Argentina",65,151,97,"377449"
150,"spotify:track:1AX4aybSRyXHWrjg27wTFE","Ke Personajes, Onda Sabanera","Pobre Corazón - En Vivo","Ke Personajes",2,150,63,"374636"
151,"spotify:track:5nRkIy23DFOjph1R6YkFG8","Q' Lokura, Los Herrera","Cuidado Que Te Supero","Q' Lokura",151,166,8,"374576"
152,"spotify:track:7GrffUxvaKz4wKmyutin0P","TINI, Morat","Consejo de Amor (feat. Morat)","5020 Records",57,182,115,"373851"
153,"spotify:track:2o0qEJLFTlR3NPxLy7Hz0T","Koino Yokan","Lo Que Hoy Quieras","Koino Yokan",126,158,6,"373496"
154,"spotify:track:7DSAEUvxU8FajXtRloy8M0","Miley Cyrus","Flowers","Columbia",5,156,59,"372892"
155,"spotify:track:36t6frENUtCYKuZus6aYDO","Taylor Swift","Who’s Afraid of Little Old Me?","Taylor Swift",59,-1,3,"372732"
156,"spotify:track:2F3N9tdombb64aW6VtZOdo","Taylor Swift","Down Bad","Taylor Swift",47,171,4,"372726"
157,"spotify:track:2HafqoJbgXdtjwCOvNEF14","iñigo quintero","Si No Estás","Acqustic",6,148,34,"372651"
158,"spotify:track:2GxrNKugF82CnoRFbQfzPf","Artemas","i like the way you kiss me","Artemas",91,139,6,"371958"
159,"spotify:track:2dK99lWPkBVwNen6gK1AtI","Chayanne","Bailando Bachata","Sony Music Latin",159,174,4,"371518"
160,"spotify:track:6vsKOJPjdxlYgRs8McgtCQ","TWENTY SIX, Tayson Kryss","Buscando Money","FFRR",3,114,17,"370714"
161,"spotify:track:6HT88WDVwEJiHEbPuQ5XcB","Damas Gratis, Ke Personajes","Costumbres - Vivo","Pelo Music S.A.",21,184,78,"369114"
162,"spotify:track:6kUopck7LHVadAjAFcXiTj","Patricio Rey y sus Redonditos de Ricota","Un Ángel para Tu Soledad","Patricio Rey Discos",136,193,87,"367079"
163,"spotify:track:7M0mBls29IohQIPGqegcyE","Emilia, Duki","como si no importara","Sony Music Latin",2,153,141,"365857"
164,"spotify:track:5FWQLEX0lavdxiWGBNkBQ4","Tiago PZK, TINI","Me Enteré","WEA Latina",4,141,52,"364748"
165,"spotify:track:1iLbUmb2b2btyAAcQ68a1p","Bizarrap, Milo j","Milo J: Bzrp Music Sessions, Vol. 57","DALE PLAY Records",1,133,33,"363846"
166,"spotify:track:5KbBVSj6AJZ5662fO8EYFh","Marshmello, Manuel Turizo","El Merengue","Sony Music Latin",35,188,49,"363359"
167,"spotify:track:2K1VdnrPKRQCzLT5EjLwJ9","djsantaa, Bruno Chavez Dj","MAS LENTITO RKT","djsantaa",167,198,2,"359520"
168,"spotify:track:6ZVLfXr015ogdhov4FW4pG","Emilia","IConic.mp3","Sony Music Latin",33,137,28,"359439"
169,"spotify:track:4pHdHimCLvD4nx8lh6uQyx","Los Abuelos De La Nada","Mil Horas - 1994 Remastered Version","Universal Music Argentina S.A.",95,175,227,"359417"
170,"spotify:track:16QAisXL2nWqt59Z0oXfkL","Airbag","Cicatrices","DALE PLAY Records / Airbag",170,178,4,"357993"
171,"spotify:track:1buwr89mlvxbaqArqmvCYS","Patricio Rey y sus Redonditos de Ricota","Esa Estrella Era Mi Lujo","Patricio Rey Discos",95,185,44,"357799"
172,"spotify:track:51ZQ1vr10ffzbwIjDCwqm4","Ariana Grande","we can't be friends (wait for your love)","Republic Records",48,160,10,"355219"
173,"spotify:track:5nJP1qwTNnXF4CiCrfmNjy","Marama, Emanero, Rafaga","Todo Comenzó Bailando - Remix","Montevideo Music Group",84,189,10,"354252"
174,"spotify:track:2wuZ3kg5ChBjRKqBYfJ9H7","CA7RIEL & Paco Amoroso, CA7RIEL, Paco Amoroso","EL ÚNICO","5020 Records",113,131,4,"352801"
175,"spotify:track:6d4d6cwiAf59mKxoRmXQoK","Babasonicos","Irresponsables","Pop Art",107,181,55,"352509"
176,"spotify:track:1O1VvCshhDw3XIOOcfLziL","Rels B, Lia Kali","La Vida Sin Ti","DALE PLAY Records / Flakk Team",104,135,3,"351019"
177,"spotify:track:2jEjxOyKqMpkcThWl697hf","Babasonicos","El Loco","Pop Art",152,-1,22,"350251"
178,"spotify:track:4NydZzgr1kCGWgUggqdwGH","El Kuelgue","Sinoca","Discos Crack",169,169,2,"350184"
179,"spotify:track:4nW5qMepEJOkZONWTsrc7w","ZARAMAY, Lil Pani","MADISON","Espantapájaros",179,-1,1,"348247"
180,"spotify:track:250FEHmhQf4Y2XiqjDz0zu","El Kuelgue","Parque Acuático","Discos Crack",167,167,3,"347014"
181,"spotify:track:32299N6IyNvtw1O3eTmWbv","Mesita","Cheto Mal","Turbo Diesel Records",181,190,2,"346571"
182,"spotify:track:0B8yu7yLe1UsXv6gewHRv2","Duki, YSY A, Rei","Pintao","SSJ Records / DALE PLAY Records",23,170,89,"345956"
183,"spotify:track:7ABLbnD53cQK00mhcaOUVG","Myke Towers","LALA","WEA Latina",1,195,46,"344685"
184,"spotify:track:04bg4edMdpKhsgkSzYqj55","Callejeros","9 de Julio","Pelo Music S.A.",136,-1,17,"343972"
185,"spotify:track:5XUWO8VqwE4PEkLYAtt7h7","Emilia","Jagger.mp3","Sony Music Latin",8,163,59,"343697"
186,"spotify:track:0OEBOJhSObnFuHuasXdt52","Shakira","Dia de Enero","Epic",156,-1,3,"342741"
187,"spotify:track:0N361WhEqVunVl5ZBkfd70","Árbol","El Fantasma","Surco",103,152,5,"342679"
188,"spotify:track:3qhlB30KknSejmIvZZLjOD","Djo","End of Beginning","Djo",107,180,10,"341918"
189,"spotify:track:49TQoqxFPH7zJWqUnv3ufQ","YSY A, SPONSOR DIOS, CLUB HATS","CADA VEZ QUE","Ysy A",67,128,5,"341666"
190,"spotify:track:7lLc3W3Yb2vGOrkuK0N0XH","Salastkbron, Alejo Isakk, Gusty dj","La Chispa Es Una","WEA Latina",68,-1,33,"341298"
191,"spotify:track:3Vevii7qKqrmW8CcyzBHDl","Taylor Swift","So Long, London","Taylor Swift",41,177,4,"340015"
192,"spotify:track:6QCTo3BaEdkEp0BbbNCVIt","Milo j, Yami Safdie","CARENCIAS DE CORDURA","DALE PLAY Records",60,179,11,"339636"
193,"spotify:track:4HYDUMY0xSpeBr0AMY9cUz","Jay Wheeler, DJ Nelson, Myke Towers","La Curiosidad","Linked Music / Dynamic Records / EMPIRE",4,-1,123,"335999"
194,"spotify:track:3fjN3y5x4hN53rykAN2LHQ","Rels B","cómo dormiste?","DALE PLAY Records / Flakk Team",4,-1,83,"334998"
195,"spotify:track:3j5zNcb0aSk7dx3W3mAKzw","Ozuna, Anuel AA, Chris Jedi","Pa Ti Estoy","Aura Music Corp.",144,-1,14,"334419"
196,"spotify:track:4bw8mcDUSRWfQo63ZTYRnU","Maluma, Carin Leon","Según Quién","Sony Music Latin",64,-1,33,"334050"
197,"spotify:track:0W3TCDzYM7xFrZSaXnQvs4","YSY A, SPONSOR DIOS, Evlay","CÓMO CHILLA ELLA","SPONSOR DIOS",2,173,58,"333936"
198,"spotify:track:56mbNpJVn5WQhOlsOvb2A0","Bersuit Vergarabat","La Soledad","Int'l Latin America",192,192,2,"331301"
199,"spotify:track:2XXwLdtuAcE0HSCu61ijAb","Taylor Swift","My Boy Only Breaks His Favorite Toys","Taylor Swift",46,-1,3,"330827"
200,"spotify:track:0W0iAC1VGlB82PI6elxFYf","Taylor Swift","Guilty as Sin?","Taylor Swift",68,199,4,"329843"
