rank,uri,artist_names,track_name,source,peak_rank,previous_rank,weeks_on_chart,streams
1,"spotify:track:6AI3ezQ4o3HUoP6Dhudph3","Kendrick Lamar","Not Like Us","Kendrick Lamar, under exclusive license to Interscope Records",1,1,9,"502101"
2,"spotify:track:1G3NTy7WKbEznyJlTQXWMX","Kabza De Small, Young Stunna, Nkosazana Daughter, Mthunzi, Nokwazi, Anzo, Mashudu, Murumba Pitch, Tman Xpress","Kabza Chant (feat. Young Stunna, Nkosazana Daughter, Mthunzi, Nokwazi, Anzo, Mashudu, Murumba Pitch & Tman Xpress)","Piano Hub",1,2,4,"396908"
3,"spotify:track:4GxZKOak4mz6VmMJUmO4Is","Tyler ICU, DJ Maphorisa, Masterpiece YVK, Ceeka RSA, M.J, Silas Africa, Al Xapo","Manzi Nte (feat. Masterpiece YVK, Ceeka RSA, M.J, Silas Africa & Al Xapo)","New Money Gang Records",3,5,5,"376906"
4,"spotify:track:6Kijtp0DB6VwcoJIw7PJ9W","Kabza De Small, Mthunzi, DJ Maphorisa, Young Stunna, Sizwe Alakine, Umthakathi Kush","Imithandazo (feat. Young Stunna, DJ Maphorisa, Sizwe Alakine & Umthakathi Kush)","Piano Hub",1,3,36,"351113"
5,"spotify:track:5DqA8IUhk1DQSGmf6XOVrI","Uncle Waffles, Royal MusiQ, OHP Sage, Pcee","Wadibusa (feat. Royal MusiQ, OHP Sage, & Pcee)","Encore Recordings",2,6,11,"327113"
6,"spotify:track:3bqCtq5RcPzULlyqkFGVJ7","Umafikizolo, Umashotana","Ngathi Nguye","Insika Yethonga",6,8,4,"326850"
7,"spotify:track:5AJ9hqTS2wcFQCELCFRO7A","Tommy Richman","MILLION DOLLAR BABY","PULSE Records",2,4,10,"325351"
8,"spotify:track:6hqel7QjWBsjk1LJG6J0pD","Shakes & Les, LeeMcKrazy","Funk 99","Kreativekornerr",1,7,13,"315682"
9,"spotify:track:2Oe52Ggx8lxxI55azZbr5h","Kabza De Small, Mthunzi, MaWhoo","Amazwe (feat. Mawhoo)","Piano Hub",9,10,36,"288963"
10,"spotify:track:5SefJrw27Juf3N9eGhNHi3","Mid9t, Officixl Rsa","Banyana","Mid9t",8,9,10,"288452"
11,"spotify:track:1gM44tVZ9pfUe9v35Stp31","Bassie, M-Touch, Ranger, Amaza, LeeMcKrazy, Tman Xpress","Kwelanga 2.0 (feat. Tman Xpress & LeeMcKrazy)","Warner Music Africa",11,18,4,"281018"
12,"spotify:track:6dOtVTDdiauQNBQEDOtlAB","Billie Eilish","BIRDS OF A FEATHER","Darkroom/Interscope Records",11,11,7,"272713"
13,"spotify:track:2hrycoFU1mZw6YPvMcn8yC","Jordan Adetunji","KEHLANI","300 Entertainment",13,15,4,"271849"
14,"spotify:track:3xkHsmpQCBMytMJNiDf3Ii","Benson Boone","Beautiful Things","Night Street Records, Inc./Warner Records Inc.",4,12,24,"253245"
15,"spotify:track:2qSkIjg1o9h3YT9RAgYN75","Sabrina Carpenter","Espresso","Island Records",14,14,12,"243845"
16,"spotify:track:5fZJQrFKWQLb7FpJXZ1g7K","Shaboozey","A Bar Song (Tipsy)","American Dogwood / EMPIRE",7,13,12,"241182"
17,"spotify:track:4kydNoaTX4vfyCPeXE2bpt","Sam Deep, Azana","BoGogo","Universal Music (Pty) Ltd.",17,36,4,"232463"
18,"spotify:track:54seQV7MCcppBrznALCdlT","TitoM, Yuppe, S.N.E, EeQue","Tshwala Bam (feat. S.N.E, EeQue)","TitoM",1,22,19,"230959"
19,"spotify:track:1KpHX3zexEHvYTw0dSyfgF","Msongi, Cici, Sir Trill, Dot Mega","Xola","Lushazi Projects & Management",19,27,7,"229219"
20,"spotify:track:7iabz12vAuVQYyekFIWJxD","Central Cee, Lil Baby","BAND4BAND (feat. Lil Baby)","Columbia",6,16,6,"228777"
21,"spotify:track:40zr1pQlSaIWUYyR8APyy2","Bandros, Kelvin Momo, Smash SA, Mr. Maker","Uhambe Wrongo (feat. Mr. Maker)","Jive Hub Productions Pty (Ltd)",4,21,14,"221911"
22,"spotify:track:2pqIaYg12ziqIpVtdVESGt","Kelvin Momo, Babalwa M, Nia Pearl, Stixx","Amalobolo (feat. Stixx, Nia Pearl)","Kelvin Momo Productions",6,23,30,"221800"
23,"spotify:track:3Vr3zh0r7ALn8VLqCiRR10","Myles Smith","Stargazing","RCA Records Label",8,19,8,"218776"
24,"spotify:track:5N3hjp1WNayUPZrA8kJmJP","Sabrina Carpenter","Please Please Please","Island Records",12,17,4,"215219"
25,"spotify:track:7JNPhwzFNg4pb7wZqfR5ms","KMAT, CowBoii, Gubziin, Ranger","MKK (feat. CowBoii, djygubzin.live & Ranger)","Matt Records / EMPIRE",11,20,12,"214520"
26,"spotify:track:3E1PwVodPiDbBHOI85CO9M","Tyler ICU, LeeMcKrazy, Tman Xpress, Visca, Ceeka RSA, SjavasDaDeejay, Al Xapo","Ebasini (feat. Tman Xpress, Visca, Ceeka RSA, Sjavasdadeejay & Al Xapo)","Baby Blue Entertainment",26,31,19,"210004"
27,"spotify:track:4iZ4pt7kvcaH6Yo8UoZ4s2","SZA","Snooze","Top Dawg Entertainment/RCA Records",12,25,82,"208849"
28,"spotify:track:4tsVMjM60RNTe9EV5oQ4sQ","DJ Stokie, Eemoh","Masithokoze","Universal Music (Pty) Ltd.",3,28,37,"200078"
29,"spotify:track:0JXXNGljqupsJaZsgSbMZV","Miguel","Sure Thing","Jive",13,26,183,"197401"
30,"spotify:track:5Z0UnEtpLDQyYlWwgi8m9C","Hozier","Too Sweet","Rubyworks / Universal-Island Records Ltd",6,24,14,"195742"
31,"spotify:track:7GaFYUqP2WdR4KTPk7cXoP","Mario","Let Me Love You","J Records",25,30,291,"192178"
32,"spotify:track:7JbLSEDlRdoJaXk5ddZae2","Mthandeni SK, Lwah Ndlunkulu","Paris","Mthandeni Music Production",4,29,47,"191560"
33,"spotify:track:2cwsLyg0jSqOS0FIgaN0S3","Makhadzi Entertainment, Iyanya, Prince Benza","Number 1 (feat. Iyanya, Prince Benza)","Makhadzi Entertainment",22,40,8,"189229"
34,"spotify:track:2nYDr6EASJj7UcjiEmlvj0","Babalwa M, Kelvin Momo, Stixx, Baby S.O.N","Pholisa","Mavuso Business Solutions",5,32,10,"184072"
35,"spotify:track:48lcmlbwm4VHcOfXqWlVbx","Mellow & Sleazy, Eltee, LeeMcKrazy, Scotts Maphuma, Gipa","Kokotela (feat. Scotts Maphuma & Gipa)","Sound African Recordings",27,41,19,"177527"
36,"spotify:track:17phhZDn6oGtzMe56NuWvj","Teddy Swims","Lose Control","Warner Records",24,34,26,"177303"
37,"spotify:track:4xXHrIiIeW7dMh5FoYI5m1","Zee Nxumalo, Pabi Cooper, 031CHOPPA, Shakes & Les","Thula Mabota","KwaNxumalo",19,33,14,"173723"
38,"spotify:track:3XqM8hLCEYlbnFjoWwqtFv","Chris Brown","Angel Numbers / Ten Toes","Chris Brown Entertainment/RCA Records",15,38,34,"171142"
39,"spotify:track:5TY9ovYtBeJTY9s7K3ijEd","Ugatsheni","Hit after Hit","Kuhleliwe Mmema Holdings",9,39,27,"169948"
40,"spotify:track:1tvDDR0ZAowEqKLN15g7tH","Zwide, Umafikizolo, uMehlabomvu","Wenhliziyo Yami","Insika Yethonga",11,43,19,"166503"
41,"spotify:track:43PuMrRfbyyuz4QpZ3oAwN","Bryson Tiller","Exchange","TrapSoul/RCA Records",33,42,126,"164387"
42,"spotify:track:2tudvzsrR56uom6smgOcSf","Future, Metro Boomin, Kendrick Lamar","Like That","Wilburn Holding Co./Boominati/Epic/Republic",3,37,15,"161148"
43,"spotify:track:2GxrNKugF82CnoRFbQfzPf","Artemas","i like the way you kiss me","Artemas",5,35,15,"160284"
44,"spotify:track:3mxQry8oUO3gvdz9sGkbud","SjavasDaDeejay, TitoM, Vyno Keys, CowBoii, Mellow & Sleazy, Nobantu Vilakazi","Bayazi (feat. Mellow & Sleazy, Nobantu Vilakazi, Cowboii)","SjavasDaDeejay",44,44,6,"159312"
45,"spotify:track:6jlG8gBPNAgBgoivw2Ig09","Tommy Richman","DEVIL IS A LIE","PULSE Records",45,46,3,"158767"
46,"spotify:track:3pImmSzeKex5ffzsDoaL3z","Bassie, Aymos, T-Man SA","Izenzo","Djs Production Pty Ltd",5,52,45,"149211"
47,"spotify:track:0WIv5qV41y6YjjB9V1biuC","Muni Long","Made For Me","Supergiant Records, LLC / Def Jam Recordings",5,45,24,"143197"
48,"spotify:track:3TpQcE8EqBqobOznNdl20l","DJ KSB, LeeMcKrazy, Soulful G","Umaqondana","Wanitwa Mos Entertainment",22,64,8,"142248"
49,"spotify:track:4rXLjWdF2ZZpXCVTfWcshS","Gunna","fukumean","300 Entertainment",5,47,55,"141267"
50,"spotify:track:6OGNF7mro80pMi5q1HhylS","Khalil Harrison, Tyler ICU, LeeMcKrazy, Ceeka RSA","Jealousy (feat. Leemckrazy & Ceeka RSA)","Baby Blue Entertainment",21,61,30,"140387"
51,"spotify:track:3pXF1nA74528Edde4of9CC","Bryson Tiller","Don't","TrapSoul/RCA Records",46,56,131,"140100"
52,"spotify:track:2wXExC9YzKpslEpiUpUlou","DJ Tshegu, LeeMcKrazy, Zee Nxumalo, Al Xapo, Vyno Keys, QuayR Musiq","Chengu Shesha (feat. Al xapo, Vyno Keys and QuayR Musiq)","18 Area Holdings",52,58,7,"139577"
53,"spotify:track:6XpEm7VJ7TZxZTawH8BCSW","Tyla, Gunna, Skillibeng","Jump","FAX Records/Epic",19,50,15,"137235"
54,"spotify:track:7221xIgOnuakPdLqT0F3nP","Post Malone, Morgan Wallen","I Had Some Help (Feat. Morgan Wallen)","Mercury Records/Republic Records",12,49,8,"136860"
55,"spotify:track:5jsO87ShnH2lEXhIfjMAUj","Mzukulu, Shenge wasehlalankosi","Ijuba","BAQAZILE ENTERTAINMENT",46,67,30,"135441"
56,"spotify:track:77DRzu7ERs0TX3roZcre7Q","Kendrick Lamar","euphoria","Kendrick Lamar, under exclusive license to Interscope Records",3,48,10,"133768"
57,"spotify:track:3jTedBPHIIr48xoJchYHNH","Kharishma, Ba Bethe Gashoazen","Chokeslem","4397321 Records DK",57,147,3,"133101"
58,"spotify:track:5yyYL1FpimADTIftYQU0cg","Dlala Thukzin, Zaba, Sykes","iPlan","Dlala Records (PTY) Ltd",1,60,42,"132518"
59,"spotify:track:5jOBkF36FUThJIHEJ3Zac5","Bandros, ZANI, Zee Nxumalo","Nguwe","Jive Hub Productions Pty (Ltd)",55,55,25,"131639"
60,"spotify:track:4iuNZTcvT9diFySSzVsnVS","Fantasia","When I See U","J Records",26,62,217,"128058"
61,"spotify:track:7kCvZYf9IEtJLlGctDBUAw","Mshinwemali, Zothando","Ngicel Uhambe","Insika Yethonga",50,54,25,"126412"
62,"spotify:track:59nOXPmaKlBfGMDeOVGrIK","Future, Drake, Tems","WAIT FOR U (feat. Drake & Tems)","Epic/Freebandz",1,71,111,"126035"
63,"spotify:track:3wszhvnFWgMXzYGJVQweII","Da Gifto, Brandon Dhludhlu","Ingelosi","DHF Records",57,65,17,"125577"
64,"spotify:track:5IgjP7X4th6nMNDh4akUHb","Chris Brown","Under The Influence","Chris Brown Entertainment/RCA Records",2,69,120,"125284"
65,"spotify:track:4EI8VuxUuIHKfafU72emqz","Mariah Carey","We Belong Together","Def Jam Recordings",44,63,122,"124321"
66,"spotify:track:710qLZ4WOxBj7ZaVbVJtkh","Kelvin Momo, Babalwa M, Azana, Stixx","Maye Maye (feat. Azana, Stixx)","Kelvin Momo Productions",17,87,31,"124138"
67,"spotify:track:4Na2HfNSr58chvfX69fy36","Gunna","one of wun","300 Entertainment",17,51,8,"123774"
68,"spotify:track:1rtMuIY76v879DN8kW1fhf","Kelvin Momo, Babalwa M, Sfarzo Rtee","Sukakude (feat. Sfarzo Rtee)","Kelvin Momo Productions",7,104,82,"123710"
69,"spotify:track:2uqYupMHANxnwgeiXTZXzd","Dasha","Austin (Boots Stop Workin')","Warner Records",58,59,17,"123013"
70,"spotify:track:2HYFX63wP3otVIvopRS99Z","Eminem","Houdini","Shady/Aftermath/Interscope Records",9,53,5,"121583"
71,"spotify:track:5aIVCx5tnk0ntmdiinnYvw","Tyla","Water","FAX Records/Epic",4,68,44,"120974"
72,"spotify:track:1eUGmzzvahJjOSWgDHuRlv","Miguel","Girl With The Tattoo Enter.lewd","Jive",61,75,48,"119569"
73,"spotify:track:5uQ7de4EWjb3rkcFxyEOpu","Mark Ambor","Belong Together","Hundred Days Records, LLC",41,77,14,"119349"
74,"spotify:track:0p8AKRTIxPeHDZu7ydYTxM","Shakes & Les, DBN Gogo, Zee Nxumalo, Ceeka RSA, Chley","Funk 55 (feat. Ceeka RSA, Chley)","Kreativekornerr",2,78,31,"119244"
75,"spotify:track:1bl7mvR2BaoqA7ak6xJ3yj","K.O, Maglera Doe Boy","Let Me Cook (feat. Maglera Doe Boy)","Sound African Recordings",74,91,6,"118204"
76,"spotify:track:4J1H4EuucGhhYfcPpYCBRr","DJ Stokie, Zee_nhle, Omit ST, Sobzeen","Awukhuzeki","Universal Music (Pty) Ltd.",1,82,55,"118041"
77,"spotify:track:3LfXImvXHkHzz0qqdFAol4","DJ Kent, Thakzin, Brenden Praise, Mo-T, MÖRDA","Horns In The Sun (feat. Mo-T, Brenden Praise & Mörda) [Thakzin Remix]","Spinnin' Deep",17,86,38,"117860"
78,"spotify:track:3GLF4uV3uS1ImSEPyhLZLp","TxC, Davido, Tony Duardo, LeeMcKrazy, Djy Biza","Yebo","2024 TXC Enterprises /LVRN Records",78,99,2,"117134"
79,"spotify:track:51eSHglvG1RJXtL3qI5trr","Benson Boone","Slow It Down","Night Street Records, Inc./Warner Records Inc.",47,66,15,"117098"
80,"spotify:track:25em98e6uqAT1356DvrbQx","Mfr Souls, Kabza De Small, MaWhoo, Bassie, T-Man SA, Shane907","Ngifa Nawe","Kombelani",80,-1,1,"116806"
81,"spotify:track:7CyPwkp0oE8Ro9Dd5CUDjW","The Weeknd, JENNIE, Lily-Rose Depp","One Of The Girls (with JENNIE, Lily Rose Depp)","XO / Republic Records",31,79,34,"116035"
82,"spotify:track:42VsgItocQwOQC3XWZ8JNA","Travis Scott, Playboi Carti","FE!N (feat. Playboi Carti)","Cactus Jack/Epic",5,72,40,"115256"
83,"spotify:track:3u4er9DgmXCyTMhBns3Rpp","Mafikizolo","Emlanjeni","Kalawa Jazmee",75,81,11,"115169"
84,"spotify:track:331l3xABO0HMr1Kkyh2LZq","David Guetta, OneRepublic","I Don't Wanna Wait","Parlophone UK",84,109,7,"114386"
85,"spotify:track:3S8Tcoqm0QATkmk5g74AeQ","Shebeshxt, Skomota, Naqua SA, Buddy Sax","MAVUSO A TAO TAO","Fyve",57,57,5,"114288"
86,"spotify:track:53wwaMp15eGyE12Cm7sxLa","Xolly Mncwango","Ungukuphila","Universal Music (Pty) Ltd.",55,76,19,"113139"
87,"spotify:track:7BRD7x5pt8Lqa1eGYC4dzj","Billie Eilish","CHIHIRO","Darkroom/Interscope Records",15,70,7,"112865"
88,"spotify:track:3hRV0jL3vUpRrcy398teAU","Lord Huron","The Night We Met","Play It Again Sam",73,83,59,"112826"
89,"spotify:track:1eDI5oU04SLsXl0TfxfwYf","Tems","Love Me JeJe","RCA Records/Since 93'",42,73,10,"112604"
90,"spotify:track:2fOazsCfbGoDQqwxIJLUzG","Naledi Aphiwe","Ngiyabonga","Naledi Aphiwe",69,96,23,"111690"
91,"spotify:track:3XVBdLihbNbxUwZosxcGuJ","Alicia Keys","If I Ain't Got You","J Records",83,92,33,"111548"
92,"spotify:track:4xQgivVLGFlB0tctjpR2SU","Lwah Ndlunkulu","Eyami","Nkabi Records",15,89,48,"110959"
93,"spotify:track:6VnLhQOKMPpftnMuk2aMKO","Makhadzi Entertainment, Ba Bethe Gashaozen","Letswai (feat. Ba Bethe Gashaozen)","Makhadzi Entertainment",78,126,11,"110354"
94,"spotify:track:1ALpjc1x4V8dX43kJyps3v","Usimamane","Cheque","gamma. Africa",20,80,15,"109548"
95,"spotify:track:1ng4byy7mejezJ08hs4P7R","Sam Deep, Njelic, Aymos","Isgubhu","Universal Music (Pty) Ltd.",6,98,44,"109399"
96,"spotify:track:03rdHTIFjxhsWXBsfj2c9h","Mellow & Sleazy, Gipa Entertainment, DJ DADAMAN","Christmas Present","Sound African Recordings",96,125,3,"108235"
97,"spotify:track:5Dsuz6UsZyoWM3HOaRgQeC","Lloyiso","Seasons","Universal Music (Pty) Ltd.",62,120,121,"108107"
98,"spotify:track:0UBK6HcgmmWUQzFQTncmDz","Wanitwa Mos, Nkosazana Daughter, Master KG, Dalom Kids","Keneilwe (feat. Dalom Kids)","Wanitwa Mos Entertainment",2,94,33,"108075"
99,"spotify:track:7wcjeveluiW5djtxLCxNSx","Spirit Of Praise, Mpumi Mtsweni","Thath'Indawo (Live)","Spirit Music",23,84,71,"107750"
100,"spotify:track:6lrKA1DMAihPI490Oj0twC","MaWhoo, Deep Sen, KingTalkzin, Mthunzi","Ngilimele (feat. Deep Sen, KingTalkzin, Mthunzi)","MaWhoo Entertainment",28,106,42,"107223"
101,"spotify:track:0JGdktTFMHlfUdSZcbTOXC","Lwah Ndlunkulu","Ngyathandaza","Nkabi Records",55,112,32,"107202"
102,"spotify:track:0u2P5u6lvoDfwTYjAADbn4","Billie Eilish, Khalid","lovely (with Khalid)","Darkroom",22,113,323,"106480"
103,"spotify:track:1ULFJZX54HXXjSTMx63dk0","Kabza De Small, Msaki","Khusela (feat. Msaki)","Piano Hub",5,117,81,"105854"
104,"spotify:track:7qEHsqek33rTcFNT9PFqLf","Lewis Capaldi","Someone You Loved","Vertigo Berlin",7,90,286,"104885"
105,"spotify:track:6xcJyGpfZbuuiequtnlKt4","Travis Scott","BUTTERFLY EFFECT","Cactus Jack / Epic",29,103,36,"104566"
106,"spotify:track:1RMJOxR6GRPsBHL8qeC2ux","Daniel Caesar, H.E.R.","Best Part (feat. H.E.R.)","Golden Child Recordings",83,130,244,"103824"
107,"spotify:track:629DixmZGHc7ILtEntuiWE","Billie Eilish","LUNCH","Darkroom/Interscope Records",18,74,7,"103707"
108,"spotify:track:4OzS0O0i88cGeu8YklCHrT","Fridayy","When It Comes To You","FRIDAYY PS/ Def Jam",70,88,25,"103377"
109,"spotify:track:7ir1pK0mSBVZLoqUPbmous","Goldmax, Dlala Thukzin, Funky Qla, Zee Nxumalo, Beast Rsa","FOMO","Afrotainment",88,145,17,"103149"
110,"spotify:track:7axl6v0Yv4ksLVMt6XItpc","Tyla","Truth or Dare","FAX Records/Epic",17,93,31,"103120"
111,"spotify:track:0tIDIj46MoZhTuU7lPw4qD","Sjava, Qwellers, Blue Pappi, LaCabra, Lowfeye, Sastii","Typhoon (feat. Sastii, LaCabra, Lowfeye, Blue Pappi)","1020 Cartel",101,111,8,"102464"
112,"spotify:track:3xKsf9qdS1CyvXSMEid6g8","Frank Ocean","Pink + White","Boys Don't Cry",58,97,85,"102084"
113,"spotify:track:7DfFc7a6Rwfi3YQMRbDMau","Frank Ocean","Thinkin Bout You","Red Zone Entertainment / IDJ",70,127,33,"101444"
114,"spotify:track:0WbMK4wrZ1wFSty9F7FCgu","Chappell Roan","Good Luck, Babe!","Chappell Roan PS/ Island",114,123,2,"101076"
115,"spotify:track:5uCax9HTNlzGybIStD3vDh","James Arthur","Say You Won't Let Go","Columbia",80,124,316,"100888"
116,"spotify:track:3GCdLUSnKSMJhs4Tj6CV3s","Kendrick Lamar, SZA","All The Stars (with SZA)","Black Panther (TDE/DMG) PS",4,115,75,"100847"
117,"spotify:track:1vbe9sh7U9vdMceAhitWr2","New Edition","Can You Stand The Rain","Geffen*",102,102,17,"100726"
118,"spotify:track:7d2se65A7Vxyvlh0tnYoGN","Umlabalaba","Ilo Nalo Naloya","1962225 Records DK",79,122,15,"100588"
119,"spotify:track:68vgtRHr7iZHpzGpon6Jlo","USHER, Alicia Keys","My Boo","LaFace Records",115,119,13,"100011"
120,"spotify:track:6Qb4XQnsuRnMlGxwR3GOGV","TitoM, Yuppe, Burna Boy, S.N.E","Tshwala Bam (feat. S.N.E)","Boundary Ent / Spaceship",41,101,7,"98785"
121,"spotify:track:1KDT0dCJbLdJGFb47430tk","Kabza De Small, Mthunzi, MaWhoo","Bonga (feat. Mawhoo)","Piano Hub",120,142,32,"98450"
122,"spotify:track:05lM7Ep8UESoe3LV5yrew5","Lloyiso","Dream About You","Ambitiouz Entertainment",54,136,96,"98335"
123,"spotify:track:28drn6tQo95MRvO0jQEo5C","Future, Metro Boomin, Travis Scott, Playboi Carti","Type Shit","Wilburn Holding Co./Boominati/Epic/Republic",11,116,15,"97356"
124,"spotify:track:4oY24Bjq0KeTTpuw34DdP0","Makhadzi Entertainment, Babethe Gashoazen","Mapara (feat. Babethe Gashoazen)","Makhadzi Entertainment",91,186,10,"97250"
125,"spotify:track:2QjOHCTQ1Jl3zawyYOpxh6","The Neighbourhood","Sweater Weather","Columbia",57,133,149,"97169"
126,"spotify:track:7A2hGxo1tS0nuPB53wLDSe","Tyler ICU, LeeMcKrazy, DJ Maphorisa, Ceeka RSA, Tiiger, Tyrone Dee, Al Xapo, Jay Sax","Government (feat. LeeMcKrazy, DJ Maphorisa, Ceeka RSA, Tiiger, Tyrone Dee, Al Xapo & JaySax)","New Money Gang Records",83,105,10,"96067"
127,"spotify:track:7A1T1a4RlppJDCIsqciE0Y","Jayy Scott, KayyStar777, Ishuu Industry, Laz Mfanaka","CHOMI YAKA","Sixxtune Africa (Pty) Ltd",127,176,2,"95499"
128,"spotify:track:1bjeWoagtHmUKputLVyDxQ","SZA","Saturn","Top Dawg Entertainment/RCA Records",27,100,19,"95419"
129,"spotify:track:60Z2UUVW3R0oeWCLi4Y3aK","Shebeshxt, Naqua SA, Buddy Sax, Bayor 97, Zoli White Smoke, Smeazy","Ambulance","The Royal Media House Group",58,149,21,"95097"
130,"spotify:track:1zhMHgotgZXkLCXpqNRnPK","PARTYNEXTDOOR","N o C h i l l","OVO Sound",130,159,4,"94856"
131,"spotify:track:68Dni7IE4VyPkTOH9mRWHr","J. Cole","No Role Modelz","Roc Nation Records LLC",39,148,194,"94045"
132,"spotify:track:51ZQ1vr10ffzbwIjDCwqm4","Ariana Grande","we can't be friends (wait for your love)","Republic Records",16,114,17,"93844"
133,"spotify:track:3JyEmaZmPsuIvFivnwN22k","Glenn Jones","All for You","Jive",99,152,66,"93667"
134,"spotify:track:4Dvkj6JhhA12EX05fT7y2e","Harry Styles","As It Was","Columbia",1,128,109,"93413"
135,"spotify:track:5b3XJ1pjrHO5JtY2PcTjnI","Megan Thee Stallion, Yuki Chiba","Mamushi (feat. Yuki Chiba)","Hot Girl Productions",135,-1,1,"93412"
136,"spotify:track:3B54sVLJ402zGa6Xm4YGNe","French Montana, Swae Lee","Unforgettable","Bad Boy Entertainment/Epic Records",90,140,49,"93369"
137,"spotify:track:1zi7xx7UVEFkmKfv06H8x0","Drake, Wizkid, Kyla","One Dance","Cash Money Records/Young Money Ent./Universal Rec.",78,151,164,"93286"
138,"spotify:track:2FDTHlrBguDzQkp7PVj16Q","Dave, Central Cee","Sprinter","Neighbourhood / Live Yours",4,129,55,"93057"
139,"spotify:track:3qhlB30KknSejmIvZZLjOD","Djo","End of Beginning","Djo",24,121,19,"92767"
140,"spotify:track:6MJ2zbeyqzQteAB9rEc9VX","Lwah Ndlunkulu, Siya Ntuli","Ithuba","Nkabi Records",33,175,98,"92668"
141,"spotify:track:4uz8SKa7tfqngHBMJ8YTlY","Harrycane, Nkosazana Daughter","Sondela Dali","Wanitwa Mos Entertainment",135,135,2,"92386"
142,"spotify:track:5hJFhO9dvhJoDvUZZ9iWSw","Miguel","Adorn","ByStorm Entertainment/RCA Records",42,150,94,"91884"
143,"spotify:track:38yfPQYoGWFJtn3NLBqTB0","Daliwonga, Nkosazana Daughter, Happy Jazzman","Seduce Me (feat. Nkosazana Daughter & Happy JazzMan)","New Money Gang Records",17,169,36,"91547"
144,"spotify:track:1Qrg8KqiBpW07V7PNxwwwL","SZA","Kill Bill","Top Dawg Entertainment/RCA Records",5,134,78,"91495"
145,"spotify:track:2HbKqm4o0w5wEeEFXm2sD4","Kendrick Lamar, Jay Rock","Money Trees","Aftermath",49,153,104,"91311"
146,"spotify:track:0uSbvEk6hGHnOP0wM7xOBg","TxC, Tony Duardo","Turn Off The Lights","2024 TXC Enterprises /LVRN Records",9,160,24,"90802"
147,"spotify:track:7sO5G9EABYOXQKNPNiE9NR","Offset, Metro Boomin","Ric Flair Drip (with Metro Boomin)","Slaughter Gang, LLC/Epic/Quality Control Music/Motown/Capitol/Boominati Worldwide/Republic",27,158,28,"90664"
148,"spotify:track:6NjWCIYu1W8xa3HIvcIhd4","Tinashe","Nasty","Tinashe Music Inc., under exclusive license to Nice Life Recording Company",144,144,4,"90615"
149,"spotify:track:0mflMxspEfB0VbI1kyLiAv","Noah Kahan","Stick Season","Mercury Records/Republic Records",33,137,31,"90320"
150,"spotify:track:5tpft20jhQvRlG3O7XfwWy","Tyler ICU, Tumelo_za, DJ Maphorisa, Nandipha808, Ceeka RSA, Tyrone Dee","Mnike (feat. DJ Maphorisa, Nandipha808, Ceeka RSA & Tyron Dee)","New Money Gang Records",1,171,62,"90311"
151,"spotify:track:5jPckUbvd78IYYd1bEJSwJ","Khuthuza, MAFIKIZOLO","NGIJOLA NEBHINCA","5932550 Records DK",43,167,35,"90303"
152,"spotify:track:561jH07mF1jHuk7KlaeF0s","Eminem","Mockingbird","Aftermath",52,163,89,"90275"
153,"spotify:track:1CKJewE41VybHL3Dpz6z7J","Umafikizolo","Wethu","Insika Yethonga",153,-1,1,"89866"
154,"spotify:track:3c6afiysmB7OnxQzzSqRfD","Tamia","So Into You","Rhino/Warner Records",80,139,57,"89435"
155,"spotify:track:3rtv6UeFWYOAbegjRrrGCB","Solly Moholo","Banaka Nako Ea Me E Haufi","Sony Music Special Projects",154,179,9,"89331"
156,"spotify:track:1aHy1ipWQRNauI0ee9uYfi","Lithe","Fall Back","GSL",55,108,9,"89308"
157,"spotify:track:4uzKAj0mIyYmyhsRRyPXaQ","Alex Warren","Carry You Home","Atlantic Records",157,172,4,"88028"
158,"spotify:track:5Y35SjAfXjjG0sFQ3KOxmm","SZA","Nobody Gets Me","Top Dawg Entertainment/RCA Records",20,154,39,"87426"
159,"spotify:track:3Pbp7cUCx4d3OAkZSCoNvn","Michael Marcagi","Scared To Start","Warner Records",65,138,23,"87365"
160,"spotify:track:5r8aHQYosE37dL7zznR4LR","Lindo Mtangayi","Kuvele Kukhanye","Independent",124,173,5,"87221"
161,"spotify:track:7jtQIBanIiJOMS6RyCx6jZ","Tom Odell","Another Love","ITNO/Columbia",45,162,109,"87195"
162,"spotify:track:1A1ifX8sWzelNpkL5PxcHT","Ayra Starr, GIVĒON","Last Heartbreak Song (feat. Giveon)","Mavin Global Holdings Ltd.",68,85,4,"87116"
163,"spotify:track:7ko9EAsZ2N1ZpEBlMUkR3J","Kabza De Small, DJ Maphorisa, Njelic, Young Stunna, Nkosazana Daughter, Xolani Guitar","Nana Thula (feat. Njelic, Young Stunna, Nkosazana Daughter & Xolani Guitar)","Piano Hub",6,180,52,"86453"
164,"spotify:track:3broQqYTmS1ctbl5mvFAKc","Focalistic, Sims Noreng","13 POS (Ke Bo Mang)","18 Area Holdings",59,132,6,"86387"
165,"spotify:track:6Nh5rpPBqpKVQs674CLHNi","DJ Lag, Mr Nation Thingz, K.C Driller","Hade Boss","Black Major x Ice Drop",13,131,23,"86255"
166,"spotify:track:4fxwbUSI6jF4XdnvCUVG97","Elaine","You're the One","Columbia",12,174,115,"86124"
167,"spotify:track:0jxg3fpP4EAjYKs9o9aVVz","SUPTA, Thalitha, Bongane Sax","Kuzolunga","SUPTA",153,-1,2,"85507"
168,"spotify:track:2x2olWuWXpqjoeE4bO1NFS","Flo Milli","Never Lose Me","'94 Sounds/RCA Records",26,161,26,"85281"
169,"spotify:track:7ATU7xI4ffZgPGm3QCKX4K","Lwah Ndlunkulu","Ngiyeza","Nkabi Records",8,189,76,"85251"
170,"spotify:track:3FAJ6O0NOHQV8Mc5Ri6ENp","GIVĒON","Heartbreak Anniversary","Epic/Not So Fast",3,107,150,"85083"
171,"spotify:track:2eAvDnpXP5W0cVtiI0PUxV","Ruth B.","Dandelions","Columbia",56,141,124,"84928"
172,"spotify:track:1KGi9sZVMeszgZOWivFpxs","TLC","No Scrubs","Arista/LaFace Records",172,177,8,"84602"
173,"spotify:track:7fyVAeiVE6mvM4MgyX4zi8","Aymos, Eemoh, Kabza De Small","Esgela","Lyf Styl Entertainment",135,178,4,"84007"
174,"spotify:track:2qxgejJTaZIHNSHDD22Uhl","Kabza De Small, DJ Maphorisa, Ami Faku","Abalele","Piano Hub",1,192,123,"83722"
175,"spotify:track:31kxPC3ZB9AYwCLyHaqEVX","Tems","Me & U","RCA Records/Since 93'",22,157,39,"83254"
176,"spotify:track:3w0w2T288dec0mgeZZqoNN","¥$, Kanye West, Ty Dolla $ign","CARNIVAL","Ye",5,156,21,"83126"
177,"spotify:track:2OzhQlSqBEmt7hmkYxfT6m","Taylor Swift, Post Malone","Fortnight (feat. Post Malone)","Taylor Swift",7,166,11,"82457"
178,"spotify:track:7zFXmv6vqI4qOt4yGf3jYZ","Daniel Caesar, Kali Uchis","Get You (feat. Kali Uchis)","Golden Child Recordings",119,183,68,"82229"
179,"spotify:track:1XBYiRV30ykHw5f4wm6qEn","The Kid LAROI","NIGHTS LIKE THIS","Columbia",179,-1,1,"82180"
180,"spotify:track:2OpBganfGk2GVdSlRdxzaX","Khalid","Better","Right Hand Music Group, LLC/RCA Records",1,194,175,"81612"
181,"spotify:track:3QaPy1KgI7nu9FJEQUgn6h","Billie Eilish","WILDFLOWER","Darkroom/Interscope Records",61,168,7,"81373"
182,"spotify:track:4zhmUyXRnEPNysQZCKIRKt","Tamia","Still","Elektra Records",143,143,5,"81183"
183,"spotify:track:5Zu0VKpAzGOxAvmhXuLa0G","Q Twins, Gatsheni","Umalambana","Afrotainment",96,187,11,"81135"
184,"spotify:track:40ds3xedbMkWhszkGnZwxi","Tyla","ART","FAX Records/Epic",23,164,15,"80914"
185,"spotify:track:2ktg2oZDyFAX3iY1QNkXl5","Summer Walker","Session 32","LVRN Records",87,190,83,"80169"
186,"spotify:track:7EK0Se77nYoRndoAJXUWHq","Spirit Of Praise, Spirit of Praise Choir, Pastor M Tshabalala","Bamba Mzalwane (Live)","Spirit Music",178,195,6,"79961"
187,"spotify:track:0nbXyq5TXYPCO7pr3N8S4I","Roddy Ricch","The Box","Atlantic Records",1,170,87,"79858"
188,"spotify:track:6mrrQb0xQFxDAA6PkdpnaQ","Jaziel Brothers","Ngeke Ndiphinde","Jaziel Music Productions",172,-1,5,"79776"
189,"spotify:track:1NQCinyxiglxekxXVPEhnC","Uncle Waffles, Ice Beats Slide, Sbuda Maleather","Peacock Revisit (feat. Ice Beats Slide & Sbuda Maleather)","Encore Recordings",3,-1,34,"79706"
190,"spotify:track:5obuTVRQLKjqUlfLj73Dny","Dinho, Kabza De Small, Tumza D'Kota, Agzo, Optimist Music ZA, Seun1401, El.Stephano","uKhome Lotto (feat. Agzo, Optimist Music ZA, Seun1401 & El.Stephano)","Sound African Recordings",152,-1,2,"79668"
191,"spotify:track:5GorFaKkP2mLREQvhSblIg","K-Ci & JoJo","All My Life","Geffen*",171,193,9,"79621"
192,"spotify:track:7yq4Qj7cqayVTp3FF9CWbm","Vance Joy","Riptide","F-Stop Records/Atlantic",72,146,58,"79541"
193,"spotify:track:6PGoSes0D9eUDeeAafB2As","Kendrick Lamar, Zacari","LOVE. FEAT. ZACARI.","Aftermath",74,191,86,"79302"
