rank,uri,artist_names,track_name,source,peak_rank,previous_rank,weeks_on_chart,streams
193,"spotify:track:5obuTVRQLKjqUlfLj73Dny","Dinho, Kabza De Small, Tumza D'Kota, Agzo, Optimist Music ZA, Seun1401, El.Stephano","uKhome Lotto (feat. Agzo, Optimist Music ZA, Seun1401 & El.Stephano)","Sound African Recordings",57,186,19,"98139"
194,"spotify:track:3Rq1cgwfOjGCH8oxb9jiOz","Sun-El Musician, Simmy, Sino Msolo","Kwalula","El-World",33,128,14,"98026"
195,"spotify:track:4eLFAxZWiV4Mfp8mpzdrdT","Mlindo The Vocalist","Emakhaya","Sound African Recordings",114,174,18,"97904"
196,"spotify:track:1zi7xx7UVEFkmKfv06H8x0","Drake, Wizkid, Kyla","One Dance","Cash Money Records/Young Money Ent./Universal Rec.",78,183,181,"97823"
197,"spotify:track:710qLZ4WOxBj7ZaVbVJtkh","Kelvin Momo, Babalwa M, Azana, Stixx","Maye Maye (feat. Azana, Stixx)","Kelvin Momo Productions",17,187,43,"97758"
198,"spotify:track:68Dni7IE4VyPkTOH9mRWHr","J. Cole","No Role Modelz","Roc Nation Records LLC",39,157,211,"97619"
199,"spotify:track:17YUnqdkyiKp7XzgwtNsAQ","Tyler ICU, Tumelo_za, Ceeka RSA","Ng'limele (feat. Ceeka RSA)","New Money Gang Records",199,-1,1,"97172"
200,"spotify:track:2tHwzyyOLoWSFqYNjeVMzj","Sabrina Carpenter","Please Please Please","Island Records",12,144,21,"96747"
