rank,uri,artist_names,track_name,source,peak_rank,previous_rank,weeks_on_chart,streams
1,"spotify:track:0NLRYW9HyqHcbyzfAwskKN","Felo Le Tee, Scotts Maphuma, Thabza Tee, DJ Maphorisa, Djy Biza","Yebo Lapho (Gogo) (feat. DJ Maphorisa & Djy Biza)","New Money Gang Records",1,1,8,"523483"
2,"spotify:track:64e1w4LMyXcTLCFzR3xCRX","Wanitwa Mos, Nkosazana Daughter, Master KG, Big Zulu, Zee Nxumalo","Mfazi Wephepha (feat. Big Zulu & Zee Nxumalo)","Wanitwa Mos Entertainment",2,3,3,"408332"
3,"spotify:track:1gM44tVZ9pfUe9v35Stp31","Bassie, M-Touch, Ranger, Amaza, LeeMcKrazy, Tman Xpress","Kwelanga 2.0 (feat. Tman Xpress & LeeMcKrazy)","Warner Music Africa",2,2,12,"359844"
4,"spotify:track:3mWu4sw2LsmNX4UBfhrvC1","CowBoii, Mellow & Sleazy, Scotts Maphuma, Eltee, Novatron","eGoli (feat. Eltee & Novatron)","Mculo / EMPIRE",4,6,5,"331556"
5,"spotify:track:6dOtVTDdiauQNBQEDOtlAB","Billie Eilish","BIRDS OF A FEATHER","Darkroom/Interscope Records",5,5,15,"323915"
6,"spotify:track:0cnbEf12FLBWx9QnBlw1EL","Dlala Thukzin, Funky Qla, Zee Nxumalo, MK Productions","Ama Gear","Dlala Records and Funko Media",6,7,8,"313571"
7,"spotify:track:6AI3ezQ4o3HUoP6Dhudph3","Kendrick Lamar","Not Like Us","Kendrick Lamar, under exclusive license to Interscope Records",1,4,17,"312802"
8,"spotify:track:21fhgH4tjYcAKzkzCuYyr6","Blaq Major, BLESS THE GENTLEMAN, DJ KAP","Sdakiwe Sbali (feat. Bless The Gentleman & DJ Kap)","Wanitwa Mos Entertainment",8,9,5,"307821"
9,"spotify:track:1KpHX3zexEHvYTw0dSyfgF","Msongi, Cici, Sir Trill, Dot Mega","Xola","Lushazi Projects & Management",9,10,15,"298491"
10,"spotify:track:5DqA8IUhk1DQSGmf6XOVrI","Uncle Waffles, Royal MusiQ, OHP Sage, Pcee","Wadibusa (feat. Royal MusiQ, OHP Sage, & Pcee)","Encore Recordings",2,13,19,"271809"
11,"spotify:track:4GxZKOak4mz6VmMJUmO4Is","Tyler ICU, DJ Maphorisa, Masterpiece YVK, Ceeka RSA, M.J, Silas Africa, Al Xapo","Manzi Nte (feat. Masterpiece YVK, Ceeka RSA, M.J, Silas Africa & Al Xapo)","New Money Gang Records",3,12,13,"268578"
12,"spotify:track:3bqCtq5RcPzULlyqkFGVJ7","Umafikizolo, Umashotana","Ngathi Nguye","Insika Yethonga",3,8,12,"263417"
13,"spotify:track:0X5qaCnHN98ELiqincjJwg","DoouShii, Scotts Maphuma, Mellow & Sleazy","MaDlamini (feat. Mellow & Sleazy)","Sessions 55 (Pty) LTD",13,30,3,"259683"
14,"spotify:track:2hrycoFU1mZw6YPvMcn8yC","Jordan Adetunji","KEHLANI","300 Entertainment",6,11,12,"252447"
15,"spotify:track:3jTedBPHIIr48xoJchYHNH","Kharishma, Ba Bethe Gashoazen","Chokeslem","4397321 Records DK",13,18,11,"238120"
16,"spotify:track:4kydNoaTX4vfyCPeXE2bpt","Sam Deep, Azana","BoGogo","Universal Music (Pty) Ltd.",11,15,12,"234287"
17,"spotify:track:3xkHsmpQCBMytMJNiDf3Ii","Benson Boone","Beautiful Things","Night Street Records, Inc./Warner Records Inc.",4,16,32,"228803"
18,"spotify:track:0JXXNGljqupsJaZsgSbMZV","Miguel","Sure Thing","Jive",13,14,191,"225248"
19,"spotify:track:3E1PwVodPiDbBHOI85CO9M","Tyler ICU, LeeMcKrazy, Tman Xpress, Visca, Ceeka RSA, SjavasDaDeejay, Al Xapo","Ebasini (feat. Tman Xpress, Visca, Ceeka RSA, Sjavasdadeejay & Al Xapo)","Baby Blue Entertainment",18,21,27,"221729"
20,"spotify:track:6Kijtp0DB6VwcoJIw7PJ9W","Kabza De Small, Mthunzi, DJ Maphorisa, Young Stunna, Sizwe Alakine, Umthakathi Kush","Imithandazo (feat. Young Stunna, DJ Maphorisa, Sizwe Alakine & Umthakathi Kush)","Piano Hub",1,19,44,"217302"
21,"spotify:track:7GaFYUqP2WdR4KTPk7cXoP","Mario","Let Me Love You","J Records",20,20,299,"210109"
22,"spotify:track:3Vr3zh0r7ALn8VLqCiRR10","Myles Smith","Stargazing","RCA Records Label",8,29,16,"208274"
23,"spotify:track:1mourdmaqv51JvXKTjuFCP","Kelvin Momo, Sykes","Bala (feat. SYKES)","Kelvin Momo Productions",12,17,4,"204259"
24,"spotify:track:2qSkIjg1o9h3YT9RAgYN75","Sabrina Carpenter","Espresso","Island Records",14,39,20,"202770"
25,"spotify:track:2plbrEY59IikOBgBGLjaoe","Lady Gaga, Bruno Mars","Die With A Smile","Interscope",25,73,2,"196272"
26,"spotify:track:2Oe52Ggx8lxxI55azZbr5h","Kabza De Small, Mthunzi, MaWhoo","Amazwe (feat. Mawhoo)","Piano Hub",9,23,44,"195970"
27,"spotify:track:17phhZDn6oGtzMe56NuWvj","Teddy Swims","Lose Control","Warner Records",24,32,34,"194306"
28,"spotify:track:2HiHffF7XArCZDDn5VNUGM","DJ Stokie, Zee_nhle, Sobzeen, Faith Strings","Selimathunzi","Universal Music (Pty) Ltd.",28,37,7,"192576"
29,"spotify:track:5fZJQrFKWQLb7FpJXZ1g7K","Shaboozey","A Bar Song (Tipsy)","American Dogwood / EMPIRE",7,25,20,"192263"
30,"spotify:track:5N3hjp1WNayUPZrA8kJmJP","Sabrina Carpenter","Please Please Please","Island Records",12,50,12,"191816"
31,"spotify:track:0OA00aPt3BV10qeMIs3meW","Hanumankind, Kalmi","Big Dawgs","Universal Music India Pvt Ltd.",22,22,5,"189181"
32,"spotify:track:5AJ9hqTS2wcFQCELCFRO7A","Tommy Richman","MILLION DOLLAR BABY","PULSE Records",2,24,18,"182070"
33,"spotify:track:3mxQry8oUO3gvdz9sGkbud","SjavasDaDeejay, TitoM, Vyno Keys, CowBoii, Mellow & Sleazy, Nobantu Vilakazi","Bayazi (feat. Mellow & Sleazy, Nobantu Vilakazi, Cowboii)","SjavasDaDeejay",33,33,14,"181428"
34,"spotify:track:6hqel7QjWBsjk1LJG6J0pD","Shakes & Les, LeeMcKrazy","Funk 99","Kreativekornerr",1,27,21,"180071"
35,"spotify:track:5G2f63n7IPVPPjfNIGih7Q","Sabrina Carpenter","Taste","Island Records",35,-1,1,"178478"
36,"spotify:track:1G3NTy7WKbEznyJlTQXWMX","Kabza De Small, Young Stunna, Nkosazana Daughter, Mthunzi, Nokwazi, Anzo, Mashudu, Murumba Pitch, Tman Xpress","Kabza Chant (feat. Young Stunna, Nkosazana Daughter, Mthunzi, Nokwazi, Anzo, Mashudu, Murumba Pitch & Tman Xpress)","Piano Hub",1,31,12,"178442"
37,"spotify:track:43PuMrRfbyyuz4QpZ3oAwN","Bryson Tiller","Exchange","TrapSoul/RCA Records",28,28,134,"177403"
38,"spotify:track:40zr1pQlSaIWUYyR8APyy2","Bandros, Kelvin Momo, Smash SA, Mr. Maker","Uhambe Wrongo (feat. Mr. Maker)","Jive Hub Productions Pty (Ltd)",4,26,22,"176673"
39,"spotify:track:2cwsLyg0jSqOS0FIgaN0S3","Makhadzi Entertainment, Iyanya, Prince Benza","Number 1 (feat. Iyanya, Prince Benza)","Makhadzi Entertainment",22,41,16,"175271"
40,"spotify:track:3Rq1cgwfOjGCH8oxb9jiOz","Sun-El Musician, Simmy, Sino Msolo","Kwalula","El-World",40,42,5,"173286"
41,"spotify:track:7JbLSEDlRdoJaXk5ddZae2","Mthandeni SK, Lwah Ndlunkulu","Paris","Mthandeni Music Production",4,35,55,"171691"
42,"spotify:track:5Z0UnEtpLDQyYlWwgi8m9C","Hozier","Too Sweet","Rubyworks / Universal-Island Records Ltd",6,34,22,"170882"
43,"spotify:track:4EI8VuxUuIHKfafU72emqz","Mariah Carey","We Belong Together","Def Jam Recordings",36,36,130,"167543"
44,"spotify:track:1AEiIl8iXEya3SXC5qE1il","Harrycane, Nkosazana Daughter","Sondela Dali","Wanitwa Mos Entertainment",44,51,10,"164322"
45,"spotify:track:6WcijmexMH672jSFMyhBPU","Mid9t, Officixl Rsa","Banyana","North West Sound Recordings",8,38,18,"161860"
46,"spotify:track:7JNPhwzFNg4pb7wZqfR5ms","KMAT, CowBoii, Gubziin, Ranger","MKK (feat. CowBoii, djygubzin.live & Ranger)","Matt Records / EMPIRE",11,43,20,"160806"
47,"spotify:track:3QaPy1KgI7nu9FJEQUgn6h","Billie Eilish","WILDFLOWER","Darkroom/Interscope Records",47,71,15,"152797"
48,"spotify:track:59nOXPmaKlBfGMDeOVGrIK","Future, Drake, Tems","WAIT FOR U (feat. Drake & Tems)","Epic/Freebandz",1,44,119,"151777"
49,"spotify:track:4iZ4pt7kvcaH6Yo8UoZ4s2","SZA","Snooze","Top Dawg Entertainment/RCA Records",12,46,90,"150235"
50,"spotify:track:3XqM8hLCEYlbnFjoWwqtFv","Chris Brown","Angel Numbers / Ten Toes","Chris Brown Entertainment/RCA Records",15,45,42,"149268"
51,"spotify:track:4iuNZTcvT9diFySSzVsnVS","Fantasia","When I See U","J Records",26,52,225,"148006"
52,"spotify:track:3pXF1nA74528Edde4of9CC","Bryson Tiller","Don't","TrapSoul/RCA Records",45,49,139,"146147"
53,"spotify:track:4zZxynw8cwhCRlDl9pay2f","Khathapillar, Sol Phenduka, Smash SA, Kamoh Xaba","Diqabang","Unity Music Africa",53,84,8,"145508"
54,"spotify:track:2b35KuJzUmtfroem1tRM8R","Spirit Of Praise, Dumi Mkokstad","Asikho Isikhali (Live)","Spirit Music",54,54,2,"144552"
55,"spotify:track:4oAuqjuAV5OiJv4aI8B6CL","DBN Gogo, Tyler ICU, LeeMcKrazy, Khalil Harrison, Tumelo_za, Ceeka RSA, Eltee","Balimele","Universal Music (Pty) Ltd.",55,57,7,"143971"
56,"spotify:track:2pqIaYg12ziqIpVtdVESGt","Kelvin Momo, Babalwa M, Nia Pearl, Stixx","Amalobolo (feat. Stixx, Nia Pearl)","Kelvin Momo Productions",6,47,38,"143469"
57,"spotify:track:5obuTVRQLKjqUlfLj73Dny","Dinho, Kabza De Small, Tumza D'Kota, Agzo, Optimist Music ZA, Seun1401, El.Stephano","uKhome Lotto (feat. Agzo, Optimist Music ZA, Seun1401 & El.Stephano)","Sound African Recordings",57,61,10,"141952"
58,"spotify:track:0fYfr7tY8rxHX8bcWsaCF9","Harrycane, Eemoh","Vula Sekele","Wanitwa Mos Entertainment",58,62,7,"141943"
59,"spotify:track:3hRV0jL3vUpRrcy398teAU","Lord Huron","The Night We Met","Play It Again Sam",46,63,67,"140942"
60,"spotify:track:0ZbjOC879HZhQDUQAGCW3m","King Temoso, Master KG, Nkosazana Daughter, Nobuhle","Dali Wami (feat. Nobuhle)","Wanitwa Mos Entertainment",59,59,8,"140125"
61,"spotify:track:5yyYL1FpimADTIftYQU0cg","Dlala Thukzin, Zaba, Sykes","iPlan","Dlala Records (PTY) Ltd",1,78,50,"140005"
62,"spotify:track:2idjAQVybG1IRGeZIxIxYK","DJ Stokie, Eemoh","Masithokoze","Universal Music (Pty) Ltd.",3,74,45,"139703"
63,"spotify:track:5QlP6tgRlEtnMsolNWuK2T","ShaunMusiq & Ftears, Myztro, Scotts Maphuma, Bontle Smith","Beke le Beke (feat. Bontle Smith)","Kgaday",60,66,5,"137206"
64,"spotify:track:7iabz12vAuVQYyekFIWJxD","Central Cee, Lil Baby","BAND4BAND (feat. Lil Baby)","Columbia",6,48,14,"136392"
65,"spotify:track:54seQV7MCcppBrznALCdlT","TitoM, Yuppe, S.N.E, EeQue","Tshwala Bam (feat. S.N.E, EeQue)","TitoM",1,53,27,"135233"
66,"spotify:track:3XVBdLihbNbxUwZosxcGuJ","Alicia Keys","If I Ain't Got You","J Records",55,65,41,"133773"
67,"spotify:track:5IgjP7X4th6nMNDh4akUHb","Chris Brown","Under The Influence","Chris Brown Entertainment/RCA Records",2,58,128,"133272"
68,"spotify:track:4Na2HfNSr58chvfX69fy36","Gunna","one of wun","300 Entertainment",17,69,16,"132665"
69,"spotify:track:6txAWGckgEGJIhLjhNdtE9","Chris Brown","Residuals","Chris Brown Entertainment/RCA Records",46,67,16,"131886"
70,"spotify:track:2fOazsCfbGoDQqwxIJLUzG","Naledi Aphiwe","Ngiyabonga","Naledi Aphiwe",69,112,31,"131259"
71,"spotify:track:4wZB5QFhGjwAHisMeSicPl","Ntokzin, Zee_nhle, Moscow, Macfowlen","Hleka nabo","Groove Natives Productions",71,105,2,"130879"
72,"spotify:track:5TY9ovYtBeJTY9s7K3ijEd","Ugatsheni","Hit after Hit","Kuhleliwe Mmema Holdings",9,79,35,"129183"
73,"spotify:track:4Zy1GFdZeuvkMzmsfEzcnW","Wanitwa Mos, Nkosazana Daughter, Nobuhle, Harrycane","Moyo Ongcwele (feat. Harry Cane)","Wanitwa Mos Entertainment",73,93,4,"128828"
74,"spotify:track:1tvDDR0ZAowEqKLN15g7tH","Zwide, Umafikizolo, uMehlabomvu","Wenhliziyo Yami","Insika Yethonga",11,75,27,"128166"
75,"spotify:track:4xXHrIiIeW7dMh5FoYI5m1","Zee Nxumalo, Pabi Cooper, 031CHOPPA, Shakes & Les","Thula Mabota","KwaNxumalo",19,68,22,"127315"
76,"spotify:track:3u4er9DgmXCyTMhBns3Rpp","Mafikizolo","Emlanjeni","Kalawa Jazmee",40,40,19,"125769"
77,"spotify:track:0WbMK4wrZ1wFSty9F7FCgu","Chappell Roan","Good Luck, Babe!","Chappell Roan PS/ Island",77,89,10,"125538"
78,"spotify:track:7wcjeveluiW5djtxLCxNSx","Spirit Of Praise, Mpumi Mtsweni","Thath'Indawo (Live)","Spirit Music",23,77,79,"125492"
79,"spotify:track:2nYDr6EASJj7UcjiEmlvj0","Babalwa M, Kelvin Momo, Stixx, Baby S.O.N","Pholisa","Mavuso Business Solutions",5,55,18,"125332"
80,"spotify:track:5b3XJ1pjrHO5JtY2PcTjnI","Megan Thee Stallion, Yuki Chiba","Mamushi (feat. Yuki Chiba)","Hot Girl Productions",32,64,9,"124096"
81,"spotify:track:0WIv5qV41y6YjjB9V1biuC","Muni Long","Made For Me","Supergiant Records, LLC / Def Jam Recordings",5,72,32,"124027"
82,"spotify:track:3xKsf9qdS1CyvXSMEid6g8","Frank Ocean","Pink + White","Boys Don't Cry",58,99,93,"122879"
83,"spotify:track:6v2F90xvuPxVUsx9d12T2b","Xduppy, Scotts Maphuma, Mellow & Sleazy, DJ Maphorisa, Pushkin, Kabelo Sings","Khuthuzile (feat. DJ Maphorisa, Pushkin & Kabelo Sings)","Kgaday",45,91,6,"121224"
84,"spotify:track:2uqYupMHANxnwgeiXTZXzd","Dasha","Austin (Boots Stop Workin')","Warner Records",58,92,25,"120779"
85,"spotify:track:5aIVCx5tnk0ntmdiinnYvw","Tyla","Water","FAX Records/Epic",4,85,52,"120257"
86,"spotify:track:5Dsuz6UsZyoWM3HOaRgQeC","Lloyiso","Seasons","Universal Music (Pty) Ltd.",62,103,129,"120206"
87,"spotify:track:4VQO1UdVIecQqB49PlANHz","Drake, Young Thug, 21 Savage","It's Up (feat. Young Thug & 21 Savage)","OVO/Republic",57,60,3,"119228"
88,"spotify:track:53wwaMp15eGyE12Cm7sxLa","Xolly Mncwango","Ungukuphila","Universal Music (Pty) Ltd.",54,70,27,"119049"
89,"spotify:track:3pImmSzeKex5ffzsDoaL3z","Bassie, Aymos, T-Man SA","Izenzo","Djs Production Pty Ltd",5,104,53,"118539"
90,"spotify:track:1RMJOxR6GRPsBHL8qeC2ux","Daniel Caesar, H.E.R.","Best Part (feat. H.E.R.)","Golden Child Recordings",75,106,252,"117931"
91,"spotify:track:0u2P5u6lvoDfwTYjAADbn4","Billie Eilish, Khalid","lovely (with Khalid)","Darkroom",22,80,331,"117846"
92,"spotify:track:51eSHglvG1RJXtL3qI5trr","Benson Boone","Slow It Down","Night Street Records, Inc./Warner Records Inc.",47,86,23,"117601"
93,"spotify:track:2wXExC9YzKpslEpiUpUlou","DJ Tshegu, LeeMcKrazy, Zee Nxumalo, Al Xapo, Vyno Keys, QuayR Musiq","Chengu Shesha (feat. Al xapo, Vyno Keys and QuayR Musiq)","18 Area Holdings",52,88,15,"117589"
94,"spotify:track:7qEHsqek33rTcFNT9PFqLf","Lewis Capaldi","Someone You Loved","Vertigo Berlin",7,96,294,"117473"
95,"spotify:track:3GLF4uV3uS1ImSEPyhLZLp","TxC, Davido, Tony Duardo, LeeMcKrazy, Djy Biza","Yebo","2024 TXC Enterprises /LVRN Records",62,82,10,"116547"
96,"spotify:track:0tIDIj46MoZhTuU7lPw4qD","Sjava, Qwellers, Blue Pappi, LaCabra, Lowfeye, Sastii","Typhoon (feat. Sastii, LaCabra, Lowfeye, Blue Pappi)","1020 Cartel",79,118,16,"116125"
97,"spotify:track:5jsO87ShnH2lEXhIfjMAUj","Mzukulu, Shenge wasehlalankosi","Ijuba","BAQAZILE ENTERTAINMENT",46,102,38,"114181"
98,"spotify:track:1zhMHgotgZXkLCXpqNRnPK","PARTYNEXTDOOR","N o C h i l l","OVO Sound",94,94,12,"113780"
99,"spotify:track:3wszhvnFWgMXzYGJVQweII","Da Gifto, Brandon Dhludhlu","Ingelosi","DHF Records",57,98,25,"113582"
100,"spotify:track:3JyEmaZmPsuIvFivnwN22k","Glenn Jones","All for You","Jive",99,108,74,"112995"
101,"spotify:track:05lM7Ep8UESoe3LV5yrew5","Lloyiso","Dream About You","Ambitiouz Entertainment",54,115,104,"112944"
102,"spotify:track:0UBK6HcgmmWUQzFQTncmDz","Wanitwa Mos, Nkosazana Daughter, Master KG, Dalom Kids","Keneilwe (feat. Dalom Kids)","Wanitwa Mos Entertainment",2,109,41,"112805"
103,"spotify:track:7DfFc7a6Rwfi3YQMRbDMau","Frank Ocean","Thinkin Bout You","Red Zone Entertainment / IDJ",70,90,41,"112529"
104,"spotify:track:4OzS0O0i88cGeu8YklCHrT","Fridayy","When It Comes To You","FRIDAYY PS/ Def Jam",70,95,33,"111813"
105,"spotify:track:1rtMuIY76v879DN8kW1fhf","Kelvin Momo, Babalwa M, Sfarzo Rtee","Sukakude (feat. Sfarzo Rtee)","Kelvin Momo Productions",7,97,90,"111575"
106,"spotify:track:4uzKAj0mIyYmyhsRRyPXaQ","Alex Warren","Carry You Home","Atlantic Records",106,145,12,"111147"
107,"spotify:track:3LfXImvXHkHzz0qqdFAol4","DJ Kent, Thakzin, Brenden Praise, Mo-T, MÖRDA","Horns In The Sun (feat. Mo-T, Brenden Praise & Mörda) [Thakzin Remix]","Spinnin' Deep",17,114,46,"110758"
108,"spotify:track:7kCvZYf9IEtJLlGctDBUAw","Mshinwemali, Zothando","Ngicel Uhambe","Insika Yethonga",50,76,33,"109754"
109,"spotify:track:46IZ0fSY2mpAiktS3KOqds","Adele","Easy On Me","Columbia",1,120,109,"109468"
110,"spotify:track:7CyPwkp0oE8Ro9Dd5CUDjW","The Weeknd, JENNIE, Lily-Rose Depp","One Of The Girls (with JENNIE, Lily Rose Depp)","XO / Republic Records",31,107,42,"108315"
111,"spotify:track:42VsgItocQwOQC3XWZ8JNA","Travis Scott, Playboi Carti","FE!N (feat. Playboi Carti)","Cactus Jack/Epic",5,126,48,"108243"
112,"spotify:track:0KCIkmnAWrMtto1YIFTKpr","Aymos, Mas Musiq, MaWhoo","Amabhoza","Lyf Styl Entertainment",112,156,5,"107346"
113,"spotify:track:0wGxQ8OwsI0kKlQdYCUYYK","Mr JazziQ, Vigro Deep","Fede","Sound African Recordings",67,81,4,"107294"
114,"spotify:track:4eLFAxZWiV4Mfp8mpzdrdT","Mlindo The Vocalist","Emakhaya","Sound African Recordings",114,132,9,"106430"
115,"spotify:track:6mrrQb0xQFxDAA6PkdpnaQ","Jaziel Brothers","Ngeke Ndiphinde","Jaziel Music Productions",115,141,11,"106128"
116,"spotify:track:1UAJu97cqaKFs5S0suFhvH","Kelvin Momo, Stixx, Babalwa M, Yallunder, Sia Mzizi","Langa'elihle (feat. Babalwa M, Yallunder & Sia Mzizi)","Kelvin Momo Productions",34,101,3,"105812"
117,"spotify:track:4J1H4EuucGhhYfcPpYCBRr","DJ Stokie, Zee_nhle, Omit ST, Sobzeen","Awukhuzeki","Universal Music (Pty) Ltd.",1,113,63,"105241"
118,"spotify:track:5uCax9HTNlzGybIStD3vDh","James Arthur","Say You Won't Let Go","Columbia",77,100,324,"104895"
119,"spotify:track:5hJFhO9dvhJoDvUZZ9iWSw","Miguel","Adorn","ByStorm Entertainment/RCA Records",42,152,102,"104231"
120,"spotify:track:5rgrBsAFYMun6yhtnLKRPz","Bryson Tiller","Right My Wrongs","TrapSoul/RCA Records",109,110,24,"103909"
121,"spotify:track:4fxwbUSI6jF4XdnvCUVG97","Elaine","You're the One","Columbia",12,127,123,"103831"
122,"spotify:track:6aHKYbwzLpJczbcDxIFNL0","G-Jealous, Thembi","Amabhinca","7416012 Records DK",122,-1,1,"103609"
123,"spotify:track:5IZXB5IKAD2qlvTPJYDCFB","Post Malone, Morgan Wallen","I Had Some Help (Feat. Morgan Wallen)","Mercury Records / Republic Records",12,87,16,"103508"
124,"spotify:track:4xQgivVLGFlB0tctjpR2SU","Lwah Ndlunkulu","Eyami","Nkabi Records",15,129,56,"103507"
125,"spotify:track:2tudvzsrR56uom6smgOcSf","Future, Metro Boomin, Kendrick Lamar","Like That","Wilburn Holding Co./Boominati/Epic/Republic",3,117,23,"103177"
126,"spotify:track:2uIX8YMNjGMD7441kqyyNU","Billie Eilish","ocean eyes","Darkroom",92,166,121,"102845"
127,"spotify:track:1bl7mvR2BaoqA7ak6xJ3yj","K.O, Maglera Doe Boy","Let Me Cook (feat. Maglera Doe Boy)","Sound African Recordings",74,116,14,"102656"
128,"spotify:track:32BO8PBNFVDWh2Fwzs4izZ","ShaunMusiq & Ftears, Myztro, Scotts Maphuma","Cishe Nga Posta","Kgaday",120,157,9,"101489"
129,"spotify:track:3JG1uFc40wfyrqaWC7iv0e","Artemas","i like the way you kiss me","Artemas",5,111,23,"100874"
130,"spotify:track:3BraTCQg9APnWRC7HQZyOJ","Wanitwa Mos, Nkosazana Daughter, Master KG, Casswell P","Makhelwane (feat. Casswell P)","Wanitwa Mos Entertainment",36,140,28,"100719"
131,"spotify:track:7jtQIBanIiJOMS6RyCx6jZ","Tom Odell","Another Love","ITNO/Columbia",45,160,117,"100677"
132,"spotify:track:7sO5G9EABYOXQKNPNiE9NR","Offset, Metro Boomin","Ric Flair Drip (with Metro Boomin)","Slaughter Gang, LLC/Epic/Quality Control Music/Motown/Capitol/Boominati Worldwide/Republic",27,167,34,"100585"
133,"spotify:track:331l3xABO0HMr1Kkyh2LZq","David Guetta, OneRepublic","I Don't Wanna Wait","Parlophone UK",84,130,15,"100508"
134,"spotify:track:03rdHTIFjxhsWXBsfj2c9h","Mellow & Sleazy, Gipa Entertainment, DJ DADAMAN","Christmas Present","Sound African Recordings",96,163,11,"100476"
135,"spotify:track:7BRD7x5pt8Lqa1eGYC4dzj","Billie Eilish","CHIHIRO","Darkroom/Interscope Records",15,149,15,"100441"
136,"spotify:track:3B54sVLJ402zGa6Xm4YGNe","French Montana, Swae Lee","Unforgettable","Bad Boy Entertainment/Epic Records",90,139,56,"100362"
137,"spotify:track:6OJblc63vbMcC9uEIY1Hpq","Da Mabusa, Ama Grootman","Ithuba","Major Role Music",137,159,4,"100355"
138,"spotify:track:3c6afiysmB7OnxQzzSqRfD","Tamia","So Into You","Rhino/Warner Records",80,144,65,"100004"
139,"spotify:track:3Pbp7cUCx4d3OAkZSCoNvn","Michael Marcagi","Scared To Start","Warner Records",65,155,31,"99799"
140,"spotify:track:4rXLjWdF2ZZpXCVTfWcshS","Gunna","fukumean","300 Entertainment",5,83,63,"98818"
141,"spotify:track:2QjOHCTQ1Jl3zawyYOpxh6","The Neighbourhood","Sweater Weather","Columbia",57,137,157,"98805"
142,"spotify:track:7ir1pK0mSBVZLoqUPbmous","Goldmax, Dlala Thukzin, Funky Qla, Zee Nxumalo, Beast Rsa","FOMO","Afrotainment",88,143,25,"98774"
143,"spotify:track:174rZBKJAqD10VBnOjlQQ3","Mario","How Do I Breathe","J Records/Legacy",128,128,4,"98169"
144,"spotify:track:3WOhcATHxK2SLNeP5W3v1v","Charli xcx, Billie Eilish","Guess featuring billie eilish","Atlantic Records",66,123,4,"97952"
145,"spotify:track:60Z2UUVW3R0oeWCLi4Y3aK","Shebeshxt, Naqua SA, Buddy Sax, Bayor 97, Zoli White Smoke, Smeazy","Ambulance","The Royal Media House Group",58,180,28,"97870"
146,"spotify:track:57lsYy0OZLNb5OQ7fEa3Hs","Ice Spice, Central Cee","Did It First (with Central Cee)","10K Projects/Capitol Records",39,125,7,"97481"
147,"spotify:track:0jxg3fpP4EAjYKs9o9aVVz","SUPTA, Thalitha, Bongane Sax","Kuzolunga","SUPTA",104,124,10,"97402"
148,"spotify:track:1zi7xx7UVEFkmKfv06H8x0","Drake, Wizkid, Kyla","One Dance","Cash Money Records/Young Money Ent./Universal Rec.",78,135,172,"96931"
149,"spotify:track:2O0rVlBMPoqudJ4UUCHCWx","SKHANDAWORLD, K.O, Nasty C","TOO MUCH","Universal Music (Pty) Ltd.",56,56,2,"96131"
150,"spotify:track:68vgtRHr7iZHpzGpon6Jlo","USHER, Alicia Keys","My Boo","LaFace Records",106,122,21,"96008"
151,"spotify:track:1HhrhMlsYpTHESr6NIU0rr","Lizwi Wokuqala, Sannere","eLesotho","The Whole Time Entertainment",119,119,4,"95540"
152,"spotify:track:1XBYiRV30ykHw5f4wm6qEn","The Kid LAROI","NIGHTS LIKE THIS","Columbia",147,171,9,"95280"
153,"spotify:track:0JGdktTFMHlfUdSZcbTOXC","Lwah Ndlunkulu","Ngyathandaza","Nkabi Records",55,154,40,"95279"
154,"spotify:track:5496lks6V3fh1mZAB6IAap","Sevdaliza, Pabllo Vittar, Yseult","Alibi (with Pabllo Vittar & Yseult)","Twisted Elegance",108,134,6,"95075"
155,"spotify:track:48lcmlbwm4VHcOfXqWlVbx","Mellow & Sleazy, Eltee, LeeMcKrazy, Scotts Maphuma, Gipa","Kokotela (feat. Scotts Maphuma & Gipa)","Sound African Recordings",27,121,27,"94791"
156,"spotify:track:2PVWNCTVQCHn0jLJ3q1YBR","Thak'so Ujey Choir","Mvelinqangi","Thak'so Ujey Choir",75,158,7,"94616"
157,"spotify:track:0B7wvvmu9EISAwZnOpjhNI","Bruno Mars","When I Was Your Man","Atlantic Records",132,146,12,"94394"
158,"spotify:track:6BZfqUo03B6jZ3NHvJNLQ2","Sayfar, Tman Xpress, Scotts Maphuma","Manje","SayFar PTY LTD",158,-1,1,"94081"
159,"spotify:track:7EK0Se77nYoRndoAJXUWHq","Spirit Of Praise, Spirit of Praise Choir, Pastor M Tshabalala","Bamba Mzalwane (Live)","Spirit Music",141,148,13,"93562"
160,"spotify:track:0rtDE9zfXbamTlRUSwY7zy","Mark Ambor","Belong Together","Hundred Days Records, LLC",41,133,22,"92808"
161,"spotify:track:6ZiPVgBrULcpN0n9qQ3XO4","Blaq Major, BLESS THE GENTLEMAN, DJ KAP","Dali (feat. Bless The Gentleman & DJ Kap)","Wanitwa Mos Entertainment",161,195,2,"92743"
162,"spotify:track:3TpQcE8EqBqobOznNdl20l","DJ KSB, LeeMcKrazy, Soulful G","Umaqondana","Wanitwa Mos Entertainment",22,164,16,"92652"
163,"spotify:track:5G2Q4Vx9zwBAdQoEWgM8uX","Madison Ryann Ward","Mirror","Madison/American Recordings/Republic",163,-1,1,"92468"
164,"spotify:track:2ktg2oZDyFAX3iY1QNkXl5","Summer Walker","Session 32","LVRN Records",87,178,91,"92004"
165,"spotify:track:0mflMxspEfB0VbI1kyLiAv","Noah Kahan","Stick Season","Mercury Records/Republic Records",33,170,39,"91970"
166,"spotify:track:6MJ2zbeyqzQteAB9rEc9VX","Lwah Ndlunkulu, Siya Ntuli","Ithuba","Nkabi Records",33,190,106,"91895"
167,"spotify:track:3S8Tcoqm0QATkmk5g74AeQ","Shebeshxt, Skomota, Naqua SA, Buddy Sax","MAVUSO A TAO TAO","Fyve",57,197,13,"91616"
168,"spotify:track:68Dni7IE4VyPkTOH9mRWHr","J. Cole","No Role Modelz","Roc Nation Records LLC",39,151,202,"91598"
169,"spotify:track:1vbe9sh7U9vdMceAhitWr2","New Edition","Can You Stand The Rain","Geffen*",70,177,24,"91231"
170,"spotify:track:3GCdLUSnKSMJhs4Tj6CV3s","Kendrick Lamar, SZA","All The Stars (with SZA)","Black Panther (TDE/DMG) PS",4,138,83,"91154"
171,"spotify:track:6VnLhQOKMPpftnMuk2aMKO","Makhadzi Entertainment, Ba Bethe Gashaozen","Letswai (feat. Ba Bethe Gashaozen)","Makhadzi Entertainment",78,-1,18,"91126"
172,"spotify:track:6XpEm7VJ7TZxZTawH8BCSW","Tyla, Gunna, Skillibeng","Jump","FAX Records/Epic",19,150,23,"90827"
173,"spotify:track:0JjecOzaIzBTfIY35QGmgw","Myles Smith","Wait For You","RCA Records Label",173,-1,1,"90816"
174,"spotify:track:3tkxfORwPo2zydAf25YFOc","Sonder","Care","Sonder",131,-1,18,"90727"
175,"spotify:track:2OpBganfGk2GVdSlRdxzaX","Khalid","Better","Right Hand Music Group, LLC/RCA Records",1,168,183,"90617"
176,"spotify:track:5Nt2FMqnKI2mlp7lztURNo","Jordan Adetunji, Kehlani","KEHLANI (REMIX) [feat. Kehlani]","300 Entertainment",176,-1,1,"90553"
177,"spotify:track:1A1ifX8sWzelNpkL5PxcHT","Ayra Starr, GIVĒON","Last Heartbreak Song (feat. Giveon)","Mavin Global Holdings Ltd.",68,193,12,"90505"
178,"spotify:track:2qxgejJTaZIHNSHDD22Uhl","Kabza De Small, DJ Maphorisa, Ami Faku","Abalele","Piano Hub",1,183,126,"90211"
179,"spotify:track:6jlG8gBPNAgBgoivw2Ig09","Tommy Richman","DEVIL IS A LIE","PULSE Records",41,136,11,"90080"
180,"spotify:track:1Qrg8KqiBpW07V7PNxwwwL","SZA","Kill Bill","Top Dawg Entertainment/RCA Records",5,147,85,"90017"
181,"spotify:track:6NGfCx1dUHeBEyLjiGcb6Q","Navigator Gcwensa, Ashantiey, LIMIT NALA","Kuyenzeka","Insika Yethonga",152,173,8,"89958"
182,"spotify:track:5lkpeJwmQKgY3bX2zChjxX","Adele","Someone Like You","XL Recordings",50,196,8,"89559"
183,"spotify:track:1CKJewE41VybHL3Dpz6z7J","Umafikizolo","Wethu","Insika Yethonga",120,165,9,"89244"
184,"spotify:track:1bjeWoagtHmUKputLVyDxQ","SZA","Saturn","Top Dawg Entertainment/RCA Records",27,192,27,"88780"
185,"spotify:track:7d2se65A7Vxyvlh0tnYoGN","Umlabalaba","Ilo Nalo Naloya","1962225 Records DK",79,153,23,"88755"
186,"spotify:track:7zFXmv6vqI4qOt4yGf3jYZ","Daniel Caesar, Kali Uchis","Get You (feat. Kali Uchis)","Golden Child Recordings",119,175,75,"88414"
187,"spotify:track:710qLZ4WOxBj7ZaVbVJtkh","Kelvin Momo, Babalwa M, Azana, Stixx","Maye Maye (feat. Azana, Stixx)","Kelvin Momo Productions",17,176,39,"88255"
188,"spotify:track:3U4isOIWM3VvDubwSI3y7a","John Legend","All of Me","G.O.O.D. Music/Columbia",92,174,159,"87999"
189,"spotify:track:1m2xMsxbtxv21Brome189p","Joe","I Wanna Know","Jive",166,199,21,"87575"
190,"spotify:track:2fXwCWkh6YG5zU1IyvQrbs","SZA","Broken Clocks","Top Dawg Entertainment/RCA Records",174,184,12,"86894"
