rank,uri,artist_names,track_name,source,peak_rank,previous_rank,weeks_on_chart,streams
1,"spotify:track:54seQV7MCcppBrznALCdlT","TitoM, Yuppe, S.N.E, EeQue","Tshwala Bam (feat. S.N.E, EeQue)","TitoM",1,2,2,"806586"
2,"spotify:track:6Kijtp0DB6VwcoJIw7PJ9W","Kabza De Small, Mthunzi, DJ Maphorisa, Young Stunna, Sizwe Alakine, Umthakathi Kush","Imithandazo (feat. Young Stunna, DJ Maphorisa, Sizwe Alakine & Umthakathi Kush)","Piano Hub",1,1,19,"656306"
3,"spotify:track:5CD3ImPPdCW8QFQkjo5TXt","Shakes & Les, DBN Gogo, Zee Nxumalo, Ceeka RSA, Chley","Funk 55 (feat. Ceeka RSA, Chley)","Kreativekornerr",2,3,14,"392163"
4,"spotify:track:4tsVMjM60RNTe9EV5oQ4sQ","DJ Stokie, Eemoh","Masithokoze","Universal Music (Pty) Ltd.",3,4,20,"350477"
5,"spotify:track:3w0w2T288dec0mgeZZqoNN","¥$, Kanye West, Ty Dolla $ign","CARNIVAL","Ye",5,10,4,"320097"
6,"spotify:track:0WIv5qV41y6YjjB9V1biuC","Muni Long","Made For Me","Supergiant Records, LLC / Def Jam Recordings",5,5,7,"313523"
7,"spotify:track:0UBK6HcgmmWUQzFQTncmDz","Wanitwa Mos, Nkosazana Daughter, Master KG, Dalom Kids","Keneilwe (feat. Dalom Kids)","Wanitwa Mos Entertainment",2,6,16,"311488"
8,"spotify:track:6tNQ70jh4OwmPGpYy6R2o9","Benson Boone","Beautiful Things","Night Street Records, Inc./Warner Records Inc.",4,7,7,"309496"
9,"spotify:track:3pImmSzeKex5ffzsDoaL3z","Bassie, Aymos, T-Man SA","Izenzo","Djs Production Pty Ltd",5,8,28,"289834"
10,"spotify:track:2pqIaYg12ziqIpVtdVESGt","Kelvin Momo, Babalwa M, Nia Pearl, Stixx","Amalobolo (feat. Stixx, Nia Pearl)","Kelvin Momo Productions",8,11,13,"285389"
11,"spotify:track:5TY9ovYtBeJTY9s7K3ijEd","Ugatsheni","Hit after Hit","Kuhleliwe Mmema Holdings",9,9,10,"279181"
12,"spotify:track:2fofdfhRxFVP1bRdjA1FEc","TxC, Tony Duardo","Turn Off The Lights","TXC Enterprises (PTY) LTD., under exclusive license to LVRN Records (Love Renaissance)",12,34,7,"264692"
13,"spotify:track:7JbLSEDlRdoJaXk5ddZae2","Mthandeni SK, Lwah Ndlunkulu","Paris","Mthandeni Music Production",4,12,30,"244094"
14,"spotify:track:2ee1Pa7Gs7lIGRXrl217IG","DJ Lag, Mr Nation Thingz, K.C Driller","Hade Boss","Black Major x Ice Drop",14,23,6,"239208"
15,"spotify:track:5yyYL1FpimADTIftYQU0cg","Dlala Thukzin, Zaba, Sykes","iPlan","Dlala Records (PTY) Ltd",1,13,25,"225437"
16,"spotify:track:5aIVCx5tnk0ntmdiinnYvw","Tyla","Water","FAX Records/Epic",4,18,27,"197430"
17,"spotify:track:1whAXVGN8AdfrnoXNIXfJf","Tyla","Truth or Dare","FAX Records/Epic",17,17,14,"194745"
18,"spotify:track:1ng4byy7mejezJ08hs4P7R","Sam Deep, Njelic, Aymos","Isgubhu","Universal Music (Pty) Ltd.",6,19,27,"193373"
19,"spotify:track:4iZ4pt7kvcaH6Yo8UoZ4s2","SZA","Snooze","Top Dawg Entertainment/RCA Records",12,14,65,"189098"
20,"spotify:track:1eOOCRtXcPwK8qG8VjtczJ","Harrycane, Master KG, Eemoh, DJ Latimmy","Dubula (feat. DJ Latimmy) - Remake","Wanitwa Mos Entertainment",3,15,18,"188148"
21,"spotify:track:6OGNF7mro80pMi5q1HhylS","Khalil Harrison, Tyler ICU, LeeMcKrazy, Ceeka RSA","Jealousy (feat. Leemckrazy & Ceeka RSA)","Baby Blue Entertainment",21,22,13,"184436"
22,"spotify:track:2Oe52Ggx8lxxI55azZbr5h","Kabza De Small, Mthunzi, MaWhoo","Amazwe (feat. Mawhoo)","Piano Hub",22,24,19,"183003"
23,"spotify:track:52eIcoLUM25zbQupAZYoFh","21 Savage","redrum","Slaughter Gang, LLC/Epic Records",12,20,8,"179827"
24,"spotify:track:3XqM8hLCEYlbnFjoWwqtFv","Chris Brown","Angel Numbers / Ten Toes","Chris Brown Entertainment/RCA Records",15,21,17,"177493"
25,"spotify:track:710qLZ4WOxBj7ZaVbVJtkh","Kelvin Momo, Babalwa M, Azana, Stixx","Maye Maye (feat. Azana, Stixx)","Kelvin Momo Productions",17,32,14,"167950"
26,"spotify:track:4J1H4EuucGhhYfcPpYCBRr","DJ Stokie, Zee_nhle, Omit ST, Sobzeen","Awukhuzeki","Universal Music (Pty) Ltd.",1,38,38,"164147"
27,"spotify:track:17phhZDn6oGtzMe56NuWvj","Teddy Swims","Lose Control","Warner Records",26,26,9,"163683"
28,"spotify:track:0OBkFew4sntJl9PaJp0TOA","Nandipha808, Ceeka RSA, DEMOLA","Forgive Our Trespasses (feat. Demola, Ceeka RSA)","Stena Academy",24,27,10,"162493"
29,"spotify:track:4URabg9AGHasjFEVdTbWcC","Kamo Mphela, Tyler ICU, Khalil Harrison, Baby S.O.N","Dalie (feat. Baby S.O.N)","KAMO MPHELA ENTERTAINMENT",3,30,20,"162459"
30,"spotify:track:38yfPQYoGWFJtn3NLBqTB0","Daliwonga, Nkosazana Daughter, Happy Jazzman","Seduce Me (feat. Nkosazana Daughter & Happy JazzMan)","New Money Gang Records",17,28,19,"162082"
31,"spotify:track:4xhsWYTOGcal8zt0J161CU","Jack Harlow","Lovin On Me","Generation Now/Atlantic",10,25,17,"160031"
32,"spotify:track:4iuNZTcvT9diFySSzVsnVS","Fantasia","When I See U","J Records",32,42,200,"155594"
33,"spotify:track:7AYmToZ5y67fBjq4RLFbuq","Beyoncé","TEXAS HOLD 'EM","Parkwood Entertainment/Columbia",16,16,4,"154282"
34,"spotify:track:3oPYVnm0LsmAQ4RobrRS29","Mellow & Sleazy, SjavasDaDeejay, TitoM, Tman Xpress","Imnandi lento (feat. Tman Xpress)","Sound African Recordings",1,33,29,"153372"
35,"spotify:track:4xQgivVLGFlB0tctjpR2SU","Lwah Ndlunkulu","Eyami","Nkabi Records",15,39,31,"143808"
36,"spotify:track:48lcmlbwm4VHcOfXqWlVbx","Mellow & Sleazy, Eltee, LeeMcKrazy, Scotts Maphuma, Gipa","Kokotela (feat. Scotts Maphuma & Gipa)","Sound African Recordings",36,71,2,"143179"
37,"spotify:track:5utUZ5nv6y6dR8irsnOQEj","Aqyila","Bloom","Sony Music Canada",14,29,4,"141840"
38,"spotify:track:3rUGC1vUpkDG9CZFHMur1t","Tate McRae","greedy","RCA Records Label",27,44,25,"141594"
39,"spotify:track:0JXXNGljqupsJaZsgSbMZV","Miguel","Sure Thing","Jive",13,35,166,"139428"
40,"spotify:track:4nFrcGM7MY1mpoQCC7Kefj","Tems","Me & U","RCA Records/Since 93'",22,37,22,"138866"
41,"spotify:track:1VNWdmXSbaNrnWod10WIL0","The Weeknd, JENNIE, Lily-Rose Depp","One Of The Girls (with JENNIE, Lily Rose Depp)","Universal Republic Records",31,36,17,"137689"
42,"spotify:track:5PyDJG7SQRgWXefgexqIge","Doja Cat","Agora Hills","Kemosabe Records/RCA Records",20,41,24,"135664"
43,"spotify:track:3qhlB30KknSejmIvZZLjOD","Djo","End of Beginning","Djo",43,78,2,"134259"
44,"spotify:track:0mflMxspEfB0VbI1kyLiAv","Noah Kahan","Stick Season","Mercury Records/Republic Records",33,40,14,"133298"
45,"spotify:track:42VsgItocQwOQC3XWZ8JNA","Travis Scott, Playboi Carti","FE!N (feat. Playboi Carti)","Cactus Jack/Epic",5,53,23,"130253"
46,"spotify:track:7GaFYUqP2WdR4KTPk7cXoP","Mario","Let Me Love You","J Records",46,56,274,"130151"
47,"spotify:track:6uTPdRrEDeH8Fyg5L5qmeU","Flo Milli","Never Lose Me","'94 Sounds/RCA Records",26,43,9,"129158"
48,"spotify:track:1bjeWoagtHmUKputLVyDxQ","SZA","Saturn","Top Dawg Entertainment/RCA Records",45,45,2,"124889"
49,"spotify:track:1tvDDR0ZAowEqKLN15g7tH","Zwide, Umafikizolo, uMehlabomvu","Wenhliziyo Yami","Insika Yethonga",49,64,2,"124243"
50,"spotify:track:43PuMrRfbyyuz4QpZ3oAwN","Bryson Tiller","Exchange","TrapSoul/RCA Records",50,87,109,"123817"
51,"spotify:track:3h5TiWTqGxjSjFrbruPFH9","YG Marley","Praise Jah In The Moonlight","YG Marley Music",31,31,6,"123524"
52,"spotify:track:5jsO87ShnH2lEXhIfjMAUj","Mzukulu, Shenge wasehlalankosi","Ijuba","BAQAZILE ENTERTAINMENT",46,48,13,"122109"
53,"spotify:track:4EI8VuxUuIHKfafU72emqz","Mariah Carey","We Belong Together","Def Jam Recordings",44,49,105,"121273"
54,"spotify:track:597LY7HnUeb9n6EUFUF8uc","Felo Le Tee, Focalistic, Massive95k, Dj Motee, L4desh, Turnupkiid","Ka Lekeke (feat. Dj Motee, L4desh & Turnupkiid)","New Money Gang Records",31,52,6,"119547"
55,"spotify:track:6lrKA1DMAihPI490Oj0twC","MaWhoo, Deep Sen, KingTalkzin, Mthunzi","Ngilimele (feat. Deep Sen, KingTalkzin, Mthunzi)","MaWhoo Entertainment",28,54,25,"117769"
56,"spotify:track:5jPckUbvd78IYYd1bEJSwJ","Khuthuza, MAFIKIZOLO","NGIJOLA NEBHINCA","5932550 Records DK",43,46,18,"117651"
57,"spotify:track:3LfXImvXHkHzz0qqdFAol4","DJ Kent, Thakzin, Brenden Praise, Mo-T, MÖRDA","Horns In The Sun (feat. Mo-T, Brenden Praise & Mörda) [Thakzin Remix]","Spinnin' Deep",17,47,21,"117469"
58,"spotify:track:5tpft20jhQvRlG3O7XfwWy","Tyler ICU, Tumelo_za, DJ Maphorisa, Nandipha808, Ceeka RSA, Tyrone Dee","Mnike (feat. DJ Maphorisa, Nandipha808, Ceeka RSA & Tyron Dee)","New Money Gang Records",1,50,45,"114751"
59,"spotify:track:5hJFhO9dvhJoDvUZZ9iWSw","Miguel","Adorn","ByStorm Entertainment/RCA Records",59,89,77,"114095"
60,"spotify:track:7ATU7xI4ffZgPGm3QCKX4K","Lwah Ndlunkulu","Ngiyeza","Nkabi Records",8,60,59,"113610"
61,"spotify:track:7Gc7tNSocAypLct0MYYzmk","Felo Le Tee, LeeMcKrazy, Keynote","Yini Ngathi (Insane)","New Money Gang Records",10,67,21,"112126"
62,"spotify:track:4rXLjWdF2ZZpXCVTfWcshS","Gunna","fukumean","300 Entertainment",5,51,38,"109566"
63,"spotify:track:4XQNZPkMyo1LxR3NYbVegt","Maverick Muji, Nonny","Ngimtholile","Muji Records",29,66,21,"108613"
64,"spotify:track:6NC6bUY7tAIgr5xvzzZnBR","DJ Tshegu, Focalistic, Sims Noreng","Tiya Mfana (Mzokwana) [feat. Sims Noreng]","18 Area Holdings",11,68,19,"108508"
65,"spotify:track:4i2Dz0USzHqcOTrP0y79V9","Oscar Mbo, KG Smallz, Thakzin, Dearson, Mhaw Keys, MÖRDA","Yes God (feat. Dearson, Mörda & Mhaw keys)","The Ashmed Hour Records",17,55,31,"108245"
66,"spotify:track:57wp7VFnV8X0pSVnYArGeJ","Bryson Tiller","Whatever She Wants","TrapSoul/RCA Records",66,82,3,"108062"
67,"spotify:track:68Dni7IE4VyPkTOH9mRWHr","J. Cole","No Role Modelz","Roc Nation Records LLC",39,65,177,"107561"
68,"spotify:track:7wcjeveluiW5djtxLCxNSx","Spirit Of Praise, Mpumi Mtsweni","Thath'Indawo (Live)","Spirit Music",23,62,54,"107108"
69,"spotify:track:1rtMuIY76v879DN8kW1fhf","Kelvin Momo, Babalwa M, Sfarzo Rtee","Sukakude (feat. Sfarzo Rtee)","Kelvin Momo Productions",7,74,65,"107019"
70,"spotify:track:7aqfrAY2p9BUSiupwk3svU","Drake, J. Cole","First Person Shooter (feat. J. Cole)","OVO/Republic",3,61,22,"106116"
71,"spotify:track:3E1PwVodPiDbBHOI85CO9M","Tyler ICU, LeeMcKrazy, Tman Xpress, Visca, Ceeka RSA, SjavasDaDeejay, Al Xapo","Ebasini (feat. Tman Xpress, Visca, Ceeka RSA, Sjavasdadeejay & Al Xapo)","Baby Blue Entertainment",71,73,2,"106020"
72,"spotify:track:3BraTCQg9APnWRC7HQZyOJ","Wanitwa Mos, Nkosazana Daughter, Master KG, Casswell P","Makhelwane (feat. Casswell P)","Wanitwa Mos Entertainment",36,63,16,"105416"
73,"spotify:track:7GUhiAHLoVy1V8ucQuZ3CB","The Weeknd, Playboi Carti, Madonna","Popular (with Playboi Carti & Madonna)","Universal Republic Records",33,59,37,"103868"
74,"spotify:track:0JGdktTFMHlfUdSZcbTOXC","Lwah Ndlunkulu","Ngyathandaza","Nkabi Records",64,84,15,"103758"
75,"spotify:track:3xKsf9qdS1CyvXSMEid6g8","Frank Ocean","Pink + White","Boys Don't Cry",58,58,68,"101920"
76,"spotify:track:4P62OAoBti8I0OusyVFQJc","Ggoldie, Chley, Ceeka RSA, T.M.A_Rsa, RIVALZ","Asambe","2023 HGA/LVRN Records (Love Renaissance)",27,57,11,"101066"
77,"spotify:track:1IMRi5UVOV77PsAgdWDvzh","Chike, Mohbad","Egwu","Brothers Records, under exclusive license to ONErpm",77,173,2,"100815"
78,"spotify:track:0u2P5u6lvoDfwTYjAADbn4","Billie Eilish, Khalid","lovely (with Khalid)","Darkroom",22,80,306,"99912"
79,"spotify:track:7qEHsqek33rTcFNT9PFqLf","Lewis Capaldi","Someone You Loved","Vertigo Berlin",7,77,269,"98822"
80,"spotify:track:53wwaMp15eGyE12Cm7sxLa","Xolly Mncwango","Ungukuphila","Universal Music (Pty) Ltd.",80,99,2,"98445"
81,"spotify:track:3hRV0jL3vUpRrcy398teAU","Lord Huron","The Night We Met","Play It Again Sam",77,85,42,"97711"
82,"spotify:track:2fOazsCfbGoDQqwxIJLUzG","Naledi Aphiwe","Ngiyabonga","Naledi Aphiwe",69,76,6,"97433"
83,"spotify:track:6wf7Yu7cxBSPrRlWeSeK0Q","Billie Eilish","What Was I Made For? [From The Motion Picture ""Barbie""]","Darkroom/Interscope Records",17,75,34,"97111"
84,"spotify:track:0XSYoJ0MJpMB2tddyRcBEC","De Mthuda, Da Muziqal Chef, Eemoh","Sgudi Snyc","Universal Music (Pty) Ltd.",2,97,42,"96418"
85,"spotify:track:2xjZHjB3Vi6x8MlRQqL1AT","Eloff","Vlerke","Select",51,72,14,"96373"
86,"spotify:track:1g7hu7KMV5woMx6xfi1C6p","YANII, Mxolisi Khumalo","Ngibambeni","Yanii Entertainment",21,81,15,"95661"
87,"spotify:track:6MJ2zbeyqzQteAB9rEc9VX","Lwah Ndlunkulu, Siya Ntuli","Ithuba","Nkabi Records",33,83,81,"95087"
88,"spotify:track:7DfFc7a6Rwfi3YQMRbDMau","Frank Ocean","Thinkin Bout You","Red Zone Entertainment / IDJ",70,70,16,"93387"
89,"spotify:track:5jOBkF36FUThJIHEJ3Zac5","Bandros, ZANI, Zee Nxumalo","Nguwe","Jive Hub Productions Pty (Ltd)",77,98,8,"92293"
90,"spotify:track:3pXF1nA74528Edde4of9CC","Bryson Tiller","Don't","TrapSoul/RCA Records",55,91,114,"91146"
91,"spotify:track:03CvGhnHgFpcm5O2bSrGL7","Lwah Ndlunkulu, DR BUSELAPHI","Maye","Nkabi Records",56,79,14,"90555"
92,"spotify:track:2FDTHlrBguDzQkp7PVj16Q","Dave, Central Cee","Sprinter","Neighbourhood / Live Yours",4,86,40,"90533"
93,"spotify:track:3s2qeMcvlTLdhkXy5VIUBA","Pcee, Officixl Rsa","Gabriella (feat. Officixl RSA)","Sound African Recordings",39,96,12,"90458"
94,"spotify:track:1djewwWkOaJGFtPaQc2MU6","Sam Deep, Eemoh, Da Muziqal Chef","iMpumelelo","Universal Music (Pty) Ltd.",8,117,52,"90319"
95,"spotify:track:1bmZLmDu9jkzwHInzPsYLD","Inkabi Zezwe, Sjava, Big Zulu","Umbayimbayi","Warner Music Africa",1,88,50,"89061"
96,"spotify:track:5l4S6LVL1AQfZC01pypXl6","Megadrumz, Lady Du","Tjina","Open Mic Productions",9,139,25,"88941"
97,"spotify:track:1eUGmzzvahJjOSWgDHuRlv","Miguel","Girl With The Tattoo Enter.lewd","Jive",97,170,31,"88714"
98,"spotify:track:1BxfuPKGuaTgP7aM0Bbdwr","Taylor Swift","Cruel Summer","Taylor Swift",26,90,39,"88555"
99,"spotify:track:4OzS0O0i88cGeu8YklCHrT","Fridayy","When It Comes To You","FRIDAYY PS/ Def Jam",96,101,8,"87816"
100,"spotify:track:0QosomGFiJYOxj2ViZfqng","Justin Timberlake","Selfish","RCA Records Label",45,69,6,"87766"
101,"spotify:track:6xcJyGpfZbuuiequtnlKt4","Travis Scott","BUTTERFLY EFFECT","Cactus Jack / Epic",29,188,19,"87197"
102,"spotify:track:4pEAeKopzeGr3YCMaVVWwS","Xduppy, Young Stunna, Thuto The Human, DJ Maphorisa","Monday Boys Holiday (feat. DJ Maphorisa)","Kgaday",61,94,11,"87049"
103,"spotify:track:09zHC0CNGuWQ1ot7WhzwKJ","Fezeka Dlamini, Nomfundo Moh, Naledi","Uyangijabulisa","Sginci Media",12,95,29,"87022"
104,"spotify:track:3Pbp7cUCx4d3OAkZSCoNvn","Michael Marcagi","Scared To Start","Warner Records",97,106,6,"85740"
105,"spotify:track:1zi7xx7UVEFkmKfv06H8x0","Drake, Wizkid, Kyla","One Dance","Cash Money Records/Young Money Ent./Universal Rec.",78,93,147,"85599"
106,"spotify:track:43zdsphuZLzwA9k4DJhU0I","Billie Eilish","when the party's over","Darkroom/Interscope Records",11,113,156,"85389"
107,"spotify:track:6oEVnWKgPqIEPc53OYDNqG","H.E.R., Bryson Tiller","Could've Been (feat. Bryson Tiller)","MBK Entertainment/RCA Records",77,167,72,"84693"
108,"spotify:track:3XVBdLihbNbxUwZosxcGuJ","Alicia Keys","If I Ain't Got You","J Records",93,130,20,"84425"
109,"spotify:track:5uCax9HTNlzGybIStD3vDh","James Arthur","Say You Won't Let Go","Columbia",85,165,299,"84202"
110,"spotify:track:3vkCueOmm7xQDoJ17W1Pm3","Mitski","My Love Mine All Mine","Dead Oceans",76,109,22,"84182"
111,"spotify:track:5mjYQaktjmjcMKcUIcqz4s","Kenya Grace","Strangers","Warner Records/Major Recordings",29,104,27,"84128"
112,"spotify:track:3c6afiysmB7OnxQzzSqRfD","Tamia","So Into You","Rhino/Warner Records",85,114,40,"83998"
113,"spotify:track:7qoxdajngC0j9VXrcnephA","Alex Warren","Before You Leave Me","Atlantic Records",113,125,2,"83333"
114,"spotify:track:3JyEmaZmPsuIvFivnwN22k","Glenn Jones","All for You","Jive",112,112,49,"83100"
115,"spotify:track:2uIX8YMNjGMD7441kqyyNU","Billie Eilish","ocean eyes","Darkroom",92,124,98,"82911"
116,"spotify:track:7kCvZYf9IEtJLlGctDBUAw","Mshinwemali, Zothando","Ngicel Uhambe","Insika Yethonga",100,116,8,"82862"
117,"spotify:track:59nOXPmaKlBfGMDeOVGrIK","Future, Drake, Tems","WAIT FOR U (feat. Drake & Tems)","Epic/Freebandz",1,110,97,"82827"
118,"spotify:track:5L8SXJHxQBLCt4i6ohuPee","Deejaykgosi, Baby Momo, Lington, Phemelo Saxer, Zee_nhle, iam.psalm","Ngizwile (feat. Lington, Zee_nhle, iam.psalm, Phemelo Saxer)","Wanitwa Mos Entertainment",23,140,33,"82571"
119,"spotify:track:1RMJOxR6GRPsBHL8qeC2ux","Daniel Caesar, H.E.R.","Best Part (feat. H.E.R.)","Golden Child Recordings",83,105,227,"82231"
120,"spotify:track:5IgjP7X4th6nMNDh4akUHb","Chris Brown","Under The Influence","Chris Brown Entertainment/RCA Records",2,103,103,"82093"
121,"spotify:track:1y5eHXBYiLgNv00KoHXm4o","Soa Mattrix, Mashudu, Happy Jazzman, Emotionz DJ","Mina Nawe","Soa Music Group",1,118,73,"81937"
122,"spotify:track:1odExI7RdWc4BT515LTAwj","David Kushner","Daylight","Miserable Music Group, LLC",18,119,47,"81867"
123,"spotify:track:56y1jOTK0XSvJzVv9vHQBK","Doja Cat","Paint The Town Red","Kemosabe Records/RCA Records",10,102,31,"81393"
124,"spotify:track:6fAQNPY3jkRAKs75NqvdLS","Kabza De Small, Mthunzi, Young Stunna","Impumelelo (feat. Young Stunna)","Piano Hub",61,120,19,"80346"
125,"spotify:track:6wsqVwoiVH2kde4k4KKAFU","Travis Scott","I KNOW ?","Cactus Jack/Epic",11,100,31,"79880"
126,"spotify:track:2eAvDnpXP5W0cVtiI0PUxV","Ruth B.","Dandelions","Columbia",56,185,107,"79846"
127,"spotify:track:05A1KzxTLvShctiD0Bsydd","Inkabi Zezwe, Sjava, Big Zulu","Sayona","Warner Music Africa",51,134,42,"79584"
128,"spotify:track:4fxwbUSI6jF4XdnvCUVG97","Elaine","You're the One","Columbia",12,129,98,"79447"
129,"spotify:track:4JOP8ELK6AaeySe7sKe996","Alicia Keys","Un-thinkable (I'm Ready)","J Records",126,177,17,"79388"
130,"spotify:track:1Qrg8KqiBpW07V7PNxwwwL","SZA","Kill Bill","Top Dawg Entertainment/RCA Records",5,107,65,"79349"
131,"spotify:track:5rgrBsAFYMun6yhtnLKRPz","Bryson Tiller","Right My Wrongs","TrapSoul/RCA Records",131,-1,12,"79027"
132,"spotify:track:3zSm2FYUjpc9egsTA0bJ16","Die Piesangskille","Inge 2","Universal Music (Pty) Ltd.",55,136,29,"78581"
133,"spotify:track:6V5k8CKadngx40RMhx5lPj","De Mthuda, Kabza De Small, Da Muziqal Chef, Sino Msolo, Murumba Pitch","Muntu Wam","Universal Music (Pty) Ltd.",103,135,13,"78202"
134,"spotify:track:7DSAEUvxU8FajXtRloy8M0","Miley Cyrus","Flowers","Columbia",1,121,60,"77883"
135,"spotify:track:3GCdLUSnKSMJhs4Tj6CV3s","Kendrick Lamar, SZA","All The Stars (with SZA)","Black Panther (TDE/DMG) PS",4,126,58,"77846"
136,"spotify:track:3EFj3mNL6FTSEpW2cIMzr7","Masterpiece YVK, Tyler ICU, Ceeka RSA, Al Xapo","Woza Madzala (feat. Ceeka RSA & Al Xapo)","Piano Hub",136,-1,1,"77784"
137,"spotify:track:44G2gUVQvNNZ6w3i05tR4n","Chris Brown, Davido, Lojay","Sensational (feat. Davido & Lojay)","Chris Brown Entertainment/RCA Records",26,108,20,"77709"
138,"spotify:track:5cRR74BWupFPw8n5BlG1YF","Kelvin Momo, Stixx, Mzizi","Wa Nsiya (feat. Mzizi)","Kelvin Momo Productions",23,147,13,"77674"
139,"spotify:track:69phA1R4gmQsBFRQ3INW8C","Rich Amiri","ONE CALL","Internet Money Records / 10K Projects",119,133,4,"77569"
140,"spotify:track:68vgtRHr7iZHpzGpon6Jlo","USHER, Alicia Keys","My Boo","LaFace Records",115,127,4,"76607"
141,"spotify:track:7ko9EAsZ2N1ZpEBlMUkR3J","Kabza De Small, DJ Maphorisa, Njelic, Young Stunna, Nkosazana Daughter, Xolani Guitar","Nana Thula (feat. Njelic, Young Stunna, Nkosazana Daughter & Xolani Guitar)","Piano Hub",6,141,42,"76580"
142,"spotify:track:7MXVkk9YMctZqd1Srtv4MB","The Weeknd, Daft Punk","Starboy","Universal Republic Records",80,142,99,"76515"
143,"spotify:track:6bFD28m0wxDX6CpzTKKCnT","Dj Jaivane, LeeMcKrazy, Skandisoul","Ulala Kanjani (feat. LeeMckrazy & Skandisoul)","Ziiki Media",17,150,33,"76187"
144,"spotify:track:7DswEZZthZ6piQpL25qGAM","Victoria Monét","On My Mama","Lovett Music/RCA Records",70,175,5,"76092"
145,"spotify:track:06QKSv9bjUYLEUdRpuaGeQ","Nandipha808, Ceeka RSA, LeeMcKrazy, Philharmonic","Banike (feat. Philharmonic, LeeMcKrazy)","Stena Academy",22,151,19,"75991"
146,"spotify:track:2ktg2oZDyFAX3iY1QNkXl5","Summer Walker","Session 32","LVRN Records",87,149,66,"75904"
147,"spotify:track:561jH07mF1jHuk7KlaeF0s","Eminem","Mockingbird","Aftermath",52,161,72,"75749"
148,"spotify:track:3liiv1wmlYn2b7rnHRU2db","Muni Long, Yumbs","Made For Me - Yumbs’ Amapiano Remix","Supergiant Records, LLC / Def Jam Recordings",129,159,3,"75647"
149,"spotify:track:1yeB8MUNeLo9Ek1UEpsyz6","Drake, Sexyy Red, SZA","Rich Baby Daddy (feat. Sexyy Red & SZA)","OVO/Republic",34,122,18,"74786"
150,"spotify:track:5UqFcsRHW5It2HD3f2yoJD","Riaan Benadé","Boksemdais","Warner Music Africa",73,137,21,"74639"
151,"spotify:track:5NijSs5dAwaIybq1GaRTIe","Brent Faiyaz","Poison","Lost Kids",148,148,11,"74224"
152,"spotify:track:4EWCNWgDS8707fNSZ1oaA5","Kanye West","Heartless","Roc-A-Fella",115,138,24,"74220"
153,"spotify:track:66AON6YCCTK5MbJbumk2C0","Pushkin RSA, Springle, Choco Dynasty, Mankay","Welele (feat. Mankay, ChocoDynasty)","Pushkin & Springle",23,92,20,"74213"
154,"spotify:track:14SaZBTjxlorHJQxXh01Hu","Summer Walker, Drake","Girls Need Love (with Drake) - Remix","LVRN/Interscope Records",43,180,201,"73630"
155,"spotify:track:5R9zmvswQj0SRJ1XM0yTzU","Killorbeezbeatz","Ngilele E Hotel","Killorbeez Records",6,163,27,"73382"
156,"spotify:track:2e3Ea0o24lReQFR4FA7yXH","J. Cole","Love Yourz","Roc Nation Records LLC",93,156,52,"73247"
157,"spotify:track:2LBqCSwhJGcFQeTHMVGwy3","The Weeknd","Die For You","Universal Republic Records",35,162,93,"72924"
158,"spotify:track:3FAJ6O0NOHQV8Mc5Ri6ENp","GIVĒON","Heartbreak Anniversary","Epic/Not So Fast",3,-1,133,"72859"
159,"spotify:track:4l0RmWt52FxpVxMNni6i63","Tate McRae","you broke me first","RCA Records Label",14,-1,115,"72580"
160,"spotify:track:1KDT0dCJbLdJGFb47430tk","Kabza De Small, Mthunzi, MaWhoo","Bonga (feat. Mawhoo)","Piano Hub",139,160,15,"72336"
161,"spotify:track:4uUG5RXrOk84mYEfFvj3cK","David Guetta, Bebe Rexha","I'm Good (Blue)","Parlophone UK",8,168,80,"72183"
162,"spotify:track:6dpLxbF7lfCAnC9QRTjNLK","Good Neighbours","Home","Some Action",122,132,5,"72089"
163,"spotify:track:1s7oOCT8vauUh01PbJD6ps","Rema, Selena Gomez","Calm Down (with Selena Gomez)","Mavin Records / Jonzing World",7,153,80,"71148"
164,"spotify:track:5wttBUDyaHAR5q9fYnN3YF","21 Savage, Summer Walker","prove it","Slaughter Gang, LLC/Epic Records",31,144,8,"71115"
165,"spotify:track:1PRL5i4psRnhOutaezVAzd","Dodo Nyoka","Country Girl Van Bloem","Warner Music Africa",89,154,12,"71002"
166,"spotify:track:26b3oVLrRUaaybJulow9kz","Libianca","People","5K Records Limited",5,-1,61,"70871"
167,"spotify:track:3U5JVgI2x4rDyHGObzJfNf","Natasha Bedingfield","Unwritten","Sony Music CG",123,123,3,"70387"
168,"spotify:track:2uwnP6tZVVmTovzX5ELooy","J. Cole, Miguel","Power Trip (feat. Miguel)","Roc Nation LLC",168,194,2,"70297"
169,"spotify:track:7sTyAjxDXq9afwfSQy6D0s","Don Toliver","BANDIT","Cactus Jack / Atlantic",93,111,5,"70284"
170,"spotify:track:0VjIjW4GlUZAMYd2vXMi3b","The Weeknd","Blinding Lights","Republic Records",1,178,215,"70237"
171,"spotify:track:2xyx0o4xNOLLjBSbOOdcbA","Summer Walker, Bryson Tiller","Playing Games (with Bryson Tiller) - Extended Version","LVRN/Interscope Records",37,171,89,"70131"
172,"spotify:track:1xs8bOvm3IzEYmcLJVOc34","Ayra Starr","Rush","Mavin Records",7,166,75,"69849"
173,"spotify:track:0ehYWFeYfsH3S4dSuPj1zL","LIMIT NALA","Mawalawala","LIMIT NALA MUSIC",63,189,15,"69373"
174,"spotify:track:7N0ymLLWoUCe9kAvMOzYba","Kelvin Momo, Makhanj","Khawleza (feat. Makhanj)","Kelvin Momo Productions",151,-1,2,"69038"
175,"spotify:track:6PGoSes0D9eUDeeAafB2As","Kendrick Lamar, Zacari","LOVE. FEAT. ZACARI.","Aftermath",74,191,73,"68420"
176,"spotify:track:5Dsuz6UsZyoWM3HOaRgQeC","Lloyiso","Seasons","Universal Music (Pty) Ltd.",62,190,106,"68369"
177,"spotify:track:7zFXmv6vqI4qOt4yGf3jYZ","Daniel Caesar, Kali Uchis","Get You (feat. Kali Uchis)","Golden Child Recordings",119,176,52,"68104"
178,"spotify:track:5Y35SjAfXjjG0sFQ3KOxmm","SZA","Nobody Gets Me","Top Dawg Entertainment/RCA Records",20,146,26,"68021"
179,"spotify:track:4Skkx52Dh8yo4G1ijAEGs3","Myles Smith","Solo","RCA Records Label",66,196,6,"67929"
180,"spotify:track:2JvzF1RMd7lE3KmFlsyZD8","J. Cole","MIDDLE CHILD","Dreamville, Inc., Under exclusive license to Roc Nation Records",2,199,145,"67917"
181,"spotify:track:2YSzYUF3jWqb9YP9VXmpjE","Drake, Yeat","IDGAF (feat. Yeat)","OVO/Republic",5,174,22,"67897"
182,"spotify:track:1m2xMsxbtxv21Brome189p","Joe","I Wanna Know","Jive",166,186,7,"67670"
183,"spotify:track:2J6OF7CkpdQGSfm1wdclqn","Brent Faiyaz","Clouded","Lost Kids",63,158,56,"67638"
184,"spotify:track:7yq4Qj7cqayVTp3FF9CWbm","Vance Joy","Riptide","F-Stop Records/Atlantic",72,115,53,"67377"
185,"spotify:track:5fEB6ZmVkg63GZg9qO86jh","PARTYNEXTDOOR","Break from Toronto","OVO Sound",88,143,62,"67338"
186,"spotify:track:1OAh8uOEOvTDqkKFsKksCi","DJ Khaled, Rihanna, Bryson Tiller","Wild Thoughts (feat. Rihanna & Bryson Tiller)","Epic/We The Best",186,-1,1,"67333"
187,"spotify:track:1ei3hzQmrgealgRKFxIcWn","Benson Boone","In The Stars","Warner Records",87,169,22,"67320"
188,"spotify:track:6gBFPUFcJLzWGx4lenP6h2","Travis Scott","goosebumps","Cactus Jack / Epic",6,-1,86,"67228"
189,"spotify:track:4tqcoej1zPvwePZCzuAjJd","J. Cole","Wet Dreamz","Roc Nation Records LLC",91,195,96,"67197"
190,"spotify:track:3U4isOIWM3VvDubwSI3y7a","John Legend","All of Me","G.O.O.D. Music/Columbia",92,-1,146,"67178"
191,"spotify:track:6I3mqTwhRpn34SLVafSH7G","Justin Bieber","Ghost","RBMG/Def Jam",21,181,117,"66955"
192,"spotify:track:2mzM4Y0Rnx2BDZqRnhQ5Q6","Tems","Free Mind","Leading Vibe Ltd",68,-1,94,"66848"
193,"spotify:track:1vcWFclg5NPEi5Xvrws9kl","Makhadzi Entertainment, Babethe Gashoazen","Mapara (feat. Babethe Gashoazen)","Makhadzi Entertainment",91,-1,5,"66510"
194,"spotify:track:6qBFSepqLCuh5tehehc1bd","GIVĒON","Like I Want You","Epic/Not So Fast",55,-1,45,"66186"
195,"spotify:track:4pAl7FkDMNBsjykPXo91B3","Rihanna","Needed Me","Roc Nation / Rihanna",93,197,30,"66131"
196,"spotify:track:5XeFesFbtLpXzIVDNQP22n","Arctic Monkeys","I Wanna Be Yours","Domino Recording Co",153,200,24,"65917"
197,"spotify:track:4k5FlWz3dfhyQzmRpVPZsW","Lady Amar, JL SA, Cici, Murumba Pitch","Hamba Juba","Lea Records",1,-1,48,"65905"
198,"spotify:track:1zgHn1EqUyA0HqNYMdJ5ia","Brent Faiyaz","Best Time","ISO Supremacy under exclusive license to UnitedMasters LLC",131,131,6,"65867"
199,"spotify:track:4fYte8ZvTK14NEhAOZocBi","OneRepublic","I Ain't Worried","Mosley Music/Interscope Records",11,-1,88,"65855"
