rank,uri,artist_names,track_name,source,peak_rank,previous_rank,weeks_on_chart,streams
1,"spotify:track:54seQV7MCcppBrznALCdlT","TitoM, Yuppe, S.N.E, EeQue","Tshwala Bam (feat. S.N.E, EeQue)","TitoM",1,1,4,"832383"
2,"spotify:track:6Kijtp0DB6VwcoJIw7PJ9W","Kabza De Small, Mthunzi, DJ Maphorisa, Young Stunna, Sizwe Alakine, Umthakathi Kush","Imithandazo (feat. Young Stunna, DJ Maphorisa, Sizwe Alakine & Umthakathi Kush)","Piano Hub",1,2,21,"583106"
3,"spotify:track:0p8AKRTIxPeHDZu7ydYTxM","Shakes & Les, DBN Gogo, Zee Nxumalo, Ceeka RSA, Chley","Funk 55 (feat. Ceeka RSA, Chley)","Kreativekornerr",2,3,16,"374257"
4,"spotify:track:6tNQ70jh4OwmPGpYy6R2o9","Benson Boone","Beautiful Things","Night Street Records, Inc./Warner Records Inc.",4,5,9,"325374"
5,"spotify:track:4tsVMjM60RNTe9EV5oQ4sQ","DJ Stokie, Eemoh","Masithokoze","Universal Music (Pty) Ltd.",3,4,22,"309733"
6,"spotify:track:2pqIaYg12ziqIpVtdVESGt","Kelvin Momo, Babalwa M, Nia Pearl, Stixx","Amalobolo (feat. Stixx, Nia Pearl)","Kelvin Momo Productions",6,8,15,"300032"
7,"spotify:track:0WIv5qV41y6YjjB9V1biuC","Muni Long","Made For Me","Supergiant Records, LLC / Def Jam Recordings",5,6,9,"294735"
8,"spotify:track:3w0w2T288dec0mgeZZqoNN","¥$, Kanye West, Ty Dolla $ign","CARNIVAL","Ye",5,7,6,"287799"
9,"spotify:track:2fofdfhRxFVP1bRdjA1FEc","TxC, Tony Duardo","Turn Off The Lights","TXC Enterprises (PTY) LTD., under exclusive license to LVRN Records (Love Renaissance)",9,9,9,"276809"
10,"spotify:track:0UBK6HcgmmWUQzFQTncmDz","Wanitwa Mos, Nkosazana Daughter, Master KG, Dalom Kids","Keneilwe (feat. Dalom Kids)","Wanitwa Mos Entertainment",2,10,18,"274113"
11,"spotify:track:5TY9ovYtBeJTY9s7K3ijEd","Ugatsheni","Hit after Hit","Kuhleliwe Mmema Holdings",9,11,12,"268330"
12,"spotify:track:3pImmSzeKex5ffzsDoaL3z","Bassie, Aymos, T-Man SA","Izenzo","Djs Production Pty Ltd",5,12,30,"265657"
13,"spotify:track:2ee1Pa7Gs7lIGRXrl217IG","DJ Lag, Mr Nation Thingz, K.C Driller","Hade Boss","Black Major x Ice Drop",13,14,8,"240688"
14,"spotify:track:7JbLSEDlRdoJaXk5ddZae2","Mthandeni SK, Lwah Ndlunkulu","Paris","Mthandeni Music Production",4,13,32,"224822"
15,"spotify:track:5yyYL1FpimADTIftYQU0cg","Dlala Thukzin, Zaba, Sykes","iPlan","Dlala Records (PTY) Ltd",1,15,27,"220416"
16,"spotify:track:2Oe52Ggx8lxxI55azZbr5h","Kabza De Small, Mthunzi, MaWhoo","Amazwe (feat. Mawhoo)","Piano Hub",16,17,21,"210776"
17,"spotify:track:51ZQ1vr10ffzbwIjDCwqm4","Ariana Grande","we can't be friends (wait for your love)","Republic Records",16,16,2,"208501"
18,"spotify:track:1tvDDR0ZAowEqKLN15g7tH","Zwide, Umafikizolo, uMehlabomvu","Wenhliziyo Yami","Insika Yethonga",18,32,4,"205114"
19,"spotify:track:5aIVCx5tnk0ntmdiinnYvw","Tyla","Water","FAX Records/Epic",4,19,29,"194293"
20,"spotify:track:1ng4byy7mejezJ08hs4P7R","Sam Deep, Njelic, Aymos","Isgubhu","Universal Music (Pty) Ltd.",6,18,29,"191349"
21,"spotify:track:710qLZ4WOxBj7ZaVbVJtkh","Kelvin Momo, Babalwa M, Azana, Stixx","Maye Maye (feat. Azana, Stixx)","Kelvin Momo Productions",17,24,16,"177297"
22,"spotify:track:1whAXVGN8AdfrnoXNIXfJf","Tyla","Truth or Dare","FAX Records/Epic",17,21,16,"176781"
23,"spotify:track:6OGNF7mro80pMi5q1HhylS","Khalil Harrison, Tyler ICU, LeeMcKrazy, Ceeka RSA","Jealousy (feat. Leemckrazy & Ceeka RSA)","Baby Blue Entertainment",21,22,15,"174710"
24,"spotify:track:3qhlB30KknSejmIvZZLjOD","Djo","End of Beginning","Djo",24,27,4,"174537"
25,"spotify:track:1eOOCRtXcPwK8qG8VjtczJ","Harrycane, Master KG, Eemoh, DJ Latimmy","Dubula (feat. DJ Latimmy) - Remake","Wanitwa Mos Entertainment",3,26,20,"171876"
26,"spotify:track:4iuNZTcvT9diFySSzVsnVS","Fantasia","When I See U","J Records",26,30,202,"170782"
27,"spotify:track:4J1H4EuucGhhYfcPpYCBRr","DJ Stokie, Zee_nhle, Omit ST, Sobzeen","Awukhuzeki","Universal Music (Pty) Ltd.",1,25,40,"168545"
28,"spotify:track:3XqM8hLCEYlbnFjoWwqtFv","Chris Brown","Angel Numbers / Ten Toes","Chris Brown Entertainment/RCA Records",15,20,19,"167335"
29,"spotify:track:4iZ4pt7kvcaH6Yo8UoZ4s2","SZA","Snooze","Top Dawg Entertainment/RCA Records",12,23,67,"167038"
30,"spotify:track:17phhZDn6oGtzMe56NuWvj","Teddy Swims","Lose Control","Warner Records",26,28,11,"164946"
31,"spotify:track:48lcmlbwm4VHcOfXqWlVbx","Mellow & Sleazy, Eltee, LeeMcKrazy, Scotts Maphuma, Gipa","Kokotela (feat. Scotts Maphuma & Gipa)","Sound African Recordings",31,34,4,"161750"
32,"spotify:track:1IMRi5UVOV77PsAgdWDvzh","Chike, Mohbad","Egwu","Brothers Records, under exclusive license to ONErpm",32,54,4,"158655"
33,"spotify:track:38yfPQYoGWFJtn3NLBqTB0","Daliwonga, Nkosazana Daughter, Happy Jazzman","Seduce Me (feat. Nkosazana Daughter & Happy JazzMan)","New Money Gang Records",17,31,21,"152830"
34,"spotify:track:52eIcoLUM25zbQupAZYoFh","21 Savage","redrum","Slaughter Gang, LLC/Epic Records",12,29,10,"148201"
35,"spotify:track:4xQgivVLGFlB0tctjpR2SU","Lwah Ndlunkulu","Eyami","Nkabi Records",15,38,33,"147470"
36,"spotify:track:42VsgItocQwOQC3XWZ8JNA","Travis Scott, Playboi Carti","FE!N (feat. Playboi Carti)","Cactus Jack/Epic",5,33,25,"145907"
37,"spotify:track:0OBkFew4sntJl9PaJp0TOA","Nandipha808, Ceeka RSA, DEMOLA","Forgive Our Trespasses (feat. Demola, Ceeka RSA)","Stena Academy",24,37,12,"145350"
38,"spotify:track:4URabg9AGHasjFEVdTbWcC","Kamo Mphela, Tyler ICU, Khalil Harrison, Baby S.O.N","Dalie (feat. Baby S.O.N)","KAMO MPHELA ENTERTAINMENT",3,35,22,"144663"
39,"spotify:track:3oPYVnm0LsmAQ4RobrRS29","Mellow & Sleazy, SjavasDaDeejay, TitoM, Tman Xpress","Imnandi lento (feat. Tman Xpress)","Sound African Recordings",1,42,31,"142354"
40,"spotify:track:7GaFYUqP2WdR4KTPk7cXoP","Mario","Let Me Love You","J Records",39,39,276,"140893"
41,"spotify:track:4xhsWYTOGcal8zt0J161CU","Jack Harlow","Lovin On Me","Generation Now/Atlantic",10,36,19,"138583"
42,"spotify:track:5hJFhO9dvhJoDvUZZ9iWSw","Miguel","Adorn","ByStorm Entertainment/RCA Records",42,52,79,"138281"
43,"spotify:track:43PuMrRfbyyuz4QpZ3oAwN","Bryson Tiller","Exchange","TrapSoul/RCA Records",43,44,111,"136141"
44,"spotify:track:4EI8VuxUuIHKfafU72emqz","Mariah Carey","We Belong Together","Def Jam Recordings",44,53,107,"135992"
45,"spotify:track:7AYmToZ5y67fBjq4RLFbuq","Beyoncé","TEXAS HOLD 'EM","Parkwood Entertainment/Columbia",16,40,6,"135044"
46,"spotify:track:5jPckUbvd78IYYd1bEJSwJ","Khuthuza, MAFIKIZOLO","NGIJOLA NEBHINCA","5932550 Records DK",43,55,20,"132476"
47,"spotify:track:1VNWdmXSbaNrnWod10WIL0","The Weeknd, JENNIE, Lily-Rose Depp","One Of The Girls (with JENNIE, Lily Rose Depp)","Universal Republic Records",31,43,19,"132448"
48,"spotify:track:3rUGC1vUpkDG9CZFHMur1t","Tate McRae","greedy","RCA Records Label",27,41,27,"131697"
49,"spotify:track:7ATU7xI4ffZgPGm3QCKX4K","Lwah Ndlunkulu","Ngiyeza","Nkabi Records",8,59,61,"127069"
50,"spotify:track:3E1PwVodPiDbBHOI85CO9M","Tyler ICU, LeeMcKrazy, Tman Xpress, Visca, Ceeka RSA, SjavasDaDeejay, Al Xapo","Ebasini (feat. Tman Xpress, Visca, Ceeka RSA, Sjavasdadeejay & Al Xapo)","Baby Blue Entertainment",50,63,4,"127003"
51,"spotify:track:5PyDJG7SQRgWXefgexqIge","Doja Cat","Agora Hills","Kemosabe Records/RCA Records",20,47,26,"126023"
52,"spotify:track:0mflMxspEfB0VbI1kyLiAv","Noah Kahan","Stick Season","Mercury Records/Republic Records",33,48,16,"125990"
53,"spotify:track:5jsO87ShnH2lEXhIfjMAUj","Mzukulu, Shenge wasehlalankosi","Ijuba","BAQAZILE ENTERTAINMENT",46,57,15,"125013"
54,"spotify:track:0JXXNGljqupsJaZsgSbMZV","Miguel","Sure Thing","Jive",13,46,168,"122982"
55,"spotify:track:4nFrcGM7MY1mpoQCC7Kefj","Tems","Me & U","RCA Records/Since 93'",22,45,24,"122263"
56,"spotify:track:0JGdktTFMHlfUdSZcbTOXC","Lwah Ndlunkulu","Ngyathandaza","Nkabi Records",56,60,17,"119853"
57,"spotify:track:597LY7HnUeb9n6EUFUF8uc","Felo Le Tee, Focalistic, Massive95k, Dj Motee, L4desh, Turnupkiid","Ka Lekeke (feat. Dj Motee, L4desh & Turnupkiid)","New Money Gang Records",31,71,8,"116060"
58,"spotify:track:1rtMuIY76v879DN8kW1fhf","Kelvin Momo, Babalwa M, Sfarzo Rtee","Sukakude (feat. Sfarzo Rtee)","Kelvin Momo Productions",7,64,67,"114860"
59,"spotify:track:6lrKA1DMAihPI490Oj0twC","MaWhoo, Deep Sen, KingTalkzin, Mthunzi","Ngilimele (feat. Deep Sen, KingTalkzin, Mthunzi)","MaWhoo Entertainment",28,65,27,"112957"
60,"spotify:track:1bjeWoagtHmUKputLVyDxQ","SZA","Saturn","Top Dawg Entertainment/RCA Records",45,49,4,"112070"
61,"spotify:track:3LfXImvXHkHzz0qqdFAol4","DJ Kent, Thakzin, Brenden Praise, Mo-T, MÖRDA","Horns In The Sun (feat. Mo-T, Brenden Praise & Mörda) [Thakzin Remix]","Spinnin' Deep",17,66,23,"111974"
62,"spotify:track:5utUZ5nv6y6dR8irsnOQEj","Aqyila","Bloom","Sony Music Canada",14,50,6,"111772"
63,"spotify:track:68Dni7IE4VyPkTOH9mRWHr","J. Cole","No Role Modelz","Roc Nation Records LLC",39,67,179,"109491"
64,"spotify:track:6MJ2zbeyqzQteAB9rEc9VX","Lwah Ndlunkulu, Siya Ntuli","Ithuba","Nkabi Records",33,80,83,"109132"
65,"spotify:track:5tpft20jhQvRlG3O7XfwWy","Tyler ICU, Tumelo_za, DJ Maphorisa, Nandipha808, Ceeka RSA, Tyrone Dee","Mnike (feat. DJ Maphorisa, Nandipha808, Ceeka RSA & Tyron Dee)","New Money Gang Records",1,69,47,"108010"
66,"spotify:track:0u2P5u6lvoDfwTYjAADbn4","Billie Eilish, Khalid","lovely (with Khalid)","Darkroom",22,75,308,"105727"
67,"spotify:track:7wcjeveluiW5djtxLCxNSx","Spirit Of Praise, Mpumi Mtsweni","Thath'Indawo (Live)","Spirit Music",23,68,56,"104910"
68,"spotify:track:57wp7VFnV8X0pSVnYArGeJ","Bryson Tiller","Whatever She Wants","TrapSoul/RCA Records",66,70,5,"104412"
69,"spotify:track:3QS9ZCtoSCJhmaJ7QNXSAS","4batz, Drake","act ii: date @ 8 (feat. Drake) - remix","4batz / OVO Sound",51,51,2,"104041"
70,"spotify:track:3Pbp7cUCx4d3OAkZSCoNvn","Michael Marcagi","Scared To Start","Warner Records",70,87,8,"103657"
71,"spotify:track:7qEHsqek33rTcFNT9PFqLf","Lewis Capaldi","Someone You Loved","Vertigo Berlin",7,79,271,"103293"
72,"spotify:track:0ZBg0OsGKgZajDgFtryiz7","Gunna, Offset","prada dem (feat. Offset)","300 Entertainment",72,-1,1,"101610"
73,"spotify:track:6wf7Yu7cxBSPrRlWeSeK0Q","Billie Eilish","What Was I Made For? [From The Motion Picture ""Barbie""]","Darkroom/Interscope Records",17,73,36,"100700"
74,"spotify:track:2wq5tNWrGnqtLOhmmI1g4K","Halle","In Your Hands","Parkwood Entertainment/Columbia",74,-1,1,"100105"
75,"spotify:track:3BraTCQg9APnWRC7HQZyOJ","Wanitwa Mos, Nkosazana Daughter, Master KG, Casswell P","Makhelwane (feat. Casswell P)","Wanitwa Mos Entertainment",36,86,18,"99723"
76,"spotify:track:7aqfrAY2p9BUSiupwk3svU","Drake, J. Cole","First Person Shooter (feat. J. Cole)","OVO/Republic",3,76,24,"99304"
77,"spotify:track:4i2Dz0USzHqcOTrP0y79V9","Oscar Mbo, KG Smallz, Thakzin, Dearson, Mhaw Keys, MÖRDA","Yes God (feat. Dearson, Mörda & Mhaw keys)","The Ashmed Hour Records",17,77,33,"98288"
78,"spotify:track:5jOBkF36FUThJIHEJ3Zac5","Bandros, ZANI, Zee Nxumalo","Nguwe","Jive Hub Productions Pty (Ltd)",77,96,10,"97906"
79,"spotify:track:4rXLjWdF2ZZpXCVTfWcshS","Gunna","fukumean","300 Entertainment",5,83,40,"97434"
80,"spotify:track:6xcJyGpfZbuuiequtnlKt4","Travis Scott","BUTTERFLY EFFECT","Cactus Jack / Epic",29,101,21,"96982"
81,"spotify:track:7DfFc7a6Rwfi3YQMRbDMau","Frank Ocean","Thinkin Bout You","Red Zone Entertainment / IDJ",70,84,18,"95665"
82,"spotify:track:4XQNZPkMyo1LxR3NYbVegt","Maverick Muji, Nonny","Ngimtholile","Muji Records",29,82,23,"95628"
83,"spotify:track:3XVBdLihbNbxUwZosxcGuJ","Alicia Keys","If I Ain't Got You","J Records",83,102,22,"95414"
84,"spotify:track:2x2olWuWXpqjoeE4bO1NFS","Flo Milli","Never Lose Me","'94 Sounds/RCA Records",26,56,11,"95378"
85,"spotify:track:3xKsf9qdS1CyvXSMEid6g8","Frank Ocean","Pink + White","Boys Don't Cry",58,88,70,"94595"
86,"spotify:track:1zi7xx7UVEFkmKfv06H8x0","Drake, Wizkid, Kyla","One Dance","Cash Money Records/Young Money Ent./Universal Rec.",78,106,149,"94401"
87,"spotify:track:5uCax9HTNlzGybIStD3vDh","James Arthur","Say You Won't Let Go","Columbia",85,99,301,"94203"
88,"spotify:track:1eUGmzzvahJjOSWgDHuRlv","Miguel","Girl With The Tattoo Enter.lewd","Jive",88,91,33,"93618"
89,"spotify:track:1g7hu7KMV5woMx6xfi1C6p","YANII, Mxolisi Khumalo","Ngibambeni","Yanii Entertainment",21,103,17,"93481"
90,"spotify:track:4P62OAoBti8I0OusyVFQJc","Ggoldie, Chley, Ceeka RSA, T.M.A_Rsa, RIVALZ","Asambe","2023 HGA/LVRN Records (Love Renaissance)",27,108,13,"92694"
91,"spotify:track:7GUhiAHLoVy1V8ucQuZ3CB","The Weeknd, Playboi Carti, Madonna","Popular (with Playboi Carti & Madonna)","Universal Republic Records",33,92,39,"92628"
92,"spotify:track:7Gc7tNSocAypLct0MYYzmk","Felo Le Tee, LeeMcKrazy, Keynote","Yini Ngathi (Insane)","New Money Gang Records",10,97,23,"92565"
93,"spotify:track:3hRV0jL3vUpRrcy398teAU","Lord Huron","The Night We Met","Play It Again Sam",77,93,44,"92505"
94,"spotify:track:3h5TiWTqGxjSjFrbruPFH9","YG Marley","Praise Jah In The Moonlight","YG Marley Music",31,74,8,"92137"
95,"spotify:track:7kCvZYf9IEtJLlGctDBUAw","Mshinwemali, Zothando","Ngicel Uhambe","Insika Yethonga",89,89,10,"92040"
96,"spotify:track:2xjZHjB3Vi6x8MlRQqL1AT","Eloff","Vlerke","Select",51,90,16,"91499"
97,"spotify:track:6NC6bUY7tAIgr5xvzzZnBR","DJ Tshegu, Focalistic, Sims Noreng","Tiya Mfana (Mzokwana) [feat. Sims Noreng]","18 Area Holdings",11,107,21,"90312"
98,"spotify:track:2FDTHlrBguDzQkp7PVj16Q","Dave, Central Cee","Sprinter","Neighbourhood / Live Yours",4,105,42,"89507"
99,"spotify:track:1BxfuPKGuaTgP7aM0Bbdwr","Taylor Swift","Cruel Summer","Taylor Swift",26,104,41,"88659"
100,"spotify:track:1RMJOxR6GRPsBHL8qeC2ux","Daniel Caesar, H.E.R.","Best Part (feat. H.E.R.)","Golden Child Recordings",83,111,229,"88594"
101,"spotify:track:4OzS0O0i88cGeu8YklCHrT","Fridayy","When It Comes To You","FRIDAYY PS/ Def Jam",96,109,10,"88497"
102,"spotify:track:53wwaMp15eGyE12Cm7sxLa","Xolly Mncwango","Ungukuphila","Universal Music (Pty) Ltd.",80,81,4,"87735"
103,"spotify:track:6b81dy3WjbozXK6b7C1gu5","Dasha","Austin (Boots Stop Workin')","Warner Records",103,154,2,"87189"
104,"spotify:track:1bmZLmDu9jkzwHInzPsYLD","Inkabi Zezwe, Sjava, Big Zulu","Umbayimbayi","Warner Music Africa",1,117,52,"86220"
105,"spotify:track:6V5k8CKadngx40RMhx5lPj","De Mthuda, Kabza De Small, Da Muziqal Chef, Sino Msolo, Murumba Pitch","Muntu Wam","Universal Music (Pty) Ltd.",103,132,15,"85855"
106,"spotify:track:6oEVnWKgPqIEPc53OYDNqG","H.E.R., Bryson Tiller","Could've Been (feat. Bryson Tiller)","MBK Entertainment/RCA Records",77,113,74,"85696"
107,"spotify:track:43zdsphuZLzwA9k4DJhU0I","Billie Eilish","when the party's over","Darkroom/Interscope Records",11,112,158,"84433"
108,"spotify:track:4JOP8ELK6AaeySe7sKe996","Alicia Keys","Un-thinkable (I'm Ready)","J Records",108,129,19,"84394"
109,"spotify:track:3JyEmaZmPsuIvFivnwN22k","Glenn Jones","All for You","Jive",109,115,51,"84259"
110,"spotify:track:1djewwWkOaJGFtPaQc2MU6","Sam Deep, Eemoh, Da Muziqal Chef","iMpumelelo","Universal Music (Pty) Ltd.",8,127,54,"82938"
111,"spotify:track:1y5eHXBYiLgNv00KoHXm4o","Soa Mattrix, Mashudu, Happy Jazzman, Emotionz DJ","Mina Nawe","Soa Music Group",1,110,75,"82684"
112,"spotify:track:2uIX8YMNjGMD7441kqyyNU","Billie Eilish","ocean eyes","Darkroom",92,121,100,"82681"
113,"spotify:track:3zSm2FYUjpc9egsTA0bJ16","Die Piesangskille","Inge 2","Universal Music (Pty) Ltd.",55,135,31,"82624"
114,"spotify:track:0Lmbke3KNVFXtoH2mMSHCw","Ariana Grande","the boy is mine","Republic Records",61,61,2,"82573"
115,"spotify:track:5rgrBsAFYMun6yhtnLKRPz","Bryson Tiller","Right My Wrongs","TrapSoul/RCA Records",115,126,14,"81763"
116,"spotify:track:4pEAeKopzeGr3YCMaVVWwS","Xduppy, Young Stunna, Thuto The Human, DJ Maphorisa","Monday Boys Holiday (feat. DJ Maphorisa)","Kgaday",61,131,13,"81723"
117,"spotify:track:3c6afiysmB7OnxQzzSqRfD","Tamia","So Into You","Rhino/Warner Records",85,124,42,"81699"
118,"spotify:track:2eAvDnpXP5W0cVtiI0PUxV","Ruth B.","Dandelions","Columbia",56,128,109,"81395"
119,"spotify:track:4fxwbUSI6jF4XdnvCUVG97","Elaine","You're the One","Columbia",12,120,100,"81184"
120,"spotify:track:3pXF1nA74528Edde4of9CC","Bryson Tiller","Don't","TrapSoul/RCA Records",55,123,116,"80786"
121,"spotify:track:2BIHVjaSpbTAtvx0IrXmv6","DJ Stokie, Zee_nhle, Murumba Pitch","Mali","Universal Music (Pty) Ltd.",121,-1,1,"80417"
122,"spotify:track:5mjYQaktjmjcMKcUIcqz4s","Kenya Grace","Strangers","Warner Records/Major Recordings",29,116,29,"80386"
123,"spotify:track:03CvGhnHgFpcm5O2bSrGL7","Lwah Ndlunkulu, DR BUSELAPHI","Maye","Nkabi Records",56,125,16,"80120"
124,"spotify:track:5cRR74BWupFPw8n5BlG1YF","Kelvin Momo, Stixx, Mzizi","Wa Nsiya (feat. Mzizi)","Kelvin Momo Productions",23,122,15,"80035"
125,"spotify:track:2fOazsCfbGoDQqwxIJLUzG","Naledi Aphiwe","Ngiyabonga","Naledi Aphiwe",69,98,8,"79032"
126,"spotify:track:7sTyAjxDXq9afwfSQy6D0s","Don Toliver","BANDIT","Cactus Jack / Atlantic",93,-1,6,"78971"
127,"spotify:track:2uwnP6tZVVmTovzX5ELooy","J. Cole, Miguel","Power Trip (feat. Miguel)","Roc Nation LLC",127,163,4,"78738"
128,"spotify:track:7MXVkk9YMctZqd1Srtv4MB","The Weeknd, Daft Punk","Starboy","Universal Republic Records",80,143,101,"78665"
129,"spotify:track:3GCdLUSnKSMJhs4Tj6CV3s","Kendrick Lamar, SZA","All The Stars (with SZA)","Black Panther (TDE/DMG) PS",4,134,60,"78557"
130,"spotify:track:2ktg2oZDyFAX3iY1QNkXl5","Summer Walker","Session 32","LVRN Records",87,162,68,"78465"
131,"spotify:track:5IgjP7X4th6nMNDh4akUHb","Chris Brown","Under The Influence","Chris Brown Entertainment/RCA Records",2,130,105,"78423"
132,"spotify:track:69phA1R4gmQsBFRQ3INW8C","Rich Amiri","ONE CALL","Internet Money Records / 10K Projects",119,157,6,"78330"
133,"spotify:track:0XSYoJ0MJpMB2tddyRcBEC","De Mthuda, Da Muziqal Chef, Eemoh","Sgudi Snyc","Universal Music (Pty) Ltd.",2,119,44,"78270"
134,"spotify:track:1odExI7RdWc4BT515LTAwj","David Kushner","Daylight","Miserable Music Group, LLC",18,138,49,"78223"
135,"spotify:track:7fyVAeiVE6mvM4MgyX4zi8","Aymos, Eemoh, Kabza De Small","Esgela","Lyf Styl Entertainment",135,-1,1,"78096"
136,"spotify:track:68vgtRHr7iZHpzGpon6Jlo","USHER, Alicia Keys","My Boo","LaFace Records",115,142,6,"78095"
137,"spotify:track:3FAJ6O0NOHQV8Mc5Ri6ENp","GIVĒON","Heartbreak Anniversary","Epic/Not So Fast",3,147,135,"78012"
138,"spotify:track:60Z2UUVW3R0oeWCLi4Y3aK","Shebeshxt, Naqua SA, Buddy Sax, Bayor 97, Zoli White Smoke, Smeazy","Ambulance","The Royal Media House Group",58,180,11,"77993"
139,"spotify:track:1KDT0dCJbLdJGFb47430tk","Kabza De Small, Mthunzi, MaWhoo","Bonga (feat. Mawhoo)","Piano Hub",139,161,17,"77688"
140,"spotify:track:3s2qeMcvlTLdhkXy5VIUBA","Pcee, Officixl Rsa","Gabriella (feat. Officixl RSA)","Sound African Recordings",39,114,14,"77612"
141,"spotify:track:7N0ymLLWoUCe9kAvMOzYba","Kelvin Momo, Makhanj","Khawleza (feat. Makhanj)","Kelvin Momo Productions",141,160,4,"77561"
142,"spotify:track:561jH07mF1jHuk7KlaeF0s","Eminem","Mockingbird","Aftermath",52,144,74,"77472"
143,"spotify:track:5D34wRmbFS29AjtTOP2QJe","Ariana Grande","yes, and?","Republic Records",20,62,8,"76991"
144,"spotify:track:59nOXPmaKlBfGMDeOVGrIK","Future, Drake, Tems","WAIT FOR U (feat. Drake & Tems)","Epic/Freebandz",1,139,99,"76941"
145,"spotify:track:1vbe9sh7U9vdMceAhitWr2","New Edition","Can You Stand The Rain","Geffen*",145,156,2,"76904"
146,"spotify:track:09zHC0CNGuWQ1ot7WhzwKJ","Fezeka Dlamini, Nomfundo Moh, Naledi","Uyangijabulisa","Sginci Media",12,118,31,"76376"
147,"spotify:track:4EWCNWgDS8707fNSZ1oaA5","Kanye West","Heartless","Roc-A-Fella",115,150,26,"76225"
148,"spotify:track:7ko9EAsZ2N1ZpEBlMUkR3J","Kabza De Small, DJ Maphorisa, Njelic, Young Stunna, Nkosazana Daughter, Xolani Guitar","Nana Thula (feat. Njelic, Young Stunna, Nkosazana Daughter & Xolani Guitar)","Piano Hub",6,148,44,"76157"
149,"spotify:track:3B54sVLJ402zGa6Xm4YGNe","French Montana, Swae Lee","Unforgettable","Bad Boy Entertainment/Epic Records",90,166,34,"75317"
150,"spotify:track:4l0RmWt52FxpVxMNni6i63","Tate McRae","you broke me first","RCA Records Label",14,167,117,"75282"
151,"spotify:track:7pDfRnoEDRkcz7bQsOjnPc","Cardi B","Enough (Miami)","Atlantic Records",151,-1,1,"75137"
152,"spotify:track:4k5FlWz3dfhyQzmRpVPZsW","Lady Amar, JL SA, Cici, Murumba Pitch","Hamba Juba","Lea Records",1,-1,49,"75067"
153,"spotify:track:4uUG5RXrOk84mYEfFvj3cK","David Guetta, Bebe Rexha","I'm Good (Blue)","Parlophone UK",8,151,82,"74904"
154,"spotify:track:2e3Ea0o24lReQFR4FA7yXH","J. Cole","Love Yourz","Roc Nation Records LLC",93,146,54,"74796"
155,"spotify:track:6fAQNPY3jkRAKs75NqvdLS","Kabza De Small, Mthunzi, Young Stunna","Impumelelo (feat. Young Stunna)","Piano Hub",61,174,21,"74788"
156,"spotify:track:1ei3hzQmrgealgRKFxIcWn","Benson Boone","In The Stars","Warner Records",87,184,24,"74755"
157,"spotify:track:1yeB8MUNeLo9Ek1UEpsyz6","Drake, Sexyy Red, SZA","Rich Baby Daddy (feat. Sexyy Red & SZA)","OVO/Republic",34,152,20,"74735"
158,"spotify:track:56y1jOTK0XSvJzVv9vHQBK","Doja Cat","Paint The Town Red","Kemosabe Records/RCA Records",10,137,33,"74281"
159,"spotify:track:5NijSs5dAwaIybq1GaRTIe","Brent Faiyaz","Poison","Lost Kids",148,155,13,"73709"
160,"spotify:track:5UqFcsRHW5It2HD3f2yoJD","Riaan Benadé","Boksemdais","Warner Music Africa",73,165,23,"73367"
161,"spotify:track:14SaZBTjxlorHJQxXh01Hu","Summer Walker, Drake","Girls Need Love (with Drake) - Remix","LVRN/Interscope Records",43,170,203,"73332"
162,"spotify:track:3U4isOIWM3VvDubwSI3y7a","John Legend","All of Me","G.O.O.D. Music/Columbia",92,194,148,"73156"
163,"spotify:track:6bFD28m0wxDX6CpzTKKCnT","Dj Jaivane, LeeMcKrazy, Skandisoul","Ulala Kanjani (feat. LeeMckrazy & Skandisoul)","Ziiki Media",17,168,35,"72972"
164,"spotify:track:05A1KzxTLvShctiD0Bsydd","Inkabi Zezwe, Sjava, Big Zulu","Sayona","Warner Music Africa",51,141,44,"72759"
165,"spotify:track:1OAh8uOEOvTDqkKFsKksCi","DJ Khaled, Rihanna, Bryson Tiller","Wild Thoughts (feat. Rihanna & Bryson Tiller)","Epic/We The Best",165,176,3,"72668"
166,"spotify:track:6qBFSepqLCuh5tehehc1bd","GIVĒON","Like I Want You","Epic/Not So Fast",55,191,47,"72470"
167,"spotify:track:7DSAEUvxU8FajXtRloy8M0","Miley Cyrus","Flowers","Columbia",1,145,62,"72153"
168,"spotify:track:2xyx0o4xNOLLjBSbOOdcbA","Summer Walker, Bryson Tiller","Playing Games (with Bryson Tiller) - Extended Version","LVRN/Interscope Records",37,185,91,"71890"
169,"spotify:track:7zFXmv6vqI4qOt4yGf3jYZ","Daniel Caesar, Kali Uchis","Get You (feat. Kali Uchis)","Golden Child Recordings",119,178,54,"71729"
170,"spotify:track:6PGoSes0D9eUDeeAafB2As","Kendrick Lamar, Zacari","LOVE. FEAT. ZACARI.","Aftermath",74,177,75,"71610"
171,"spotify:track:4fYte8ZvTK14NEhAOZocBi","OneRepublic","I Ain't Worried","Mosley Music/Interscope Records",11,192,90,"71549"
172,"spotify:track:06QKSv9bjUYLEUdRpuaGeQ","Nandipha808, Ceeka RSA, LeeMcKrazy, Philharmonic","Banike (feat. Philharmonic, LeeMcKrazy)","Stena Academy",22,-1,20,"71322"
173,"spotify:track:2LBqCSwhJGcFQeTHMVGwy3","The Weeknd","Die For You","Universal Republic Records",35,171,95,"71294"
174,"spotify:track:26b3oVLrRUaaybJulow9kz","Libianca","People","5K Records Limited",5,188,63,"71084"
175,"spotify:track:7DswEZZthZ6piQpL25qGAM","Victoria Monét","On My Mama","Lovett Music/RCA Records",70,158,7,"71016"
176,"spotify:track:0VjIjW4GlUZAMYd2vXMi3b","The Weeknd","Blinding Lights","Republic Records",1,187,217,"71013"
177,"spotify:track:5Dsuz6UsZyoWM3HOaRgQeC","Lloyiso","Seasons","Universal Music (Pty) Ltd.",62,181,108,"70899"
178,"spotify:track:0ehYWFeYfsH3S4dSuPj1zL","LIMIT NALA","Mawalawala","LIMIT NALA MUSIC",63,182,17,"70863"
179,"spotify:track:44G2gUVQvNNZ6w3i05tR4n","Chris Brown, Davido, Lojay","Sensational (feat. Davido & Lojay)","Chris Brown Entertainment/RCA Records",26,140,22,"70745"
180,"spotify:track:64WL36LvfiLGQJIDqLPAwB","Justin Timberlake","Selfish","RCA Records Label",45,136,8,"70577"
181,"spotify:track:3vkCueOmm7xQDoJ17W1Pm3","Mitski","My Love Mine All Mine","Dead Oceans",76,149,24,"70537"
182,"spotify:track:4pAl7FkDMNBsjykPXo91B3","Rihanna","Needed Me","Roc Nation / Rihanna",93,183,32,"70319"
183,"spotify:track:6gBFPUFcJLzWGx4lenP6h2","Travis Scott","goosebumps","Cactus Jack / Epic",6,197,88,"69962"
184,"spotify:track:0RiRZpuVRbi7oqRdSMwhQY","Post Malone, Swae Lee","Sunflower - Spider-Man: Into the Spider-Verse","Republic Records",1,-1,221,"69726"
185,"spotify:track:1NQCinyxiglxekxXVPEhnC","Uncle Waffles, Ice Beats Slide, Sbuda Maleather","Peacock Revisit (feat. Ice Beats Slide & Sbuda Maleather)","Encore Recordings",3,-1,31,"69572"
186,"spotify:track:1zHdh2Muk7jyPYXc8h1zPs","Big Zulu, Mduduzi Ncube, Siya Ntuli, Lwah Ndlunkulu, Xowla","Voicemail","Nkabi Records",11,-1,67,"69452"
187,"spotify:track:1mXVgsBdtIVeCLJnSnmtdV","Sam Smith","Too Good At Goodbyes","PLG - Capitol",69,198,152,"69023"
188,"spotify:track:4tqcoej1zPvwePZCzuAjJd","J. Cole","Wet Dreamz","Roc Nation Records LLC",91,186,98,"68990"
189,"spotify:track:1zgHn1EqUyA0HqNYMdJ5ia","Brent Faiyaz","Best Time","ISO Supremacy under exclusive license to UnitedMasters LLC",131,199,8,"68510"
190,"spotify:track:7qoxdajngC0j9VXrcnephA","Alex Warren","Before You Leave Me","Atlantic Records",113,175,4,"68203"
191,"spotify:track:6I3mqTwhRpn34SLVafSH7G","Justin Bieber","Ghost","RBMG/Def Jam",21,193,119,"68164"
192,"spotify:track:1s7oOCT8vauUh01PbJD6ps","Rema, Selena Gomez","Calm Down (with Selena Gomez)","Mavin Records / Jonzing World",7,190,82,"68140"
193,"spotify:track:2JvzF1RMd7lE3KmFlsyZD8","J. Cole","MIDDLE CHILD","Dreamville, Inc., Under exclusive license to Roc Nation Records",2,195,147,"68092"
194,"spotify:track:1PRL5i4psRnhOutaezVAzd","Dodo Nyoka","Country Girl Van Bloem","Warner Music Africa",89,196,14,"67849"
195,"spotify:track:78QR3Wp35dqAhFEc2qAGjE","Lil Baby, Gunna","Drip Too Hard (Lil Baby & Gunna)","Quality Control Music/Young Stoner Life Records, a 300 Entertainment Label/Motown Records/Capitol Records",41,-1,116,"67736"
196,"spotify:track:1Qrg8KqiBpW07V7PNxwwwL","SZA","Kill Bill","Top Dawg Entertainment/RCA Records",5,169,67,"67334"
197,"spotify:track:2CvOqDpQIMw69cCzWqr5yr","Beyoncé","Halo","Music World Music/Columbia",112,-1,40,"67036"
