rank,uri,artist_names,track_name,source,peak_rank,previous_rank,weeks_on_chart,streams
191,"spotify:track:51ZQ1vr10ffzbwIjDCwqm4","Ariana Grande","we can't be friends (wait for your love)","Republic Records",16,198,24,"86646"
192,"spotify:track:1DyNpDv4M8qBTthYIAPvqW","Cyfred, Scotts Maphuma","Phuthuma","Cyfred holdings",142,142,2,"86533"
193,"spotify:track:70VtSPbK7NyX2dUpKQbUxN","Mlindo The Vocalist, Sjava","Egoli (feat. Sjava)","Sound African Recordings",54,-1,9,"86501"
194,"spotify:track:3rtv6UeFWYOAbegjRrrGCB","Solly Moholo","Banaka Nako Ea Me E Haufi","Sony Music Special Projects",118,188,17,"86336"
195,"spotify:track:05A1KzxTLvShctiD0Bsydd","Inkabi Zezwe, Sjava, Big Zulu","Sayona","Warner Music Africa",51,-1,63,"85364"
196,"spotify:track:5BUzZKefLvG4Kwq5vnWjJA","Mordecai, Katlego Vocals","Inhliziyo","Rapture Music Group",196,-1,1,"85147"
197,"spotify:track:3qhlB30KknSejmIvZZLjOD","Djo","End of Beginning","Djo",24,187,26,"84846"
198,"spotify:track:6lrKA1DMAihPI490Oj0twC","MaWhoo, Deep Sen, KingTalkzin, Mthunzi","Ngilimele (feat. Deep Sen, KingTalkzin, Mthunzi)","MaWhoo Entertainment",28,185,50,"84797"
199,"spotify:track:36Ns4pYKuaGE9tHxylgVGa","Kelvin Momo, Makhadzi, Mr Brown Ent","Mashaka (feat. Mr Brown Ent)","Kelvin Momo Productions",22,131,3,"84756"
200,"spotify:track:4oY24Bjq0KeTTpuw34DdP0","Makhadzi Entertainment, Babethe Gashoazen","Mapara (feat. Babethe Gashoazen)","Makhadzi Entertainment",91,-1,17,"84626"
