rank,uri,artist_names,track_name,source,peak_rank,previous_rank,weeks_on_chart,streams
1,"spotify:track:5eyL6waluu7hXrRrWewBFU","ANNA","30ºC","Universal Music Italia srL.",1,2,4,"5652131"
2,"spotify:track:2Q4Z2js0C6DDUVc7GuLGdF","Tony Effe, Gaia","SESSO E SAMBA (feat. Gaia)","Universal Music Italia srL.",1,1,5,"5406311"
3,"spotify:track:0GgIXlhkacCRh30t2Se92q","Fedez, Emis Killa","SEXY SHOP","Warner Music",3,4,4,"3256931"
4,"spotify:track:7kS2AVRk5Yj6BTj8PyJFfC","Ghali","Paprika","Warner Music",2,3,7,"3227923"
5,"spotify:track:0lXVWzLwDnKB7Ro5p0AJPg","Rose Villain, Guè","COME UN TUONO (feat. Guè)","Warner Music",1,5,16,"3016069"
6,"spotify:track:6XjDF6nds4DE2BBbagZol6","FloyyMenor, Cris Mj","Gata Only","FloyyMenor under exclusive license to UnitedMasters LLC",2,6,16,"2743446"
7,"spotify:track:0ZjxK3xSqyFEDKMMnA7fyl","Tony Effe","MIU MIU","Universal Music Italia srL.",1,10,15,"2537121"
8,"spotify:track:4z9xPVz2Sii4dhM7yhxOpj","Geolier, Sfera Ebbasta, Dardust","IO T’O GIUR’ (feat. Sfera Ebbasta)","Warner Music",7,8,3,"2446337"
9,"spotify:track:69VAE3LA7jn5rGAsdflMOS","Geolier, Poison Beatz","EL PIBE DE ORO","Warner Music",5,11,7,"2304614"
10,"spotify:track:5LDmD4cFF0C8BCf3tVvyBW","Tedua, Annalisa","Beatrice (feat. Annalisa)","Epic",1,7,5,"2293878"
11,"spotify:track:5oJVfPUHsD7A8bZtKVqgL2","Geolier, Ultimo, Takagi & Ketra","L'ULTIMA POESIA (feat. Ultimo)","Warner Music",2,13,14,"2167686"
12,"spotify:track:01XexSX2HDgVDxnnHEBblB","Olly, JVLI","Devastante","Epic",9,9,16,"2145409"
13,"spotify:track:0PnIaRhEUne93rWxeHgV70","ANNA, Lazza","BBE (feat. Lazza)","Universal Music Italia srL.",6,12,7,"2096805"
14,"spotify:track:1IkzT4wzFJRbFOmKOSqTen","Geolier, Takagi & Ketra, Dat Boi Dee","EPISODIO D'AMORE","Warner Music",14,21,3,"2046916"
15,"spotify:track:5GZupy8zByqFmXvpwZ4JOC","Tananai, Annalisa","STORIE BREVI","Universal Music Italia srL.",15,16,3,"1974553"
16,"spotify:track:3zp0YPZ5jA8XS9UPmA3O5j","AVA, Mida, VillaBanks","BACIO DI GIUDA (feat. Mida & VillaBanks)","Warner Music",15,15,2,"1969128"
17,"spotify:track:2mU3I4jfQp1K14JO2PmmQA","Tony Effe, Bresh, Tedua","DOPO LE 4 (feat. Bresh & Tedua)","Universal Music Italia srL.",1,14,15,"1900624"
18,"spotify:track:50okpBf3MvXr4FyWB6jJIK","Bresh","Torcida","Epic",12,17,7,"1878551"
19,"spotify:track:6s5DJ2zRf9T3A2VidCCHxZ","Geolier, Dat Boi Dee, Poison Beatz, Geenaro & Ghana Beats","SI STAT’ TU","Warner Music",15,20,3,"1766533"
20,"spotify:track:5bXgMzxuNymWhpwkgvYn4O","Lazza","100 MESSAGGI","Universal Music Italia srL.",1,18,18,"1640745"
21,"spotify:track:1i0oabK4KhsbIJr029XStL","Rhove, Capo Plaza","Alé (feat. Capo Plaza)","Universal Music Italia srL.",21,22,13,"1484170"
22,"spotify:track:6FtNSMSavhz0jPx0CzwG3q","Geolier, Poison Beatz","NU PARL, NU SENT, NU VEC","Warner Music",22,30,3,"1472334"
23,"spotify:track:7BeZyW4hVjeCocSLwDrCME","Geolier, Michelangelo","I P’ ME, TU P’ TE","Warner Music",1,25,21,"1463057"
24,"spotify:track:1A1xTBtNnJ09JNINiLjdOK","Ultimo","ALTROVE","Ultimo Records",19,34,7,"1453251"
25,"spotify:track:7Isi6whc5DD6A5wH5nqyUw","Mahmood","RA TA TA","Universal Music Italia srL.",25,26,2,"1445177"
26,"spotify:track:4ERO7nWPAAGo687R3gF4PZ","Geolier, Poison Beatz, Geenaro & Ghana Beats","EMIRATES","Warner Music",19,28,3,"1421180"
27,"spotify:track:1zp4TEQ9zaNGXTjY6fsz1p","Capo Plaza, ANNA","Soldi Arrotolati (feat. ANNA)","Warner Music",5,24,8,"1407060"
28,"spotify:track:5y7dpbKf0E3TW93k5w0JIs","Angelina Mango","melodrama","Latarma S.r.l.",19,19,5,"1373973"
29,"spotify:track:371l4ekF9cDC2D5WuuabU6","Mahmood","TUTA GOLD","Universal Music Italia srL.",1,23,21,"1344640"
30,"spotify:track:3twPYZvOOoVjLx5BclA2mT","Capo Plaza, Takagi & Ketra","Fino All'Alba","Warner Music",30,-1,1,"1338752"
31,"spotify:track:0kcXZMVoH1q923xLM9OKf6","Elodie","Black Nirvana","Universal Music Italia srL.",27,27,4,"1312782"
32,"spotify:track:41sQhmjhPRrMv8jFKzJTRV","Rhove, ANNA","Petit Fou Fou (feat. ANNA)","Universal Music Italia srL.",3,48,28,"1238607"
33,"spotify:track:1tIGa9fXqu3T3AikU5G8Ds","Geolier, Michelangelo","PER SEMPRE","Warner Music",26,36,3,"1233682"
34,"spotify:track:04fyqFKw0UeWRfFylNODYv","Geolier, Lazza, Finesse, Dat Boi Dee","IDEE CHIARE (feat. Lazza)","Warner Music",18,29,3,"1220898"
35,"spotify:track:5JEAwqy2UQebOWrE0Sc4Fs","Icy Subzero, CLARA","GHETTO LOVE (feat. CLARA)","Columbia",35,54,4,"1218330"
36,"spotify:track:0AxRJk8LTx7w4xQWw9NIFF","Tony Effe","ICON","Universal Music Italia srL.",21,41,15,"1205352"
37,"spotify:track:2qSkIjg1o9h3YT9RAgYN75","Sabrina Carpenter","Espresso","Island Records",35,35,10,"1191638"
38,"spotify:track:6prylI8YOrVcvR2CKrM9w7","Geolier, Dat Boi Dee","UNA COME TE","Warner Music",24,38,3,"1187281"
39,"spotify:track:1HCwbTHBvC4XCIC417NB5k","Rose Villain","CLICK BOOM!","Warner Music",7,32,21,"1183663"
40,"spotify:track:2GxrNKugF82CnoRFbQfzPf","Artemas","i like the way you kiss me","Artemas",13,39,14,"1148360"
41,"spotify:track:29nqe5lhK8JmNcVXum7UuA","Kid Yugi, Tedua, Junior K","Eva (feat. Tedua)","Universal Music Italia srL.",3,45,17,"1067917"
42,"spotify:track:58b9VLwnigGBDjvq89Eo1W","Artie 5ive","00","Warner Music",3,37,13,"1062161"
43,"spotify:track:1kKccj5wYXTj3gTpUIMoac","bnkr44, Pino D'Angiò","MA CHE IDEA (feat. Pino D'Angiò)","Universal Music Italia srL.",19,33,20,"1049254"
44,"spotify:track:6UKPNShrYDQE32SBkrjfTj","Le-one, VTR","ADDO STAJE - Ride it RMX","Le-One",18,44,14,"1048265"
45,"spotify:track:3xkHsmpQCBMytMJNiDf3Ii","Benson Boone","Beautiful Things","Night Street Records, Inc./Warner Records Inc.",19,46,22,"1038279"
46,"spotify:track:5ewubv7hwvNzi43bQ191Ix","Petit","MAMMAMÌ","Warner Music / 21co",46,49,7,"1034772"
47,"spotify:track:2Y3gIiYfcphPCPNYuQDMph","Icy Subzero","I CAN FLY","Columbia",10,40,14,"1002629"
48,"spotify:track:49tdZnvKAnJP6Xb3PUucPD","Coma_Cose","MALAVITA","Warner Music",48,62,6,"991639"
49,"spotify:track:6VpkhPUKnXxDsse0jnG64F","ANNA","VIENI DALLA BADDIE - interlude","Universal Music Italia srL.",21,55,10,"982341"
50,"spotify:track:362nbPmkrCtts9zhlLFfIR","Geolier, Shiva, MACE","UNA VITA FA (feat. Shiva)","Warner Music",20,42,3,"970583"
51,"spotify:track:2aptSWAkwTLva4188FFrjE","Alfa","vai!","Artist First",9,52,21,"969571"
52,"spotify:track:0cDq1fpfr9NNFNAKQXLLK7","Alessandra Amoroso, BigMama","Mezzo Rotto (feat. BigMama)","Epic",52,59,4,"923723"
53,"spotify:track:6bN41HjY008ggroMFxNLaa","Sfera Ebbasta, Geolier, Simba La Rue, Baby Gang","Calcolatrici","Universal Music Italia srL.",1,69,32,"916116"
54,"spotify:track:2MHGhfiCXvfeo3ZQ3RyG0B","Tony Effe, Emma, Takagi & Ketra","TAXI SULLA LUNA (feat. Emma & Takagi & Ketra)","Universal Music Italia srL.",5,65,55,"913100"
55,"spotify:track:5qR8me97mDHqvggt1G2eFn","Angelina Mango","Ci pensiamo domani","BMG Rights Management Italy S.R.L.",11,60,59,"887660"
56,"spotify:track:7frFMgNLiLH2udrlWLbbfA","Gazzelle","Mezzo secondo","Warner Music",30,31,5,"881942"
57,"spotify:track:4Y60H8heDsEpQ2hin2g6V5","Don Pero","Baby Mama","Pulp Entertainment",22,61,70,"869363"
58,"spotify:track:2K7bv4Q0FNNKPt4PPPCjOi","Tananai","VELENO","Universal Music Italia srL.",39,57,15,"855411"
59,"spotify:track:3EJSUFQGUaTm4Km2Zri1Zp","JVLI, Emma, Olly","HO VOGLIA DI TE","Universal Music Italia srL.",53,53,2,"848442"
60,"spotify:track:60QN1JrgYM7jcfW8pdQFqT","Annalisa","Sinceramente","Warner Music",3,43,21,"847674"
61,"spotify:track:0SxncNbbzm0Sq8SBy5N0Np","Geolier, Luchè, Dat Boi Dee","GIÀ LO SAI (feat. Luchè)","Warner Music",44,66,3,"840565"
62,"spotify:track:78jAJtOnoKtpHvXM8ByleE","Geolier, Kermit, Dat Boi Dee","PRESIDENTE","Warner Music",27,56,3,"838266"
63,"spotify:track:1F2rElyIiwgnq3TM2LN3ag","Emma","APNEA","Universal Music Italia srL.",13,63,21,"787203"
64,"spotify:track:4ySxBjhmdnkeFUqhKxW3cY","Sfera Ebbasta","Visiera A Becco","Universal Music Italia srL.",46,100,177,"782606"
65,"spotify:track:5omIW7YOPhA6CULhkdz6jE","Tedua, Baby Gang, Kid Yugi","Paradiso Artificiale (feat. Baby Gang & Kid Yugi)","Epic",2,70,56,"774307"
66,"spotify:track:629DixmZGHc7ILtEntuiWE","Billie Eilish","LUNCH","Darkroom/Interscope Records",36,47,6,"770451"
67,"spotify:track:6a9Z1jUms915w4O7N1PxjY","Rvssian, Rauw Alejandro, Ayra Starr","Santa","Sony Music Latin",57,68,9,"753014"
68,"spotify:track:6dOtVTDdiauQNBQEDOtlAB","Billie Eilish","BIRDS OF A FEATHER","Darkroom/Interscope Records",68,71,6,"746872"
69,"spotify:track:5wU2NUt1pSAeTIWfXnRRkQ","Tony Effe, Sfera Ebbasta, Geolier","PILLOLE (feat. Sfera Ebbasta & Geolier)","Universal Music Italia srL.",5,78,15,"746507"
70,"spotify:track:6PBr7VubD4T2TqqIj7FaWw","Geolier, Guè, Dat Boi Dee","357 (feat. Guè)","Warner Music",33,64,3,"743703"
71,"spotify:track:5EbuKgB6acYhza2WOztvXQ","Geolier, Yung Snapp, MV Killa, Lele Blade, Dat Boi Dee","CLS (feat. Yung Snapp, MV Killa, Lele Blade)","Warner Music",51,75,3,"741422"
72,"spotify:track:3Tk7eEuh7bMDIAdYfSG3tb","The Kolors","KARMA","Warner Music",72,80,5,"737802"
73,"spotify:track:6YB8rH5Lr340A4ps8eV7hw","Kid Yugi","Lilith","Universal Music Italia srL.",8,81,17,"732103"
74,"spotify:track:0MLu1cFYL4ikdRTdasCQT9","Shablo, Geolier, Sfera Ebbasta","M' Manc (con Geolier & Sfera Ebbasta)","Universal Music Italia srL.",1,112,173,"721239"
75,"spotify:track:1ItU1iY6Dbrlikq2WGzzLN","Baby Gang, BLANCO, Marracash","Adrenalina (feat. BLANCO, Marracash)","Warner Music",10,77,11,"720191"
76,"spotify:track:48lxT5qJF0yYyf2z4wB4xW","Jaxomy, Agatino Romero, Raffaella Carrà","Pedro","Columbia/B1 Recordings/Ultra Records",52,73,11,"712377"
77,"spotify:track:0eUgmndC1CN1eijY6EKSaE","VillaBanks","Papaya","Universal Music Italia srL.",2,74,43,"704282"
78,"spotify:track:6jkUMOIkL1N0vOcD9mr25r","Geolier, Poison Beatz, Yung Snapp","SCUMPAR","Warner Music",54,83,3,"701880"
79,"spotify:track:35BRwHz18c75LnbPq1IvTQ","BLANCO","DESNUDA","Universal Music Italia srL.",79,-1,1,"699398"
80,"spotify:track:4fFgeSZzTn58kUawHfW532","Tedua","Mare Calmo","Epic",4,50,5,"682724"
81,"spotify:track:30TvIcbkoDh6j7hhKjs4Jg","Capo Plaza, Tedua","Ancora Qua (feat. Tedua)","Warner Music",8,72,8,"682596"
82,"spotify:track:47lZfI1lqF7r2zeOkuo3VC","BM, Simba La Rue, FT Kings","Big Benz","Touch Paper Records",82,-1,1,"676017"
83,"spotify:track:5WssaPhjCCUFBMk9PpnHYj","Sfera Ebbasta, Elodie","Anche Stasera","Universal Music Italia srL.",5,94,32,"675112"
84,"spotify:track:2HYFX63wP3otVIvopRS99Z","Eminem","Houdini","Shady/Aftermath/Interscope Records",46,67,4,"671256"
85,"spotify:track:1K9qAxGT4cWUicf2OezSen","AVA, ANNA, Capo Plaza","VETRI NERI","Warner Music",1,91,58,"665788"
86,"spotify:track:4OqRBVQcEXwKCj5d7ztx6Z","Tedua","Kill Bill","Epic",10,51,5,"663943"
87,"spotify:track:7MMJa7cjMadOSR6CFWvB1x","Coez","La musica non c'è","Undamento",1,89,224,"663671"
88,"spotify:track:1MZhpRUEC5f0u5FTls4dPP","VMonster","FULL FULL","VMONSTER",88,116,3,"661908"
89,"spotify:track:05wb6MEyJeG2z1MVCIXxC8","Sfera Ebbasta, Marracash","15 Piani","Universal Music Italia srL.",1,124,32,"658962"
90,"spotify:track:2RVy5hchm7GxsGzXO6haOv","Irama","Galassie","Warner Music",50,79,6,"651233"
91,"spotify:track:2oQeSFEOYr7JEWhOx9uPHH","Tony Boy","Leanin'","Warner Music",38,82,10,"647860"
92,"spotify:track:5zNi9r8j00Fjte8a1z1om3","Geolier, Maria Becerra, Poison Beatz, Geenaro & Ghana Beats","BELLA E BRUTTA NOTIZIA (feat. Maria Becerra)","Warner Music",45,76,3,"635346"
93,"spotify:track:331l3xABO0HMr1Kkyh2LZq","David Guetta, OneRepublic","I Don't Wanna Wait","Parlophone UK",93,110,11,"627530"
94,"spotify:track:60NDVF7fFIq13aO9rIN80c","The Kolors","UN RAGAZZO UNA RAGAZZA","Warner Music",7,98,21,"622139"
95,"spotify:track:3VtGh8xE9qRsFyY2Uj1WG3","Tedua, Sfera Ebbasta","Hoe (feat. Sfera Ebbasta)","Epic",1,108,56,"615740"
96,"spotify:track:0W7yvrUlkhdFvKB4KMxqS7","SLF, Geolier, MV Killa, Yung Snapp, Lele Blade, Vale Lambo","SARÒ CON TE (feat. MV Killa, Yung Snapp, Lele Blade, Vale Lambo) - Original Soundtrack","Warner Music",46,105,8,"615119"
97,"spotify:track:5x9LonDyHxGUO2VzfHJHLE","Geolier","COME VUOI","Columbia",5,115,77,"613933"
98,"spotify:track:2di5hqDHPdUyjKtGyEmvl8","Ultimo","Vieni nel mio cuore","Ultimo Records",19,168,57,"609187"
99,"spotify:track:3Zp7TNmnDCdqGaQJfUh7hL","Emma","FEMME FATALE","Universal Music Italia srL.",99,99,7,"605056"
100,"spotify:track:20bTkdvyWZjO4ORHmzXQR4","Takagi & Ketra, Shiva, ANNA, Geolier","EVERYDAY (feat. Shiva, ANNA, Geolier)","Columbia",1,95,37,"604241"
101,"spotify:track:2ZKODik6QtY6IvCnbXLnWE","Geolier, Dat Boi Dee","DIO LO SA","Warner Music",47,97,3,"603772"
102,"spotify:track:3m2loz99NJ3z8UYEFcFdmS","Rocco Hunt","Musica Italiana","Epic",102,130,2,"602419"
103,"spotify:track:2SEAbXqFtdTwkzgAb5Ci80","Kid Yugi, Simba La Rue","Denaro (feat. Simba La Rue)","Universal Music Italia srL.",11,106,17,"602060"
104,"spotify:track:3Vr3zh0r7ALn8VLqCiRR10","Myles Smith","Stargazing","RCA Records Label",104,113,4,"600355"
105,"spotify:track:6KJ57PY7fIIRlaweLnNbXj","Elmatadormc7","Maliciosa (From the Netflix Rap Show “Nuova Scena”)","Netflix Music",31,102,17,"595776"
106,"spotify:track:25vEq7pqZdwS6cOXvJLrqU","Gigi D'Alessio, Geolier","Senza tuccà (feat. Geolier)","GGD EDIZIONI Srl",93,93,5,"591245"
107,"spotify:track:5Z0UnEtpLDQyYlWwgi8m9C","Hozier","Too Sweet","Rubyworks / Universal-Island Records Ltd",82,90,12,"590137"
108,"spotify:track:4cWrKV5SN7AknqPy4ryBDG","Ghali","Casa Mia","Warner Music",3,109,21,"588333"
109,"spotify:track:0uXDSAM6q44glALKnQQyqW","Rose Villain, Geolier","Fantasmi (feat. Geolier)","Columbia",24,123,75,"587430"
110,"spotify:track:6GMyR5UghG6k4MpsXsaim8","Boro, Artie 5ive, Andry The Hitmaker","Cadillac (feat. Artie 5ive)","Universal Music Italia srL.",1,107,40,"587395"
111,"spotify:track:3nuIiyDd0pDiD5tIqccFA5","Angelina Mango","la noia","Latarma S.r.l.",4,86,21,"579013"
112,"spotify:track:3J0cZ53BkzP4yhtOh0y02o","Baby Gang, Higashi, Sfera Ebbasta","Madame (feat. Sfera Ebbasta)","Warner Music",9,121,9,"578309"
113,"spotify:track:27sveRwlAkrG0lKGMKA4of","Mahmood, Geolier","PERSONALE","Universal Music Italia srL.",42,104,16,"567233"
114,"spotify:track:3tQRLmfOWBlB00i2mGLN3M","Zucchero, Salmo","Overdose D'Amore 2024","Universal Music Italia srL.",85,85,2,"562330"
115,"spotify:track:2qrCResILkL1JFeRBrv3qA","Alfa","bellissimissima <3","Artist First",4,127,59,"561755"
116,"spotify:track:3mMjLv3IyxlEKmXg3JxCI5","Pinguini Tattici Nucleari","Rubami la Notte","Columbia",5,118,58,"561478"
117,"spotify:track:0mHC3BK9vFGoEU0EcGPWRZ","Lazza","CENERE","Universal Music Italia srL.",1,128,73,"559480"
118,"spotify:track:6sLBJkMyZIkGevtpYgeotT","Ultimo","Piccola Stella","Honiro distribuito da Believe Distribution Services",15,184,136,"558066"
119,"spotify:track:62ZzWNju7R2pKvOuSNiR2i","Geolier, Poison Beatz","FINCHÈ NON SI MUORE","Warner Music",73,132,3,"557206"
120,"spotify:track:2yAjjqcHMy6qUI6NNzNoVD","Bellini","Samba do Brasil","Soundness Records",72,103,4,"556988"
121,"spotify:track:11HeOLoW2cnWZzGHWnllYq","Elmatadormc7","EL MATADOR (From the Netflix Rap Show “Nuova Scena”)","Netflix Music",14,92,17,"554823"
122,"spotify:track:2tTmW7RDtMQtBk7m2rYeSw","Bizarrap, Quevedo","Quevedo: Bzrp Music Sessions, Vol. 52","DALE PLAY Records",1,114,101,"553720"
123,"spotify:track:5b5cPscqVEMChvDqscVw26","Dua Lipa","Training Season","Warner Records",83,126,19,"549736"
124,"spotify:track:48I2h2HnPqS1CMSlz7bZ7E","Mida","ROSSOFUOCO","Dinero",7,111,33,"543880"
125,"spotify:track:31ePh9rOTkIERrloY8BUUc","Tony Boy","Respiro","Warner Music",36,88,4,"543696"
126,"spotify:track:3JXgSnBQCLWjnyx6XAF0R9","Shiva","First Day Out","Milano Ovest",18,58,6,"539234"
127,"spotify:track:53AWZCqbx6kIPsVgSNYn92","MACE, Tony Boy, Guè, Noyz Narcos","PRAISE THE LORD ☥ (con Guè, Noyz Narcos, Tony Boy)","Universal Music Italia srL.",18,129,12,"538158"
128,"spotify:track:0YI32qkEhhUjoGVMGXDm8b","Artie 5ive, ANNA","ANELLI E COLLANE (feat. ANNA)","Trenches Records Ent.",10,143,60,"531705"
129,"spotify:track:7kktKNHgINrBczPUGoG38p","Sfera Ebbasta","Bang Bang","Universal Music Italia srL.",62,147,102,"529666"
130,"spotify:track:5r9wBfbbK4JcZUEAGFg6su","Baby Gang, Higashi, Lazza, Tedua","Sola (feat. Lazza, Tedua)","Warner Music",8,120,9,"529484"
131,"spotify:track:1d4YCwCYfH8coMCIgvnCPl","Fred De Palma, Guè","NOTTE CATTIVA","Warner Music",88,122,3,"528425"
132,"spotify:track:2gGq8fqoGuKpCjuV7p2dd3","Massimo Pericolo, Emis Killa","Moneylove (feat. Emis Killa)","Epic",1,117,30,"526355"
133,"spotify:track:5N3hjp1WNayUPZrA8kJmJP","Sabrina Carpenter","Please Please Please","Island Records",101,101,3,"522602"
134,"spotify:track:74cyFjvgjyiFiQ3QxszFWq","Tananai","TANGO","Universal Music Italia srL.",3,131,73,"513037"
135,"spotify:track:1w91YxaRwTShkKe4apYf3r","Marracash, Guè","Insta Lova","Universal Music Italia srL.",1,139,64,"508775"
136,"spotify:track:1kZLATTXQa5BtEKH8GbW2U","Tedua","Red Light","Epic",8,141,56,"508134"
137,"spotify:track:37L7CN8VlbcLZIpWLG2QiU","Tananai","BABY GODDAMN","Universal Music Italia srL.",1,155,98,"506325"
138,"spotify:track:6AI3ezQ4o3HUoP6Dhudph3","Kendrick Lamar","Not Like Us","Kendrick Lamar, under exclusive license to Interscope Records",50,-1,7,"502702"
139,"spotify:track:6tP2AFUZkz4PuUfssawUBn","Drillionaire, Lazza, BLANCO, Sfera Ebbasta, Michelangelo","BON TON (feat. Lazza, Blanco, Sfera Ebbasta & Michelangelo)","Universal Music Italia srL.",2,161,53,"501333"
140,"spotify:track:5QJ2FsEt4kvkEbGW37L1VO","bnkr44","ESTATE 80","Universal Music Italia srL.",125,125,2,"501011"
141,"spotify:track:5eV8XfvbR9bsFqG1jvvNmw","Tedua, Izi, Disme, Bresh, Vaz Tè","Jolly Roger (feat. Izi, Disme, Bresh & Vaz Tè)","Epic",8,84,5,"496950"
142,"spotify:track:7Da5kjy5GByLHE5OPQ4tpg","Geolier, Marracash","IL MALE CHE MI FAI (feat. Marracash)","Columbia",1,189,64,"495342"
143,"spotify:track:2HIv4bKTCULRZ2eZIkVB3N","Tony Effe, Lazza, Capo Plaza","HONEY (feat. Lazza & Capo Plaza)","Universal Music Italia srL.",8,137,15,"487830"
144,"spotify:track:7yq4Qj7cqayVTp3FF9CWbm","Vance Joy","Riptide","F-Stop Records/Atlantic",97,134,22,"486421"
145,"spotify:track:6z1RlIjlUjvzlxgl7Dufp7","Ultimo","NEVE AL SOLE","Ultimo Records",61,188,5,"482400"
146,"spotify:track:6GLmGfALwjzCaOiHwgfU7g","Ultimo","Ti dedico il silenzio","Honiro",35,-1,96,"482163"
147,"spotify:track:1BJJbSX6muJVF2AK7uH1x4","Adam Port, Stryv, Keinemusik, Orso, Malachiii","Move","Keinemusik",147,179,2,"479755"
148,"spotify:track:0DGMnFK2SMUg3bWlxuhEAt","Geolier, Dat Boi Dee","6 MILIONI DI EURO FA (skit)","Warner Music",60,138,3,"479668"
149,"spotify:track:55JgCMrXnEr7efsSEaUjpd","Sarah Toscano","Sexy Magica","Warner Music",90,146,8,"479098"
150,"spotify:track:242NmD3BqOefyiOZQy2MT2","Sfera Ebbasta","VDLC","Universal Music Italia srL.",2,191,30,"478175"
151,"spotify:track:21Ay8mJRYQuOMZp7qyQXl6","Lùnapop","50 Special - Remastered 2019","Universal Music Italia srL.",151,174,10,"474626"
152,"spotify:track:20631sGIm2TRZ7LEVS1Wk5","Tedua, Tony Boy","Al Limite (feat. Tony Boy)","Epic",14,87,5,"469664"
153,"spotify:track:7nRFsITVaSHko2Fw2Gcy59","Gazzelle","Destri","Artist First / Maciste Dischi",2,162,196,"469274"
154,"spotify:track:3elLXGwE5zaREuOzWdlRJ2","Ludwig","Domani ci passa","Ludwig Official",59,153,84,"468974"
155,"spotify:track:17phhZDn6oGtzMe56NuWvj","Teddy Swims","Lose Control","Warner Records",78,142,21,"467366"
156,"spotify:track:1lITmb4ZIkR9bUMnbd0b6H","Niky Savage, Blssd","ZITELLA","Warner Music",135,135,4,"464749"
157,"spotify:track:6nxQV4fJgfvyfZRPPJm1mO","Fabri Fibra, Emma, Baby Gang","In Italia 2024 (feat. Emma & Baby Gang)","Epic",15,151,18,"463962"
158,"spotify:track:5LZVK19ieaV8Mk9FsqTL3F","Pinguini Tattici Nucleari","Ridere","RCA Records Label",31,181,220,"462834"
159,"spotify:track:2w5wtWq30yTkNSG9YjMFvW","Ultimo","Pianeti","Honiro",20,-1,150,"462206"
160,"spotify:track:0wTUTktrrCdXAzPVlodP72","Capo Plaza","Acqua Passata","Warner Music",12,145,16,"460482"
161,"spotify:track:6vsKOJPjdxlYgRs8McgtCQ","TWENTY SIX, Tayson Kryss","Buscando Money","FFRR",61,150,18,"459370"
162,"spotify:track:4midGjEpVz0mYkIdQMFX3l","Geolier, Lazza, Takagi & Ketra","CHIAGNE (feat. Lazza & Takagi & Ketra)","Columbia",1,-1,86,"459144"
163,"spotify:track:4yyCGGdTVaYG17vhsrUPoL","FloyyMenor, Lewis Somes","APAGA EL CEL","FloyyMenor under exclusive license to UnitedMasters LLC",122,148,4,"458581"
164,"spotify:track:3TE8sw3fWmWficRYKRKkqx","Papa V, Kuremino, Nerissima Serpe, Fritu","Mattone (feat. Kuremino, Nerissima Serpe)","Columbia",67,165,21,"447157"
165,"spotify:track:1xp1EsyBT4OAWWd8Gkhl60","SLF, MV Killa, Geolier, Tony Effe","CADILLAC (feat. MV Killa, Geolier, Tony Effe)","Columbia",66,-1,77,"445796"
166,"spotify:track:2cpZJsQFxwHvBF0KB5dCaB","Gazzelle","Tutto Qui","Warner Music",6,149,21,"445201"
167,"spotify:track:7iabz12vAuVQYyekFIWJxD","Central Cee, Lil Baby","BAND4BAND (feat. Lil Baby)","Columbia",76,136,5,"444957"
168,"spotify:track:05G7GqOjkYKObUWFDownVV","Ultimo","Quel filo che ci unisce","Ultimo Records",44,-1,5,"444764"
169,"spotify:track:4Bsfr9fyqjgThu4In7RkE7","Luciennn, Salmo","100% (feat. Salmo)","Epic",169,-1,1,"443661"
170,"spotify:track:5MpZphaE8ML2JJrtdPy6Pt","Zerb, Sofiya Nzau","Mwaki","TH3RD BRAIN",168,169,16,"443039"
171,"spotify:track:3UMayUk8vyZ76MAkKmxiYG","Alfa","vabbè ciao","Artist First",171,-1,1,"440017"
172,"spotify:track:1YsU8rW2u8z4F0pwOBQ4Ea","Coldplay","feelslikeimfallinginlove - Single Version","Parlophone UK",172,-1,1,"438459"
173,"spotify:track:4CQNELF3U3gyNcI6sLr6yK","Bresh, SHUNE","Guasto D'Amore","Epic",2,158,74,"437803"
174,"spotify:track:3cGuiySfwJPXqvE15OiEEg","Sfera Ebbasta","Tran Tran","Universal Music Italia srL.",1,-1,149,"436598"
175,"spotify:track:3tt9i3Hhzq84dPS8H7iSiJ","Manuel Turizo","La Bachata","Sony Music Latin/La Industria",59,160,68,"435592"
176,"spotify:track:5AJ9hqTS2wcFQCELCFRO7A","Tommy Richman","MILLION DOLLAR BABY","PULSE Records",83,152,7,"433233"
177,"spotify:track:1xUnvxp9DFrpwXnO0RHKUp","Guè, ANNA, Sfera Ebbasta","Cookies N' Cream (feat. ANNA & Sfera Ebbasta)","Universal Music Italia srL.",1,-1,61,"431512"
178,"spotify:track:2a1o6ZejUi8U3wzzOtCOYw","Don Omar, Lucenzo","Danza Kuduro","UMLE - Machete",157,157,5,"429046"
179,"spotify:track:3NLdcu14EPntcZIn3mxSR7","Kid Yugi, Night Skinny, Tony Boy","Sintetico (feat. Tony Boy)","Universal Music Italia srL.",76,164,36,"428529"
180,"spotify:track:5L1HQLXeih82ecmY0tOH7w","Boomdabash","Per Un Milione","Universal Music Italia srL.",1,187,87,"428295"
181,"spotify:track:7KTseTI8UdMT4WUIOmjTQC","TY1, Kid Yugi, Nerissima Serpe","MONOPOLIO (feat. Kid Yugi, Nerissima Serpe)","Thaurus",114,166,30,"427213"
182,"spotify:track:5YSR0sWUZk7NuIbkycxndu","Rkomi, Sfera Ebbasta, Junior K","NUOVO RANGE (con SFERA EBBASTA)","Universal Music Italia srL.",1,-1,150,"425374"
183,"spotify:track:6MQYhSIrh9vwztmM6mwkzQ","Kid Yugi, Night Skinny, Artie 5ive","Porto il Commerciale (feat. Artie 5ive)","Universal Music Italia srL.",93,185,15,"424752"
184,"spotify:track:7qMPbdeHrCNZL2FJf0ZzrS","Mida","QUE PASA","Dinero",101,167,8,"424371"
185,"spotify:track:4qx89c79cx9Q1DvClaLTOZ","Annalisa","Mon Amour","Warner Music",5,177,62,"423738"
186,"spotify:track:4Dvkj6JhhA12EX05fT7y2e","Harry Styles","As It Was","Columbia",3,-1,82,"423249"
187,"spotify:track:0lqGKcPzUX4RO4PYysoLes","Sfera Ebbasta, Lazza, Shiva","G63","Universal Music Italia srL.",3,-1,25,"422546"
188,"spotify:track:2A1uI5MjnW7C5L5lbsCJOz","Papa V, Nerissima Serpe, Fritu","Responsabile (feat. Nerissima Serpe)","Columbia",81,163,11,"422359"
189,"spotify:track:5OFVzqSeFxGpvDGyHvVeLj","Mr. Belt & Wezol","It's Not Right But It's Okay","Sony Music Entertainment",189,-1,1,"419922"
190,"spotify:track:4nS6mZBLYgtksYyXsuXgBw","Frah Quintale","Si, ah","Undamento",142,-1,17,"415643"
191,"spotify:track:2Zx64xP39WnpMlYgQa0ESv","Articolo 31, Fabri Fibra, Rocco Hunt","PEYOTE (feat. Fabri Fibra & Rocco Hunt)","Columbia",161,-1,4,"412662"
192,"spotify:track:6uN0PQk9GLI4ze5Vr9hOX3","Tony Effe, Simba La Rue","CARRARA (feat. Simba La Rue)","Universal Music Italia srL.",13,182,15,"408879"
193,"spotify:track:7eq3b71KXZCwbgOamt5q9M","Capo Plaza, Lazza","Money Rain (feat. Lazza)","Warner Music",2,159,8,"408304"
194,"spotify:track:2E32Pv8w20r6ZH4oFecxOf","Geolier, Sfera Ebbasta","X CASO (feat. Sfera Ebbasta)","Columbia",1,-1,74,"407944"
195,"spotify:track:3RgpMcg7uRz9b4Sbn1iXec","Il Pagante, VillaBanks","Spingere","EVentures",28,173,23,"407463"
196,"spotify:track:5dcyltc1ataieXIeTqhH3t","Frah Quintale, Giorgio Poi","Missili","Undamento",26,176,65,"407179"
197,"spotify:track:7L7QYf7S6wg6pseN2C0d6K","Frah Quintale","Gli occhi","Undamento",72,154,55,"405991"
198,"spotify:track:2hHC2jw8qiE4IAPDGjU4Fu","Finesse, Shiva, Sfera Ebbasta, Guè, Drillionaire","Gelosa (feat. Shiva, Sfera Ebbasta, Guè)","Epic",1,-1,69,"405940"
199,"spotify:track:4ICCU06b8FkQIrMv0XTzlv","Pinguini Tattici Nucleari","Giovani Wannabe","Columbia",3,198,99,"401317"
200,"spotify:track:7yS8LfvvFEhtGhKLk29j5a","Calcutta ","2minuti","Bomba Dischi - Puro Srl",8,-1,31,"400749"
