rank,uri,artist_names,track_name,source,peak_rank,previous_rank,weeks_on_chart,streams
1,"spotify:track:2DkiFEQ1ihXcYKaIRsfGFp","Marracash","LEI","Universal Music Italia srL.",1,1,3,"2568638"
2,"spotify:track:62OO2X47vPk5WxTx68HDqg","Artie 5ive, Niky Savage","BAMBOLA (feat. Niky Savage)","Warner Music",2,5,3,"2363137"
3,"spotify:track:41lOxc6ARYZPXpKeMWcHsD","Pinguini Tattici Nucleari","Islanda","Epic",1,9,7,"2056547"
4,"spotify:track:4X4R6qsIicxIQIFbnDcJLO","Olly, JVLI","Scarabocchi","Epic",4,8,10,"1906255"
5,"spotify:track:2L16IuIQgLL1HupWGN4F4t","Cesare Cremonini","Ora che non ho più te","Universal Music Italia srL.",1,10,15,"1837685"
6,"spotify:track:1QcmAp6Ev2HuYxKujUwnw0","Alfa","il filo rosso","Artist First",2,12,11,"1836377"
7,"spotify:track:5nFyfjGy6AMZqkW0OMUWJJ","Olly, Angelina Mango, JVLI","Per due come noi","Epic",1,14,17,"1818418"
8,"spotify:track:4MtjrbmBKdYRMTyEHqOUmM","Marracash","GLI SBANDATI HANNO PERSO","Universal Music Italia srL.",2,6,3,"1764403"
9,"spotify:track:2O8jjjtyEfXliQ6vdtdPvH","Papa V, Nerissima Serpe, Fritu","Tip Tap","UNIKAL",3,4,5,"1750689"
10,"spotify:track:00URgxWgyVoybGLhhmKr7g","Baby Gang, Omega, Higashi, Roberto Ferrante","Tu Me Quieres - Prod. by Higashi x Roberto Ferrante","Baby Gang / Planet Records [Powered by Planet Distribution]",10,17,16,"1609158"
11,"spotify:track:3yFgWoossjlaJ919XDCG4C","Simba La Rue, FT Kings, Sick Luke","MI PIACCIONO LE ARMI","Warner Music",1,18,11,"1452161"
12,"spotify:track:3XOcMFFT6Oo2ZCXLJ9lqdT","Geolier, Rose Villain, Poison Beatz","TU ED IO (feat. Rose Villain)","Warner Music",8,22,6,"1379422"
13,"spotify:track:2gI2IA7QGtzKZKuahon3W1","Achille Lauro","Amore Disperato","Warner Music",5,20,15,"1351843"
14,"spotify:track:4wJ5Qq0jBN4ajy7ouZIV1c","ROSÉ, Bruno Mars","APT.","Atlantic Records",14,33,11,"1343825"
15,"spotify:track:7sj9VfVtmcEZBDbRAsVXWY","ANNA, Niky Savage","TT LE GIRLZ (feat. Niky Savage)","Universal Music Italia srL.",1,29,27,"1334532"
16,"spotify:track:1ej2NcW0CHnscPp1RZpr1V","Olly, JVLI","Devastante","Epic",9,32,43,"1207455"
17,"spotify:track:6hBvXhUosokAqnc701pVE1","Marracash","È FINITA LA PACE","Universal Music Italia srL.",3,13,3,"1195778"
18,"spotify:track:1nLGeFQuY7PFxrou3ezEvP","Sal Da Vinci","Rossetto e caffè","Cose Production srl",10,39,25,"1172975"
19,"spotify:track:1GVDt0vn0wJ1QemPfMEWTU","Ghali","Niente Panico","Warner Music",16,35,12,"1146032"
20,"spotify:track:2plbrEY59IikOBgBGLjaoe","Lady Gaga, Bruno Mars","Die With A Smile","Interscope",20,40,20,"1109033"
21,"spotify:track:75Y6WgUldQN8mipAVLy8KJ","Olly, JVLI","Quei ricordi là","Epic",19,41,10,"1085030"
22,"spotify:track:6d9eOuVkzV4XJ8YIWM3Q1k","Tony Effe, Kid Yugi, Sick Luke","PEZZI DA 100 (feat. Kid Yugi)","Universal Music Italia srL.",22,38,4,"1079837"
23,"spotify:track:3OewdIjWctx4TH6jswXRrc","Pinguini Tattici Nucleari","Amaro","Epic",11,31,4,"1068577"
24,"spotify:track:19DHPlTC2gx1j4jrFzNbwL","ANNA","30ºC","Universal Music Italia srL.",1,52,31,"1061243"
25,"spotify:track:0wHW7nZlqZqbxnmTotTLGp","Marracash","POWER SLAP","Universal Music Italia srL.",1,16,3,"1040149"
26,"spotify:track:1IkzT4wzFJRbFOmKOSqTen","Geolier, Takagi & Ketra, Dat Boi Dee","EPISODIO D'AMORE","Warner Music",7,36,30,"1033261"
27,"spotify:track:6WatFBLVB0x077xWeoVc2k","KAROL G","Si Antes Te Hubiera Conocido","Bichota/Interscope Records",5,50,27,"1018877"
28,"spotify:track:4ZRVI6xwgbjgW5SgJB468n","ANNA, Artie 5ive","I LOVE IT (feat. Artie 5ive)","Universal Music Italia srL.",3,55,27,"1011801"
29,"spotify:track:5MJc4IVIt17xEt6angtZcq","Lazza","BUIO DAVANTI","Universal Music Italia srL.",8,42,15,"999840"
30,"spotify:track:0CCWIksRK4Q3um834dNG3a","Pinguini Tattici Nucleari","Romantico Ma Muori","Epic",7,51,16,"939707"
31,"spotify:track:7ne4VBA60CxGM75vw0EYad","Gracie Abrams","That’s So True","Gracie Abrams, under exclusive license to Interscope Records",31,76,8,"909306"
32,"spotify:track:0GFkLnsRGqtkd23dFWpoI0","Lele Blade, Geolier, Dele, Poison Beatz","HEETS (feat. Geolier)","Warner Music",5,43,10,"906605"
33,"spotify:track:13wkp4Ph4UNAVPwf9B04l8","Marracash","VITTIMA","Universal Music Italia srL.",6,23,3,"896085"
34,"spotify:track:2wpSLqGcN5KXVeAGdAnQd0","Ornella Vanoni, Jack Sani","Sant'allegria - Jack Sani Remix","NAR International",34,64,19,"868926"
35,"spotify:track:3zjwZqLebYTDvRS2RJH5Be","ANNA, Sillyelly","HELLO KITTY (feat. Sillyelly)","Universal Music Italia srL.",15,62,27,"867911"
36,"spotify:track:7BeZyW4hVjeCocSLwDrCME","Geolier, Michelangelo","I P’ ME, TU P’ TE","Warner Music",1,61,48,"856493"
37,"spotify:track:6OCnAtM8oa0JymErlTYXxG","Astro, ANNA","1 MOMENTO (feat. ANNA)","Warner Music",6,60,13,"846090"
38,"spotify:track:6MQYhSIrh9vwztmM6mwkzQ","Kid Yugi, Night Skinny, Artie 5ive","Porto il Commerciale (feat. Artie 5ive)","Universal Music Italia srL.",38,69,39,"819229"
39,"spotify:track:2z9FUHRkbkV4BObNzbHsFU","Damiano David","Born With a Broken Heart","Sony Music Italy / Arista Records",39,63,10,"814780"
40,"spotify:track:3o9OeBX0vgh51r15Ta7Dok","CoCo, Geolier, Startuffo, D-Ross","Video hot (feat. Geolier)","Warner Music",15,56,8,"809207"
41,"spotify:track:0U2mw5WWH5LmeqHl59uWUh","Simba La Rue, FT Kings","VRP","Warner Music",24,53,14,"793723"
42,"spotify:track:30yZdVYOfemHG7uuntz7HH","ANNA","TONIGHT","Universal Music Italia srL.",30,79,27,"752003"
43,"spotify:track:3bQBpGIlToMHfyKtKZwOyN","Marracash","DETOX / REHAB","Universal Music Italia srL.",7,30,3,"738352"
44,"spotify:track:1zp4TEQ9zaNGXTjY6fsz1p","Capo Plaza, ANNA","Soldi Arrotolati (feat. ANNA)","Warner Music",5,82,35,"731824"
45,"spotify:track:3EJSUFQGUaTm4Km2Zri1Zp","JVLI, Emma, Olly","HO VOGLIA DI TE","Universal Music Italia srL.",15,84,29,"721711"
46,"spotify:track:347HJzwbn0cmrxJUmAXj5c","Geolier, Dardust","MAI PER SEMPRE","Warner Music",9,75,7,"721309"
47,"spotify:track:3pR6j5Zhl7Qbrv4lh3DTG5","Tony Effe, Gaia","SESSO E SAMBA (feat. Gaia)","Universal Music Italia srL.",1,98,32,"716138"
48,"spotify:track:42wdz3j7gstgUuhoFLCXqd","FloyyMenor","PELIGROSA","FloyyMenor under exclusive license to UnitedMasters LLC",41,89,19,"710799"
49,"spotify:track:5HWWpSsNnlc2Kyh5QLrq1W","Tananai","RAGNI","Universal Music Italia srL.",16,92,17,"703963"
50,"spotify:track:0Op5iGBVLyY0G1lDDRfEnf","Marracash","CRASH","Universal Music Italia srL.",5,37,3,"689868"
51,"spotify:track:6dOtVTDdiauQNBQEDOtlAB","Billie Eilish","BIRDS OF A FEATHER","Darkroom/Interscope Records",41,110,33,"687722"
52,"spotify:track:4Y60H8heDsEpQ2hin2g6V5","Don Pero","Baby Mama","Pulp Entertainment",22,88,97,"676059"
53,"spotify:track:3Npk1eTTxSkRNYet4PW2yY","thasup, Mara Sattei","POSTO MIO","Thasup s.r.l.",27,77,3,"675282"
54,"spotify:track:1A1xTBtNnJ09JNINiLjdOK","Ultimo","ALTROVE","Ultimo Records",19,103,34,"671845"
55,"spotify:track:7dYgUWAIXFUniq5S2OkDZC","ANNA","WHY U MAD","Universal Music Italia srL.",55,101,6,"669176"
56,"spotify:track:79wDKThuLEgiQwJ0onVs3s","Tony Boy, Shiva","Perdono (feat. Shiva)","Warner Music",7,49,4,"668589"
57,"spotify:track:2ceJa7d62wQ3eRBK589ALG","Shiva, Kid Yugi","Gotham (feat. Kid Yugi)","Milano Ovest",2,87,17,"653832"
58,"spotify:track:0ngRr9jrwrd4bhltVSHTEb","Marracash","SOLI","Universal Music Italia srL.",9,44,3,"650396"
59,"spotify:track:5oJVfPUHsD7A8bZtKVqgL2","Geolier, Ultimo, Takagi & Ketra","L'ULTIMA POESIA (feat. Ultimo)","Warner Music",2,83,41,"640941"
60,"spotify:track:5JgTIfS7FfSE9tuebzX8HC","Night Skinny, Nerissima Serpe, Papa V","Tessera sanitaria (feat. Nerissima Serpe & Papa V)","Universal Music Italia srL.",7,85,12,"639994"
61,"spotify:track:5EPfp1edrw1vgxriqxLTlD","RRARI DAL TACCO","CAFFÈ AMARO","Universal Music Italia srL.",61,158,4,"635245"
62,"spotify:track:3WS0TcakSQfE0t1fFTQwDW","Marracash","PENTOTHAL","Universal Music Italia srL.",13,45,3,"629089"
63,"spotify:track:2fgOUiGsgelBOjH8ZTSJHs","Tony Boy, ANNA","Codeine (feat. ANNA)","Warner Music",34,105,4,"624176"
64,"spotify:track:4ySxBjhmdnkeFUqhKxW3cY","Sfera Ebbasta","Visiera A Becco","Universal Music Italia srL.",43,116,204,"619938"
65,"spotify:track:1tIGa9fXqu3T3AikU5G8Ds","Geolier, Michelangelo","PER SEMPRE","Warner Music",26,97,30,"608046"
66,"spotify:track:5omIW7YOPhA6CULhkdz6jE","Tedua, Baby Gang, Kid Yugi","Paradiso Artificiale (feat. Baby Gang & Kid Yugi)","Epic",2,91,83,"607237"
67,"spotify:track:5LDmD4cFF0C8BCf3tVvyBW","Tedua, Annalisa","Beatrice (feat. Annalisa)","Epic",1,96,32,"603797"
68,"spotify:track:0HiHVL8iC1Z1kAjV6vZdIo","Tony Boy, Frah Quintale, Capo Plaza","Non mi basta mai (feat. Frah Quintale, Capo Plaza)","Warner Music",13,81,4,"603488"
69,"spotify:track:2esZG2XFtuoWWA9AfDvSxy","FloyyMenor, Cris Mj","Gata Only","FloyyMenor under exclusive license to UnitedMasters LLC",2,125,43,"592164"
70,"spotify:track:1oBM9JTuD0wqfVQ8iuLjLQ","Artie 5ive, Ddusi, Sadturs, KIID","64 BARRE IN FACCIA (Red Bull 64 Bars)","Warner Music",45,78,17,"587664"
71,"spotify:track:0lXVWzLwDnKB7Ro5p0AJPg","Rose Villain, Guè","COME UN TUONO (feat. Guè)","Warner Music",1,130,43,"587499"
72,"spotify:track:0qeIFEGRQqHoaJtLCl0U73","Myke Towers, benny blanco","DEGENERE 👑 (feat. benny blanco)","WEA Latina",72,126,8,"583820"
73,"spotify:track:4I2SWtTgB08SICbqN6983B","ANNA, Lazza","BBE (feat. Lazza)","Universal Music Italia srL.",4,113,34,"583802"
74,"spotify:track:2wriIDkmJi8ouCfNi985KT","ANNA","UNA TIPA COME ME","Universal Music Italia srL.",64,127,27,"581846"
75,"spotify:track:5Tte5M4saQ25z2ZI83wgYU","Le-one, Christian Liguori, Babywyne","NUN È OVER","Epic",28,111,12,"580755"
76,"spotify:track:0mEyPi2ya8h8632gp9XmmQ","Night Skinny, Tony Boy, Kid Yugi, Capo Plaza","Entro nel posto (feat. Tony Boy, Kid Yugi & Capo Plaza)","Universal Music Italia srL.",1,109,12,"576103"
77,"spotify:track:4ObR0HIDnDfycaxGTALioH","Geolier, Dat Boi Dee","CHE SOLE OGGI","Warner Music",15,106,6,"575980"
78,"spotify:track:2l4NKSQbBA3sV0nxpNjSkj","Lazza","100 MESSAGGI","Universal Music Italia srL.",1,119,45,"574875"
79,"spotify:track:14siwDD1osf77j5kwQnlQ4","Marracash","FACTOTUM","Universal Music Italia srL.",16,54,3,"573130"
80,"spotify:track:6bN41HjY008ggroMFxNLaa","Sfera Ebbasta, Geolier, Simba La Rue, Baby Gang","Calcolatrici","Universal Music Italia srL.",1,117,59,"571930"
81,"spotify:track:05wb6MEyJeG2z1MVCIXxC8","Sfera Ebbasta, Marracash","15 Piani","Universal Music Italia srL.",1,107,59,"566443"
82,"spotify:track:69VAE3LA7jn5rGAsdflMOS","Geolier, Poison Beatz","EL PIBE DE ORO","Warner Music",5,134,34,"566193"
83,"spotify:track:5EeDZPNPIjEtEZsHMkX1m7","Kid Yugi","Donna","Universal Music Italia srL.",3,124,10,"566174"
84,"spotify:track:1yZIX0bRGjVH6CqyUW8Dkw","Tananai, Annalisa","STORIE BREVI","Universal Music Italia srL.",5,139,30,"561466"
85,"spotify:track:7KTseTI8UdMT4WUIOmjTQC","TY1, Kid Yugi, Nerissima Serpe","MONOPOLIO (feat. Kid Yugi, Nerissima Serpe)","Thaurus",85,131,48,"558050"
86,"spotify:track:0p4TRJB0KEBaeC5yBwLzNL","Shiva, Paky","Digos","Milano Ovest",47,47,2,"538998"
87,"spotify:track:7MMJa7cjMadOSR6CFWvB1x","Coez","La musica non c'è","Undamento",1,169,251,"537364"
88,"spotify:track:0xEgDBXYO9gGzmxCFWKxNg","Marracash","CRUDELIA - I nervi","Universal Music Italia srL.",2,132,259,"526333"
89,"spotify:track:2262bWmqomIaJXwCRHr13j","Gigi Perez","Sailor Song","Gigi Perez PS/ Island",84,140,12,"524010"
90,"spotify:track:3xkHsmpQCBMytMJNiDf3Ii","Benson Boone","Beautiful Things","Night Street Records, Inc./Warner Records Inc.",19,137,49,"522965"
91,"spotify:track:55aJJZPGLrIjI0nYYb7Bul","Lazza, Lil Baby","CANZONE D'ODIO (feat. Lil Baby)","Universal Music Italia srL.",1,141,15,"516868"
92,"spotify:track:1CGqE43Inhm54oPCMrgF7S","SETTEMBRE","VERTEBRE","Isola degli Artisti",66,112,6,"516059"
93,"spotify:track:1BJJbSX6muJVF2AK7uH1x4","Adam Port, Stryv, Keinemusik, Orso, Malachiii","Move","Keinemusik",18,176,29,"510199"
94,"spotify:track:1j7NJW5M4YLFbXFa8kFBaS","Marracash","MI SONO INNAMORATO DI UN AI","Universal Music Italia srL.",15,59,3,"504884"
95,"spotify:track:7nRFsITVaSHko2Fw2Gcy59","Gazzelle","Destri","Artist First / Maciste Dischi",2,150,223,"503167"
96,"spotify:track:62UEDjQEgBx7GDKDiSoz3i","Tananai","BOOSTER","Universal Music Italia srL.",96,164,8,"494554"
97,"spotify:track:1CJNj8Qnpoz6lyil9EgqfE","Astro, Simba La Rue","SPENDERE (feat. Simba La Rue)","Warner Music",10,135,13,"494030"
98,"spotify:track:29nqe5lhK8JmNcVXum7UuA","Kid Yugi, Tedua, Junior K","Eva (feat. Tedua)","Universal Music Italia srL.",3,157,44,"494012"
99,"spotify:track:1HCwbTHBvC4XCIC417NB5k","Rose Villain","CLICK BOOM!","Warner Music",7,163,48,"492270"
100,"spotify:track:7KI9vyPycMZ0Noh51ylQ9W","Night Skinny, Artie 5ive, Capo Plaza, Tony Effe","Nella trap (feat. Artie 5ive, Capo Plaza & Tony Effe)","Universal Music Italia srL.",6,151,12,"491926"
101,"spotify:track:0sZ7ORHX2NHuIQZjpX0Te4","Night Skinny, Tony Boy, anice, Geolier, Shiva","Solo Dio sa (feat. Tony Boy, anice, Geolier & Shiva)","Universal Music Italia srL.",5,143,12,"491847"
102,"spotify:track:2vrIP2Q50rshudyAuMmw5O","Night Skinny, Low-Red, Kid Yugi, Tony Boy, Papa V, Nerissima Serpe, Artie 5ive, Astro","Players Club '24 (feat. Low-Red, Tony Boy, Papa V, Nerissima Serpe, Artie 5ive, Kid Yugi, Astro)","Universal Music Italia srL.",46,46,2,"487818"
103,"spotify:track:3ppXueOTvYpYp7zQUbuIKh","Shiva, Tony Boy","Polvere (feat. Tony Boy)","Milano Ovest",9,146,17,"487448"
104,"spotify:track:3qtuOAI0YyfoBM1s7Tvm46","Cesare Cremonini","La Nuova Stella Di Broadway","Universal Music Italia srL.",68,186,84,"486789"
105,"spotify:track:6YB8rH5Lr340A4ps8eV7hw","Kid Yugi","Lilith","Universal Music Italia srL.",8,160,44,"483763"
106,"spotify:track:1Es7AUAhQvapIcoh3qMKDL","The Weeknd, Playboi Carti","Timeless (feat. Playboi Carti)","XO / Republic Records",50,170,14,"481747"
107,"spotify:track:7tI8dRuH2Yc6RuoTjxo4dU","Jimin","Who","BIGHIT MUSIC",92,165,23,"478302"
108,"spotify:track:7jfthjlyognNdV2geSbtsE","Capo Plaza","Borse Hermès","Warner Music",46,149,10,"477469"
109,"spotify:track:1jM7qLKYebmZhnjwl2MpTo","Papa V, Nerissima Serpe, Fritu","Apparecchiato (feat. Nerissima Serpe)","Columbia",96,144,22,"477219"
110,"spotify:track:1yKRalWLlHie0zbKW3n6W0","Alfa","vai!","Artist First",9,-1,38,"476457"
111,"spotify:track:1xiCaiy7CFnymZvf80ZKBk","Pinguini Tattici Nucleari","Burnout","Epic",31,128,4,"472391"
112,"spotify:track:49mN8ph1LK58r7TMYW1Srb","Fred De Palma, Rose Villain","MMH (feat. Rose Villain)","Warner Music",77,142,11,"472139"
113,"spotify:track:40L4vT3sk7YxFaWLItE3df","Marracash","HAPPY END","Universal Music Italia srL.",19,73,3,"468475"
114,"spotify:track:3bXpBkWuxmutEWvTqAIdaz","Coma_Cose","POSTI VUOTI","Warner Music",114,181,3,"467411"
115,"spotify:track:1K9qAxGT4cWUicf2OezSen","AVA, ANNA, Capo Plaza","VETRI NERI","Warner Music",1,174,85,"467349"
116,"spotify:track:0bYg9bo50gSsH3LtXe2SQn","Mariah Carey","All I Want for Christmas Is You","Columbia",2,2,47,"461665"
117,"spotify:track:5LZVK19ieaV8Mk9FsqTL3F","Pinguini Tattici Nucleari","Ridere","RCA Records Label",31,180,247,"461539"
118,"spotify:track:2D70Rxq21tVlTJwtugZ4CA","thasup, Mara Sattei","BLESS SU BLESS","Thasup s.r.l.",39,121,3,"460280"
119,"spotify:track:6s5DJ2zRf9T3A2VidCCHxZ","Geolier, Dat Boi Dee, Poison Beatz, Geenaro & Ghana Beats","SI STAT’ TU","Warner Music",15,153,30,"457982"
120,"spotify:track:1JSTJqkT5qHq8MDJnJbRE1","The Police","Every Breath You Take","Polydor Records",120,-1,6,"455087"
121,"spotify:track:4Pd8GRxfNPqKWi2NLtvQ03","Nabi","Calibro","Warner Music",95,147,5,"453431"
122,"spotify:track:7kktKNHgINrBczPUGoG38p","Sfera Ebbasta","Bang Bang","Universal Music Italia srL.",57,198,129,"452991"
123,"spotify:track:2xjxaKiYssIdDU6DCPpZPt","Dark Polo Gang","Cambiare Adesso","Universal Music Italia srL.",1,-1,66,"452015"
124,"spotify:track:50okpBf3MvXr4FyWB6jJIK","Bresh","Torcida","Epic",12,184,34,"448996"
125,"spotify:track:2fwe8oxvNUUvvEDAth54jN","Elodie, Tiziano Ferro","Feeling","Universal Music Italia srL.",23,193,8,"447502"
126,"spotify:track:3sVyYDKJ5vhzn6ryEcaGHt","Rhove, ANNA","Petit Fou Fou (feat. ANNA)","Universal Music Italia srL.",3,-1,46,"447076"
127,"spotify:track:3NLdcu14EPntcZIn3mxSR7","Kid Yugi, Night Skinny, Tony Boy","Sintetico (feat. Tony Boy)","Universal Music Italia srL.",76,175,63,"447035"
128,"spotify:track:7fH13hSOyNoeiDGbjEnTUC","Guè, Marracash","Brivido","Universal Music Italia srL.",73,200,250,"446807"
129,"spotify:track:0kcXZMVoH1q923xLM9OKf6","Elodie","Black Nirvana","Universal Music Italia srL.",10,-1,29,"446390"
130,"spotify:track:0WbMK4wrZ1wFSty9F7FCgu","Chappell Roan","Good Luck, Babe!","Chappell Roan PS/ Island",116,-1,18,"446331"
131,"spotify:track:5pYy054Wcuj9CFdDIxZSVU","Olly, JVLI","Menomale che c'è il mare","Epic",107,177,19,"445808"
132,"spotify:track:7kS2AVRk5Yj6BTj8PyJFfC","Ghali","Paprika","Warner Music",2,185,34,"444379"
133,"spotify:track:0YmbCvOH82KPkFVK3qBaAD","Mahmood","TUTA GOLD","Universal Music Italia srL.",1,-1,42,"441259"
134,"spotify:track:5BqUbKq9rCMrCkRtAiz8XA","Il Pagante","Settimana Bianca","Il Pagante",98,-1,49,"439745"
135,"spotify:track:0Okgqls9nKLzgnQGL9HGVL","Simba La Rue, FT Kings","40 GRADI","Warner Music",33,168,17,"439699"
136,"spotify:track:4elAiEgBssziHLfCrBoEA2","Cesare Cremonini, Luca Carboni","San Luca (feat. Luca Carboni)","Universal Music Italia srL.",54,148,5,"439001"
137,"spotify:track:07qo9gnLM488CUr0EtgIA1","Cesare Cremonini","Poetica","Universal Music Italia srL.",15,-1,55,"435115"
138,"spotify:track:3X5Zw8zkIGULZEnJUwwJwj","Glocky","Problem Solver","Square",138,-1,1,"434964"
139,"spotify:track:3qxiSQOe8EhQm7OckqKiUu","Tony Effe, Bresh, Tedua","DOPO LE 4 (feat. Bresh & Tedua)","Universal Music Italia srL.",1,161,42,"433725"
140,"spotify:track:3Fg8eOwcv5ctsjYYajBzFk","Capo Plaza, Shiva","Nuovo Inizio (feat. Shiva)","Warner Music",13,159,7,"431100"
141,"spotify:track:2FRnf9qhLbvw8fu4IBXx78","Wham!","Last Christmas","Epic",3,3,42,"430926"
142,"spotify:track:60QN1JrgYM7jcfW8pdQFqT","Annalisa","Sinceramente","Warner Music",3,-1,40,"428316"
143,"spotify:track:2HRqTpkrJO5ggZyyK6NPWz","Sabrina Carpenter","Espresso","Island Records",30,-1,35,"424942"
144,"spotify:track:74cyFjvgjyiFiQ3QxszFWq","Tananai","TANGO","Universal Music Italia srL.",3,-1,97,"423769"
145,"spotify:track:5nqOdSrqurNq8ejE7Ujc9l","Kid Yugi","Il Filmografo","Universal Music Italia srL.",97,179,31,"422498"
146,"spotify:track:0Sr7ssScx54yxdM2ols7nW","Omar Courtz, De La Rose","Q U E V A S H A C E R H O Y ?","Mr. 305 Records / Rimas Entertainment",94,171,12,"422252"
147,"spotify:track:3cGuiySfwJPXqvE15OiEEg","Sfera Ebbasta","Tran Tran","Universal Music Italia srL.",1,-1,165,"418075"
148,"spotify:track:0liQcHfCU5zKeSEdIYfGIP","Holden, mew","GRANDINE (feat. mew)","Latarma S.r.l.",40,197,8,"417616"
149,"spotify:track:05mlLQhbyQ9CCdtIt4jHVS","Enrico Nigiotti","Tu sei per me","Columbia",128,196,4,"416834"
150,"spotify:track:0bKDQionn4VKcgNKbs4SWX","Pinguini Tattici Nucleari","Pastello Bianco","RCA Records Label",2,-1,138,"412758"
151,"spotify:track:3sdvDRHwSpuKUehwVYxHcG","Shiva","Take 5","Milano Ovest",3,162,19,"410453"
152,"spotify:track:0rDIjhe1IQJhh3oPDxZJMg","Pinguini Tattici Nucleari","Your Dog","Epic",41,145,4,"410339"
153,"spotify:track:1JqrH0LVgFCXzxnmLcJ2WV","Marracash","TROI*","Universal Music Italia srL.",18,86,3,"405535"
154,"spotify:track:4z9xPVz2Sii4dhM7yhxOpj","Geolier, Sfera Ebbasta, Dardust","IO T’O GIUR’ (feat. Sfera Ebbasta)","Warner Music",7,-1,29,"405047"
155,"spotify:track:1XpmMe95dk9jh3zuOMpeU2","Capo Plaza","Capri Sun","Atlantic/WM Italy",2,183,111,"404842"
156,"spotify:track:5zVQoMHyELfcHYviXDao3I","Artie 5ive, Guè","MILANO TESTAROSSA (feat. Guè)","Warner Music",23,-1,22,"404678"
157,"spotify:track:7Isi6whc5DD6A5wH5nqyUw","Mahmood","RA TA TA","Universal Music Italia srL.",11,-1,28,"404622"
158,"spotify:track:76VxwttPNesap8xfdDn8tG","Glocky, Faneto","MOLLY ROSA","Square / Trenches Records Ent",158,-1,3,"404553"
159,"spotify:track:0gkV0FyCdrJqwyrFW7NsEQ","883","Come mai","WM Italy",83,-1,9,"403562"
160,"spotify:track:2tTmW7RDtMQtBk7m2rYeSw","Bizarrap, Quevedo","Quevedo: Bzrp Music Sessions, Vol. 52","DALE PLAY Records",1,-1,121,"401684"
161,"spotify:track:0YI32qkEhhUjoGVMGXDm8b","Artie 5ive, ANNA","ANELLI E COLLANE (feat. ANNA)","Trenches Records Ent.",10,-1,86,"397082"
162,"spotify:track:2UdBmBTG6AEG5UJrm5QBAc","Shiva","Giovane re","Milano Ovest",68,68,2,"396383"
163,"spotify:track:0cDq1fpfr9NNFNAKQXLLK7","Alessandra Amoroso, BigMama","Mezzo Rotto (feat. BigMama)","Epic",14,-1,30,"394756"
164,"spotify:track:5WssaPhjCCUFBMk9PpnHYj","Sfera Ebbasta, Elodie","Anche Stasera","Universal Music Italia srL.",5,-1,58,"394199"
165,"spotify:track:7115pIZRP1L0MaJCPFPPFM","Tony Boy","Come mi guardi","Gorilla Records",102,189,16,"393944"
166,"spotify:track:1LcAwUvsiWJqTgV9vDs0oq","Kid Yugi, Sfera Ebbasta, Shablo","Ex Angelo (feat. Sfera Ebbasta)","Universal Music Italia srL.",10,-1,40,"393915"
167,"spotify:track:6T0QOCB2vNIBHlw5OZiyah","Tony Boy","Il tempo cura","Warner Music",10,-1,16,"391626"
168,"spotify:track:20bTkdvyWZjO4ORHmzXQR4","Takagi & Ketra, Shiva, ANNA, Geolier","EVERYDAY (feat. Shiva, ANNA, Geolier)","Columbia",1,-1,59,"391401"
169,"spotify:track:3ivYdb6E97oNyy3v3atWGW","Shiva","Ride or Die","Milano Ovest",74,74,2,"391267"
170,"spotify:track:5Gup6xk94HJp2bYANhJsoS","Geolier, Yung Snapp, Murad","500K","Warner Music",18,188,6,"383221"
171,"spotify:track:3KqIOF2HTFEwz0HmErwOYG","Lazza, Sfera Ebbasta","FENTANYL (feat. Sfera Ebbasta)","Universal Music Italia srL.",1,-1,14,"381896"
172,"spotify:track:2SEAbXqFtdTwkzgAb5Ci80","Kid Yugi, Simba La Rue","Denaro (feat. Simba La Rue)","Universal Music Italia srL.",11,-1,41,"380797"
173,"spotify:track:4NvS5pdDVE3O387xaAeoaI","Pinguini Tattici Nucleari","Nevica","Epic",47,190,4,"377237"
174,"spotify:track:1N7cE9RdKR5FRkB9cxsjH4","Low-Red, Yung Snapp","BISEX (feat. Yung Snapp)","Universal Music Italia srL.",174,-1,1,"373364"
175,"spotify:track:2toyDDWentmjZTyojLVXfP","Olly, JVLI","I cantieri del Giappone","Epic",76,-1,4,"373255"
176,"spotify:track:3Vr3zh0r7ALn8VLqCiRR10","Myles Smith","Stargazing","RCA Records Label",51,-1,28,"373184"
177,"spotify:track:1KZKtIn6ul3F68mY4YY0cg","CLARA","NERO GOTICO","Warner Music",177,-1,4,"371029"
178,"spotify:track:5eSC7faDYHxnklPjcxZjD6","Marracash","BRAVI A CADERE - I polmoni","Universal Music Italia srL.",8,-1,90,"370764"
179,"spotify:track:2EBlqIr8yZLUqTiWtB9Tgo","Tony Boy","Stanza","Warner Music",23,187,4,"369301"
180,"spotify:track:0MLu1cFYL4ikdRTdasCQT9","Shablo, Geolier, Sfera Ebbasta","M' Manc (con Geolier & Sfera Ebbasta)","Universal Music Italia srL.",1,-1,192,"367016"
181,"spotify:track:0Sp6AOrAlVmKRIzmQGjLS8","Gheba, Pave","Boxer","RBE SELF MADE",181,-1,1,"366938"
182,"spotify:track:3w73qvCSGWPCx7w1UMIh6e","Capo Plaza","Lo So Che","Warner Music",34,-1,6,"366861"
183,"spotify:track:6wCmW3Bv3A2zT9pjnvuATf","thasup, Mara Sattei","SO CHE CI SEI","Thasup s.r.l.",50,167,3,"365326"
184,"spotify:track:0mHC3BK9vFGoEU0EcGPWRZ","Lazza","CENERE","Universal Music Italia srL.",1,-1,89,"365135"
185,"spotify:track:1odrZy5kTuj3SGdfgzhMzq","Night Skinny, Luchè","Scale (con Luchè)","Universal Music Italia srL.",28,-1,32,"362026"
186,"spotify:track:2z8mWFWbz1dyBqbLWbmPWi","Kid Yugi, Night Skinny","Massafghanistan","Universal Music Italia srL.",118,-1,12,"360644"
187,"spotify:track:48I2h2HnPqS1CMSlz7bZ7E","Mida","ROSSOFUOCO","Dinero",7,-1,44,"360175"
188,"spotify:track:1VhrzhdZxQybGPmGXZeVwI","Tony Boy, Kid Yugi","Nn so se (feat. Kid Yugi)","Warner Music",17,173,4,"359595"
189,"spotify:track:0W61zMLHl8SKOXpwEnenRP","Frezza","Vecchio stampo & West Coast","Warner Music",33,-1,19,"358905"
190,"spotify:track:3hRV0jL3vUpRrcy398teAU","Lord Huron","The Night We Met","Play It Again Sam",85,-1,46,"358256"
191,"spotify:track:7uu3YZytpYW15VIfa7ynJk","Marracash, Federica Abbate","Niente Canzoni D'Amore - Inedito","Universal Music Italia srL.",137,-1,22,"357439"
192,"spotify:track:21Ay8mJRYQuOMZp7qyQXl6","Lùnapop","50 Special - Remastered 2019","Universal Music Italia srL.",151,-1,13,"357139"
193,"spotify:track:1w91YxaRwTShkKe4apYf3r","Marracash, Guè","Insta Lova","Universal Music Italia srL.",1,-1,86,"356006"
194,"spotify:track:58b9VLwnigGBDjvq89Eo1W","Artie 5ive","00","Warner Music",3,-1,32,"354531"
195,"spotify:track:2YdOZTN2ElEYhEuq6zmwT8","Gazzelle","Non sei tu","Maciste Dischi",141,-1,42,"353335"
196,"spotify:track:3mMjLv3IyxlEKmXg3JxCI5","Pinguini Tattici Nucleari","Rubami la Notte","Columbia",5,-1,82,"351558"
197,"spotify:track:3TI7sMXWt5lu89VGCa7q1k","ANNA, Tony Boy, thasup","ABC (feat. Tony Boy & thasup)","Universal Music Italia srL.",9,-1,25,"350844"
198,"spotify:track:3PYYiqmhooCNCGiiPTM5zS","Elisa, Calcutta ","Se Piovesse Il Tuo Nome - con Calcutta","Universal Music Italia srL.",60,-1,31,"349847"
199,"spotify:track:22skzmqfdWrjJylampe0kt","Macklemore, Ryan Lewis, Macklemore & Ryan Lewis, Ray Dalton","Can't Hold Us (feat. Ray Dalton)","Macklemore",116,-1,90,"349228"
200,"spotify:track:34YxYcGtsAzI1K0SNAWMn1","Yung Snapp, Geolier","Kiss You (F**k You) [feat. Geolier]","Warner Music",20,-1,48,"348747"
