rank,uri,artist_names,track_name,source,peak_rank,previous_rank,weeks_on_chart,streams
1,"spotify:track:0lXVWzLwDnKB7Ro5p0AJPg","Rose Villain, Guè","COME UN TUONO (feat. Guè)","Warner Music",1,1,10,"3654951"
2,"spotify:track:5bXgMzxuNymWhpwkgvYn4O","Lazza","100 MESSAGGI","Universal Music Italia srL.",1,3,12,"3334448"
3,"spotify:track:6XjDF6nds4DE2BBbagZol6","FloyyMenor, Cris Mj","Gata Only","FloyyMenor under exclusive license to UnitedMasters LLC",3,6,10,"3140367"
4,"spotify:track:0ZjxK3xSqyFEDKMMnA7fyl","Tony Effe","MIU MIU","Universal Music Italia srL.",1,4,9,"3058323"
5,"spotify:track:0vjcqQVb6nhk1A4lvW6ytN","Geolier, Ultimo, Takagi & Ketra","L'ULTIMA POESIA (feat. Ultimo)","Warner Music",2,7,8,"2968266"
6,"spotify:track:0PnIaRhEUne93rWxeHgV70","ANNA, Lazza","BBE (feat. Lazza)","Universal Music Italia srL.",6,-1,1,"2746129"
7,"spotify:track:2mU3I4jfQp1K14JO2PmmQA","Tony Effe, Bresh, Tedua","DOPO LE 4 (feat. Bresh & Tedua)","Universal Music Italia srL.",1,9,9,"2718997"
8,"spotify:track:1zp4TEQ9zaNGXTjY6fsz1p","Capo Plaza, ANNA","Soldi Arrotolati (feat. ANNA)","Warner Music",5,5,2,"2685546"
9,"spotify:track:2bkz0YDgPTNOto5OhskjbS","Geolier, Poison Beatz","EL PIBE DE ORO","Warner Music",9,-1,1,"2539504"
10,"spotify:track:30TvIcbkoDh6j7hhKjs4Jg","Capo Plaza, Tedua","Ancora Qua (feat. Tedua)","Warner Music",8,8,2,"2416377"
11,"spotify:track:01XexSX2HDgVDxnnHEBblB","Olly, JVLI","Devastante","Epic",11,18,10,"2330587"
12,"spotify:track:7eq3b71KXZCwbgOamt5q9M","Capo Plaza, Lazza","Money Rain (feat. Lazza)","Warner Music",2,2,2,"2183183"
13,"spotify:track:7kS2AVRk5Yj6BTj8PyJFfC","Ghali","Paprika","Warner Music",13,-1,1,"2174106"
14,"spotify:track:3j1453KrdHjw7y4gnBj7nF","Geolier, Michelangelo","I P’ ME, TU P’ TE","Warner Music",1,16,15,"2057556"
15,"spotify:track:371l4ekF9cDC2D5WuuabU6","Mahmood","TUTA GOLD","Universal Music Italia srL.",1,17,15,"1909528"
16,"spotify:track:58b9VLwnigGBDjvq89Eo1W","Artie 5ive","00","Warner Music",3,13,7,"1904179"
17,"spotify:track:50okpBf3MvXr4FyWB6jJIK","Bresh","Torcida","Epic",17,-1,1,"1839764"
18,"spotify:track:49R1F3rIdSzuPk7AcHi6d1","Angelina Mango","la noia","Latarma S.r.l.",4,35,15,"1818133"
19,"spotify:track:5r9wBfbbK4JcZUEAGFg6su","Baby Gang, Higashi, Lazza, Tedua","Sola (feat. Lazza, Tedua)","Warner Music",8,14,3,"1755877"
20,"spotify:track:1HCwbTHBvC4XCIC417NB5k","Rose Villain","CLICK BOOM!","Warner Music",7,22,15,"1652819"
21,"spotify:track:6VpkhPUKnXxDsse0jnG64F","ANNA","VIENI DALLA BADDIE - interlude","Universal Music Italia srL.",21,36,4,"1568084"
22,"spotify:track:60QN1JrgYM7jcfW8pdQFqT","Annalisa","Sinceramente","Warner Music",3,27,15,"1534250"
23,"spotify:track:2Y3gIiYfcphPCPNYuQDMph","Icy Subzero","I CAN FLY","Columbia",10,25,8,"1522902"
24,"spotify:track:5mTuGUq93D6eAOeJApPi8J","Ultimo","ALTROVE","Ultimo Records",24,-1,1,"1504470"
25,"spotify:track:2GxrNKugF82CnoRFbQfzPf","Artemas","i like the way you kiss me","Artemas",13,29,8,"1481856"
26,"spotify:track:1ItU1iY6Dbrlikq2WGzzLN","Baby Gang, BLANCO, Marracash","Adrenalina (feat. BLANCO, Marracash)","Warner Music",10,31,5,"1472617"
27,"spotify:track:29nqe5lhK8JmNcVXum7UuA","Kid Yugi, Tedua, Junior K","Eva (feat. Tedua)","Universal Music Italia srL.",3,28,11,"1421633"
28,"spotify:track:6UKPNShrYDQE32SBkrjfTj","Le-one, VTR","ADDO STAJE - Ride it RMX","Le-One",18,34,8,"1402246"
29,"spotify:track:0wTUTktrrCdXAzPVlodP72","Capo Plaza","Acqua Passata","Warner Music",12,12,10,"1395388"
30,"spotify:track:0AxRJk8LTx7w4xQWw9NIFF","Tony Effe","ICON","Universal Music Italia srL.",21,40,9,"1371008"
31,"spotify:track:3J0cZ53BkzP4yhtOh0y02o","Baby Gang, Higashi, Sfera Ebbasta","Madame (feat. Sfera Ebbasta)","Warner Music",9,24,3,"1362902"
32,"spotify:track:2oDlAuhJExJd7papr3cyBF","Capo Plaza","Sottovuoto","Warner Music",10,10,2,"1353446"
33,"spotify:track:11HeOLoW2cnWZzGHWnllYq","Elmatadormc7","EL MATADOR (From the Netflix Rap Show “Nuova Scena”)","Netflix Music",14,32,11,"1327857"
34,"spotify:track:1kKccj5wYXTj3gTpUIMoac","bnkr44, Pino D'Angiò","MA CHE IDEA (feat. Pino D'Angiò)","Universal Music Italia srL.",19,39,14,"1253497"
35,"spotify:track:1i0oabK4KhsbIJr029XStL","Rhove, Capo Plaza","Alé (feat. Capo Plaza)","Universal Music Italia srL.",35,45,7,"1246698"
36,"spotify:track:2Io79aod9PA58xWjpPrHUr","Capo Plaza","Ferite","Warner Music",11,11,2,"1237530"
37,"spotify:track:3xkHsmpQCBMytMJNiDf3Ii","Benson Boone","Beautiful Things","Night Street Records, Inc./Warner Records Inc.",19,42,16,"1213007"
38,"spotify:track:2aptSWAkwTLva4188FFrjE","Alfa","vai!","Artist First",9,38,15,"1203308"
39,"spotify:track:4cWrKV5SN7AknqPy4ryBDG","Ghali","Casa Mia","Warner Music",3,43,15,"1195893"
40,"spotify:track:2K7bv4Q0FNNKPt4PPPCjOi","Tananai","VELENO","Universal Music Italia srL.",40,54,9,"1165045"
41,"spotify:track:1F2rElyIiwgnq3TM2LN3ag","Emma","APNEA","Universal Music Italia srL.",13,37,15,"1109516"
42,"spotify:track:5WssaPhjCCUFBMk9PpnHYj","Sfera Ebbasta, Elodie","Anche Stasera","Universal Music Italia srL.",5,46,26,"1100603"
43,"spotify:track:21NYfIzdx54csIcKIYHKaW","LIBERATO","LUCIA (STAY WITH ME)","LIBERATO",43,-1,1,"1100165"
44,"spotify:track:41sQhmjhPRrMv8jFKzJTRV","Rhove, ANNA","Petit Fou Fou (feat. ANNA)","Universal Music Italia srL.",3,51,22,"1052239"
45,"spotify:track:52vA7mR6kKFJTaMzRUKMmk","Capo Plaza, Tony Boy","I Miss U (feat. Tony Boy)","Warner Music",15,15,2,"1049226"
46,"spotify:track:4Q46G91LXPGAdUt5kc1QEQ","Don Joe, Guè, Annalisa, Ernia","Istinto Animale (feat. Guè, Annalisa, Ernia)","Warner Music",46,-1,1,"1021381"
47,"spotify:track:5wU2NUt1pSAeTIWfXnRRkQ","Tony Effe, Sfera Ebbasta, Geolier","PILLOLE (feat. Sfera Ebbasta & Geolier)","Universal Music Italia srL.",5,50,9,"1000286"
48,"spotify:track:6YB8rH5Lr340A4ps8eV7hw","Kid Yugi","Lilith","Universal Music Italia srL.",8,49,11,"974809"
49,"spotify:track:6bN41HjY008ggroMFxNLaa","Sfera Ebbasta, Geolier, Simba La Rue, Baby Gang","Calcolatrici","Universal Music Italia srL.",1,52,26,"955870"
50,"spotify:track:6AI3ezQ4o3HUoP6Dhudph3","Kendrick Lamar","Not Like Us","Kendrick Lamar, under exclusive license to Interscope Records",50,118,2,"947329"
51,"spotify:track:2HIv4bKTCULRZ2eZIkVB3N","Tony Effe, Lazza, Capo Plaza","HONEY (feat. Lazza & Capo Plaza)","Universal Music Italia srL.",8,48,9,"945589"
52,"spotify:track:4Y60H8heDsEpQ2hin2g6V5","Don Pero","Baby Mama","Pulp Entertainment",22,62,64,"904304"
53,"spotify:track:5dx4QY85j4zjMNHreobVsS","Capo Plaza, Annalisa","Memories (feat. Annalisa)","Warner Music",21,21,2,"904245"
54,"spotify:track:2cpZJsQFxwHvBF0KB5dCaB","Gazzelle","Tutto Qui","Warner Music",6,53,15,"901285"
55,"spotify:track:0W7yvrUlkhdFvKB4KMxqS7","SLF, Geolier, MV Killa, Yung Snapp, Lele Blade, Vale Lambo","SARÒ CON TE (feat. MV Killa, Yung Snapp, Lele Blade, Vale Lambo) - Original Soundtrack","Warner Music",55,65,2,"899306"
56,"spotify:track:5RNZaMaGSxrTkNVsMUqPOk","Capo Plaza, Artie 5ive","La Ca$$a (feat. Artie 5ive)","Warner Music",23,23,2,"886606"
57,"spotify:track:5qR8me97mDHqvggt1G2eFn","Angelina Mango","Ci pensiamo domani","BMG Rights Management Italy S.R.L.",11,68,53,"882122"
58,"spotify:track:20bTkdvyWZjO4ORHmzXQR4","Takagi & Ketra, Shiva, ANNA, Geolier","EVERYDAY (feat. Shiva, ANNA, Geolier)","Columbia",1,60,31,"879699"
59,"spotify:track:5omIW7YOPhA6CULhkdz6jE","Tedua, Baby Gang, Kid Yugi","Paradiso Artificiale (feat. Baby Gang & Kid Yugi)","Epic",2,59,50,"873324"
60,"spotify:track:5bi0gh89wRuH2OgjdAKFsb","Rvssian, Rauw Alejandro, Ayra Starr","Santa","Sony Music Latin",60,75,3,"864867"
61,"spotify:track:2qSkIjg1o9h3YT9RAgYN75","Sabrina Carpenter","Espresso","Island Records",61,76,4,"862409"
62,"spotify:track:6KJ57PY7fIIRlaweLnNbXj","Elmatadormc7","Maliciosa (From the Netflix Rap Show “Nuova Scena”)","Netflix Music",31,55,11,"842071"
63,"spotify:track:0QEI2IrwYKZNppR1W62jXj","Capo Plaza","Oh Amore","Warner Music",19,19,2,"841312"
64,"spotify:track:1EjIXKhNHI00ZLMRpS8iz8","Nemo","The Code","Better Now Records",64,-1,1,"836666"
65,"spotify:track:48lxT5qJF0yYyf2z4wB4xW","Jaxomy, Agatino Romero, Raffaella Carrà","Pedro","Columbia/B1 Recordings/Ultra Records",52,73,5,"826138"
66,"spotify:track:35JHeT2zURSbrhwZW4cPry","Capo Plaza","Baby Girl","Warner Music",20,20,2,"826079"
67,"spotify:track:5B5p5w9QV0QFBsnASmtL24","Mida","ROSSOFUOCO","Dinero",7,64,27,"814746"
68,"spotify:track:5mQTzYTDDob48mOP3U9k7Q","Irama","Tu No","Warner Music",5,61,15,"808121"
69,"spotify:track:1lKCEBF9dBDOklnyl5tbK9","Baby Gang, Geolier","Miez A Via (feat. Geolier)","Warner Music",20,57,3,"805602"
70,"spotify:track:60NDVF7fFIq13aO9rIN80c","The Kolors","UN RAGAZZO UNA RAGAZZA","Warner Music",7,58,15,"798024"
71,"spotify:track:27sveRwlAkrG0lKGMKA4of","Mahmood, Geolier","PERSONALE","Universal Music Italia srL.",42,66,10,"789761"
72,"spotify:track:656s15tbLUO8m36U9UTYqU","Articolo 31, Tedua","SCUSI MAESTRA (feat. Tedua)","Columbia",72,-1,1,"785111"
73,"spotify:track:1K9qAxGT4cWUicf2OezSen","AVA, ANNA, Capo Plaza","VETRI NERI","Warner Music",1,70,52,"771668"
74,"spotify:track:05wb6MEyJeG2z1MVCIXxC8","Sfera Ebbasta, Marracash","15 Piani","Universal Music Italia srL.",1,69,26,"771605"
75,"spotify:track:0uXDSAM6q44glALKnQQyqW","Rose Villain, Geolier","Fantasmi (feat. Geolier)","Columbia",24,74,69,"766649"
76,"spotify:track:2wTMDCt0LWSPp0UlXXxlWS","Capo Plaza","Mi Riempi Di Chiamate","Warner Music",30,30,2,"758900"
77,"spotify:track:0mHC3BK9vFGoEU0EcGPWRZ","Lazza","CENERE","Universal Music Italia srL.",1,77,67,"746448"
78,"spotify:track:2gGq8fqoGuKpCjuV7p2dd3","Massimo Pericolo, Emis Killa","Moneylove (feat. Emis Killa)","Epic",1,71,24,"733395"
79,"spotify:track:1cyes3Q6UBIIZukTDA4ExV","Kid Yugi","64 BARRE DA CENSURA (Red Bull 64 Bars)","Universal Music Italia srL.",79,-1,1,"730654"
80,"spotify:track:6KM80DJGk9gehJMDmKuzfv","CLARA","DIAMANTI GREZZI","Warner Music",11,63,15,"729195"
81,"spotify:track:2MHGhfiCXvfeo3ZQ3RyG0B","Tony Effe, Emma, Takagi & Ketra","TAXI SULLA LUNA (feat. Emma & Takagi & Ketra)","Universal Music Italia srL.",5,89,49,"727506"
82,"spotify:track:5x9LonDyHxGUO2VzfHJHLE","Geolier","COME VUOI","Columbia",5,83,71,"723741"
83,"spotify:track:7fzHQizxTqy8wTXwlrgPQQ","Tommy Richman","MILLION DOLLAR BABY","PULSE Records",83,-1,1,"719953"
84,"spotify:track:6GMyR5UghG6k4MpsXsaim8","Boro, Artie 5ive, Andry The Hitmaker","Cadillac (feat. Artie 5ive)","Universal Music Italia srL.",1,78,34,"713457"
85,"spotify:track:3VtGh8xE9qRsFyY2Uj1WG3","Tedua, Sfera Ebbasta","Hoe (feat. Sfera Ebbasta)","Epic",1,86,50,"712686"
86,"spotify:track:6tP2AFUZkz4PuUfssawUBn","Drillionaire, Lazza, BLANCO, Sfera Ebbasta, Michelangelo","BON TON (feat. Lazza, Blanco, Sfera Ebbasta & Michelangelo)","Universal Music Italia srL.",2,82,47,"711188"
87,"spotify:track:2QieMRkH51KbJw4ZauGJfY","AVA, Capo Plaza, Tony Boy","MOON (feat. Capo Plaza & Tony Boy)","Warner Music",2,67,17,"691791"
88,"spotify:track:2oQeSFEOYr7JEWhOx9uPHH","Tony Boy","Leanin'","Warner Music",38,72,4,"691482"
89,"spotify:track:7MMJa7cjMadOSR6CFWvB1x","Coez","La musica non c'è","Undamento",1,100,218,"689424"
90,"spotify:track:5Z0UnEtpLDQyYlWwgi8m9C","Hozier","Too Sweet","Rubyworks / Universal-Island Records Ltd",87,87,6,"682406"
91,"spotify:track:6mIjiYKYP8hcO8Rqm81Vii","Niky Savage, Blssd, Paky","NO EX (feat. Paky)","Warner Music",46,81,4,"677100"
92,"spotify:track:4ySxBjhmdnkeFUqhKxW3cY","Sfera Ebbasta","Visiera A Becco","Universal Music Italia srL.",46,109,171,"675718"
93,"spotify:track:6nxQV4fJgfvyfZRPPJm1mO","Fabri Fibra, Emma, Baby Gang","In Italia 2024 (feat. Emma & Baby Gang)","Epic",15,84,12,"672971"
94,"spotify:track:17cDJE4DUg0yyt5ul8xo2K","Marracash","GLI ALTRI (Giorni Stupidi)","Universal Music Italia srL.",11,79,11,"670807"
95,"spotify:track:3WyrKzgCeGQQcUtW8ZwLMP","Capo Plaza","Busy","Warner Music",26,26,2,"668172"
96,"spotify:track:1LcAwUvsiWJqTgV9vDs0oq","Kid Yugi, Sfera Ebbasta, Shablo","Ex Angelo (feat. Sfera Ebbasta)","Universal Music Italia srL.",10,95,11,"661429"
97,"spotify:track:7kktKNHgINrBczPUGoG38p","Sfera Ebbasta","Bang Bang","Universal Music Italia srL.",62,108,96,"657020"
98,"spotify:track:0MLu1cFYL4ikdRTdasCQT9","Shablo, Geolier, Sfera Ebbasta","M' Manc (con Geolier & Sfera Ebbasta)","Universal Music Italia srL.",1,93,167,"656926"
99,"spotify:track:2OzhQlSqBEmt7hmkYxfT6m","Taylor Swift, Post Malone","Fortnight (feat. Post Malone)","Taylor Swift",28,88,4,"651144"
100,"spotify:track:5uQ7de4EWjb3rkcFxyEOpu","Mark Ambor","Belong Together","Hundred Days Records, LLC",100,119,4,"650967"
101,"spotify:track:7Da5kjy5GByLHE5OPQ4tpg","Geolier, Marracash","IL MALE CHE MI FAI (feat. Marracash)","Columbia",1,91,58,"646918"
102,"spotify:track:2qrCResILkL1JFeRBrv3qA","Alfa","bellissimissima <3","Artist First",4,101,53,"634694"
103,"spotify:track:74cyFjvgjyiFiQ3QxszFWq","Tananai","TANGO","Universal Music Italia srL.",3,111,67,"630257"
104,"spotify:track:0uHrMbMv3c78398pIANDqR","Joost","Europapa","Joost Klein",104,-1,1,"628400"
105,"spotify:track:17phhZDn6oGtzMe56NuWvj","Teddy Swims","Lose Control","Warner Records",78,107,15,"627665"
106,"spotify:track:2tTmW7RDtMQtBk7m2rYeSw","Bizarrap, Quevedo","Quevedo: Bzrp Music Sessions, Vol. 52","DALE PLAY Records",1,104,95,"626289"
107,"spotify:track:4midGjEpVz0mYkIdQMFX3l","Geolier, Lazza, Takagi & Ketra","CHIAGNE (feat. Lazza & Takagi & Ketra)","Columbia",1,102,81,"624119"
108,"spotify:track:2SEAbXqFtdTwkzgAb5Ci80","Kid Yugi, Simba La Rue","Denaro (feat. Simba La Rue)","Universal Music Italia srL.",11,80,11,"621812"
109,"spotify:track:6vsKOJPjdxlYgRs8McgtCQ","TWENTY SIX, Tayson Kryss","Buscando Money","FFRR",61,105,12,"621518"
110,"spotify:track:7EpeEp1AB5Qs4Y8LXvn5xG","MACE, Kid Yugi, Izi, Franco126","TUTTO FUORI CONTROLLO ൵ (con Franco 126, Kid Yugi, Izi)","Universal Music Italia srL.",13,92,6,"617703"
111,"spotify:track:18nFs7h8Jhn1SZ0pL6t2cG","Capo Plaza, Mahmood","No Drama (feat. Mahmood)","Warner Music",33,33,2,"615287"
112,"spotify:track:53AWZCqbx6kIPsVgSNYn92","MACE, Tony Boy, Guè, Noyz Narcos","PRAISE THE LORD ☥ (con Guè, Noyz Narcos, Tony Boy)","Universal Music Italia srL.",18,90,6,"609845"
113,"spotify:track:3qhlB30KknSejmIvZZLjOD","Djo","End of Beginning","Djo",40,97,11,"600595"
114,"spotify:track:0eUgmndC1CN1eijY6EKSaE","VillaBanks","Papaya","Universal Music Italia srL.",2,106,37,"600538"
115,"spotify:track:6uN0PQk9GLI4ze5Vr9hOX3","Tony Effe, Simba La Rue","CARRARA (feat. Simba La Rue)","Universal Music Italia srL.",13,96,9,"600356"
116,"spotify:track:0eLYWoIuuNzaR26eynemYM","El Chapo Junior, DJ Princex","Plaza Freestyle","40 Saints",45,110,17,"598889"
117,"spotify:track:1w91YxaRwTShkKe4apYf3r","Marracash, Guè","Insta Lova","Universal Music Italia srL.",1,115,58,"596064"
118,"spotify:track:3mMjLv3IyxlEKmXg3JxCI5","Pinguini Tattici Nucleari","Rubami la Notte","Columbia",5,116,52,"596022"
119,"spotify:track:0TK60zhllub2uzbpkckwiD","Baby Gang, Higashi, Simba La Rue","Assistente Sociale (feat. Simba La Rue)","Warner Music",30,85,3,"572388"
120,"spotify:track:3M48RdME7j6qwd3hF3wSZX","Kalionte, Frezza","PLATA O PLOMO","Kalionte",120,127,4,"572259"
121,"spotify:track:4CQNELF3U3gyNcI6sLr6yK","Bresh, SHUNE","Guasto D'Amore","Epic",2,135,68,"569588"
122,"spotify:track:3RgpMcg7uRz9b4Sbn1iXec","Il Pagante, VillaBanks","Spingere","EVentures",28,114,17,"563503"
123,"spotify:track:7nRFsITVaSHko2Fw2Gcy59","Gazzelle","Destri","Artist First / Maciste Dischi",2,122,190,"562761"
124,"spotify:track:3NLdcu14EPntcZIn3mxSR7","Kid Yugi, Night Skinny, Tony Boy","Sintetico (feat. Tony Boy)","Universal Music Italia srL.",76,126,30,"559610"
125,"spotify:track:42VsgItocQwOQC3XWZ8JNA","Travis Scott, Playboi Carti","FE!N (feat. Playboi Carti)","Cactus Jack/Epic",41,155,20,"557888"
126,"spotify:track:5b5cPscqVEMChvDqscVw26","Dua Lipa","Training Season","Warner Records",83,94,13,"547996"
127,"spotify:track:5LZVK19ieaV8Mk9FsqTL3F","Pinguini Tattici Nucleari","Ridere","RCA Records Label",31,125,214,"546674"
128,"spotify:track:1kZLATTXQa5BtEKH8GbW2U","Tedua","Red Light","Epic",8,131,50,"545227"
129,"spotify:track:7fH13hSOyNoeiDGbjEnTUC","Guè, Marracash","Brivido","Universal Music Italia srL.",73,134,230,"542107"
130,"spotify:track:0SsUOrXUM2gZxVLYizZfQZ","Lazza, Takagi & Ketra","PANICO (feat. Takagi & Ketra)","Universal Music Italia srL.",6,139,110,"532469"
131,"spotify:track:3Cz3hSSN3lwOtGXWuLo0cr","Ricchi E Poveri","Ma non tutta la vita","DM Produzioni licensed to Carosello Records",11,99,15,"527312"
132,"spotify:track:7He9P5gjaE4cmQOquezZnl","bnkr44","GOVERNO PUNK","Universal Music Italia srL.",18,124,15,"523003"
133,"spotify:track:0Q81Qb9ruKqHpz7e67MZDK","Petit","MAMMAMÌ","Warner Music / 21co",133,-1,1,"522725"
134,"spotify:track:0CUNOGNzjQY5vHgliB7on6","Capo Plaza","Tutta La Night","Warner Music",41,41,2,"521167"
135,"spotify:track:6SiJ1o6148rcmF2BydC1LW","Bresh, Pinguini Tattici Nucleari","Nightmares","Epic",4,136,33,"509531"
136,"spotify:track:6SQmh0L5icrThwGDTeLkg1","Lazza","MOLOTOV","Universal Music Italia srL.",5,137,106,"506586"
137,"spotify:track:2HafqoJbgXdtjwCOvNEF14","iñigo quintero","Si No Estás","Acqustic",3,142,33,"504531"
138,"spotify:track:0YI32qkEhhUjoGVMGXDm8b","Artie 5ive, ANNA","ANELLI E COLLANE (feat. ANNA)","Trenches Records Ent.",10,145,54,"503646"
139,"spotify:track:242NmD3BqOefyiOZQy2MT2","Sfera Ebbasta","VDLC","Universal Music Italia srL.",2,149,26,"503358"
140,"spotify:track:5rmWxr4qgejVuLWwxNzISC","Dargen D'Amico","Onda Alta","Universal Music Italia srL.",11,121,15,"501308"
141,"spotify:track:5TswDbxMnxptgFTf6ZxvXQ","Baby Lasagna","Rim Tim Tagi Dim","Polydor / Universal Music Hrvatska",141,-1,1,"497146"
142,"spotify:track:3TE8sw3fWmWficRYKRKkqx","Papa V, Kuremino, Nerissima Serpe, Fritu","Mattone (feat. Kuremino, Nerissima Serpe)","Columbia",67,133,15,"496604"
143,"spotify:track:6SSv0mVOX54GMKtIOrKpI1","Artie 5ive, Rondodasosa","BOULEVARD","Warner Music",13,140,19,"495556"
144,"spotify:track:4QRWBM7LFWHhIUU8b1O6GK","Mr.Rain","DUE ALTALENE","Warner Music",11,123,15,"494671"
145,"spotify:track:4ICCU06b8FkQIrMv0XTzlv","Pinguini Tattici Nucleari","Giovani Wannabe","Columbia",3,161,94,"489447"
146,"spotify:track:2hHC2jw8qiE4IAPDGjU4Fu","Finesse, Shiva, Sfera Ebbasta, Guè, Drillionaire","Gelosa (feat. Shiva, Sfera Ebbasta, Guè)","Epic",1,157,64,"487884"
147,"spotify:track:6SbD3zpxiqS9F4YHtaGEC1","Capo Plaza","Non C'è Love","Warner Music",44,44,2,"487608"
148,"spotify:track:3zWXAQuZ2cgRb2p0xqAORS","nayt, 3D","se ne va","Columbia",63,120,8,"486445"
149,"spotify:track:2A1uI5MjnW7C5L5lbsCJOz","Papa V, Nerissima Serpe, Fritu","Responsabile (feat. Nerissima Serpe)","Columbia",81,130,5,"485679"
150,"spotify:track:7L7QYf7S6wg6pseN2C0d6K","Frah Quintale","Gli occhi","Undamento",72,151,49,"477443"
151,"spotify:track:34YxYcGtsAzI1K0SNAWMn1","Yung Snapp, Geolier","Kiss You (F**k You) [feat. Geolier]","Warner Music",20,150,37,"474763"
152,"spotify:track:3tt9i3Hhzq84dPS8H7iSiJ","Manuel Turizo","La Bachata","Sony Music Latin/La Industria",59,173,62,"471609"
153,"spotify:track:381VH1JFj9q08V1OMlPU5m","Coez","Le luci della città","Undamento",9,143,138,"470146"
154,"spotify:track:7KTseTI8UdMT4WUIOmjTQC","TY1, Kid Yugi, Nerissima Serpe","MONOPOLIO (feat. Kid Yugi, Nerissima Serpe)","Thaurus",114,141,24,"469165"
155,"spotify:track:4QBfVk60RIBQg1uyox78Kh","Tedua, Capo Plaza","Parole Vuote (La Solitudine) (feat. Capo Plaza)","Epic",4,129,25,"466428"
156,"spotify:track:4qx89c79cx9Q1DvClaLTOZ","Annalisa","Mon Amour","Warner Music",5,165,59,"462218"
157,"spotify:track:4IgE2EClVv3KJex9IXVraO","Mida","QUE PASA","Dinero",157,196,2,"460950"
158,"spotify:track:5VcfNmujrZNUcztU5tR4qY","Tony Effe","SORRY","Universal Music Italia srL.",46,160,9,"460919"
159,"spotify:track:5EId1m4DNwTf3at31w8bPJ","Ozuna","El Farsante","VP Records Corp/Dimelo Vi",110,152,18,"459414"
160,"spotify:track:37L7CN8VlbcLZIpWLG2QiU","Tananai","BABY GODDAMN","Universal Music Italia srL.",1,153,94,"458256"
161,"spotify:track:2Zx64xP39WnpMlYgQa0ESv","Articolo 31, Fabri Fibra, Rocco Hunt","PEYOTE (feat. Fabri Fibra & Rocco Hunt)","Columbia",161,-1,1,"458047"
162,"spotify:track:6ds6kgkB0qRSpSnxcBomCO","BLANCO, Mina","Un Briciolo Di Allegria (con MINA)","Universal Music Italia srL.",2,156,57,"457484"
163,"spotify:track:5YSR0sWUZk7NuIbkycxndu","Rkomi, Sfera Ebbasta, Junior K","NUOVO RANGE (con SFERA EBBASTA)","Universal Music Italia srL.",1,163,147,"456822"
164,"spotify:track:7221xIgOnuakPdLqT0F3nP","Post Malone, Morgan Wallen","I Had Some Help (Feat. Morgan Wallen)","Mercury Records/Republic Records",164,-1,1,"456816"
165,"spotify:track:2orGI5VXRF4uplYVuvdRyU","Club Dogo, Marracash","Nato Per Questo (feat. Marracash)","Universal Music Italia srL.",2,144,18,"453763"
166,"spotify:track:0TTDfFZQggxtYF3NDX0u0G","Baby Gang, Gemitaiz, MadMan","Huracàn (feat. Gemitaiz, MadMan)","Warner Music",27,98,3,"452700"
167,"spotify:track:0ksqA7waEGNDkGkmRz0Gwj","Club Dogo, Sfera Ebbasta","Milly (feat. Sfera Ebbasta)","Universal Music Italia srL.",1,162,18,"451196"
168,"spotify:track:6BUueuMQR4k7CuoMEsnGou","Lazza, Sfera Ebbasta","PIOVE (feat. Sfera Ebbasta)","Universal Music Italia srL.",1,171,108,"449669"
169,"spotify:track:1fvlYWQjBaZOuRRwbYHAYm","Capo Plaza","Solo Un'Ora","Warner Music",47,47,2,"448219"
170,"spotify:track:5dcyltc1ataieXIeTqhH3t","Frah Quintale, Giorgio Poi","Missili","Undamento",26,194,60,"444945"
171,"spotify:track:01DXwNf1GzEJkYTbXgL0eb","Lazza","USCITO DI GALERA","Universal Music Italia srL.",5,147,110,"443502"
172,"spotify:track:162P3KqGAc1bPwk6ZBfrpY","Baby Gang, Higashi","Guerra","Warner Music",34,112,3,"440982"
173,"spotify:track:20qlAd6sHAYjc7TrrM5VeY","Angelina Mango","che t'o dico a fa'","Latarma S.r.l.",6,191,32,"440096"
174,"spotify:track:2E32Pv8w20r6ZH4oFecxOf","Geolier, Sfera Ebbasta","X CASO (feat. Sfera Ebbasta)","Columbia",1,167,71,"437082"
175,"spotify:track:4Z43nMEiOiNeDrqu2BN0JD","Coez","La tua canzone","Carosello Records",25,172,74,"433562"
176,"spotify:track:3dRMnxXq34xFpPnp1njzZu","Baby Gang, Higashi","Bloods & Crips","Warner Music",40,117,3,"429415"
177,"spotify:track:3QAU2pj4LUKf7yaTgANlQV","The Kolors","ITALODISCO","Warner Music",2,169,51,"428086"
178,"spotify:track:331l3xABO0HMr1Kkyh2LZq","David Guetta, OneRepublic","I Don't Wanna Wait","Parlophone UK",163,185,5,"427514"
179,"spotify:track:0QZYznuUxIPXs7gY8CPvS4","Kid Yugi","GRAMMELOT","Universal Music Italia srL.",95,170,36,"424226"
180,"spotify:track:0xEgDBXYO9gGzmxCFWKxNg","Marracash","CRUDELIA - I nervi","Universal Music Italia srL.",2,178,236,"420059"
181,"spotify:track:5MpZphaE8ML2JJrtdPy6Pt","Zerb, Sofiya Nzau","Mwaki","TH3RD BRAIN",170,184,10,"419631"
182,"spotify:track:1M7CwtrWZ24mopNdDPB3DM","Simba La Rue, FT Kings","TUNNEL","Warner Music",1,168,19,"417017"
183,"spotify:track:3g6ejyAz7jwE6MitrKCMVY","Ernia, Bresh, Fabri Fibra","PARAFULMINI (con Bresh & Fabri Fibra)","Universal Music Italia srL.",14,-1,38,"416609"
184,"spotify:track:4Dvkj6JhhA12EX05fT7y2e","Harry Styles","As It Was","Columbia",3,-1,79,"415975"
185,"spotify:track:5tlYqeZG8cO3ST3PCipnxQ","Baby Gang, Paky","Gangster (feat. Paky)","Warner Music",28,103,3,"415756"
186,"spotify:track:6MQYhSIrh9vwztmM6mwkzQ","Kid Yugi, Night Skinny, Artie 5ive","Porto il Commerciale (feat. Artie 5ive)","Universal Music Italia srL.",93,-1,9,"415389"
187,"spotify:track:4BVcVEp6Df9VQN5qFwxDn3","Slimane","Mon amour","Universal Music Division Capitol Music France",187,-1,1,"413049"
188,"spotify:track:22skzmqfdWrjJylampe0kt","Macklemore, Ryan Lewis, Macklemore & Ryan Lewis, Ray Dalton","Can't Hold Us (feat. Ray Dalton)","Macklemore",116,189,86,"412199"
189,"spotify:track:3myPe2jZvDbPoNXY7v2TU0","Tedua","Malamente","Epic",3,-1,49,"411687"
190,"spotify:track:5tYCl2bT9bDjMuTyn6OVb0","6ix9ine, Anuel AA","MALA (feat. Anuel AA)","ScumGang Records / TenThousand Projects, LLC",13,197,33,"409841"
191,"spotify:track:0FTUNe8E1nHwbDymK9XnkB","Rhove","Ancora","Universal Music Italia srL.",21,-1,42,"409413"
192,"spotify:track:7CLlCROEnQiqEDTt2zjn2t","Sarah Toscano","Sexy Magica","Warner Music",158,158,2,"407912"
193,"spotify:track:3oa04Ck4mNP1RQAUWAqW0v","Capo Plaza","Nato Per Questo","Warner Music",16,56,10,"406600"
194,"spotify:track:6qNXkVk19OYLu4CoqjDfZ0","Coez","Faccio un casino","Undamento",7,-1,107,"406013"
195,"spotify:track:5nqOdSrqurNq8ejE7Ujc9l","Kid Yugi","Il Filmografo","Universal Music Italia srL.",147,181,13,"403768"
196,"spotify:track:3rUGC1vUpkDG9CZFHMur1t","Tate McRae","greedy","RCA Records Label",44,180,34,"402355"
197,"spotify:track:4nS6mZBLYgtksYyXsuXgBw","Frah Quintale","Si, ah","Undamento",142,-1,16,"401928"
198,"spotify:track:7jtQIBanIiJOMS6RyCx6jZ","Tom Odell","Another Love","ITNO/Columbia",24,174,155,"401041"
199,"spotify:track:7yS8LfvvFEhtGhKLk29j5a","Calcutta ","2minuti","Bomba Dischi - Puro Srl",8,175,30,"400476"
200,"spotify:track:3ki4qt24MTfhk0iruUCpSR","Il Tre","FRAGILI","Warner Music",13,176,15,"400265"
