rank,uri,artist_names,track_name,source,peak_rank,previous_rank,weeks_on_chart,streams
190,"spotify:track:1wnozUBSe7OMpmZiTPJC5j","A.R. Rahman, Javed Ali, KIRTI SAGATHIA, Pooja AV","Tum Tak","Sony Music Entertainment India Pvt. Ltd.",167,167,3,"1230177"
191,"spotify:track:72CkpVdvmc8t28o8I9N32J","Atif Aslam, Manoj Muntashir","Tere Sang Yaara","Zee Music Company",150,-1,16,"1228956"
192,"spotify:track:51DEaelXeJJ6cFFYbX8Hal","Javed-Mohsin, Vishal Mishra, Shreya Ghoshal","Zihaal e Miskin","Universal Music India Pvt Ltd.",7,-1,53,"1223392"
193,"spotify:track:7igpahReLzGbhI2XiokrXQ","Rasraj Ji Maharaj","Hanuman Chalisa (Lo-fi)","Vianet Media",193,-1,1,"1219159"
194,"spotify:track:5W7DOVGQLTigu09afW7QMT","Sidhu Moose Wala","295","Sidhu Moose Wala",1,175,141,"1206110"
195,"spotify:track:0dJacN6K3mSGLE9p7QE0lO","KK","Beete Lamhein (From ""The Train"")","T-Series",75,197,29,"1203633"
196,"spotify:track:0rk2X5TAhraBC5aCIXK2Rq","Jawad Ahmad, Shaarib Toshi, Arijit Singh, Shreya Ghoshal","Samjhawan","Sony Music Entertainment India Pvt. Ltd.",70,-1,178,"1202831"
197,"spotify:track:1hQia6rxgfM1ly2hE3StWp","Vishal-Shekhar, Shekhar Ravjiani, Salim Merchant, Neeti Mohan","Ishq Wala Love","Sony Music Entertainment India Pvt. Ltd.",100,160,77,"1202634"
198,"spotify:track:1feANd8EfcDP5UqSvbheM3","Sachet Tandon, Sachet-Parampara","Bekhayali (From ""Kabir Singh"")","T-Series",1,176,250,"1202424"
199,"spotify:track:54PbBpquVfhfrwRwvjSXbI","Charlie Puth, Selena Gomez","We Don't Talk Anymore (feat. Selena Gomez)","Artist Partner",77,198,121,"1196970"
200,"spotify:track:5DgY6Ab0vpyUMKnY9ubFOF","Anirudh Ravichander, Super Subu","Hukum - Thalaivar Alappara","Sun Pictures",1,166,66,"1194609"
