rank,uri,artist_names,track_name,source,peak_rank,previous_rank,weeks_on_chart,streams
191,"spotify:track:2MvCNH9ua0CeOgUQfZf56z","Javed Ali","Guzarish","T-Series",191,-1,1,"1142358"
192,"spotify:track:0ojpEubhy4JNeVftmVuiN7","Vishal Mishra, Armaan Malik","Pehla Pyaar","T-Series",11,-1,176,"1142324"
193,"spotify:track:4uK0M8AI6gyFmyzUneQpbi","A.R. Rahman, Arijit Singh, Shashaa Tirupati","Rait Zara Si (From ""Atrangi Re"")","T-Series",12,181,141,"1141010"
194,"spotify:track:5PvwPy5eRO8BPwpRzCHK3D","Ankit Tiwari","Sunn Raha Hai (Male Version)","T-Series",146,-1,7,"1136318"
195,"spotify:track:4kaLkst9lT3sQ5Crgxs3ic","Ayushmann Khurrana, Rochak Kohli","Pani Da Rang - Male Vocals","Eros Now Music",68,189,34,"1134549"
196,"spotify:track:2rOnSn2piaqLAlYjtfUBlY","Tanishk Bagchi, Jubin Nautiyal, Asees Kaur","Raataan Lambiyan (From ""Shershaah"")","Sony Music Entertainment India Pvt. Ltd.",1,-1,163,"1132587"
197,"spotify:track:0dJacN6K3mSGLE9p7QE0lO","KK","Beete Lamhein (From ""The Train"")","T-Series",75,191,28,"1126995"
198,"spotify:track:54PbBpquVfhfrwRwvjSXbI","Charlie Puth, Selena Gomez","We Don't Talk Anymore (feat. Selena Gomez)","Artist Partner",77,192,120,"1125670"
199,"spotify:track:5a2Hoi1wuhCA6Ob7pbOlpW","Divya Kumar, Priya Saraiya","Sun Saathiya","Zee Music Company",121,184,18,"1123192"
200,"spotify:track:6oz1L5jcqZWYuId7nxvIan","Shubh","Still Rollin","SHUBH",4,-1,67,"1116356"
