rank,uri,artist_names,track_name,source,peak_rank,previous_rank,weeks_on_chart,streams
1,"spotify:track:5zCnGtCl5Ac5zlFHXaZmhy","Ram Sampath, Arijit Singh, Prashant Pandey","Sajni (From ""Laapataa Ladies"")","T-Series",1,1,7,"8978401"
2,"spotify:track:34Fh4HXZmnuBdtgejWUZg2","Mohammad Faiz, Jaani","Dekhha Tenu (From ""Mr. And Mrs. Mahi"")","Sony Music Entertainment India Pvt. Ltd.",2,2,5,"6534095"
3,"spotify:track:1a1xLj9W8libnO9PvJf6ao","Sushin Shyam, Dabzee, Vinayak Sasikumar","Illuminati","Think Music",3,5,11,"4747280"
4,"spotify:track:3yHyiUDJdz02FZ6jfUbsmY","Arijit Singh, Shreyas Puranik, Siddharth - Garima","Satranga (From ""ANIMAL"")","T-Series",2,4,34,"4605627"
5,"spotify:track:1tf2iody5iRLYYPDSBpzRc","Badshah, Arijit Singh","Soulmate","Universal Music India Pvt Ltd.",2,3,13,"4340049"
6,"spotify:track:36N5awamOX6XX5pQn3aFXZ","Darshan Raval, Jonita Gandhi, Rochak Kohli, Gurpreet Saini","Soni Soni (From ""Ishq Vishk Rebound"")","Tips Industries Ltd",6,23,3,"4033979"
7,"spotify:track:1eZefeDb8uOsjvcbl1fJrG","Diljit Dosanjh, Badshah, Raj Ranjodh","Naina (From ""Crew"")","Tips Industries Ltd",3,6,15,"3992876"
8,"spotify:track:0TrsGqtFXMWCrF9pPMICY9","Jyoti Nooran, Jaani, Bunny","Paon Ki Jutti","Universal Music India Pvt Ltd. – Distribution",8,9,4,"3986743"
9,"spotify:track:7yDHHVKLbvDmVw1XXhDDIO","Vishal Mishra, Raj Shekhar","Pehle Bhi Main","T-Series",1,7,29,"3882479"
10,"spotify:track:0M0ANKNzmM4Odd7FNKghzW","Mitraz","Akhiyaan Gulaab (From ""Teri Baaton Mein Aisa Uljha Jiya"")","T-Series",2,10,21,"3585140"
11,"spotify:track:0XRb6eZE4dBIJdqwf1Mixu","Juss, MixSingh","Suniyan Suniyan","Mix It Up Studio",11,14,5,"3548840"
12,"spotify:track:2ceeTJAzKy295Fm0VsaXtE","Sachin-Jigar, Raghav Chaitanya, Varun Jain, Indraneel","Tum Se (From ""Teri Baaton Mein Aisa Uljha Jiya"")","T-Series",10,11,19,"3419353"
13,"spotify:track:3FqtduiaqnFYvBgKuc6QWQ","Karan Aujla, Mxrci","Winning Speech","Karan Aujla",8,8,5,"3345377"
14,"spotify:track:0TL0LFcwIBF5eX7arDIKxY","Anuv Jain","Husn","Universal Music India Pvt. Ltd. (on behalf of Anuv Jain)",1,12,29,"3246592"
15,"spotify:track:3xMHXmedL5Rvfxmiar9Ryv","Anirudh Ravichander, Arijit Singh, Shilpa Rao, Kumaar","Chaleya","T-Series",1,13,45,"3005599"
16,"spotify:track:5Zv9GfbJv0MVntvTGF0IwG","Ikka, Diljit Dosanjh, Badshah, Sez on the Beat","Jagga Jatt","T-Series",15,15,3,"2977036"
17,"spotify:track:1hA697u7e1jX2XM8sWA6Uy","Sachin-Jigar, Arijit Singh, Amitabh Bhattacharya","Apna Bana Le","Zee Music Company",1,17,52,"2890361"
18,"spotify:track:6bmmHeCvZI92pRiTHxEdTC","Pritam, Arijit Singh, Irshad Kamil","O Maahi","T-Series",4,16,27,"2850523"
19,"spotify:track:5PUXKVVVQ74C3gl5vKy9Li","Jasleen Royal, Arijit Singh, Dulquer Salmaan","Heeriye (feat. Arijit Singh)","Warner Music India",1,19,47,"2836039"
20,"spotify:track:5ZLkihi6DVsHwDL3B8ym1t","Shubh","One Love","SHUBH",3,21,44,"2705548"
21,"spotify:track:6y5SuF4NxGkvwpAdqcAkD3","Pritam, Arijit Singh, Shreya Ghoshal, Shadab Faridi, Altamash Faridi, Amitabh Bhattacharya","Ve Kamleya","Saregama India Ltd",15,18,45,"2702278"
22,"spotify:track:4eBvRhTJ2AcxCsbfTUjoRp","Shubh","Cheques","SHUBH",1,22,56,"2693776"
23,"spotify:track:7n85x6EpfleVtbIjQGe0TD","Guru Randhawa, Babbu Maan, Sanjoy","Pagal","T-Series",23,32,3,"2589101"
24,"spotify:track:0YQJoDL6f46J0n1rOVkpxJ","Karan Aujla, Ikky","Softly","WM Canada",4,29,44,"2545683"
25,"spotify:track:0645eBDehHcqfiF15hscQV","Vishal Mishra, Rashmeet Kaur","Janiye (from the Netflix Film ""Chor Nikal Ke Bhaga"")","Netflix Music",5,20,50,"2533270"
26,"spotify:track:2qSkIjg1o9h3YT9RAgYN75","Sabrina Carpenter","Espresso","Island Records",26,36,8,"2471043"
27,"spotify:track:7KQdgW7QzNd9oPoCzjCU76","Shubh","Bandana","Shubh",8,26,12,"2440674"
28,"spotify:track:0UZLaEOSIc5kg0cc7eszqC","Vishal Mishra","Manjha","Desi Music Factory",16,27,108,"2423492"
29,"spotify:track:3zSSCPpLZ5Oc8nelhhGjKz","AUR","Tu hai kahan","Sony Music Entertainment",1,25,36,"2409942"
30,"spotify:track:5BQePe9rcCJozHK3oPayYk","Shubh","MVP","Shubh",24,24,6,"2394761"
31,"spotify:track:2Fv2injs4qAm8mJBGaxVKU","Arijit Singh, Mithoon","Tujhe Kitna Chahne Lage (From ""Kabir Singh"")","T-Series",2,34,264,"2356634"
32,"spotify:track:2PvaburAUlhNHxVhw5lvOq","Arijit Singh","Humdard (From ""Ek Villain"")","T-Series",28,38,205,"2348503"
33,"spotify:track:45PA9lW7U5LYnlpGrdTyHY","Jasleen Royal, Ujjwal Kashyap","Sang Rahiyo (feat. Ujjwal Kashyap)","Warner Music India",21,28,15,"2331968"
34,"spotify:track:1hlbywc8Jhl1FFqJxAMabE","Faheem Abdullah, Rauhan Malik, Amir Ameer","Ishq","Artiste First",27,31,12,"2317033"
35,"spotify:track:1kDZSmw3mKQeAjcmPTLS3M","Pritam, Arijit Singh, Shreya Ghoshal, Amitabh Bhattacharya","Tum Kya Mile, Pt. 2","Saregama India Ltd",9,30,51,"2212087"
36,"spotify:track:3hfWgH0UEDW1uJNlj5gRW1","Ikka, Karan Aujla, Sanjoy","House Of Lies","T-Series",36,48,4,"2190797"
37,"spotify:track:7eQl3Yqv35ioqUfveKHitE","Pritam, Mohit Chauhan, Irshad Kamil","Tum Se Hi","T-Series",27,43,222,"2116228"
38,"spotify:track:1y1rQTkWmrZdJmjwuK07GC","Vishal Mishra, Manoj Muntashir","Kaise Hua (From ""Kabir Singh"")","T-Series",5,33,262,"2082746"
39,"spotify:track:48Ix6ReYdJf2H4mKb3TIpj","Atif Aslam, Alisha Chinai, Pritam","Tera Hone Laga Hoon","Tips Industries Ltd",35,35,162,"2080069"
40,"spotify:track:0rMeOAvbQZ2RTG4B6L1M4p","Darshan Raval","Asal Mein","Indie Music Label",21,44,160,"2073413"
41,"spotify:track:26elzgFl8tvajnDfeoY1YF","Darshan Raval, Prakriti Kakar","Mannat","Warner Music India",18,41,28,"2042292"
42,"spotify:track:4UMIv5jd9gK98a39BQRD9X","Pritam, Arijit Singh, Amitabh Bhattacharya","Kesariya","Sony Music Entertainment India Pvt. Ltd.",1,40,101,"2007458"
43,"spotify:track:5Tkf5CbtVYHA1SiKo1NrJE","Sachin-Jigar, Arijit Singh, Amitabha Bhattacharya","Phir Aur Kya Chahiye (From ""Zara Hatke Zara Bachke"")","Saregama",1,45,56,"2000095"
44,"spotify:track:2IoZMG3RqiTmsy7Li3zGFg","Sachet Tandon, Parampara Tandon, Sachet-Parampara","Mere Sohneya (From ""Kabir Singh"")","T-Series",4,62,218,"1989345"
45,"spotify:track:1BpvuKIG7jK5EiTp2tv5z8","Shubh","King Shit","SHUBH",5,42,24,"1943687"
46,"spotify:track:3F3ZuXYFXGM1V6pk3b3zmi","Diljit Dosanjh, thiarajxtt","Kinni Kinni","DILJIT DOSANJH",24,39,32,"1927594"
47,"spotify:track:2fsBaSK1551VvUD9Uvbb9Q","Darshan Raval, Prakriti Giri","Tu Hai","Warner Music India",47,54,7,"1918010"
48,"spotify:track:73K33p4Vyz9koXGqmL5eFs","Sachet Tandon, Parampara Tandon, Kumaar, Sachet-Parampara","Malang Sajna","T-Series",4,50,74,"1915316"
49,"spotify:track:6c4Po8zyQjB4cR5XgLhcGb","Prabh Singh, Jay Trak, Rooh Sandhu","9:45","Prabh Singh Official",9,49,50,"1914732"
50,"spotify:track:209QxKVJzh2FLUmZHpYs4m","Badshah, Karan Aujla, Hiten","God Damn","Universal Music India Pvt Ltd.",15,51,13,"1898071"
51,"spotify:track:2C6CJGFLbisteRuY6Plb7b","Danny, Avvy Sra, Sagar","Ve Haaniyaan","Dreamiyata Music",10,47,20,"1890532"
52,"spotify:track:2ZDOzySC2g3YF1p26TPzBt","Shreya Ghoshal, Devi Sri Prasad, Raqueeb Alam","Angaaron (From ""Pushpa 2 The Rule"") [HINDI]","T-Series",52,161,2,"1880934"
53,"spotify:track:6IR6mzRO60hnMjNoq8rCPE","Raghav, Tanishk Bagchi, Asees Kaur","Teri Baaton Mein Aisa Uljha Jiya Title Song (From ""Teri Baaton Mein Aisa Uljha Jiya"")","T-Series",5,37,20,"1878538"
54,"spotify:track:4tYxGORIOZSPLnZmrSpva7","NJ, BABY JEAN, Dabzee, Rzee","Ballaatha Jaathi","Universal Music India Pvt Ltd.",54,78,11,"1819675"
55,"spotify:track:1418IuVKQPTYqt7QNJ9RXN","King","Maan Meri Jaan","Warner Music India",1,55,88,"1816941"
56,"spotify:track:2FCXQHugkoHE1K3tiDu8pu","Alka Yagnik, Arijit Singh","Agar Tum Saath Ho (From ""Tamasha"")","T-Series",4,46,264,"1797254"
57,"spotify:track:0Jiaz0O4AqnJICa9PxHhaR","Darshan Raval","Mahiye Jinna Sohna","Warner Music India",2,56,52,"1785181"
58,"spotify:track:18afrwnlrByAjhi3Ve0Ehn","Sushin Shyam, Pranavam Sasi, Vinayak Sasikumar","Armadham","Think Music",33,52,7,"1778852"
59,"spotify:track:56zZ48jdyY2oDXHVnwg5Di","Mithoon, Arijit Singh","Tum Hi Ho","T-Series",44,58,177,"1761972"
60,"spotify:track:0rlLBWFFTQiOWi963SH9bb","The Local Train","Choo Lo","The Local Train",51,68,52,"1746262"
61,"spotify:track:1YMLgvsQdE27r30q0fsLeV","Arijit Singh","Tera Fitoor","Tips Industries Ltd",61,61,50,"1719000"
62,"spotify:track:4ITtnvLQ6SOA8XhiqkLa24","Sanju Rathod, G-SPXRK","Gulabi Sadi","Sanjay Rathod",11,53,14,"1691741"
63,"spotify:track:3nKQrVVlwbAQSnFbgZWdN0","Avvy Sra, Karan Aujla, Jaani","White Brown Black","Universal Music India Pvt Ltd. – Distribution",29,66,79,"1665234"
64,"spotify:track:2JS0RFqBJvBtvG1GIsZmjW","Tanishk Bagchi, Kausar Munir, Jubin Nautiyal","Agar Ho Tum (From ""Mr. And Mrs. Mahi"")","Sony Music Entertainment India Pvt. Ltd.",59,59,3,"1644684"
65,"spotify:track:3HiobOOpSpMsi95WBKPBYk","Jeet Gannguli, Arijit Singh","Hamari Adhuri Kahani (Title Track)","Sony Music Entertainment India Pvt. Ltd.",56,79,136,"1642586"
66,"spotify:track:2GXXZFUxYg2LvG8SR0byOE","Sachin-Jigar, Atif Aslam","Jeena Jeena","Eros Now Music",37,74,151,"1638201"
67,"spotify:track:32VAw8DL9ixX5XSW2VLcZ4","Parmish Verma, PARDHAAN, Desi Crew","Aam Jahe Munde","Parmish Verma Films",20,60,50,"1630669"
68,"spotify:track:1smFN2CLqGROu0J0UyvDfL","Pritam, Arijit Singh","Shayad","Sony Music Entertainment India Pvt. Ltd.",1,67,231,"1625881"
69,"spotify:track:7uNnlVit5qDvfOje0pqICF","Mohit Chauhan, Suzanne D'Mello","Tum Ho","T-Series",69,94,3,"1610973"
70,"spotify:track:3WLJ7D5kh44K5eJ1NqZQ6W","Anuv Jain","Baarishein","Universal Music India Pvt. Ltd. (on behalf of Anuv Jain)",18,72,162,"1607018"
71,"spotify:track:3bmsaFp11I9pbicxzlStf3","Akshath","nadaaniyan","Universal Music India Pvt Ltd.",71,-1,1,"1598664"
72,"spotify:track:6t9KM2EQD4H2KbrTgHGYf3","Sachin-Jigar, Jasmine Sandlas, Amitabh Bhattacharya","Taras - From ""Munjya""","Zee Music Company",72,-1,1,"1596063"
73,"spotify:track:0FBQ4NrrHUbR9kus7rzrOj","Atif Aslam","Dil Diyan Gallan","YRF Music",56,75,227,"1582989"
74,"spotify:track:54PRUdMOYzglMGnsg9kIta","Raghav Chaitanya, Manoj Muntashir, Pritam","Hua Main (From ""ANIMAL"")","T-Series",6,71,36,"1581199"
75,"spotify:track:0YxKKO272sacGBJKjf6FnB","Jaani, B Praak","Saari Duniya Jalaa Denge","T-Series",3,83,30,"1571789"
76,"spotify:track:5XeFesFbtLpXzIVDNQP22n","Arctic Monkeys","I Wanna Be Yours","Domino Recording Co",48,77,84,"1566166"
77,"spotify:track:3yV2c3cYhkAwSsxAq6nRiv","Gajendra Verma","Mann Mera","Sony Music / Eros Now Music",26,85,168,"1565994"
78,"spotify:track:7F8RNvTQlvbeBLeenycvN6","A.R. Rahman, Javed Ali, Mohit Chauhan","Kun Faya Kun","T-Series",60,111,115,"1555350"
79,"spotify:track:1zzejMGRYKP5XOa3FmzXfa","Sai Abhyankkar","Katchi Sera - From ""Think Indie""","Think Music",6,80,20,"1544943"
80,"spotify:track:1d5lpW3gUyq537iuyrb9Lf","Aditya Rikhari","Samjho Na","CollabX Productions",64,64,61,"1544532"
81,"spotify:track:5W7DOVGQLTigu09afW7QMT","Sidhu Moose Wala","295","Sidhu Moose Wala",1,70,123,"1530342"
82,"spotify:track:2lHslGtLZJe0IGhiGwswBy","Amrinder Gill, Dr Zeus, Raj Ranjodh","That Girl","Rhythm Boyz Entertainment",76,76,3,"1522676"
83,"spotify:track:610keNiNVTIkYD0CqeSerg","Cheema Y, Gur Sidhu","California Love","Brown Town Music",27,63,56,"1518016"
84,"spotify:track:3ZGJhN4unVspOqpwGvUL2W","Diljit Dosanjh","Lemonade","DILJIT DOSANJH",26,82,99,"1489519"
85,"spotify:track:2mFXx4D49RdesixfLSsoU0","Dabzee, Bibin Ashok, Vaisakh Sugunan","Vatteppam (From ""Mandakini"")","Saregama India Ltd",85,121,3,"1487964"
86,"spotify:track:4VsP4Dm8gsibRxB5I2hEkw","Kaifi Khalil","Kahani Suno 2.0","1944121 Records DK",1,88,79,"1485397"
87,"spotify:track:77OQsnAirm7Ke8EGgBeOxz","Anirudh Ravichander","Kadharalz","Sony Music Entertainment India Pvt. Ltd.",87,150,2,"1471305"
88,"spotify:track:1kTEGyqUJFgstwdgJFLqz1","Akashdeep Sengupta, Laqshay Kapoor, Kausar Munir, Suvarna Tiwari","Dil Se Dil Tak (From ""Bawaal"")","T-Series",38,86,20,"1466907"
89,"spotify:track:6H7fLdt0AeWpuxUKXuXWrx","Hariharan","Shree Hanuman Chalisa","T-Series",39,95,97,"1465847"
90,"spotify:track:4bD9z9qa4qg9BhryvYWB7c","Pritam, Tochi Raina, Rekha Bhardwaj","Kabira","T-Series",31,81,249,"1465553"
91,"spotify:track:0snQrp1VaY5Pj1YIHRJpRJ","Aditya A","Chaand Baaliyan","Sony Music Entertainment India Pvt. Ltd.",2,106,122,"1460632"
92,"spotify:track:2oenSXLDbWVaaL7QjSGYj5","Diljit Dosanjh, Intense, Sultaan","Lalkara","DILJIT DOSANJH",22,65,37,"1458960"
93,"spotify:track:2ZD4aIEepqZsdxPxLSuUhm","Pritam, Arijit Singh, Amitabh Bhattacharya, Nikhita Gandhi","Tere Pyaar Mein","T-Series",5,96,72,"1449662"
94,"spotify:track:3txE0SZnwamBhYB2ZQtHwU","Karan Aujla, Mxrci","Goin' Off","Rehaan Records",28,57,6,"1442610"
95,"spotify:track:5BKKKNwrebowaMoUdBaNby","King","Tu Aake Dekhle","Warner Music India",3,84,177,"1437333"
96,"spotify:track:4XxfOvudrnBRdlgzEaq1sd","Diljit Dosanjh","Born to Shine","FAMOUS STUDIOS INC",28,89,51,"1426344"
97,"spotify:track:5N3hjp1WNayUPZrA8kJmJP","Sabrina Carpenter","Please Please Please","Island Records",97,-1,1,"1424435"
98,"spotify:track:6mTvwBzWTGDOVeCNQEqtOE","Amaal Mallik, Arijit Singh, Tulsi Kumar","Soch Na Sake","T-Series",64,114,77,"1421051"
99,"spotify:track:5vGiuYFSGekGLgbxhV1rD5","Atif Aslam, Pritam","Tu Jaane Na","Tips Industries Ltd",73,73,142,"1407560"
100,"spotify:track:5G7pZ8G8NFvS1MQ9H4L7dC","Javed-Mohsin, Arijit Singh, Shreya Ghoshal, Kunaal Vermaa, Prashant Ingole","Pal","Sony Music Entertainment India Pvt. Ltd.",34,92,276,"1391525"
101,"spotify:track:3bQsp4Vr9Rg4fNCx6HPOgX","Anuv Jain","Alag Aasmaan","Universal Music India Pvt. Ltd. (on behalf of Anuv Jain)",30,109,40,"1390351"
102,"spotify:track:0tgVpDi06FyKpA1z0VMD4v","Ed Sheeran","Perfect","Atlantic Records UK",29,100,218,"1387092"
103,"spotify:track:7CyPwkp0oE8Ro9Dd5CUDjW","The Weeknd, JENNIE, Lily-Rose Depp","One Of The Girls (with JENNIE, Lily Rose Depp)","XO / Republic Records",98,98,24,"1384146"
104,"spotify:track:32765xcLM1fd6wQIpkN9A0","Ami Mishra, Kunaal Vermaa","Hasi - Male Version","Sony Music Entertainment India Pvt. Ltd.",77,99,51,"1374413"
105,"spotify:track:5WXQbgwGwyauXOqswlEeQY","Tanishk Bagchi, Arijit Singh, Asees Kaur","Bolna (From ""Kapoor & Sons (Since 1921)"")","Sony Music Entertainment India Pvt. Ltd.",59,87,69,"1372953"
106,"spotify:track:72vuBPMhwFNlSYpTSf6fVD","Diljit Dosanjh, Sia, Greg Kurstin","Hass Hass","Warner Music India",5,102,34,"1372900"
107,"spotify:track:5npFBWhVs3VVlc0nY5xQMA","Sachin-Jigar, Arijit Singh","Tainu Khabar Nahi - From ""Munjya""","Zee Music Company",107,-1,1,"1372365"
108,"spotify:track:2gKNWPBrI2IRBl2RRUtoEb","Shreya Ghoshal, Devi Sri Prasad, Chandra Bose","Sooseki (From ""Pushpa 2 The Rule"") [TELUGU]","T-Series",91,91,3,"1367763"
109,"spotify:track:29m79w9xPMH4YCD6r8JSmV","AP Dhillon, Gurinder Gill, Intense","Excuses","RUN-UP RECORDS",1,93,139,"1356851"
110,"spotify:track:2RgvvnMwtP0R2OkVZmFvnV","KK","Ajab Si (From ""Om Shanti Om"")","T-Series",34,112,128,"1352668"
111,"spotify:track:42VsgItocQwOQC3XWZ8JNA","Travis Scott, Playboi Carti","FE!N (feat. Playboi Carti)","Cactus Jack/Epic",108,108,6,"1350400"
112,"spotify:track:0gPgdRfB4jdGrlyXS0Vx78","Vishal-Shekhar, KK, Shilpa Rao, Anvita Dutt Guptan","Khuda Jaane","YRF Music",37,90,89,"1342634"
113,"spotify:track:4wIWWEhbdgKAxhR68eE0Ye","Arijit Singh, Chinmayi","Mast Magan (From ""2 States"")","T-Series",45,101,174,"1332084"
114,"spotify:track:4uK0M8AI6gyFmyzUneQpbi","A.R. Rahman, Arijit Singh, Shashaa Tirupati","Rait Zara Si (From ""Atrangi Re"")","T-Series",12,120,124,"1331723"
115,"spotify:track:6fScgF2Y63ScU73nYju0ny","Atif Aslam, Arko","O Saathi","T-Series",58,127,99,"1330804"
116,"spotify:track:2tjWCe2W7sgvS3C8NHcdtI","Akhil, Dhvani Bhanushali, Kunaal Vermaa, Abhijit Vaghani","Duniyaa (From ""Luka Chuppi"")","T-Series",1,125,278,"1329997"
117,"spotify:track:5jAi1HXmSUd5poIEOQkYSy","Pritam, Arijit Singh, Jonita Gandhi, Ranveer Singh, Amitabh Bhattacharya","What Jhumka ?","Saregama India Ltd",6,103,49,"1315666"
118,"spotify:track:1UWacd8x8tPPwmrPB1MoBI","Pritam, Arijit Singh","Ae Dil Hai Mushkil Title Track","Sony Music Entertainment India Pvt. Ltd.",79,116,229,"1315355"
119,"spotify:track:4lOFc193Xe6JfMiQkVRQWO","Pritam, IP Singh, Arijit Singh, Amit Mishra","Tu Hai Champion","T-Series",119,-1,1,"1313629"
120,"spotify:track:7MXVkk9YMctZqd1Srtv4MB","The Weeknd, Daft Punk","Starboy","Universal Republic Records",12,110,151,"1310236"
121,"spotify:track:4Tkb7zsDmsawB7S5TpKQV1","Atif Aslam, Shiraz Uppal","Pehli Dafa","T-Series",121,134,33,"1306724"
122,"spotify:track:5eSoySxUnx3xsm0FHFgHiv","Hiphop Tamizha, Kharesma Ravichandran, Srinisha Jayaseelan","Achacho - From ""Aranmanai 4""","Think Music",85,97,5,"1306130"
123,"spotify:track:6udC4b4jOSnHb9ItnXgKLR","Sachin-Jigar, Shreya Ghoshal, Tochi Raina","Saibo","Sony Music Entertainment India Pvt. Ltd.",31,104,190,"1301242"
124,"spotify:track:0l6g8Z8mqGbGXFOjigYetD","Pritam, Arijit Singh","Hawayein","Sony Music Entertainment India Pvt. Ltd.",51,118,141,"1301186"
125,"spotify:track:6oz1L5jcqZWYuId7nxvIan","Shubh","Still Rollin","SHUBH",4,113,57,"1286776"
126,"spotify:track:3USxtqRwSYz57Ewm6wWRMp","Glass Animals","Heat Waves","Polydor Records",3,184,121,"1283149"
127,"spotify:track:1feANd8EfcDP5UqSvbheM3","Sachet Tandon, Sachet-Parampara","Bekhayali (From ""Kabir Singh"")","T-Series",1,131,232,"1279655"
128,"spotify:track:5O2P9iiztwhomNh8xkR9lJ","One Direction","Night Changes","Syco Music",22,115,162,"1269717"
129,"spotify:track:11qnwt18ZckPqchzK2I3U7","Mithoon, Arijit Singh, Sayeed Quadri","Dil Jhoom","Zee Music Company",93,145,19,"1258341"
130,"spotify:track:7yyCCfalLx9F8TbMo5jH03","Rasraj Ji Maharaj","Bajrang Baan-Lofi","Vianet Media",89,136,18,"1257461"
131,"spotify:track:4VosVUajzm6nzGlSb6nP3L","Parmish Verma, Paradox","Check It Out","SDA Studios",19,107,49,"1253094"
132,"spotify:track:3qhlB30KknSejmIvZZLjOD","Djo","End of Beginning","Djo",105,105,13,"1249044"
133,"spotify:track:72zHuDxFQTjbL51qJQSA7j","Jasleen Royal, B Praak, Romy","Ranjha (From ""Shershaah"")","Sony Music Entertainment India Pvt. Ltd.",1,142,150,"1232829"
134,"spotify:track:5rpCUsEfBLIumvrxrahnKF","Hasan Raheem, Umair, Talwiinder","Wishes","1698613 Records DK2",60,122,28,"1227194"
135,"spotify:track:4OcvkkpF3xmyCGGY5IBlgi","Akhil Sachdeva, Tulsi Kumar","Tera Ban Jaunga (From ""Kabir Singh"")","T-Series",4,135,249,"1220689"
136,"spotify:track:2qxmye6gAegTMjLKEBoR3d","Alec Benjamin","Let Me Down Slowly","2018",34,144,219,"1220405"
137,"spotify:track:1FEiijYPJtyswChfcpv3p0","Lana Del Rey","Summertime Sadness","Polydor Records",137,138,10,"1219572"
138,"spotify:track:6ygiy70ujkNOYXM1tQuMNe","Karan Aujla, Ikky, Preston Pablo","Admirin' You (feat. Preston Pablo)","WM Canada",24,147,46,"1217227"
139,"spotify:track:08Isz2ETWSBhvIl8UpKYsp","Shubh","No Love","SHUBH",2,133,119,"1214797"
140,"spotify:track:2eAvDnpXP5W0cVtiI0PUxV","Ruth B.","Dandelions","Columbia",14,139,134,"1211837"
141,"spotify:track:4u0D2jZ20wQaEMHBSqsDnZ","King","Tu Jaana Na Piya","Warner Music India",15,130,34,"1205242"
142,"spotify:track:2cPUB8EOT6AfJ8oxhyoNXL","Pritam, Javed Bashir","Ye Tune Kya Kiya","T-Series",139,141,18,"1194368"
143,"spotify:track:4blqlsA1uf2d2I40E90EUC","Pritam, Arijit Singh, Shilpa Rao","Tere Hawaale (From ""Laal Singh Chaddha"")","T-Series",11,137,69,"1189726"
144,"spotify:track:3QJsSWa0Xo8MfaRn1gr4Be","Isabel LaRosa","favorite","Slumbo Labs/RCA Records",77,119,10,"1188356"
145,"spotify:track:5llaVhaIoowKT3fqf2NfPO","Atif Aslam, Pritam","Pehli Nazar Mein","Tips Industries Ltd",126,126,15,"1186452"
146,"spotify:track:7fW9J3EpVWVN1ouv0slAs0","KK","Kya Mujhe Pyar Hai (From ""Woh Lamhe"")","T-Series",42,146,72,"1184022"
147,"spotify:track:7IWcVmNCt0V1KHoYQP9ZoR","Thaman S, Sri Krishna, Sahithi Chaganti, Mahesh Babu, Saraswati Putra Ramajogayya Sastry","Kurchi Madathapetti","Aditya Music",34,128,24,"1179768"
148,"spotify:track:0ojpEubhy4JNeVftmVuiN7","Vishal Mishra, Armaan Malik","Pehla Pyaar","T-Series",11,140,160,"1178409"
149,"spotify:track:2pIoyDWZV5OSW0xd6n41xV","Pritam, Arijit Singh, Swanand Kirkire, IP Singh","Lutt Putt Gaya","T-Series",22,123,30,"1163488"
150,"spotify:track:2S6N9pbnkhQRyAx80HmF79","Mohammed Irfan","Banjaara (From ""Ek Villain"")","T-Series",148,167,18,"1141277"
151,"spotify:track:3ygfdwvBJ2Y5XhJiiHFFZE","Sachet Tandon","Maiyya Mainu","Zee Music Company",5,186,88,"1138273"
152,"spotify:track:0xIuPDzJSnJywALez8dwKR","AP Dhillon","With You","Mass Appeal India",2,158,45,"1136228"
153,"spotify:track:5DgY6Ab0vpyUMKnY9ubFOF","Anirudh Ravichander, Super Subu","Hukum - Thalaivar Alappara","Sun Pictures",1,151,49,"1132340"
154,"spotify:track:7G5wpuR61ABrT7R1snos7C","Pritam, Arijit Singh","Kalank - Title Track","Zee Music Company",5,162,234,"1128303"
155,"spotify:track:6GZIAVSu0YXF7FYzyRl1MP","Sachin-Jigar, Varun Jain, Shadab Faridi, Altamash Faridi, Amitabh Bhattacharya","Tere Vaaste (From ""Zara Hatke Zara Bachke"")","Saregama",1,152,56,"1125834"
156,"spotify:track:5Gy67YHzPZTk9Q0D73LAGH","Jeet Gannguli, Arijit Singh","Khamoshiyan (From ""Khamoshiyan"")","Sony Music Entertainment India Pvt. Ltd.",90,173,60,"1125832"
157,"spotify:track:7Imk0IG6S5GA5iYWkjmMW5","Palak Muchhal, Arijit Singh","Chahun Main Ya Naa (From ""Aashiqui 2"")","T-Series",135,143,36,"1116337"
158,"spotify:track:5c6DkR7KhFZ6RWtgEUp8M3","Harsh Likhari, Vagish","Bebe Bapu","Harsh Likhari",132,163,6,"1115637"
159,"spotify:track:52itZ0w0CydihB2JCZEIft","Pritam, Mohit Chauhan, Irshad Kamil","Pee Loon","T-Series",142,155,19,"1113916"
160,"spotify:track:1L3Nsi7YXtBxTdnbqektia","Darshan Raval","Hawa Banke","Indie Music Label",26,181,73,"1108443"
161,"spotify:track:2rOnSn2piaqLAlYjtfUBlY","Tanishk Bagchi, Jubin Nautiyal, Asees Kaur","Raataan Lambiyan (From ""Shershaah"")","Sony Music Entertainment India Pvt. Ltd.",1,164,151,"1101209"
162,"spotify:track:2lX53kXvYnvpV8Vqfe4S7s","Aashir Wajahat, NAYEL, Nehaal Naseem","Sadqay","Sony Music Entertainment",15,124,17,"1100525"
163,"spotify:track:0dJacN6K3mSGLE9p7QE0lO","KK","Beete Lamhein (From ""The Train"")","T-Series",75,166,11,"1099525"
164,"spotify:track:5SftJq4uVpajyYC1Gs0RFF","Amit Trivedi, Arijit Singh, Nikhita Gandhi","Qaafirana","Zee Music Company",40,-1,172,"1093655"
165,"spotify:track:72CkpVdvmc8t28o8I9N32J","Atif Aslam, Manoj Muntashir","Tere Sang Yaara","Zee Music Company",150,-1,9,"1093256"
166,"spotify:track:0R1AZYXc34nfMaiengrkRc","Sidhu Moose Wala, Sunny Malton, Offgrid","410","Sunny Malton",17,129,10,"1088364"
167,"spotify:track:2dMlTWQbY9tfPFLIqAa7Tv","Kaifi Khalil","Kahani Meri","Novice Records LLC",104,149,7,"1086694"
168,"spotify:track:4RCd3Gdtt3dNedof64hqRD","Mohammed Irfan, Arijit Singh, Saim Bhat","Phir Mohabbat (From ""Murder 2"")","T-Series",160,178,16,"1085395"
169,"spotify:track:2IEhtVeM9TVql8fZdKdlo9","Atif Aslam, Chinmayi, Pritam","Main Rang Sharbaton Ka","Tips Industries Ltd",126,154,24,"1084220"
170,"spotify:track:5ivRSlOhVIXN2QMzqgsX0s","The Local Train","Aaoge Tum Kabhi","The Local Train",170,-1,1,"1073548"
171,"spotify:track:3APdIdF8H0jsxSuGOqXedS","Rashid Ali","Kabhi Kabhi Aditi","T-Series",73,175,121,"1070859"
172,"spotify:track:2Z6HgNji9cNlFLNORw6wDQ","Mansheel Gujral, Akhil Sachdeva","Channa Ve - From ""Bhoot - Part One: The Haunted Ship""","Zee Music Company",33,153,49,"1067620"
173,"spotify:track:18YHbIhrleUkKKj2DvEp79","Pritam, KK","Zara Sa","Sony Music Entertainment India Pvt. Ltd.",33,165,69,"1067615"
174,"spotify:track:3wz2vWhYnnBoFmgMkqtzLy","Chani Nattan, Inderpal Moga","Daku","Kharku Life Records",5,168,96,"1065983"
175,"spotify:track:567e29TDzLwZwfDuEpGTwo","The Kid LAROI, Justin Bieber","STAY (with Justin Bieber)","Columbia",1,185,138,"1064682"
176,"spotify:track:18gi2IxbZ3Ugom7wTRkohf","Tulsi Kumar, KK","Piya Aaye Na (From ""Aashiqui 2"")","T-Series",176,179,4,"1063953"
177,"spotify:track:3sqRODOZ1Z6hR4F2tnFAlg","Maninder Buttar","Sakhiyaan","Ishtar Punjabi",20,-1,220,"1063696"
178,"spotify:track:6O1RAYwmOqkcoJQr7J9SFJ","Manan Bhardwaj, Arijit Singh","Oonchi Oonchi Deewarein","T-Series",52,192,34,"1062150"
179,"spotify:track:3IowQIKCU7GfyWDKIVE4WG","Sushin Shyam, Sreenath Bhasi, Vinayak Sasikumar","Jaada","Think Music",47,188,10,"1061071"
180,"spotify:track:4SJMuaIYcBS8ke96lDYOsw","Karan Aujla","On Top","Karan Aujla Music",17,-1,51,"1059581"
181,"spotify:track:5O932cZmzOZGOGZz9RHx20","Pritam, Arijit Singh","Khairiyat","T-Series",1,183,249,"1057213"
182,"spotify:track:7aE1lfskJLMHQnzCCP1zsV","Akhil Sachdeva, Mansheel Gujral","Humsafar (From ""Badrinath Ki Dulhania"")","T-Series",158,195,34,"1054193"
183,"spotify:track:64r6z0P3RnhpTGdkA7p5Os","Darshan Raval","Ek Tarfa","Indie Music Label",33,-1,101,"1049032"
184,"spotify:track:6Z394Nd4gW6Ts9hmu3NUjx","A.R. Rahman, Mohit Chauhan","Nadaan Parinde","T-Series",184,-1,1,"1048190"
185,"spotify:track:3iFYJMrRS0fLrwDNVbqNF0","Darshan Raval","Saajan Ve","Warner Music India",39,160,24,"1044997"
186,"spotify:track:4LzjjNaJfnbPtJFYfMC8dc","Akhil Sachdeva, Kartik Dev","Saanware","PlayDMF",56,189,17,"1041731"
187,"spotify:track:0tpwqQhdfJXRcUDSNRjb9O","Arijit Singh, Neeti Mohan, Rashmi Virag","Mere Yaaraa (From ""Sooryavanshi"")","T-Series",20,182,98,"1040784"
188,"spotify:track:4MU4Kfkd9EnkArK2ocQyqK","Arijit Singh, Harshdeep Kaur","Zaalima","Zee Music Company",78,-1,68,"1036565"
189,"spotify:track:28x6WpVq1ty4dPDeqK0zPO","Sushin Shyam, Paal Dabba, Vinayak Sasikumar","Galatta","Think Music",66,177,10,"1027583"
190,"spotify:track:3JkVYvxNoGf2HCWJo61462","Sidhu Moose Wala, Sunny Malton, SOE","Never Fold","Sidhu Moose Wala",13,174,107,"1023981"
191,"spotify:track:6b2WJDzGt5X8dYfpkWtvXW","Anirudh Ravichander, Ramajogayya Sastry","Fear Song (From ""Devara Part 1"") [Telugu]","T-Series",170,170,3,"1022250"
192,"spotify:track:3XWBGyt7m2rZAjEj0awWnw","Mithoon, Arijit Singh","Sanam Re (From ""Sanam Re"")","T-Series",192,200,2,"1020149"
193,"spotify:track:7mSzDKajY2wUtstQSLdzMK","Mohit Chauhan, Rochak Kohli","Rang Lageya","Saregama",35,-1,71,"1017428"
