rank,uri,artist_names,track_name,source,peak_rank,previous_rank,weeks_on_chart,streams
1,"spotify:track:5zCnGtCl5Ac5zlFHXaZmhy","Ram Sampath, Arijit Singh, Prashant Pandey","Sajni (From ""Laapataa Ladies"")","T-Series",1,1,8,"8074273"
2,"spotify:track:34Fh4HXZmnuBdtgejWUZg2","Mohammad Faiz, Jaani","Dekhha Tenu (From ""Mr. And Mrs. Mahi"")","Sony Music Entertainment India Pvt. Ltd.",2,2,6,"5614413"
3,"spotify:track:0XRb6eZE4dBIJdqwf1Mixu","Juss, MixSingh","Suniyan Suniyan","Mix It Up Studio",3,11,6,"4278051"
4,"spotify:track:3yHyiUDJdz02FZ6jfUbsmY","Arijit Singh, Shreyas Puranik, Siddharth - Garima","Satranga (From ""ANIMAL"")","T-Series",2,4,35,"4183784"
5,"spotify:track:1eZefeDb8uOsjvcbl1fJrG","Diljit Dosanjh, Badshah, Raj Ranjodh","Naina (From ""Crew"")","Tips Industries Ltd",3,7,16,"4042905"
6,"spotify:track:1a1xLj9W8libnO9PvJf6ao","Sushin Shyam, Dabzee, Vinayak Sasikumar","Illuminati","Think Music",3,3,12,"4036966"
7,"spotify:track:1tf2iody5iRLYYPDSBpzRc","Badshah, Arijit Singh","Soulmate","Universal Music India Pvt Ltd.",2,5,14,"3914493"
8,"spotify:track:0TrsGqtFXMWCrF9pPMICY9","Jyoti Nooran, Jaani, Bunny","Paon Ki Jutti","Universal Music India Pvt Ltd. – Distribution",8,8,5,"3861020"
9,"spotify:track:36N5awamOX6XX5pQn3aFXZ","Darshan Raval, Jonita Gandhi, Rochak Kohli, Gurpreet Saini","Soni Soni (From ""Ishq Vishk Rebound"")","Tips Industries Ltd",6,6,4,"3843001"
10,"spotify:track:7yDHHVKLbvDmVw1XXhDDIO","Vishal Mishra, Raj Shekhar","Pehle Bhi Main","T-Series",1,9,30,"3626113"
11,"spotify:track:0M0ANKNzmM4Odd7FNKghzW","Mitraz","Akhiyaan Gulaab (From ""Teri Baaton Mein Aisa Uljha Jiya"")","T-Series",2,10,22,"3533858"
12,"spotify:track:3FqtduiaqnFYvBgKuc6QWQ","Karan Aujla, Mxrci","Winning Speech","Karan Aujla",8,13,6,"3314033"
13,"spotify:track:2ceeTJAzKy295Fm0VsaXtE","Sachin-Jigar, Raghav Chaitanya, Varun Jain, Indraneel","Tum Se (From ""Teri Baaton Mein Aisa Uljha Jiya"")","T-Series",10,12,20,"3262556"
14,"spotify:track:0TL0LFcwIBF5eX7arDIKxY","Anuv Jain","Husn","Universal Music India Pvt. Ltd. (on behalf of Anuv Jain)",1,14,30,"3248405"
15,"spotify:track:3bmsaFp11I9pbicxzlStf3","Akshath","nadaaniyan","Universal Music India Pvt Ltd.",15,71,2,"3138892"
16,"spotify:track:5Zv9GfbJv0MVntvTGF0IwG","Ikka, Diljit Dosanjh, Badshah, Sez on the Beat","Jagga Jatt","T-Series",15,16,4,"2939232"
17,"spotify:track:1hA697u7e1jX2XM8sWA6Uy","Sachin-Jigar, Arijit Singh, Amitabh Bhattacharya","Apna Bana Le","Zee Music Company",1,17,53,"2922457"
18,"spotify:track:3xMHXmedL5Rvfxmiar9Ryv","Anirudh Ravichander, Arijit Singh, Shilpa Rao, Kumaar","Chaleya","T-Series",1,15,46,"2917683"
19,"spotify:track:0YQJoDL6f46J0n1rOVkpxJ","Karan Aujla, Ikky","Softly","WM Canada",4,24,45,"2879227"
20,"spotify:track:5PUXKVVVQ74C3gl5vKy9Li","Jasleen Royal, Arijit Singh, Dulquer Salmaan","Heeriye (feat. Arijit Singh)","Warner Music India",1,19,48,"2833437"
21,"spotify:track:6bmmHeCvZI92pRiTHxEdTC","Pritam, Arijit Singh, Irshad Kamil","O Maahi","T-Series",4,18,28,"2808553"
22,"spotify:track:0645eBDehHcqfiF15hscQV","Vishal Mishra, Rashmeet Kaur","Janiye (from the Netflix Film ""Chor Nikal Ke Bhaga"")","Netflix Music",5,25,51,"2710837"
23,"spotify:track:5ZLkihi6DVsHwDL3B8ym1t","Shubh","One Love","SHUBH",3,20,45,"2696519"
24,"spotify:track:4eBvRhTJ2AcxCsbfTUjoRp","Shubh","Cheques","SHUBH",1,22,57,"2661364"
25,"spotify:track:0UZLaEOSIc5kg0cc7eszqC","Vishal Mishra","Manjha","Desi Music Factory",16,28,109,"2536081"
26,"spotify:track:7n85x6EpfleVtbIjQGe0TD","Guru Randhawa, Babbu Maan, Sanjoy","Pagal","T-Series",23,23,4,"2481721"
27,"spotify:track:5npFBWhVs3VVlc0nY5xQMA","Sachin-Jigar, Arijit Singh","Tainu Khabar Nahi - From ""Munjya""","Zee Music Company",27,107,2,"2467679"
28,"spotify:track:6y5SuF4NxGkvwpAdqcAkD3","Pritam, Arijit Singh, Shreya Ghoshal, Shadab Faridi, Altamash Faridi, Amitabh Bhattacharya","Ve Kamleya","Saregama India Ltd",15,21,46,"2449894"
29,"spotify:track:2PvaburAUlhNHxVhw5lvOq","Arijit Singh","Humdard (From ""Ek Villain"")","T-Series",28,32,206,"2412111"
30,"spotify:track:3zSSCPpLZ5Oc8nelhhGjKz","AUR","Tu hai kahan","Sony Music Entertainment",1,29,37,"2396062"
31,"spotify:track:1hlbywc8Jhl1FFqJxAMabE","Faheem Abdullah, Rauhan Malik, Amir Ameer","Ishq","Artiste First",27,34,13,"2379223"
32,"spotify:track:2Fv2injs4qAm8mJBGaxVKU","Arijit Singh, Mithoon","Tujhe Kitna Chahne Lage (From ""Kabir Singh"")","T-Series",2,31,265,"2374328"
33,"spotify:track:2qSkIjg1o9h3YT9RAgYN75","Sabrina Carpenter","Espresso","Island Records",26,26,9,"2368781"
34,"spotify:track:3hfWgH0UEDW1uJNlj5gRW1","Ikka, Karan Aujla, Sanjoy","House Of Lies","T-Series",34,36,5,"2317388"
35,"spotify:track:1kDZSmw3mKQeAjcmPTLS3M","Pritam, Arijit Singh, Shreya Ghoshal, Amitabh Bhattacharya","Tum Kya Mile, Pt. 2","Saregama India Ltd",9,35,52,"2292855"
36,"spotify:track:7KQdgW7QzNd9oPoCzjCU76","Shubh","Bandana","Shubh",8,27,13,"2286545"
37,"spotify:track:2ZDOzySC2g3YF1p26TPzBt","Shreya Ghoshal, Devi Sri Prasad, Raqueeb Alam","Angaaron (From ""Pushpa 2 The Rule"") [HINDI]","T-Series",37,52,3,"2244628"
38,"spotify:track:6t9KM2EQD4H2KbrTgHGYf3","Sachin-Jigar, Jasmine Sandlas, Amitabh Bhattacharya","Taras - From ""Munjya""","Zee Music Company",38,72,2,"2235648"
39,"spotify:track:5BQePe9rcCJozHK3oPayYk","Shubh","MVP","Shubh",24,30,7,"2182746"
40,"spotify:track:45PA9lW7U5LYnlpGrdTyHY","Jasleen Royal, Ujjwal Kashyap","Sang Rahiyo (feat. Ujjwal Kashyap)","Warner Music India",21,33,16,"2180098"
41,"spotify:track:1y1rQTkWmrZdJmjwuK07GC","Vishal Mishra, Manoj Muntashir","Kaise Hua (From ""Kabir Singh"")","T-Series",5,38,263,"2169088"
42,"spotify:track:0rMeOAvbQZ2RTG4B6L1M4p","Darshan Raval","Asal Mein","Indie Music Label",21,40,161,"2108007"
43,"spotify:track:7eQl3Yqv35ioqUfveKHitE","Pritam, Mohit Chauhan, Irshad Kamil","Tum Se Hi","T-Series",27,37,223,"2098617"
44,"spotify:track:26elzgFl8tvajnDfeoY1YF","Darshan Raval, Prakriti Kakar","Mannat","Warner Music India",18,41,29,"2098273"
45,"spotify:track:0MTdYgTZ25sLCO6kVnDoje","Sai Abhyankkar, Sai Smriti","Aasa Kooda - From ""Think Indie""","Think Music",45,-1,1,"2016407"
46,"spotify:track:48Ix6ReYdJf2H4mKb3TIpj","Atif Aslam, Alisha Chinai, Pritam","Tera Hone Laga Hoon","Tips Industries Ltd",35,39,163,"2014181"
47,"spotify:track:2fsBaSK1551VvUD9Uvbb9Q","Darshan Raval, Prakriti Giri","Tu Hai","Warner Music India",47,47,8,"2012189"
48,"spotify:track:2IoZMG3RqiTmsy7Li3zGFg","Sachet Tandon, Parampara Tandon, Sachet-Parampara","Mere Sohneya (From ""Kabir Singh"")","T-Series",4,44,219,"1982879"
49,"spotify:track:73K33p4Vyz9koXGqmL5eFs","Sachet Tandon, Parampara Tandon, Kumaar, Sachet-Parampara","Malang Sajna","T-Series",4,48,75,"1964064"
50,"spotify:track:4UMIv5jd9gK98a39BQRD9X","Pritam, Arijit Singh, Amitabh Bhattacharya","Kesariya","Sony Music Entertainment India Pvt. Ltd.",1,42,102,"1946607"
51,"spotify:track:3nKQrVVlwbAQSnFbgZWdN0","Avvy Sra, Karan Aujla, Jaani","White Brown Black","Universal Music India Pvt Ltd. – Distribution",29,63,80,"1908448"
52,"spotify:track:5Tkf5CbtVYHA1SiKo1NrJE","Sachin-Jigar, Arijit Singh, Amitabha Bhattacharya","Phir Aur Kya Chahiye (From ""Zara Hatke Zara Bachke"")","Saregama",1,43,57,"1902219"
53,"spotify:track:2FCXQHugkoHE1K3tiDu8pu","Alka Yagnik, Arijit Singh","Agar Tum Saath Ho (From ""Tamasha"")","T-Series",4,56,265,"1900033"
54,"spotify:track:6c4Po8zyQjB4cR5XgLhcGb","Prabh Singh, Jay Trak, Rooh Sandhu","9:45","Prabh Singh Official",9,49,51,"1880741"
55,"spotify:track:209QxKVJzh2FLUmZHpYs4m","Badshah, Karan Aujla, Hiten","God Damn","Universal Music India Pvt Ltd.",15,50,14,"1871671"
56,"spotify:track:3F3ZuXYFXGM1V6pk3b3zmi","Diljit Dosanjh, thiarajxtt","Kinni Kinni","DILJIT DOSANJH",24,46,33,"1867726"
57,"spotify:track:1BpvuKIG7jK5EiTp2tv5z8","Shubh","King Shit","SHUBH",5,45,25,"1862543"
58,"spotify:track:0rlLBWFFTQiOWi963SH9bb","The Local Train","Choo Lo","The Local Train",51,60,53,"1851069"
59,"spotify:track:6IR6mzRO60hnMjNoq8rCPE","Raghav, Tanishk Bagchi, Asees Kaur","Teri Baaton Mein Aisa Uljha Jiya Title Song (From ""Teri Baaton Mein Aisa Uljha Jiya"")","T-Series",5,53,21,"1845616"
60,"spotify:track:1418IuVKQPTYqt7QNJ9RXN","King","Maan Meri Jaan","Warner Music India",1,55,89,"1824010"
61,"spotify:track:2C6CJGFLbisteRuY6Plb7b","Danny, Avvy Sra, Sagar","Ve Haaniyaan","Dreamiyata Music",10,51,21,"1788819"
62,"spotify:track:7uNnlVit5qDvfOje0pqICF","Mohit Chauhan, Suzanne D'Mello","Tum Ho","T-Series",62,69,4,"1776782"
63,"spotify:track:56zZ48jdyY2oDXHVnwg5Di","Mithoon, Arijit Singh","Tum Hi Ho","T-Series",44,59,178,"1768224"
64,"spotify:track:3HiobOOpSpMsi95WBKPBYk","Jeet Gannguli, Arijit Singh","Hamari Adhuri Kahani (Title Track)","Sony Music Entertainment India Pvt. Ltd.",56,65,137,"1755004"
65,"spotify:track:32VAw8DL9ixX5XSW2VLcZ4","Parmish Verma, PARDHAAN, Desi Crew","Aam Jahe Munde","Parmish Verma Films",20,67,51,"1715669"
66,"spotify:track:3yV2c3cYhkAwSsxAq6nRiv","Gajendra Verma","Mann Mera","Sony Music / Eros Now Music",26,77,169,"1690294"
67,"spotify:track:1zzejMGRYKP5XOa3FmzXfa","Sai Abhyankkar","Katchi Sera - From ""Think Indie""","Think Music",6,79,21,"1674356"
68,"spotify:track:0Jiaz0O4AqnJICa9PxHhaR","Darshan Raval","Mahiye Jinna Sohna","Warner Music India",2,57,53,"1661760"
69,"spotify:track:1smFN2CLqGROu0J0UyvDfL","Pritam, Arijit Singh","Shayad","Sony Music Entertainment India Pvt. Ltd.",1,68,232,"1654931"
70,"spotify:track:1YMLgvsQdE27r30q0fsLeV","Arijit Singh","Tera Fitoor","Tips Industries Ltd",61,61,51,"1648445"
71,"spotify:track:5G7pZ8G8NFvS1MQ9H4L7dC","Javed-Mohsin, Arijit Singh, Shreya Ghoshal, Kunaal Vermaa, Prashant Ingole","Pal","Sony Music Entertainment India Pvt. Ltd.",34,100,277,"1647777"
72,"spotify:track:1d5lpW3gUyq537iuyrb9Lf","Aditya Rikhari","Samjho Na","CollabX Productions",64,80,62,"1638573"
73,"spotify:track:18afrwnlrByAjhi3Ve0Ehn","Sushin Shyam, Pranavam Sasi, Vinayak Sasikumar","Armadham","Think Music",33,58,8,"1626011"
74,"spotify:track:5N3hjp1WNayUPZrA8kJmJP","Sabrina Carpenter","Please Please Please","Island Records",74,97,2,"1625871"
75,"spotify:track:0FBQ4NrrHUbR9kus7rzrOj","Atif Aslam","Dil Diyan Gallan","YRF Music",56,73,228,"1616933"
76,"spotify:track:610keNiNVTIkYD0CqeSerg","Cheema Y, Gur Sidhu","California Love","Brown Town Music",27,83,57,"1607176"
77,"spotify:track:3ZGJhN4unVspOqpwGvUL2W","Diljit Dosanjh","Lemonade","DILJIT DOSANJH",26,84,100,"1602780"
78,"spotify:track:7F8RNvTQlvbeBLeenycvN6","A.R. Rahman, Javed Ali, Mohit Chauhan","Kun Faya Kun","T-Series",60,78,116,"1581985"
79,"spotify:track:4tYxGORIOZSPLnZmrSpva7","NJ, BABY JEAN, Dabzee, Rzee","Ballaatha Jaathi","Universal Music India Pvt Ltd.",54,54,12,"1573816"
80,"spotify:track:1kTEGyqUJFgstwdgJFLqz1","Akashdeep Sengupta, Laqshay Kapoor, Kausar Munir, Suvarna Tiwari","Dil Se Dil Tak (From ""Bawaal"")","T-Series",38,88,21,"1573329"
81,"spotify:track:54PRUdMOYzglMGnsg9kIta","Raghav Chaitanya, Manoj Muntashir, Pritam","Hua Main (From ""ANIMAL"")","T-Series",6,74,37,"1567740"
82,"spotify:track:2JS0RFqBJvBtvG1GIsZmjW","Tanishk Bagchi, Kausar Munir, Jubin Nautiyal","Agar Ho Tum (From ""Mr. And Mrs. Mahi"")","Sony Music Entertainment India Pvt. Ltd.",59,64,4,"1567271"
83,"spotify:track:3WLJ7D5kh44K5eJ1NqZQ6W","Anuv Jain","Baarishein","Universal Music India Pvt. Ltd. (on behalf of Anuv Jain)",18,70,163,"1562630"
84,"spotify:track:2GXXZFUxYg2LvG8SR0byOE","Sachin-Jigar, Atif Aslam","Jeena Jeena","Eros Now Music",37,66,152,"1554177"
85,"spotify:track:5XeFesFbtLpXzIVDNQP22n","Arctic Monkeys","I Wanna Be Yours","Domino Recording Co",48,76,85,"1541574"
86,"spotify:track:5BKKKNwrebowaMoUdBaNby","King","Tu Aake Dekhle","Warner Music India",3,95,178,"1527360"
87,"spotify:track:4bD9z9qa4qg9BhryvYWB7c","Pritam, Tochi Raina, Rekha Bhardwaj","Kabira","T-Series",31,90,250,"1526689"
88,"spotify:track:4XxfOvudrnBRdlgzEaq1sd","Diljit Dosanjh","Born to Shine","FAMOUS STUDIOS INC",28,96,52,"1525606"
89,"spotify:track:1mbDRFQEnfgUHdHs3iBWMC","Ikka, Guru Randhawa, Sanjoy","Who’s That Girl","T-Series",89,-1,1,"1520872"
90,"spotify:track:4ITtnvLQ6SOA8XhiqkLa24","Sanju Rathod, G-SPXRK","Gulabi Sadi","Sanjay Rathod",11,62,15,"1516478"
91,"spotify:track:6H7fLdt0AeWpuxUKXuXWrx","Hariharan","Shree Hanuman Chalisa","T-Series",39,89,98,"1514709"
92,"spotify:track:5W7DOVGQLTigu09afW7QMT","Sidhu Moose Wala","295","Sidhu Moose Wala",1,81,124,"1505059"
93,"spotify:track:0YxKKO272sacGBJKjf6FnB","Jaani, B Praak","Saari Duniya Jalaa Denge","T-Series",3,75,31,"1494250"
94,"spotify:track:2ZD4aIEepqZsdxPxLSuUhm","Pritam, Arijit Singh, Amitabh Bhattacharya, Nikhita Gandhi","Tere Pyaar Mein","T-Series",5,93,73,"1476302"
95,"spotify:track:2oenSXLDbWVaaL7QjSGYj5","Diljit Dosanjh, Intense, Sultaan","Lalkara","DILJIT DOSANJH",22,92,38,"1472915"
96,"spotify:track:4VsP4Dm8gsibRxB5I2hEkw","Kaifi Khalil","Kahani Suno 2.0","1944121 Records DK",1,86,80,"1469326"
97,"spotify:track:0snQrp1VaY5Pj1YIHRJpRJ","Aditya A","Chaand Baaliyan","Sony Music Entertainment India Pvt. Ltd.",2,91,123,"1460564"
98,"spotify:track:6mTvwBzWTGDOVeCNQEqtOE","Amaal Mallik, Arijit Singh, Tulsi Kumar","Soch Na Sake","T-Series",64,98,78,"1448292"
99,"spotify:track:5WXQbgwGwyauXOqswlEeQY","Tanishk Bagchi, Arijit Singh, Asees Kaur","Bolna (From ""Kapoor & Sons (Since 1921)"")","Sony Music Entertainment India Pvt. Ltd.",59,105,70,"1444288"
100,"spotify:track:5vGiuYFSGekGLgbxhV1rD5","Atif Aslam, Pritam","Tu Jaane Na","Tips Industries Ltd",73,99,143,"1427488"
101,"spotify:track:77OQsnAirm7Ke8EGgBeOxz","Anirudh Ravichander","Kadharalz","Sony Music Entertainment India Pvt. Ltd.",87,87,3,"1417640"
102,"spotify:track:6udC4b4jOSnHb9ItnXgKLR","Sachin-Jigar, Shreya Ghoshal, Tochi Raina","Saibo","Sony Music Entertainment India Pvt. Ltd.",31,123,191,"1415657"
103,"spotify:track:4uK0M8AI6gyFmyzUneQpbi","A.R. Rahman, Arijit Singh, Shashaa Tirupati","Rait Zara Si (From ""Atrangi Re"")","T-Series",12,114,125,"1405701"
104,"spotify:track:4wIWWEhbdgKAxhR68eE0Ye","Arijit Singh, Chinmayi","Mast Magan (From ""2 States"")","T-Series",45,113,175,"1390919"
105,"spotify:track:5jAi1HXmSUd5poIEOQkYSy","Pritam, Arijit Singh, Jonita Gandhi, Ranveer Singh, Amitabh Bhattacharya","What Jhumka ?","Saregama India Ltd",6,117,50,"1375021"
106,"spotify:track:0l6g8Z8mqGbGXFOjigYetD","Pritam, Arijit Singh","Hawayein","Sony Music Entertainment India Pvt. Ltd.",51,124,142,"1373506"
107,"spotify:track:0tgVpDi06FyKpA1z0VMD4v","Ed Sheeran","Perfect","Atlantic Records UK",29,102,219,"1365703"
108,"spotify:track:72vuBPMhwFNlSYpTSf6fVD","Diljit Dosanjh, Sia, Greg Kurstin","Hass Hass","Warner Music India",5,106,35,"1360596"
109,"spotify:track:1feANd8EfcDP5UqSvbheM3","Sachet Tandon, Sachet-Parampara","Bekhayali (From ""Kabir Singh"")","T-Series",1,127,233,"1360532"
110,"spotify:track:29m79w9xPMH4YCD6r8JSmV","AP Dhillon, Gurinder Gill, Intense","Excuses","RUN-UP RECORDS",1,109,140,"1346646"
111,"spotify:track:0gPgdRfB4jdGrlyXS0Vx78","Vishal-Shekhar, KK, Shilpa Rao, Anvita Dutt Guptan","Khuda Jaane","YRF Music",37,112,90,"1346221"
112,"spotify:track:11qnwt18ZckPqchzK2I3U7","Mithoon, Arijit Singh, Sayeed Quadri","Dil Jhoom","Zee Music Company",93,129,20,"1342454"
113,"spotify:track:1UWacd8x8tPPwmrPB1MoBI","Pritam, Arijit Singh","Ae Dil Hai Mushkil Title Track","Sony Music Entertainment India Pvt. Ltd.",79,118,230,"1341763"
114,"spotify:track:2RgvvnMwtP0R2OkVZmFvnV","KK","Ajab Si (From ""Om Shanti Om"")","T-Series",34,110,129,"1341402"
115,"spotify:track:6fScgF2Y63ScU73nYju0ny","Atif Aslam, Arko","O Saathi","T-Series",58,115,100,"1326530"
116,"spotify:track:32765xcLM1fd6wQIpkN9A0","Ami Mishra, Kunaal Vermaa","Hasi - Male Version","Sony Music Entertainment India Pvt. Ltd.",77,104,52,"1325414"
117,"spotify:track:2tjWCe2W7sgvS3C8NHcdtI","Akhil, Dhvani Bhanushali, Kunaal Vermaa, Abhijit Vaghani","Duniyaa (From ""Luka Chuppi"")","T-Series",1,116,279,"1324052"
118,"spotify:track:7CyPwkp0oE8Ro9Dd5CUDjW","The Weeknd, JENNIE, Lily-Rose Depp","One Of The Girls (with JENNIE, Lily Rose Depp)","XO / Republic Records",98,103,25,"1323602"
119,"spotify:track:3txE0SZnwamBhYB2ZQtHwU","Karan Aujla, Mxrci","Goin' Off","Rehaan Records",28,94,7,"1316834"
120,"spotify:track:4VosVUajzm6nzGlSb6nP3L","Parmish Verma, Paradox","Check It Out","SDA Studios",19,131,50,"1316767"
121,"spotify:track:2mFXx4D49RdesixfLSsoU0","Dabzee, Bibin Ashok, Vaisakh Sugunan","Vatteppam (From ""Mandakini"")","Saregama India Ltd",85,85,4,"1312911"
122,"spotify:track:3bQsp4Vr9Rg4fNCx6HPOgX","Anuv Jain","Alag Aasmaan","Universal Music India Pvt. Ltd. (on behalf of Anuv Jain)",30,101,41,"1307058"
123,"spotify:track:2ujhrcDEUpVOPU1Vi3ofil","Ikka, Sunidhi Chauhan, Sanjoy","Bhari Mehfil","T-Series",123,-1,1,"1302084"
124,"spotify:track:6ygiy70ujkNOYXM1tQuMNe","Karan Aujla, Ikky, Preston Pablo","Admirin' You (feat. Preston Pablo)","WM Canada",24,138,47,"1301634"
125,"spotify:track:4OcvkkpF3xmyCGGY5IBlgi","Akhil Sachdeva, Tulsi Kumar","Tera Ban Jaunga (From ""Kabir Singh"")","T-Series",4,135,250,"1288796"
126,"spotify:track:2IEhtVeM9TVql8fZdKdlo9","Atif Aslam, Chinmayi, Pritam","Main Rang Sharbaton Ka","Tips Industries Ltd",126,169,25,"1285712"
127,"spotify:track:7MXVkk9YMctZqd1Srtv4MB","The Weeknd, Daft Punk","Starboy","Universal Republic Records",12,120,152,"1285625"
128,"spotify:track:7yyCCfalLx9F8TbMo5jH03","Rasraj Ji Maharaj","Bajrang Baan-Lofi","Vianet Media",89,130,19,"1284911"
129,"spotify:track:6AI3ezQ4o3HUoP6Dhudph3","Kendrick Lamar","Not Like Us","Kendrick Lamar, under exclusive license to Interscope Records",129,-1,3,"1281251"
130,"spotify:track:42VsgItocQwOQC3XWZ8JNA","Travis Scott, Playboi Carti","FE!N (feat. Playboi Carti)","Cactus Jack/Epic",108,111,7,"1271803"
131,"spotify:track:6oz1L5jcqZWYuId7nxvIan","Shubh","Still Rollin","SHUBH",4,125,58,"1270898"
132,"spotify:track:5eSoySxUnx3xsm0FHFgHiv","Hiphop Tamizha, Kharesma Ravichandran, Srinisha Jayaseelan","Achacho - From ""Aranmanai 4""","Think Music",85,122,6,"1267277"
133,"spotify:track:4u0D2jZ20wQaEMHBSqsDnZ","King","Tu Jaana Na Piya","Warner Music India",15,141,35,"1255616"
134,"spotify:track:6egfWbtFFhMToV2DvmEzmo","Bunny, Hunny, Sagar","Tu Hain Toh (From ""Mr. And Mrs. Mahi"")","Sony Music Entertainment India Pvt. Ltd.",134,-1,1,"1239931"
135,"spotify:track:1L3Nsi7YXtBxTdnbqektia","Darshan Raval","Hawa Banke","Indie Music Label",26,160,74,"1235968"
136,"spotify:track:2eAvDnpXP5W0cVtiI0PUxV","Ruth B.","Dandelions","Columbia",14,140,135,"1233164"
137,"spotify:track:08Isz2ETWSBhvIl8UpKYsp","Shubh","No Love","SHUBH",2,139,120,"1220357"
138,"spotify:track:5llaVhaIoowKT3fqf2NfPO","Atif Aslam, Pritam","Pehli Nazar Mein","Tips Industries Ltd",126,145,16,"1218180"
139,"spotify:track:3qhlB30KknSejmIvZZLjOD","Djo","End of Beginning","Djo",105,132,14,"1214714"
140,"spotify:track:7fW9J3EpVWVN1ouv0slAs0","KK","Kya Mujhe Pyar Hai (From ""Woh Lamhe"")","T-Series",42,146,73,"1209641"
141,"spotify:track:72zHuDxFQTjbL51qJQSA7j","Jasleen Royal, B Praak, Romy","Ranjha (From ""Shershaah"")","Sony Music Entertainment India Pvt. Ltd.",1,133,151,"1207638"
142,"spotify:track:5O2P9iiztwhomNh8xkR9lJ","One Direction","Night Changes","Syco Music",22,128,163,"1203800"
143,"spotify:track:4yOSJ7Gimca2OudwDAXLSu","Sachet Tandon, Parampara Tandon, Irshad Kamil","Mera Saaya","T-Series",143,-1,1,"1202424"
144,"spotify:track:1FEiijYPJtyswChfcpv3p0","Lana Del Rey","Summertime Sadness","Polydor Records",137,137,11,"1193531"
145,"spotify:track:5rpCUsEfBLIumvrxrahnKF","Hasan Raheem, Umair, Talwiinder","Wishes","1698613 Records DK2",60,134,29,"1182786"
146,"spotify:track:2cPUB8EOT6AfJ8oxhyoNXL","Pritam, Javed Bashir","Ye Tune Kya Kiya","T-Series",139,142,19,"1181863"
147,"spotify:track:4Tkb7zsDmsawB7S5TpKQV1","Atif Aslam, Shiraz Uppal","Pehli Dafa","T-Series",121,121,34,"1176650"
148,"spotify:track:0ojpEubhy4JNeVftmVuiN7","Vishal Mishra, Armaan Malik","Pehla Pyaar","T-Series",11,148,161,"1173938"
149,"spotify:track:4blqlsA1uf2d2I40E90EUC","Pritam, Arijit Singh, Shilpa Rao","Tere Hawaale (From ""Laal Singh Chaddha"")","T-Series",11,143,70,"1173645"
150,"spotify:track:2S6N9pbnkhQRyAx80HmF79","Mohammed Irfan","Banjaara (From ""Ek Villain"")","T-Series",148,150,19,"1172420"
151,"spotify:track:52itZ0w0CydihB2JCZEIft","Pritam, Mohit Chauhan, Irshad Kamil","Pee Loon","T-Series",142,159,20,"1162979"
152,"spotify:track:7Imk0IG6S5GA5iYWkjmMW5","Palak Muchhal, Arijit Singh","Chahun Main Ya Naa (From ""Aashiqui 2"")","T-Series",135,157,37,"1157765"
153,"spotify:track:5Gy67YHzPZTk9Q0D73LAGH","Jeet Gannguli, Arijit Singh","Khamoshiyan (From ""Khamoshiyan"")","Sony Music Entertainment India Pvt. Ltd.",90,156,61,"1156221"
154,"spotify:track:2dMlTWQbY9tfPFLIqAa7Tv","Kaifi Khalil","Kahani Meri","Novice Records LLC",104,167,8,"1155852"
155,"spotify:track:0xIuPDzJSnJywALez8dwKR","AP Dhillon","With You","Mass Appeal India",2,152,46,"1154603"
156,"spotify:track:3ygfdwvBJ2Y5XhJiiHFFZE","Sachet Tandon","Maiyya Mainu","Zee Music Company",5,151,89,"1152807"
157,"spotify:track:2gKNWPBrI2IRBl2RRUtoEb","Shreya Ghoshal, Devi Sri Prasad, Chandra Bose","Sooseki (From ""Pushpa 2 The Rule"") [TELUGU]","T-Series",91,108,4,"1149706"
158,"spotify:track:5O932cZmzOZGOGZz9RHx20","Pritam, Arijit Singh","Khairiyat","T-Series",1,181,250,"1147750"
159,"spotify:track:7G5wpuR61ABrT7R1snos7C","Pritam, Arijit Singh","Kalank - Title Track","Zee Music Company",5,154,235,"1146300"
160,"spotify:track:5ivRSlOhVIXN2QMzqgsX0s","The Local Train","Aaoge Tum Kabhi","The Local Train",160,170,2,"1146050"
161,"spotify:track:3QJsSWa0Xo8MfaRn1gr4Be","Isabel LaRosa","favorite","Slumbo Labs/RCA Records",77,144,11,"1140434"
162,"spotify:track:18YHbIhrleUkKKj2DvEp79","Pritam, KK","Zara Sa","Sony Music Entertainment India Pvt. Ltd.",33,173,70,"1135836"
163,"spotify:track:0dJacN6K3mSGLE9p7QE0lO","KK","Beete Lamhein (From ""The Train"")","T-Series",75,163,12,"1135634"
164,"spotify:track:6GZIAVSu0YXF7FYzyRl1MP","Sachin-Jigar, Varun Jain, Shadab Faridi, Altamash Faridi, Amitabh Bhattacharya","Tere Vaaste (From ""Zara Hatke Zara Bachke"")","Saregama",1,155,57,"1130858"
165,"spotify:track:2pIoyDWZV5OSW0xd6n41xV","Pritam, Arijit Singh, Swanand Kirkire, IP Singh","Lutt Putt Gaya","T-Series",22,149,31,"1121710"
166,"spotify:track:64r6z0P3RnhpTGdkA7p5Os","Darshan Raval","Ek Tarfa","Indie Music Label",33,183,102,"1121463"
167,"spotify:track:4SJMuaIYcBS8ke96lDYOsw","Karan Aujla","On Top","Karan Aujla Music",17,180,52,"1115366"
168,"spotify:track:2rOnSn2piaqLAlYjtfUBlY","Tanishk Bagchi, Jubin Nautiyal, Asees Kaur","Raataan Lambiyan (From ""Shershaah"")","Sony Music Entertainment India Pvt. Ltd.",1,161,152,"1114398"
169,"spotify:track:7IWcVmNCt0V1KHoYQP9ZoR","Thaman S, Sri Krishna, Sahithi Chaganti, Mahesh Babu, Saraswati Putra Ramajogayya Sastry","Kurchi Madathapetti","Aditya Music",34,147,25,"1110467"
170,"spotify:track:46QbY78ha62aiu6gBgC7lS","Diljit Dosanjh","G.O.A.T.","FAMOUS STUDIOS INC",1,-1,38,"1109239"
171,"spotify:track:4RCd3Gdtt3dNedof64hqRD","Mohammed Irfan, Arijit Singh, Saim Bhat","Phir Mohabbat (From ""Murder 2"")","T-Series",160,168,17,"1103290"
172,"spotify:track:18gi2IxbZ3Ugom7wTRkohf","Tulsi Kumar, KK","Piya Aaye Na (From ""Aashiqui 2"")","T-Series",172,176,5,"1098270"
173,"spotify:track:5SftJq4uVpajyYC1Gs0RFF","Amit Trivedi, Arijit Singh, Nikhita Gandhi","Qaafirana","Zee Music Company",40,164,173,"1098239"
174,"spotify:track:3wz2vWhYnnBoFmgMkqtzLy","Chani Nattan, Inderpal Moga","Daku","Kharku Life Records",5,174,97,"1095809"
175,"spotify:track:7aE1lfskJLMHQnzCCP1zsV","Akhil Sachdeva, Mansheel Gujral","Humsafar (From ""Badrinath Ki Dulhania"")","T-Series",158,182,35,"1091067"
176,"spotify:track:3APdIdF8H0jsxSuGOqXedS","Rashid Ali","Kabhi Kabhi Aditi","T-Series",73,171,122,"1089532"
177,"spotify:track:2qxmye6gAegTMjLKEBoR3d","Alec Benjamin","Let Me Down Slowly","2018",34,136,220,"1087604"
178,"spotify:track:0tpwqQhdfJXRcUDSNRjb9O","Arijit Singh, Neeti Mohan, Rashmi Virag","Mere Yaaraa (From ""Sooryavanshi"")","T-Series",20,187,99,"1072294"
179,"spotify:track:5DgY6Ab0vpyUMKnY9ubFOF","Anirudh Ravichander, Super Subu","Hukum - Thalaivar Alappara","Sun Pictures",1,153,50,"1062983"
180,"spotify:track:6O1RAYwmOqkcoJQr7J9SFJ","Manan Bhardwaj, Arijit Singh","Oonchi Oonchi Deewarein","T-Series",52,178,35,"1060004"
181,"spotify:track:6Z394Nd4gW6Ts9hmu3NUjx","A.R. Rahman, Mohit Chauhan","Nadaan Parinde","T-Series",181,184,2,"1054654"
182,"spotify:track:3sqRODOZ1Z6hR4F2tnFAlg","Maninder Buttar","Sakhiyaan","Ishtar Punjabi",20,177,221,"1053931"
183,"spotify:track:6f3ANRNQ8nCiPZ6VqXqq93","Amaal Mallik, Armaan Malik, Rashmi Virag","Main Rahoon Ya Na Rahoon","T-Series",141,-1,17,"1052164"
184,"spotify:track:3iFYJMrRS0fLrwDNVbqNF0","Darshan Raval","Saajan Ve","Warner Music India",39,185,25,"1051569"
185,"spotify:track:6EB454nVg2u6sbeCvWAPej","Sam C.S., Anirudh Ravichander, Shakthisree Gopalan","Yaanji - From ""Vikram Vedha""","Think Music",122,198,35,"1045887"
186,"spotify:track:0R1AZYXc34nfMaiengrkRc","Sidhu Moose Wala, Sunny Malton, Offgrid","410","Sunny Malton",17,166,11,"1045686"
187,"spotify:track:0rk2X5TAhraBC5aCIXK2Rq","Jawad Ahmad, Shaarib Toshi, Arijit Singh, Shreya Ghoshal","Samjhawan","Sony Music Entertainment India Pvt. Ltd.",70,-1,162,"1042512"
188,"spotify:track:4LzjjNaJfnbPtJFYfMC8dc","Akhil Sachdeva, Kartik Dev","Saanware","PlayDMF",56,186,18,"1041151"
189,"spotify:track:567e29TDzLwZwfDuEpGTwo","The Kid LAROI, Justin Bieber","STAY (with Justin Bieber)","Columbia",1,175,139,"1041082"
190,"spotify:track:2k0D2OXWXwuwBPXLQQYmZx","Gurnazar, Rahat Fateh Ali Khan, Kartik Dev","Dost Banke","EYP Creation Pvt Ltd (Distro)",190,-1,1,"1037983"
191,"spotify:track:60nxFG3LCviPvdTX5JU2iB","Arijit Singh, Jonita Gandhi, Irshad Kamil","Vida Karo","Saregama India Ltd",50,-1,8,"1031518"
192,"spotify:track:7m4CgL81VVIHaaiSxyH922","Yo Yo Honey Singh","Desi Kalakaar","T-Series",13,-1,29,"1030330"
