rank,uri,artist_names,track_name,source,peak_rank,previous_rank,weeks_on_chart,streams
190,"spotify:track:6GH5qLVhOvbgRvqFdAKQ9a","Thalapathy Vijay, Yuvan Shankar Raja, Madan Karky","Whistle Podu (From ""The Greatest Of All Time"")","T-Series",141,184,4,"1132710"
191,"spotify:track:3yxUi5nDZSWcYKi1C2xmLd","Udit Narayan, Alka Yagnik, Lijo George-Dj Chetas, Anu Malik, Javed Akhtar","Mere Mehboob Mere Sanam (From ""Bad Newz"")","Saregama India Ltd",46,-1,10,"1130013"
192,"spotify:track:08Isz2ETWSBhvIl8UpKYsp","Shubh","No Love","SHUBH",2,190,134,"1128954"
193,"spotify:track:3hB9lDLyAClYVZivMMl20N","Prateek Kuhad","Co2","Elektra (NEK)",193,200,2,"1126412"
194,"spotify:track:0xIuPDzJSnJywALez8dwKR","AP Dhillon","With You","Mass Appeal India",2,198,60,"1123757"
195,"spotify:track:7yyCCfalLx9F8TbMo5jH03","Rasraj Ji Maharaj","Bajrang Baan-Lofi","Vianet Media",89,195,33,"1122718"
196,"spotify:track:5PvwPy5eRO8BPwpRzCHK3D","Ankit Tiwari","Sunn Raha Hai (Male Version)","T-Series",146,-1,6,"1118803"
197,"spotify:track:2fsBaSK1551VvUD9Uvbb9Q","Darshan Raval, Prakriti Giri","Tu Hai","Warner Music India",47,149,22,"1111066"
198,"spotify:track:0YxKKO272sacGBJKjf6FnB","Jaani, B Praak","Saari Duniya Jalaa Denge","T-Series",3,182,45,"1108497"
199,"spotify:track:4RCd3Gdtt3dNedof64hqRD","Mohammed Irfan, Arijit Singh, Saim Bhat","Phir Mohabbat (From ""Murder 2"")","T-Series",135,196,31,"1104004"
200,"spotify:track:0TrsGqtFXMWCrF9pPMICY9","Jyoti Nooran, Jaani, Bunny","Paon Ki Jutti","Universal Music India Pvt Ltd. – Distribution",8,173,19,"1102069"
