rank,uri,artist_names,track_name,source,peak_rank,previous_rank,weeks_on_chart,streams
192,"spotify:track:5rpCUsEfBLIumvrxrahnKF","Hasan Raheem, Umair, Talwiinder","Wishes","1698613 Records DK2",60,145,30,"1036975"
193,"spotify:track:6Z394Nd4gW6Ts9hmu3NUjx","A.R. Rahman, Mohit Chauhan","Nadaan Parinde","T-Series",181,181,3,"1033116"
194,"spotify:track:1L3Nsi7YXtBxTdnbqektia","Darshan Raval","Hawa Banke","Indie Music Label",26,135,75,"1030453"
195,"spotify:track:6EB454nVg2u6sbeCvWAPej","Sam C.S., Anirudh Ravichander, Shakthisree Gopalan","Yaanji - From ""Vikram Vedha""","Think Music",122,185,36,"1028392"
196,"spotify:track:4MU4Kfkd9EnkArK2ocQyqK","Arijit Singh, Harshdeep Kaur","Zaalima","Zee Music Company",78,195,70,"1023963"
197,"spotify:track:3qrdLVOClRU4yPkcXZ7c5u","Ayushmann Khurrana, Tanishk-Vayu","Mere Liye Tum Kaafi Ho (From ""Shubh Mangal Zyada Saavdhan"")","T-Series",11,-1,221,"1023377"
198,"spotify:track:5PvwPy5eRO8BPwpRzCHK3D","Ankit Tiwari","Sunn Raha Hai (Male Version)","T-Series",198,-1,1,"1019160"
199,"spotify:track:6b2WJDzGt5X8dYfpkWtvXW","Anirudh Ravichander, Ramajogayya Sastry","Fear Song (From ""Devara Part 1"") [Telugu]","T-Series",170,-1,4,"1016572"
200,"spotify:track:0tpwqQhdfJXRcUDSNRjb9O","Arijit Singh, Neeti Mohan, Rashmi Virag","Mere Yaaraa (From ""Sooryavanshi"")","T-Series",20,178,100,"1015927"
