rank,uri,artist_names,track_name,source,peak_rank,previous_rank,weeks_on_chart,streams
1,"spotify:track:5zCnGtCl5Ac5zlFHXaZmhy","Ram Sampath, Arijit Singh, Prashant Pandey","Sajni (From ""Laapataa Ladies"")","T-Series",1,19,2,"6850885"
2,"spotify:track:1tf2iody5iRLYYPDSBpzRc","Badshah, Arijit Singh","Soulmate","Universal Music India Pvt Ltd.",2,2,8,"5716177"
3,"spotify:track:7yDHHVKLbvDmVw1XXhDDIO","Vishal Mishra, Raj Shekhar","Pehle Bhi Main","T-Series",1,1,24,"5192531"
4,"spotify:track:3yHyiUDJdz02FZ6jfUbsmY","Arijit Singh, Shreyas Puranik, Siddharth - Garima","Satranga (From ""ANIMAL"")","T-Series",2,5,29,"5007665"
5,"spotify:track:1eZefeDb8uOsjvcbl1fJrG","Diljit Dosanjh, Badshah, Raj Ranjodh","Naina (From ""Crew"")","Tips Industries Ltd",3,3,10,"4749421"
6,"spotify:track:0M0ANKNzmM4Odd7FNKghzW","Mitraz","Akhiyaan Gulaab (From ""Teri Baaton Mein Aisa Uljha Jiya"")","T-Series",2,4,16,"4654454"
7,"spotify:track:1a1xLj9W8libnO9PvJf6ao","Sushin Shyam, Dabzee, Vinayak Sasikumar","Illuminati","Think Music",3,6,6,"4584205"
8,"spotify:track:0TL0LFcwIBF5eX7arDIKxY","Anuv Jain","Husn","Universal Music India Pvt. Ltd. (on behalf of Anuv Jain)",1,7,24,"3531452"
9,"spotify:track:3xMHXmedL5Rvfxmiar9Ryv","Anirudh Ravichander, Arijit Singh, Shilpa Rao, Kumaar","Chaleya","T-Series",1,9,40,"3410068"
10,"spotify:track:7KQdgW7QzNd9oPoCzjCU76","Shubh","Bandana","Shubh",8,8,7,"3267324"
11,"spotify:track:5PUXKVVVQ74C3gl5vKy9Li","Jasleen Royal, Arijit Singh, Dulquer Salmaan","Heeriye (feat. Arijit Singh)","Warner Music India",1,11,42,"3180436"
12,"spotify:track:6bmmHeCvZI92pRiTHxEdTC","Pritam, Arijit Singh, Irshad Kamil","O Maahi","T-Series",4,12,22,"3092502"
13,"spotify:track:3zSSCPpLZ5Oc8nelhhGjKz","AUR","Tu hai kahan","Sony Music Entertainment",1,10,31,"3090638"
14,"spotify:track:1hA697u7e1jX2XM8sWA6Uy","Sachin-Jigar, Arijit Singh, Amitabh Bhattacharya","Apna Bana Le","Zee Music Company",1,13,47,"2803133"
15,"spotify:track:5ZLkihi6DVsHwDL3B8ym1t","Shubh","One Love","SHUBH",3,17,39,"2788381"
16,"spotify:track:2ceeTJAzKy295Fm0VsaXtE","Sachin-Jigar, Raghav Chaitanya, Varun Jain, Indraneel","Tum Se (From ""Teri Baaton Mein Aisa Uljha Jiya"")","T-Series",14,14,14,"2768322"
17,"spotify:track:2q9lPN7CT92W1Ry77j2acn","Pritam, Arijit Singh, Shreya Ghoshal, Shadab Faridi, Altamash Faridi, Amitabh Bhattacharya","Ve Kamleya","Saregama India Ltd",15,15,40,"2725905"
18,"spotify:track:4eBvRhTJ2AcxCsbfTUjoRp","Shubh","Cheques","SHUBH",1,20,51,"2647226"
19,"spotify:track:4ITtnvLQ6SOA8XhiqkLa24","Sanju Rathod, G-SPXRK","Gulabi Sadi","Sanjay Rathod",11,18,9,"2610064"
20,"spotify:track:0645eBDehHcqfiF15hscQV","Vishal Mishra, Rashmeet Kaur","Janiye (from the Netflix Film ""Chor Nikal Ke Bhaga"")","Netflix Music",5,22,45,"2564961"
21,"spotify:track:6IR6mzRO60hnMjNoq8rCPE","Raghav, Tanishk Bagchi, Asees Kaur","Teri Baaton Mein Aisa Uljha Jiya Title Song (From ""Teri Baaton Mein Aisa Uljha Jiya"")","T-Series",5,16,15,"2564566"
22,"spotify:track:0UZLaEOSIc5kg0cc7eszqC","Vishal Mishra","Manjha","Desi Music Factory",16,25,103,"2438445"
23,"spotify:track:45PA9lW7U5LYnlpGrdTyHY","Jasleen Royal, Ujjwal Kashyap","Sang Rahiyo (feat. Ujjwal Kashyap)","Warner Music India",21,21,10,"2413021"
24,"spotify:track:73K33p4Vyz9koXGqmL5eFs","Sachet Tandon, Parampara Tandon, Kumaar, Sachet-Parampara","Malang Sajna","T-Series",4,24,69,"2384156"
25,"spotify:track:1418IuVKQPTYqt7QNJ9RXN","King","Maan Meri Jaan","Warner Music India",1,28,83,"2381589"
26,"spotify:track:4UMIv5jd9gK98a39BQRD9X","Pritam, Arijit Singh, Amitabh Bhattacharya","Kesariya","Sony Music Entertainment India Pvt. Ltd.",1,49,96,"2327427"
27,"spotify:track:7hDoxkN20lLb06zifzYnD2","Faheem Abdullah, Rauhan Malik, Amir Ameer","Ishq - From ""Lost;Found""","Artiste First",27,30,7,"2260290"
28,"spotify:track:7eQl3Yqv35ioqUfveKHitE","Pritam, Mohit Chauhan, Irshad Kamil","Tum Se Hi","T-Series",27,40,217,"2256640"
29,"spotify:track:0rMeOAvbQZ2RTG4B6L1M4p","Darshan Raval","Asal Mein","Indie Music Label",21,32,155,"2251702"
30,"spotify:track:2C6CJGFLbisteRuY6Plb7b","Danny, Avvy Sra, Sagar","Ve Haaniyaan","Dreamiyata Music",10,23,15,"2245487"
31,"spotify:track:2Fv2injs4qAm8mJBGaxVKU","Arijit Singh, Mithoon","Tujhe Kitna Chahne Lage (From ""Kabir Singh"")","T-Series",2,37,259,"2238831"
32,"spotify:track:6c4Po8zyQjB4cR5XgLhcGb","Prabh Singh, Jay Trak, Rooh Sandhu","9:45","Prabh Singh Official",9,29,45,"2229547"
33,"spotify:track:1y1rQTkWmrZdJmjwuK07GC","Vishal Mishra, Manoj Muntashir","Kaise Hua (From ""Kabir Singh"")","T-Series",5,31,257,"2182764"
34,"spotify:track:209QxKVJzh2FLUmZHpYs4m","Badshah, Karan Aujla, Hiten","God Damn","Universal Music India Pvt Ltd.",15,26,8,"2177901"
35,"spotify:track:5Tkf5CbtVYHA1SiKo1NrJE","Sachin-Jigar, Arijit Singh, Amitabha Bhattacharya","Phir Aur Kya Chahiye (From ""Zara Hatke Zara Bachke"")","Saregama",1,34,51,"2175388"
36,"spotify:track:26elzgFl8tvajnDfeoY1YF","Darshan Raval, Prakriti Kakar","Mannat","Warner Music India",18,27,23,"2159466"
37,"spotify:track:0YQJoDL6f46J0n1rOVkpxJ","Karan Aujla, Ikky","Softly","WM Canada",4,33,39,"2115171"
38,"spotify:track:1smFN2CLqGROu0J0UyvDfL","Pritam, Arijit Singh","Shayad","Sony Music Entertainment India Pvt. Ltd.",1,44,226,"2104557"
39,"spotify:track:1BpvuKIG7jK5EiTp2tv5z8","Shubh","King Shit","SHUBH",5,36,19,"2046862"
40,"spotify:track:1fGXJZny7HUQnLKwttxmYw","Vishal Mishra, Raj Shekhar","Marham (Pehle Bhi Main) [From ""ANIMAL""]","T-Series",18,43,18,"2022794"
41,"spotify:track:38h4tmH1AWBVuemWAy4R4y","Pritam, Arijit Singh, Shreya Ghoshal, Amitabh Bhattacharya","Tum Kya Mile, Pt. 2","Saregama India Ltd",9,39,46,"2020004"
42,"spotify:track:3txE0SZnwamBhYB2ZQtHwU","Karan Aujla, Mxrci","Goin' Off","Rehaan Records",42,-1,1,"2014271"
43,"spotify:track:2PvaburAUlhNHxVhw5lvOq","Arijit Singh","Humdard (From ""Ek Villain"")","T-Series",28,54,200,"1972377"
44,"spotify:track:32VAw8DL9ixX5XSW2VLcZ4","Parmish Verma, PARDHAAN, Desi Crew","Aam Jahe Munde","Parmish Verma Films",20,38,45,"1953314"
45,"spotify:track:0Jiaz0O4AqnJICa9PxHhaR","Darshan Raval","Mahiye Jinna Sohna","Warner Music India",2,35,47,"1942522"
46,"spotify:track:3F3ZuXYFXGM1V6pk3b3zmi","Diljit Dosanjh, thiarajxtt","Kinni Kinni","DILJIT DOSANJH",24,42,27,"1873005"
47,"spotify:track:3IowQIKCU7GfyWDKIVE4WG","Sushin Shyam, Sreenath Bhasi, Vinayak Sasikumar","Jaada","Think Music",47,66,5,"1854698"
48,"spotify:track:2IoZMG3RqiTmsy7Li3zGFg","Sachet Tandon, Parampara Tandon, Sachet-Parampara","Mere Sohneya (From ""Kabir Singh"")","T-Series",4,46,213,"1824410"
49,"spotify:track:18afrwnlrByAjhi3Ve0Ehn","Sushin Shyam, Pranavam Sasi, Vinayak Sasikumar","Armadham","Think Music",49,111,2,"1816237"
50,"spotify:track:1zzejMGRYKP5XOa3FmzXfa","Sai Abhyankkar","Katchi Sera - From ""Think Indie""","Think Music",6,45,15,"1790596"
51,"spotify:track:54PRUdMOYzglMGnsg9kIta","Raghav Chaitanya, Manoj Muntashir, Pritam","Hua Main (From ""ANIMAL"")","T-Series",6,47,31,"1781762"
52,"spotify:track:2ZD4aIEepqZsdxPxLSuUhm","Pritam, Arijit Singh, Amitabh Bhattacharya, Nikhita Gandhi","Tere Pyaar Mein","T-Series",5,53,67,"1767128"
53,"spotify:track:2lX53kXvYnvpV8Vqfe4S7s","Aashir Wajahat, NAYEL, Nehaal Naseem","Sadqay","Sony Music Entertainment",15,41,12,"1741580"
54,"spotify:track:56zZ48jdyY2oDXHVnwg5Di","Mithoon, Arijit Singh","Tum Hi Ho","T-Series",44,52,172,"1722803"
55,"spotify:track:6udC4b4jOSnHb9ItnXgKLR","Sachin-Jigar, Shreya Ghoshal, Tochi Raina","Saibo","Sony Music Entertainment India Pvt. Ltd.",31,75,185,"1720326"
56,"spotify:track:4VsP4Dm8gsibRxB5I2hEkw","Kaifi Khalil","Kahani Suno 2.0","1944121 Records DK",1,51,74,"1713035"
57,"spotify:track:5G7pZ8G8NFvS1MQ9H4L7dC","Javed-Mohsin, Arijit Singh, Shreya Ghoshal, Kunaal Vermaa, Prashant Ingole","Pal","Sony Music Entertainment India Pvt. Ltd.",34,82,271,"1709051"
58,"spotify:track:2FCXQHugkoHE1K3tiDu8pu","Alka Yagnik, Arijit Singh","Agar Tum Saath Ho (From ""Tamasha"")","T-Series",4,55,259,"1705541"
59,"spotify:track:5WXQbgwGwyauXOqswlEeQY","Tanishk Bagchi, Arijit Singh, Asees Kaur","Bolna (From ""Kapoor & Sons (Since 1921)"")","Sony Music Entertainment India Pvt. Ltd.",59,105,64,"1697413"
60,"spotify:track:4bD9z9qa4qg9BhryvYWB7c","Pritam, Tochi Raina, Rekha Bhardwaj","Kabira","T-Series",31,80,244,"1683131"
61,"spotify:track:4dvfxZKehPxpz3UZ7A5Fni","Tayc, Shreya Ghoshal, Rajat Nagpal","Yimmy Yimmy","Play Two",33,48,8,"1674646"
62,"spotify:track:4wIWWEhbdgKAxhR68eE0Ye","Arijit Singh, Chinmayi","Mast Magan (From ""2 States"")","T-Series",45,57,169,"1667615"
63,"spotify:track:0rlLBWFFTQiOWi963SH9bb","The Local Train","Choo Lo","The Local Train",51,56,47,"1665064"
64,"spotify:track:2oenSXLDbWVaaL7QjSGYj5","Diljit Dosanjh, Intense, Sultaan","Lalkara","DILJIT DOSANJH",22,60,32,"1659921"
65,"spotify:track:2GXXZFUxYg2LvG8SR0byOE","Sachin-Jigar, Atif Aslam","Jeena Jeena","Eros Now Music",37,84,146,"1647812"
66,"spotify:track:0gPgdRfB4jdGrlyXS0Vx78","Vishal-Shekhar, KK, Shilpa Rao, Anvita Dutt Guptan","Khuda Jaane","YRF Music",37,71,84,"1646336"
67,"spotify:track:0snQrp1VaY5Pj1YIHRJpRJ","Aditya A","Chaand Baaliyan","Sony Music Entertainment India Pvt. Ltd.",2,61,117,"1627544"
68,"spotify:track:3yV2c3cYhkAwSsxAq6nRiv","Gajendra Verma","Mann Mera","Sony Music / Eros Now Music",26,62,163,"1613982"
69,"spotify:track:3WLJ7D5kh44K5eJ1NqZQ6W","Anuv Jain","Baarishein","Universal Music India Pvt. Ltd. (on behalf of Anuv Jain)",18,59,157,"1610478"
70,"spotify:track:28x6WpVq1ty4dPDeqK0zPO","Sushin Shyam, Paal Dabba, Vinayak Sasikumar","Galatta","Think Music",66,96,5,"1605198"
71,"spotify:track:610keNiNVTIkYD0CqeSerg","Cheema Y, Gur Sidhu","California Love","Brown Town Music",27,78,51,"1592294"
72,"spotify:track:5BKKKNwrebowaMoUdBaNby","King","Tu Aake Dekhle","Warner Music India",3,58,172,"1589639"
73,"spotify:track:48Ix6ReYdJf2H4mKb3TIpj","Atif Aslam, Alisha Chinai, Pritam","Tera Hone Laga Hoon","Tips Industries Ltd",36,79,157,"1573006"
74,"spotify:track:29m79w9xPMH4YCD6r8JSmV","AP Dhillon, Gurinder Gill, Intense","Excuses","RUN-UP RECORDS",1,65,134,"1551366"
75,"spotify:track:2RgvvnMwtP0R2OkVZmFvnV","KK","Ajab Si (From ""Om Shanti Om"")","T-Series",34,70,123,"1549331"
76,"spotify:track:2fsBaSK1551VvUD9Uvbb9Q","Darshan Raval, Prakriti Giri","Tu Hai","Warner Music India",76,193,2,"1547566"
77,"spotify:track:5XeFesFbtLpXzIVDNQP22n","Arctic Monkeys","I Wanna Be Yours","Domino Recording Co",48,68,79,"1540678"
78,"spotify:track:72vuBPMhwFNlSYpTSf6fVD","Diljit Dosanjh, Sia, Greg Kurstin","Hass Hass","Warner Music India",5,63,29,"1539407"
79,"spotify:track:0YxKKO272sacGBJKjf6FnB","Jaani, B Praak","Saari Duniya Jalaa Denge","T-Series",3,64,25,"1538967"
80,"spotify:track:1kTEGyqUJFgstwdgJFLqz1","Akashdeep Sengupta, Laqshay Kapoor, Kausar Munir, Suvarna Tiwari","Dil Se Dil Tak (From ""Bawaal"")","T-Series",38,73,15,"1533407"
81,"spotify:track:3nKQrVVlwbAQSnFbgZWdN0","Avvy Sra, Karan Aujla, Jaani","White Brown Black","Universal Music India Pvt Ltd. – Distribution",29,83,74,"1525865"
82,"spotify:track:32765xcLM1fd6wQIpkN9A0","Ami Mishra, Kunaal Vermaa","Hasi - Male Version","Sony Music Entertainment India Pvt. Ltd.",82,94,46,"1522243"
83,"spotify:track:6H7fLdt0AeWpuxUKXuXWrx","Hariharan","Shree Hanuman Chalisa","T-Series",39,69,92,"1510130"
84,"spotify:track:0FBQ4NrrHUbR9kus7rzrOj","Atif Aslam","Dil Diyan Gallan","YRF Music",56,81,222,"1497469"
85,"spotify:track:3HiobOOpSpMsi95WBKPBYk","Jeet Gannguli, Arijit Singh","Hamari Adhuri Kahani (Title Track)","Sony Music Entertainment India Pvt. Ltd.",56,67,131,"1496683"
86,"spotify:track:1UWacd8x8tPPwmrPB1MoBI","Pritam, Arijit Singh","Ae Dil Hai Mushkil Title Track","Sony Music Entertainment India Pvt. Ltd.",79,86,224,"1488721"
87,"spotify:track:7iekl4P95GuphG8x8a3cNT","Pritam, Arijit Singh, Jonita Gandhi, Ranveer Singh, Amitabh Bhattacharya","What Jhumka ?","Saregama India Ltd",6,76,44,"1476200"
88,"spotify:track:4XxfOvudrnBRdlgzEaq1sd","Diljit Dosanjh","Born to Shine","FAMOUS STUDIOS INC",28,85,46,"1473161"
89,"spotify:track:3iFYJMrRS0fLrwDNVbqNF0","Darshan Raval","Saajan Ve","Warner Music India",39,74,19,"1470873"
90,"spotify:track:3QJsSWa0Xo8MfaRn1gr4Be","Isabel LaRosa","favorite","Slumbo Labs/RCA Records",77,77,5,"1467238"
91,"spotify:track:0R1AZYXc34nfMaiengrkRc","Sidhu Moose Wala, Sunny Malton, Offgrid","410","Sunny Malton",17,50,5,"1456841"
92,"spotify:track:4VosVUajzm6nzGlSb6nP3L","Parmish Verma, Paradox","Check It Out","SDA Studios",19,93,44,"1436201"
93,"spotify:track:6oz1L5jcqZWYuId7nxvIan","Shubh","Still Rollin","SHUBH",4,91,52,"1428413"
94,"spotify:track:7IWcVmNCt0V1KHoYQP9ZoR","Thaman S, Sri Krishna, Sahithi Chaganti, Mahesh Babu, Saraswati Putra Ramajogayya Sastry","Kurchi Madathapetti","Aditya Music",34,87,19,"1414892"
95,"spotify:track:0tgVpDi06FyKpA1z0VMD4v","Ed Sheeran","Perfect","Atlantic Records UK",29,100,213,"1396321"
96,"spotify:track:2tjWCe2W7sgvS3C8NHcdtI","Akhil, Dhvani Bhanushali, Kunaal Vermaa, Abhijit Vaghani","Duniyaa (From ""Luka Chuppi"")","T-Series",1,92,273,"1393617"
97,"spotify:track:4blqlsA1uf2d2I40E90EUC","Pritam, Arijit Singh, Shilpa Rao","Tere Hawaale (From ""Laal Singh Chaddha"")","T-Series",11,88,64,"1391645"
98,"spotify:track:1LBSyVTSeYbgBzV7AznMsN","NJ, BABY JEAN, Dabzee, Rzee","Ballaatha Jaathi","Universal Music India Pvt Ltd.",64,99,6,"1390936"
99,"spotify:track:2qSkIjg1o9h3YT9RAgYN75","Sabrina Carpenter","Espresso","Island Records",99,116,3,"1386963"
100,"spotify:track:5rpCUsEfBLIumvrxrahnKF","Hasan Raheem, Umair, Talwiinder","Wishes","1698613 Records DK2",60,119,23,"1377204"
101,"spotify:track:3bQsp4Vr9Rg4fNCx6HPOgX","Anuv Jain","Alag Aasmaan","Universal Music India Pvt. Ltd. (on behalf of Anuv Jain)",30,102,35,"1368755"
102,"spotify:track:6mTvwBzWTGDOVeCNQEqtOE","Amaal Mallik, Arijit Singh, Tulsi Kumar","Soch Na Sake","T-Series",64,103,72,"1368387"
103,"spotify:track:04ChFQZCKl2yRcvc0VR7qN","Denny, Rahul Mishra, Kunaal Vermaa","Chale Jaana Phir (Humko Tere Bina)","For The Record Music",14,72,45,"1367521"
104,"spotify:track:0l6g8Z8mqGbGXFOjigYetD","Pritam, Arijit Singh","Hawayein","Sony Music Entertainment India Pvt. Ltd.",51,101,136,"1365879"
105,"spotify:track:7MXVkk9YMctZqd1Srtv4MB","The Weeknd, Daft Punk","Starboy","Universal Republic Records",12,97,146,"1365740"
106,"spotify:track:4uK0M8AI6gyFmyzUneQpbi","A.R. Rahman, Arijit Singh, Shashaa Tirupati","Rait Zara Si (From ""Atrangi Re"")","T-Series",12,136,119,"1362764"
107,"spotify:track:3LlkD3AvhsR2UMVavf5cL8","Neelkamal Singh, Kalpana, Om Jha","Maroon Color Sadiya - From ""Fasal""","Worldwide Records",98,98,3,"1361394"
108,"spotify:track:5O2P9iiztwhomNh8xkR9lJ","One Direction","Night Changes","Syco Music",22,106,157,"1355076"
109,"spotify:track:3FbZoPzEaUBOD84l1FwFEH","Darshan Raval","Mujhe Peene Do","Indie Music Label",56,140,46,"1342114"
110,"spotify:track:5W7DOVGQLTigu09afW7QMT","Sidhu Moose Wala","295","Sidhu Moose Wala",1,113,118,"1330450"
111,"spotify:track:11BKSlBxpkxrHvPi8uxXzV","Sushin Shyam, Vedan","Kuthanthram","Think Music",111,142,12,"1328682"
112,"spotify:track:2dMlTWQbY9tfPFLIqAa7Tv","Kaifi Khalil","Kahani Meri","Novice Records LLC",112,191,2,"1327120"
113,"spotify:track:7CyPwkp0oE8Ro9Dd5CUDjW","The Weeknd, JENNIE, Lily-Rose Depp","One Of The Girls (with JENNIE, Lily Rose Depp)","XO / Republic Records",102,110,19,"1318703"
114,"spotify:track:72zHuDxFQTjbL51qJQSA7j","Jasleen Royal, B Praak, Romy","Ranjha (From ""Shershaah"")","Sony Music Entertainment India Pvt. Ltd.",1,115,145,"1307262"
115,"spotify:track:7yyCCfalLx9F8TbMo5jH03","Rasraj Ji Maharaj","Bajrang Baan-Lofi","Vianet Media",89,95,13,"1304933"
116,"spotify:track:4u0D2jZ20wQaEMHBSqsDnZ","King","Tu Jaana Na Piya","Warner Music India",15,104,29,"1299282"
117,"spotify:track:11qnwt18ZckPqchzK2I3U7","Mithoon, Arijit Singh, Sayeed Quadri","Dil Jhoom","Zee Music Company",93,122,14,"1299272"
118,"spotify:track:4OcvkkpF3xmyCGGY5IBlgi","Akhil Sachdeva, Tulsi Kumar","Tera Ban Jaunga (From ""Kabir Singh"")","T-Series",4,89,244,"1290399"
119,"spotify:track:1feANd8EfcDP5UqSvbheM3","Sachet Tandon, Sachet-Parampara","Bekhayali (From ""Kabir Singh"")","T-Series",1,109,227,"1284198"
120,"spotify:track:6fScgF2Y63ScU73nYju0ny","Atif Aslam, Arko","O Saathi","T-Series",58,123,94,"1273386"
121,"spotify:track:2Z6HgNji9cNlFLNORw6wDQ","Mansheel Gujral, Akhil Sachdeva","Channa Ve - From ""Bhoot - Part One: The Haunted Ship""","Zee Music Company",33,117,44,"1265736"
122,"spotify:track:0kNe3kmRFq7eKVlL15h7nb","Sunny M.R., Arijit Singh, Krishna Kanth","Anuvanuvuu","Aditya Music",87,107,4,"1262753"
123,"spotify:track:6ygiy70ujkNOYXM1tQuMNe","Karan Aujla, Ikky, Preston Pablo","Admirin' You (feat. Preston Pablo)","WM Canada",24,137,41,"1253125"
124,"spotify:track:6cUOiOY5qh2FpIQWIYAd2h","Pritam, Darshan Raval, Antara Mitra","Mehrama","Sony Music Entertainment India Pvt. Ltd.",10,124,181,"1246111"
125,"spotify:track:60nxFG3LCviPvdTX5JU2iB","Arijit Singh, Jonita Gandhi, Irshad Kamil","Vida Karo","Saregama India Ltd",50,90,4,"1238741"
126,"spotify:track:2eAvDnpXP5W0cVtiI0PUxV","Ruth B.","Dandelions","Columbia",14,118,129,"1236798"
127,"spotify:track:3wuv55oGTDrvCNmNPeSUMb","Badshah, Sharvi Yadav, Hiten","Daaku","Universal Music India Pvt Ltd.",35,108,12,"1229280"
128,"spotify:track:6wkHR8cU4INbp145hngbQO","Sukha, Chani Nattan, Prodgk, Gurlez Akhtar","8 ASLE","SODHI MUSIC INC.",53,129,21,"1226891"
129,"spotify:track:08Isz2ETWSBhvIl8UpKYsp","Shubh","No Love","SHUBH",2,144,114,"1225416"
130,"spotify:track:3dpM3ijJz0vGzbkh5DcMXz","Payal Dev, Vishal Mishra, A.M. Turaz","Naseeb Se (From ""Satyaprem Ki Katha"")","T-Series",44,120,50,"1225116"
131,"spotify:track:18YHbIhrleUkKKj2DvEp79","Pritam, KK","Zara Sa","Sony Music Entertainment India Pvt. Ltd.",33,138,64,"1224952"
132,"spotify:track:5RWZ6TVZ0HeFTdRWu3VQ7w","Diljit Dosanjh","Love Ya","Saregama",51,121,17,"1224595"
133,"spotify:track:0ojpEubhy4JNeVftmVuiN7","Vishal Mishra, Armaan Malik","Pehla Pyaar","T-Series",11,132,155,"1219786"
134,"spotify:track:4LzjjNaJfnbPtJFYfMC8dc","Akhil Sachdeva, Kartik Dev","Saanware","PlayDMF",56,112,12,"1219767"
135,"spotify:track:0tpwqQhdfJXRcUDSNRjb9O","Arijit Singh, Neeti Mohan, Rashmi Virag","Mere Yaaraa (From ""Sooryavanshi"")","T-Series",20,197,95,"1218655"
136,"spotify:track:0xIuPDzJSnJywALez8dwKR","AP Dhillon","With You","Mass Appeal India",2,114,40,"1216203"
137,"spotify:track:1d5lpW3gUyq537iuyrb9Lf","Aditya Rikhari","Samjho Na","CollabX Productions",73,125,56,"1215027"
138,"spotify:track:7BjQqiOJio4RdPL33yALKE","Yasser Desai, Tanishk Bagchi, Asees Kaur","Makhna - From ""Drive""","Zee Music Company",2,160,182,"1210613"
139,"spotify:track:3qhlB30KknSejmIvZZLjOD","Djo","End of Beginning","Djo",114,135,8,"1210339"
140,"spotify:track:5BQePe9rcCJozHK3oPayYk","Shubh","MVP","Shubh",140,-1,1,"1203605"
141,"spotify:track:0GQngE2rOYvlKwEQjTAsP8","Pritam, Sreeram, Shilpa Rao","Subhanallah","T-Series",107,165,62,"1199288"
142,"spotify:track:3ZGJhN4unVspOqpwGvUL2W","Diljit Dosanjh","Lemonade","DILJIT DOSANJH",26,150,94,"1197656"
143,"spotify:track:52itZ0w0CydihB2JCZEIft","Pritam, Mohit Chauhan, Irshad Kamil","Pee Loon","T-Series",142,146,14,"1186530"
144,"spotify:track:4Tkb7zsDmsawB7S5TpKQV1","Atif Aslam, Shiraz Uppal","Pehli Dafa","T-Series",144,151,28,"1179054"
145,"spotify:track:5O932cZmzOZGOGZz9RHx20","Pritam, Arijit Singh","Khairiyat","T-Series",1,133,244,"1177515"
146,"spotify:track:5DgY6Ab0vpyUMKnY9ubFOF","Anirudh Ravichander, Super Subu","Hukum - Thalaivar Alappara","Sun Pictures",1,143,44,"1177477"
147,"spotify:track:3wz2vWhYnnBoFmgMkqtzLy","Chani Nattan, Inderpal Moga","Daku","Kharku Life Records",5,145,91,"1171809"
148,"spotify:track:3APdIdF8H0jsxSuGOqXedS","Rashid Ali","Kabhi Kabhi Aditi","T-Series",73,128,116,"1170416"
149,"spotify:track:2rOnSn2piaqLAlYjtfUBlY","Tanishk Bagchi, Jubin Nautiyal, Asees Kaur","Raataan Lambiyan (From ""Shershaah"")","Sony Music Entertainment India Pvt. Ltd.",1,131,146,"1167899"
150,"spotify:track:6GZIAVSu0YXF7FYzyRl1MP","Sachin-Jigar, Varun Jain, Shadab Faridi, Altamash Faridi, Amitabh Bhattacharya","Tere Vaaste (From ""Zara Hatke Zara Bachke"")","Saregama",1,126,51,"1166819"
151,"spotify:track:7G5wpuR61ABrT7R1snos7C","Pritam, Arijit Singh","Kalank - Title Track","Zee Music Company",5,161,229,"1164743"
152,"spotify:track:5pkOSmSeVo8RfC8555LRHT","Dhanda Nyoliwala","Up To U","FarArmy Productions",58,134,9,"1161220"
153,"spotify:track:4ApCig0GTR4IEp7Ijsyo3r","Manan Bhardwaj, Bhupinder Babbal","Arjan Vailly","T-Series",1,130,26,"1159581"
154,"spotify:track:7afMnPC5xnakX22CVazUqK","Sushin Shyam, Malayali Monkeys, MC Couper, Vinayak Sasikumar","Mathapithakkale","Think Music",154,186,3,"1155041"
155,"spotify:track:2cPUB8EOT6AfJ8oxhyoNXL","Pritam, Javed Bashir","Ye Tune Kya Kiya","T-Series",148,148,13,"1140525"
156,"spotify:track:5SftJq4uVpajyYC1Gs0RFF","Amit Trivedi, Arijit Singh, Nikhita Gandhi","Qaafirana","Zee Music Company",40,-1,170,"1139085"
157,"spotify:track:7fW9J3EpVWVN1ouv0slAs0","KK","Kya Mujhe Pyar Hai (From ""Woh Lamhe"")","T-Series",42,171,67,"1132986"
158,"spotify:track:7qiZfU4dY1lWllzX7mPBI3","Ed Sheeran","Shape of You","Atlantic Records UK",63,155,203,"1130817"
159,"spotify:track:24MMjyA3NLqCsDJfsn51eg","Sharn, The Paul","Mi Amor","Desi Avenue",7,139,70,"1128609"
160,"spotify:track:4thOONDx78zsY8sHGfU1M2","Shubh","You and Me","SHUBH",17,127,19,"1128134"
161,"spotify:track:5vGiuYFSGekGLgbxhV1rD5","Atif Aslam, Pritam","Tu Jaane Na","Tips Industries Ltd",101,159,137,"1117698"
162,"spotify:track:5bnxMZqd9Kpn9ByHj3Dc9C","Nakash Aziz, Deepak Blue, Devi Sri Prasad, Chandra Bose","Pushpa Pushpa (From ""Pushpa 2 The Rule"") [TELUGU]","T-Series",162,-1,1,"1116949"
163,"spotify:track:5c6DkR7KhFZ6RWtgEUp8M3","Harsh Likhari, Vagish","Bebe Bapu","Harsh Likhari",163,-1,1,"1113677"
164,"spotify:track:7Imk0IG6S5GA5iYWkjmMW5","Palak Muchhal, Arijit Singh","Chahun Main Ya Naa (From ""Aashiqui 2"")","T-Series",135,152,31,"1112775"
165,"spotify:track:0rk2X5TAhraBC5aCIXK2Rq","Jawad Ahmad, Shaarib Toshi, Arijit Singh, Shreya Ghoshal","Samjhawan","Sony Music Entertainment India Pvt. Ltd.",70,153,157,"1101763"
166,"spotify:track:64r6z0P3RnhpTGdkA7p5Os","Darshan Raval","Ek Tarfa","Indie Music Label",33,-1,99,"1094326"
167,"spotify:track:2S6N9pbnkhQRyAx80HmF79","Mohammed Irfan","Banjaara (From ""Ek Villain"")","T-Series",162,162,13,"1094138"
168,"spotify:track:2pIoyDWZV5OSW0xd6n41xV","Pritam, Arijit Singh, Swanand Kirkire, IP Singh","Lutt Putt Gaya","T-Series",22,141,25,"1092644"
169,"spotify:track:2vPrBucKCfKmafHhSfJ2pt","Pritam, Arijit Singh, Amitabh Bhattacharya, Charan","Pyaar Hota Kayi Baar Hai (From ""Tu Jhoothi Main Makkaar"")","T-Series",9,163,66,"1089156"
170,"spotify:track:3ygfdwvBJ2Y5XhJiiHFFZE","Sachet Tandon","Maiyya Mainu","Zee Music Company",5,183,83,"1087245"
171,"spotify:track:2qxmye6gAegTMjLKEBoR3d","Alec Benjamin","Let Me Down Slowly","2018",34,156,214,"1083191"
172,"spotify:track:0dJacN6K3mSGLE9p7QE0lO","KK","Beete Lamhein (From ""The Train"")","T-Series",75,-1,6,"1083007"
173,"spotify:track:0czcoKJbJt08NqKrvSbbz7","Pritam, Arijit Singh, Amitabh Bhattacharya","O Bedardeya (From ""Tu Jhoothi Main Makkaar"")","T-Series",1,149,62,"1079630"
174,"spotify:track:5Gy67YHzPZTk9Q0D73LAGH","Jeet Gannguli, Arijit Singh","Khamoshiyan (From ""Khamoshiyan"")","Sony Music Entertainment India Pvt. Ltd.",90,173,55,"1077893"
175,"spotify:track:1hQia6rxgfM1ly2hE3StWp","Vishal-Shekhar, Shekhar Ravjiani, Salim Merchant, Neeti Mohan","Ishq Wala Love","Sony Music Entertainment India Pvt. Ltd.",100,176,59,"1076612"
176,"spotify:track:4SJMuaIYcBS8ke96lDYOsw","Karan Aujla","On Top","Karan Aujla Music",17,192,47,"1072038"
177,"spotify:track:1EjxJHY9A6LMOlvyZdwDly","Pritam, Neeraj Shridhar","Tum Mile","Sony Music Entertainment India Pvt. Ltd.",177,-1,1,"1071461"
178,"spotify:track:3JkVYvxNoGf2HCWJo61462","Sidhu Moose Wala, Sunny Malton, SOE","Never Fold","Sidhu Moose Wala",13,-1,103,"1063036"
179,"spotify:track:42TMa2hgBNjte4uV7jNCnQ","Shubh, Ikky","Baller","SHUBH",2,164,88,"1059799"
180,"spotify:track:3eSm4iAkLsn3BeggfiQOH9","Gaurav Chatterji, Aasa Singh, Hansika Pareek, Hrishi Giridhar, Pratik Gangavane","Kaise Ab Kahein - From ""Gutar Gu""","Sikhya Entertainment Records",78,-1,28,"1058868"
181,"spotify:track:59alvnjzlbX6LaHhXGDZYv","Iqlipse Nova, Aditya A","Khwab","Sony Music Entertainment India Pvt. Ltd.",181,187,3,"1050661"
182,"spotify:track:7H3mfOvtPNA8YDF3EdKy0L","Neeraj Shridhar, Kavita Seth, Pritam","Tum Hi Ho Bandhu","Eros Now Music",144,181,19,"1049072"
183,"spotify:track:7aE1lfskJLMHQnzCCP1zsV","Akhil Sachdeva, Mansheel Gujral","Humsafar (From ""Badrinath Ki Dulhania"")","T-Series",158,174,29,"1048769"
184,"spotify:track:6O1RAYwmOqkcoJQr7J9SFJ","Manan Bhardwaj, Arijit Singh","Oonchi Oonchi Deewarein","T-Series",52,195,31,"1048060"
185,"spotify:track:7mSzDKajY2wUtstQSLdzMK","Mohit Chauhan, Rochak Kohli","Rang Lageya","Saregama",35,182,68,"1047199"
186,"spotify:track:6ZYxNjuAU9Vy3VtF6W1dtE","Shubh","We Rollin","SHUBH",10,175,129,"1045712"
187,"spotify:track:0CtZpaOhtzvLV3FfcsVpQo","Vishal-Shekhar, Shilpa Rao, Caralisa Monteiro, Vishal Dadlani, Shekhar Ravjiani, Kumaar","Besharam Rang (From ""Pathaan"")","YRF Music",4,184,75,"1044321"
188,"spotify:track:1FEiijYPJtyswChfcpv3p0","Lana Del Rey","Summertime Sadness","Polydor Records",168,179,5,"1044247"
189,"spotify:track:6f3ANRNQ8nCiPZ6VqXqq93","Amaal Mallik, Armaan Malik, Rashmi Virag","Main Rahoon Ya Na Rahoon","T-Series",141,169,13,"1042998"
190,"spotify:track:3sqRODOZ1Z6hR4F2tnFAlg","Maninder Buttar","Sakhiyaan","Ishtar Punjabi",20,198,216,"1040908"
191,"spotify:track:5a2Hoi1wuhCA6Ob7pbOlpW","Divya Kumar, Priya Saraiya","Sun Saathiya","Zee Music Company",121,166,5,"1035697"
192,"spotify:track:03yKEFruN3BS2coglBtt2N","Laddi Chahal, Parmish Verma, Gurlez Akhtar","Rubicon Drill","Parmish Verma Films",12,168,74,"1035641"
193,"spotify:track:1YMLgvsQdE27r30q0fsLeV","Arijit Singh","Tera Fitoor","Tips Industries Ltd",87,147,45,"1033567"
