rank,uri,artist_names,track_name,source,peak_rank,previous_rank,weeks_on_chart,streams
1,"spotify:track:0eCajpR75pDW0r64U6hP2x","Anuv Jain","Jo Tum Mere Ho","Universal Music India Pvt. Ltd. (on behalf of Anuv Jain)",1,1,10,"10756003"
2,"spotify:track:5AnWrUzsrFgBvhn6dUElnr","Sachin-Jigar, Amitabh Bhattacharya, Madhubanti Bagchi, Divya Kumar","Aaj Ki Raat (From ""Stree 2"")","Saregama India Ltd",1,2,12,"6818507"
3,"spotify:track:78BWCd70D1X6LMkDZm1UoF","Yo Yo Honey Singh","Millionaire","T-Series",3,3,7,"5536589"
4,"spotify:track:1bxzr3JK05fMTcweGAZUHp","Shilpa Rao, Anirudh Ravichander, Ramajogayya Sastry","Chuttamalle (From ""Devara Part 1"")","T-Series",4,4,11,"5378421"
5,"spotify:track:1mQUEvGR7Sbt2OCz2gFrdx","Amitabh Bhattacharya, Sachin-Jigar, Pawan Singh, Simran Choudhary","Aayi Nai (From ""Stree 2"")","Saregama India Ltd",2,5,10,"5315156"
6,"spotify:track:1hlbywc8Jhl1FFqJxAMabE","Faheem Abdullah, Rauhan Malik, Amir Ameer","Ishq","Artiste First",6,7,29,"4761819"
7,"spotify:track:3CA9CjRf7IU2Ukz3GuYInP","Anirudh Ravichander, Malaysia Vasudevan, Deepthi Suresh, Yugendran Vasudevan","Manasilaayo","Sony Music Entertainment India Pvt. Ltd.",7,8,6,"4702752"
8,"spotify:track:5zCnGtCl5Ac5zlFHXaZmhy","Ram Sampath, Arijit Singh, Prashant Pandey","Sajni (From ""Laapataa Ladies"")","T-Series",1,6,24,"4624900"
9,"spotify:track:0TL0LFcwIBF5eX7arDIKxY","Anuv Jain","Husn","Universal Music India Pvt. Ltd. (on behalf of Anuv Jain)",1,9,46,"4578909"
10,"spotify:track:1o8YPl0hyGbpRcHplXNvsm","Vishal Mishra, Sachin-Jigar, Amitabh Bhattacharya","Khoobsurat (From ""Stree 2"")","Saregama India Ltd",5,11,9,"3654910"
11,"spotify:track:5Ggb9pKiKcr5vNV9v1e1vs","Varun Jain, Shilpa Rao, Sachin-Jigar, Amitabh Bhattacharya","Tumhare Hi Rahenge Hum","Saregama India Ltd",8,10,9,"3620968"
12,"spotify:track:1hA697u7e1jX2XM8sWA6Uy","Sachin-Jigar, Arijit Singh, Amitabh Bhattacharya","Apna Bana Le","Zee Music Company",1,12,69,"3509384"
13,"spotify:track:2Fv2injs4qAm8mJBGaxVKU","Arijit Singh, Mithoon","Tujhe Kitna Chahne Lage (From ""Kabir Singh"")","T-Series",2,14,281,"3433882"
14,"spotify:track:0YQJoDL6f46J0n1rOVkpxJ","Karan Aujla, Ikky","Softly","WM Canada",4,13,61,"3221739"
15,"spotify:track:25Nxyrng0Z3jC5Q0hAibpw","Karan Aujla","Tauba Tauba (From ""Bad Newz"")","Saregama India Ltd",1,16,15,"3176582"
16,"spotify:track:7eQl3Yqv35ioqUfveKHitE","Pritam, Mohit Chauhan, Irshad Kamil","Tum Se Hi","T-Series",15,15,239,"3087346"
17,"spotify:track:1eZefeDb8uOsjvcbl1fJrG","Diljit Dosanjh, Badshah, Raj Ranjodh","Naina (From ""Crew"")","Tips Industries Ltd",3,17,32,"3057775"
18,"spotify:track:7yDHHVKLbvDmVw1XXhDDIO","Vishal Mishra, Raj Shekhar","Pehle Bhi Main","T-Series",1,22,46,"2971680"
19,"spotify:track:3yHyiUDJdz02FZ6jfUbsmY","Arijit Singh, Shreyas Puranik, Siddharth - Garima","Satranga (From ""ANIMAL"")","T-Series",2,21,51,"2938683"
20,"spotify:track:5xlYVZxEwriP6hetG7QJw7","AP Dhillon","Old Money","AP Dhillon",13,20,9,"2928916"
21,"spotify:track:5thVzD79BxlDTYy0LfHzvu","Aparshakti Khurana, Savi Kahlon","Zaroor","Sony Music Entertainment India Pvt. Ltd.",13,19,11,"2892421"
22,"spotify:track:3WLJ7D5kh44K5eJ1NqZQ6W","Anuv Jain","Baarishein","Universal Music India Pvt. Ltd. (on behalf of Anuv Jain)",18,29,179,"2877447"
23,"spotify:track:5KRF3484mnhyYFVXyvsBEf","Anirudh Ravichander, Siddharth Basrur, Arivu","Hunter Vantaar","Sony Music Entertainment India Pvt. Ltd.",23,70,3,"2848152"
24,"spotify:track:0XRb6eZE4dBIJdqwf1Mixu","Juss, MixSingh","Suniyan Suniyan","Mix It Up Studio",3,23,22,"2772282"
25,"spotify:track:4XxfOvudrnBRdlgzEaq1sd","Diljit Dosanjh","Born to Shine","FAMOUS STUDIOS INC",17,18,68,"2769596"
26,"spotify:track:5npFBWhVs3VVlc0nY5xQMA","Sachin-Jigar, Arijit Singh","Tainu Khabar Nahi - From ""Munjya""","Zee Music Company",17,27,18,"2697304"
27,"spotify:track:69Qzz3yyQSsA0T95jLDoPL","Gurnazar, Chet Singh","Dil Tu Jaan Tu","Mars Films / Jhankar Music",14,26,12,"2663469"
28,"spotify:track:3zSSCPpLZ5Oc8nelhhGjKz","AUR","Tu hai kahan","Sony Music Entertainment",1,28,53,"2648562"
29,"spotify:track:5ZLkihi6DVsHwDL3B8ym1t","Shubh","One Love","SHUBH",3,31,61,"2631603"
30,"spotify:track:0M0ANKNzmM4Odd7FNKghzW","Mitraz","Akhiyaan Gulaab (From ""Teri Baaton Mein Aisa Uljha Jiya"")","T-Series",2,35,38,"2625212"
31,"spotify:track:3xMHXmedL5Rvfxmiar9Ryv","Anirudh Ravichander, Arijit Singh, Shilpa Rao, Kumaar","Chaleya","T-Series",1,32,62,"2558377"
32,"spotify:track:5ZjWYv5kOH1ywFmv5JjPNd","Sachin-Jigar, Shilpa Rao, Sachet Tandon, Priya Saraiya","Mere Mehboob","T-Series",32,79,2,"2526425"
33,"spotify:track:36N5awamOX6XX5pQn3aFXZ","Darshan Raval, Jonita Gandhi, Rochak Kohli, Gurpreet Saini","Soni Soni (From ""Ishq Vishk Rebound"")","Tips Industries Ltd",4,33,20,"2463974"
34,"spotify:track:2ceeTJAzKy295Fm0VsaXtE","Sachin-Jigar, Raghav Chaitanya, Varun Jain, Indraneel","Tum Se (From ""Teri Baaton Mein Aisa Uljha Jiya"")","T-Series",10,30,36,"2460863"
35,"spotify:track:5sUSbJo0brScvv48ZZ1HrQ","Atif Aslam, Jyotica Tangri","O Meri Laila","Zee Music Company",16,34,25,"2442852"
36,"spotify:track:7m4CgL81VVIHaaiSxyH922","Yo Yo Honey Singh","Desi Kalakaar","T-Series",13,37,39,"2416841"
37,"spotify:track:2GXXZFUxYg2LvG8SR0byOE","Sachin-Jigar, Atif Aslam","Jeena Jeena","Eros Now Music",33,40,162,"2416642"
38,"spotify:track:1r6GbBLdtUK1Vl1IHT14wP","Mohammad Faiz, Jaani","Dekhha Tenu (From ""Mr. And Mrs. Mahi"")","Sony Music Entertainment India Pvt. Ltd.",2,39,22,"2415909"
39,"spotify:track:5PUXKVVVQ74C3gl5vKy9Li","Jasleen Royal, Arijit Singh, Dulquer Salmaan","Heeriye (feat. Arijit Singh)","Warner Music India",1,41,64,"2404152"
40,"spotify:track:0xpeiTGSEchBhqrjDuIcSS","Dhibu Ninan Thomas, Vaikom Vijayalakshmi, Manu Manjith","Angu Vaana Konilu - From ""ARM""","Think Music",14,25,4,"2389345"
41,"spotify:track:0MTdYgTZ25sLCO6kVnDoje","Sai Abhyankkar, Sai Smriti","Aasa Kooda - From ""Think Indie""","Think Music",3,36,17,"2377387"
42,"spotify:track:1WxzZoWBTmB68AtyA6ejBB","Sohail Sen, Monali Thakur, Kausar Munir","Haan Ke Haan","YRF Music",9,24,11,"2342711"
43,"spotify:track:1d5lpW3gUyq537iuyrb9Lf","Aditya Rikhari","Samjho Na","CollabX Productions",43,45,78,"2314642"
44,"spotify:track:1a1xLj9W8libnO9PvJf6ao","Sushin Shyam, Dabzee, Vinayak Sasikumar","Illuminati","Think Music",3,42,28,"2312662"
45,"spotify:track:2PvaburAUlhNHxVhw5lvOq","Arijit Singh","Humdard (From ""Ek Villain"")","T-Series",28,44,222,"2304595"
46,"spotify:track:3FqtduiaqnFYvBgKuc6QWQ","Karan Aujla, Mxrci","Winning Speech","Karan Aujla",8,47,22,"2290573"
47,"spotify:track:48Ix6ReYdJf2H4mKb3TIpj","Atif Aslam, Alisha Chinai, Pritam","Tera Hone Laga Hoon","Tips Industries Ltd",35,48,179,"2265374"
48,"spotify:track:4eBvRhTJ2AcxCsbfTUjoRp","Shubh","Cheques","SHUBH",1,51,73,"2250238"
49,"spotify:track:2cPUB8EOT6AfJ8oxhyoNXL","Pritam, Javed Bashir","Ye Tune Kya Kiya","T-Series",46,46,35,"2226308"
50,"spotify:track:1y1rQTkWmrZdJmjwuK07GC","Vishal Mishra, Manoj Muntashir","Kaise Hua (From ""Kabir Singh"")","T-Series",5,57,279,"2220353"
51,"spotify:track:1dFrZr9eMUsFqeag04ClqD","Dhanda Nyoliwala","Russian Bandana","Universal Music India Pvt Ltd.",51,74,3,"2205596"
52,"spotify:track:6bmmHeCvZI92pRiTHxEdTC","Pritam, Arijit Singh, Irshad Kamil","O Maahi","T-Series",4,43,44,"2194269"
53,"spotify:track:56zZ48jdyY2oDXHVnwg5Di","Mithoon, Arijit Singh","Tum Hi Ho","T-Series",42,55,194,"2179381"
54,"spotify:track:2FCXQHugkoHE1K3tiDu8pu","Alka Yagnik, Arijit Singh","Agar Tum Saath Ho (From ""Tamasha"")","T-Series",4,54,281,"2168544"
55,"spotify:track:5Pqv6e52EWyqxeNyFYqDni","Kala Bhairava, Anirudh Ravichander, Ramajogayya Sastry","Ayudha Pooja [TELUGU]","T-Series",50,50,3,"2154449"
56,"spotify:track:0FBQ4NrrHUbR9kus7rzrOj","Atif Aslam","Dil Diyan Gallan","YRF Music",53,61,244,"2099591"
57,"spotify:track:52itZ0w0CydihB2JCZEIft","Pritam, Mohit Chauhan, Irshad Kamil","Pee Loon","T-Series",57,59,36,"2077922"
58,"spotify:track:6b2WJDzGt5X8dYfpkWtvXW","Anirudh Ravichander, Ramajogayya Sastry","Fear Song (From ""Devara Part 1"") [Telugu]","T-Series",38,38,9,"2013460"
59,"spotify:track:0rlLBWFFTQiOWi963SH9bb","The Local Train","Choo Lo","The Local Train",49,63,69,"1972373"
60,"spotify:track:7bzR0C8NhnBA79iTXUCJ7o","Vishal Mishra","Jaanam (From ""Bad Newz"")","Saregama India Ltd",7,49,14,"1960105"
61,"spotify:track:3ZGJhN4unVspOqpwGvUL2W","Diljit Dosanjh","Lemonade","DILJIT DOSANJH",26,77,116,"1932527"
62,"spotify:track:5pPyvA03RKSJrAnnDcq0nh","Sachin-Jigar, Shreya Ghoshal, Tochi Raina","Saibo","Sony Music Entertainment India Pvt. Ltd.",31,85,207,"1925362"
63,"spotify:track:29YePgOxuPLfU7uZKxKf6w","Monali Thakur, Amit Trivedi","Sawaar Loon","T-Series",56,56,7,"1886026"
64,"spotify:track:45PA9lW7U5LYnlpGrdTyHY","Jasleen Royal, Ujjwal Kashyap","Sang Rahiyo (feat. Ujjwal Kashyap)","Warner Music India",21,71,32,"1884181"
65,"spotify:track:1smFN2CLqGROu0J0UyvDfL","Pritam, Arijit Singh","Shayad","Sony Music Entertainment India Pvt. Ltd.",1,78,248,"1874453"
66,"spotify:track:0GQngE2rOYvlKwEQjTAsP8","Pritam, Sreeram, Shilpa Rao","Subhanallah","T-Series",54,81,80,"1866012"
67,"spotify:track:4UMIv5jd9gK98a39BQRD9X","Pritam, Arijit Singh, Amitabh Bhattacharya","Kesariya","Sony Music Entertainment India Pvt. Ltd.",1,65,118,"1863964"
68,"spotify:track:0645eBDehHcqfiF15hscQV","Vishal Mishra, Rashmeet Kaur","Janiye (from the Netflix Film ""Chor Nikal Ke Bhaga"")","Netflix Music",5,64,67,"1856308"
69,"spotify:track:7KQdgW7QzNd9oPoCzjCU76","Shubh","Bandana","Shubh",8,53,29,"1848897"
70,"spotify:track:1tf2iody5iRLYYPDSBpzRc","Badshah, Arijit Singh","Soulmate","Universal Music India Pvt Ltd.",2,62,30,"1829027"
71,"spotify:track:4Pow6acOGSaXcs6Gd05SP5","Jasleen Royal, B Praak, Romy","Ranjha","Sony Music Entertainment India Pvt. Ltd.",1,87,167,"1827062"
72,"spotify:track:0gPgdRfB4jdGrlyXS0Vx78","Vishal-Shekhar, KK, Shilpa Rao, Anvita Dutt Guptan","Khuda Jaane","YRF Music",37,69,106,"1811700"
73,"spotify:track:0xN4nwgOWg59k0t94CJAj4","Yuvan Shankar Raja, Shenbagaraj, Velu, Sam, Narayanan Ravishankar","Matta (From ""The Greatest Of All Time"")","T-Series",29,58,6,"1809890"
74,"spotify:track:6egfWbtFFhMToV2DvmEzmo","Bunny, Hunny, Sagar","Tu Hain Toh (From ""Mr. And Mrs. Mahi"")","Sony Music Entertainment India Pvt. Ltd.",8,66,17,"1793716"
75,"spotify:track:3APdIdF8H0jsxSuGOqXedS","Rashid Ali","Kabhi Kabhi Aditi","T-Series",58,75,138,"1791959"
76,"spotify:track:5vGiuYFSGekGLgbxhV1rD5","Atif Aslam, Pritam","Tu Jaane Na","Tips Industries Ltd",72,72,159,"1778273"
77,"spotify:track:1QZRCi2Z1DQQaR6bGAzhtN","Yo Yo Honey Singh","Love Dose","T-Series",32,52,23,"1774022"
78,"spotify:track:2C6CJGFLbisteRuY6Plb7b","Danny, Avvy Sra, Sagar","Ve Haaniyaan","Dreamiyata Music",10,76,37,"1773811"
79,"spotify:track:3F3ZuXYFXGM1V6pk3b3zmi","Diljit Dosanjh, thiarajxtt","Kinni Kinni","DILJIT DOSANJH",24,67,49,"1771902"
80,"spotify:track:3yV2c3cYhkAwSsxAq6nRiv","Gajendra Verma","Mann Mera","Sony Music / Eros Now Music",26,60,183,"1758590"
81,"spotify:track:7wW9scVNLYFLsmBb1yAUmS","Yo Yo Honey Singh","Blue Eyes","T-Series",38,68,18,"1758190"
82,"spotify:track:6fScgF2Y63ScU73nYju0ny","Atif Aslam, Arko","O Saathi","T-Series",58,93,116,"1752324"
83,"spotify:track:2RgvvnMwtP0R2OkVZmFvnV","KK","Ajab Si (From ""Om Shanti Om"")","T-Series",34,84,145,"1736127"
84,"spotify:track:6ygiy70ujkNOYXM1tQuMNe","Karan Aujla, Ikky, Preston Pablo","Admirin' You (feat. Preston Pablo)","WM Canada",24,96,63,"1735836"
85,"spotify:track:5XeFesFbtLpXzIVDNQP22n","Arctic Monkeys","I Wanna Be Yours","Domino Recording Co",48,83,101,"1733060"
86,"spotify:track:0rMeOAvbQZ2RTG4B6L1M4p","Darshan Raval","Asal Mein","Indie Music Label",21,99,177,"1720986"
87,"spotify:track:1kDZSmw3mKQeAjcmPTLS3M","Pritam, Arijit Singh, Shreya Ghoshal, Amitabh Bhattacharya","Tum Kya Mile, Pt. 2","Saregama India Ltd",9,90,68,"1711235"
88,"spotify:track:6c4Po8zyQjB4cR5XgLhcGb","Prabh Singh, Jay Trak, Rooh Sandhu","9:45","Prabh Singh Official",9,117,67,"1710391"
89,"spotify:track:3nKQrVVlwbAQSnFbgZWdN0","Avvy Sra, Karan Aujla, Jaani","White Brown Black","Universal Music India Pvt Ltd. – Distribution",29,73,96,"1693785"
90,"spotify:track:3bQsp4Vr9Rg4fNCx6HPOgX","Anuv Jain","Alag Aasmaan","Universal Music India Pvt. Ltd. (on behalf of Anuv Jain)",30,97,57,"1690254"
91,"spotify:track:29m79w9xPMH4YCD6r8JSmV","AP Dhillon, Gurinder Gill, Intense","Excuses","RUN-UP RECORDS",1,86,156,"1682704"
92,"spotify:track:6t9KM2EQD4H2KbrTgHGYf3","Sachin-Jigar, Jasmine Sandlas, Amitabh Bhattacharya","Taras - From ""Munjya""","Zee Music Company",38,121,18,"1681011"
93,"spotify:track:6RUA84fCWd7hqtmofzU6l3","Nakash Aziz, AKASA, Anirudh Ravichander","Daavudi (From ""Devara Part 1"")","T-Series",88,88,5,"1673318"
94,"spotify:track:2tjWCe2W7sgvS3C8NHcdtI","Akhil, Dhvani Bhanushali, Kunaal Vermaa, Abhijit Vaghani","Duniyaa (From ""Luka Chuppi"")","T-Series",1,91,295,"1654106"
95,"spotify:track:4VsP4Dm8gsibRxB5I2hEkw","Kaifi Khalil","Kahani Suno 2.0","1944121 Records DK",1,107,96,"1640037"
96,"spotify:track:7Je0oWG9OjLhHEXd2eHsFF","Dhibu Ninan Thomas, K. S. Harisankar, Anila Rajeev","Kiliye - From ""ARM""","Think Music",55,80,4,"1625950"
97,"spotify:track:62tJcdKJKBBGYbav0XHWAr","electronic kili, Vinayak Sasikumar","Eyy Banane - From ""Vaazha""","Think Music",74,89,5,"1609589"
98,"spotify:track:0NXnuTqFQHDsbEIoKIAVCN","Josh Brar, Kinza Hashmi","Tere Bina Na Guzara E","Times Music – Speed Records",98,-1,1,"1606039"
99,"spotify:track:2IoZMG3RqiTmsy7Li3zGFg","Sachet Tandon, Parampara Tandon, Sachet-Parampara","Mere Sohneya (From ""Kabir Singh"")","T-Series",4,95,235,"1591187"
100,"spotify:track:46QbY78ha62aiu6gBgC7lS","Diljit Dosanjh","G.O.A.T.","FAMOUS STUDIOS INC",1,92,44,"1576691"
101,"spotify:track:73K33p4Vyz9koXGqmL5eFs","Sachet Tandon, Parampara Tandon, Kumaar, Sachet-Parampara","Malang Sajna","T-Series",4,102,91,"1574305"
102,"spotify:track:1kmJ0EvXClJAt0fSSQLX1m","Haricharan, Shweta Mohan, G. V. Prakash, Karthik Netha","Hey Minnale (From ""Amaran"")","Saregama India Ltd",102,-1,1,"1569663"
103,"spotify:track:2oenSXLDbWVaaL7QjSGYj5","Diljit Dosanjh, Intense, Sultaan","Lalkara","DILJIT DOSANJH",22,103,54,"1560188"
104,"spotify:track:4bD9z9qa4qg9BhryvYWB7c","Pritam, Tochi Raina, Rekha Bhardwaj","Kabira","T-Series",31,98,266,"1551594"
105,"spotify:track:6mTvwBzWTGDOVeCNQEqtOE","Amaal Mallik, Arijit Singh, Tulsi Kumar","Soch Na Sake","T-Series",46,101,94,"1537345"
106,"spotify:track:3dHP1GUSR19PB1baWz37LN","G. V. Prakash, Arivu, Dhanush, Sublahshini","Golden Sparrow (From ""Nilavuku En Mel Ennadi Kobam"")","Wunderbar Films",106,140,2,"1535915"
107,"spotify:track:3qrdLVOClRU4yPkcXZ7c5u","Ayushmann Khurrana, Tanishk-Vayu","Mere Liye Tum Kaafi Ho (From ""Shubh Mangal Zyada Saavdhan"")","T-Series",11,118,236,"1532753"
108,"spotify:track:1418IuVKQPTYqt7QNJ9RXN","King","Maan Meri Jaan","Warner Music India",1,100,105,"1527616"
109,"spotify:track:5WXQbgwGwyauXOqswlEeQY","Tanishk Bagchi, Arijit Singh, Asees Kaur","Bolna (From ""Kapoor & Sons (Since 1921)"")","Sony Music Entertainment India Pvt. Ltd.",59,112,86,"1525379"
110,"spotify:track:4wIWWEhbdgKAxhR68eE0Ye","Arijit Singh, Chinmayi","Mast Magan (From ""2 States"")","T-Series",45,108,191,"1513863"
111,"spotify:track:5BKKKNwrebowaMoUdBaNby","King","Tu Aake Dekhle","Warner Music India",3,111,194,"1507116"
112,"spotify:track:67oNO9GjcDn7NO08lg08jj","Achint, Arijit Singh, Anumita Nadesan, Varun Grover","Tenu Sang Rakhna (From ""Jigra"")","Saregama India Ltd",112,-1,1,"1505404"
113,"spotify:track:6ivemTXTn27PwVjtd0oqDs","Anuv Jain","Gul","Universal Music India Pvt. Ltd. (on behalf of Anuv Jain)",76,123,51,"1503797"
114,"spotify:track:1hHrBEkN0JIaeFPegy4Xak","A.R. Rahman, Santhosh Narayanan, Shweta Mohan, Gana Kadhar","Water Packet (From ""Raayan"")","Sun Pictures",40,94,12,"1502965"
115,"spotify:track:6H7fLdt0AeWpuxUKXuXWrx","Hariharan","Shree Hanuman Chalisa","T-Series",39,116,114,"1495315"
116,"spotify:track:7F8RNvTQlvbeBLeenycvN6","A.R. Rahman, Javed Ali, Mohit Chauhan","Kun Faya Kun","T-Series",60,109,132,"1493855"
117,"spotify:track:0OA00aPt3BV10qeMIs3meW","Hanumankind, Kalmi","Big Dawgs","Universal Music India Pvt Ltd.",2,82,12,"1487601"
118,"spotify:track:37AGZMVr5V8mEMcCmGHroZ","Kailash Kher, Paresh Kamath, Naresh Kamath","Saiyyan","Sony Music Entertainment India Pvt. Ltd.",103,113,42,"1482649"
119,"spotify:track:0tgVpDi06FyKpA1z0VMD4v","Ed Sheeran","Perfect","Atlantic Records UK",29,104,235,"1468620"
120,"spotify:track:79hQvdTHNBkq2fp2ZrM8b2","Javed-Mohsin, Arijit Singh, Shreya Ghoshal, Kunaal Vermaa, Prashant Ingole","Pal","Sony Music Entertainment India Pvt. Ltd.",34,105,293,"1466104"
121,"spotify:track:3HiobOOpSpMsi95WBKPBYk","Jeet Gannguli, Arijit Singh","Hamari Adhuri Kahani (Title Track)","Sony Music Entertainment India Pvt. Ltd.",56,119,153,"1447793"
122,"spotify:track:5O2P9iiztwhomNh8xkR9lJ","One Direction","Night Changes","Syco Music",22,133,179,"1437659"
123,"spotify:track:4r8JqkhpTb5tzSKKHnVJIJ","Vishal-Shekhar, Mohit Chauhan, Shekhar Ravjiani, Shruti Pathak","Tujhe Bhula Diya","T-Series",123,146,10,"1432428"
124,"spotify:track:5Swyv8euhHEJu57t5qbGUs","Vishal Mishra","Aaj Bhi 2","Universal Music India Pvt Ltd.",110,110,3,"1424555"
125,"spotify:track:1UWacd8x8tPPwmrPB1MoBI","Pritam, Arijit Singh","Ae Dil Hai Mushkil Title Track","Sony Music Entertainment India Pvt. Ltd.",79,122,246,"1414792"
126,"spotify:track:7acH6yiK56etufZpUIv1YW","Shubh","Be Mine","Shubh",61,114,15,"1413025"
127,"spotify:track:2plbrEY59IikOBgBGLjaoe","Lady Gaga, Bruno Mars","Die With A Smile","Interscope",127,157,3,"1412108"
128,"spotify:track:3bmsaFp11I9pbicxzlStf3","Akshath","nadaaniyan","Universal Music India Pvt Ltd.",6,106,18,"1403948"
129,"spotify:track:5ivRSlOhVIXN2QMzqgsX0s","The Local Train","Aaoge Tum Kabhi","The Local Train",116,126,18,"1403837"
130,"spotify:track:4Tkb7zsDmsawB7S5TpKQV1","Atif Aslam, Shiraz Uppal","Pehli Dafa","T-Series",90,141,50,"1401283"
131,"spotify:track:1zzejMGRYKP5XOa3FmzXfa","Sai Abhyankkar","Katchi Sera - From ""Think Indie""","Think Music",6,120,37,"1397810"
132,"spotify:track:4FeczSomVWVyU4FW7xDeAI","A.R. Rahman, Chinmayi, Murtuza Khan, Qadir Khan","Tere Bina","Sony Music Entertainment India Pvt. Ltd.",111,130,9,"1392006"
133,"spotify:track:72vuBPMhwFNlSYpTSf6fVD","Diljit Dosanjh, Sia, Greg Kurstin","Hass Hass","Warner Music India",5,137,47,"1391248"
134,"spotify:track:7qiZfU4dY1lWllzX7mPBI3","Ed Sheeran","Shape of You","Atlantic Records UK",63,115,218,"1379025"
135,"spotify:track:6y5SuF4NxGkvwpAdqcAkD3","Pritam, Arijit Singh, Shreya Ghoshal, Shadab Faridi, Altamash Faridi, Amitabh Bhattacharya","Ve Kamleya","Saregama India Ltd",15,127,62,"1377942"
136,"spotify:track:7uNnlVit5qDvfOje0pqICF","Mohit Chauhan, Suzanne D'Mello","Tum Ho","T-Series",62,128,20,"1377236"
137,"spotify:track:0loZn1c5heXie7OAtvK6nH","Jubin Nautiyal, Rocky - Shiv","Humnava Mere","T-Series",66,124,125,"1375907"
138,"spotify:track:0l6g8Z8mqGbGXFOjigYetD","Pritam, Arijit Singh","Hawayein","Sony Music Entertainment India Pvt. Ltd.",51,125,158,"1373059"
139,"spotify:track:0Jiaz0O4AqnJICa9PxHhaR","Darshan Raval","Mahiye Jinna Sohna","Warner Music India",2,138,69,"1362524"
140,"spotify:track:5KNuHsIeFtD0oukst77hBi","Roop Kumar Rathod","Maula Mere Maula","Saregama",140,149,13,"1349001"
141,"spotify:track:7MXVkk9YMctZqd1Srtv4MB","The Weeknd, Daft Punk","Starboy","Universal Republic Records",12,134,168,"1347856"
142,"spotify:track:7fW9J3EpVWVN1ouv0slAs0","KK","Kya Mujhe Pyar Hai (From ""Woh Lamhe"")","T-Series",42,143,89,"1345501"
143,"spotify:track:3t3wsY5IdLVzB9WidegJSU","Atif Aslam, Shreya Ghoshal, Sachin-Jigar","Jeene Laga Hoon","Tips Industries Ltd",138,159,6,"1337693"
144,"spotify:track:1BpvuKIG7jK5EiTp2tv5z8","Shubh","King Shit","SHUBH",5,144,41,"1330115"
145,"spotify:track:610keNiNVTIkYD0CqeSerg","Cheema Y, Gur Sidhu","California Love","Brown Town Music",27,160,73,"1323622"
146,"spotify:track:4fyR24BKznXBLNkK8LwWla","Yo Yo Honey Singh","Dheere Dheere","T-Series",93,154,9,"1322850"
147,"spotify:track:6IR6mzRO60hnMjNoq8rCPE","Raghav, Tanishk Bagchi, Asees Kaur","Teri Baaton Mein Aisa Uljha Jiya Title Song (From ""Teri Baaton Mein Aisa Uljha Jiya"")","T-Series",5,155,37,"1310936"
148,"spotify:track:32VAw8DL9ixX5XSW2VLcZ4","Parmish Verma, PARDHAAN, Desi Crew","Aam Jahe Munde","Parmish Verma Films",20,139,67,"1307086"
149,"spotify:track:61R3DMR4U2n25qgX9ryciJ","Yo Yo Honey Singh","Jatt Mehkma","T-Series",145,145,5,"1305668"
150,"spotify:track:2RelZc0EwHPsVwrW6B6taZ","Bombay the Artist, Charan","Vekh Sohneyaa - From ""Call Me Bae""","Sony Music Entertainment India Pvt. Ltd. / Amazon Seller Services Private Limited",122,148,4,"1299485"
151,"spotify:track:7CyPwkp0oE8Ro9Dd5CUDjW","The Weeknd, JENNIE, Lily-Rose Depp","One Of The Girls (with JENNIE, Lily Rose Depp)","XO / Republic Records",98,129,41,"1299380"
152,"spotify:track:209QxKVJzh2FLUmZHpYs4m","Badshah, Karan Aujla, Hiten","God Damn","Universal Music India Pvt Ltd.",15,136,30,"1298977"
153,"spotify:track:7KmCQLSSde0UX5OqCgvGN9","Karan Aujla","ANTIDOTE","Karan Aujla/Rehaan Records",32,131,16,"1298205"
154,"spotify:track:3ygfdwvBJ2Y5XhJiiHFFZE","Sachet Tandon","Maiyya Mainu","Zee Music Company",5,198,102,"1297464"
155,"spotify:track:5ouREJYZCYqwF0p7VeUtfH","Karan Aujla","IDK HOW","Karan Aujla/Rehaan Records",7,142,16,"1292366"
156,"spotify:track:6rFckZb1cuJYzsZiGHgqks","Karan Aujla, Ikky","52 Bars","Rehaan Records",12,147,21,"1276627"
157,"spotify:track:11qnwt18ZckPqchzK2I3U7","Mithoon, Arijit Singh, Sayeed Quadri","Dil Jhoom","Zee Music Company",93,195,36,"1273113"
158,"spotify:track:1fcCPXmH4vUzG6UQTTjZp5","Mithoon, Arijit Singh, Shashaa Tirupati","Phir Bhi Tumko Chaahunga","Zee Music Company",158,161,8,"1270788"
159,"spotify:track:2IEhtVeM9TVql8fZdKdlo9","Atif Aslam, Chinmayi, Pritam","Main Rang Sharbaton Ka","Tips Industries Ltd",73,162,41,"1256124"
160,"spotify:track:1hQia6rxgfM1ly2hE3StWp","Vishal-Shekhar, Shekhar Ravjiani, Salim Merchant, Neeti Mohan","Ishq Wala Love","Sony Music Entertainment India Pvt. Ltd.",100,151,76,"1255063"
161,"spotify:track:1YMLgvsQdE27r30q0fsLeV","Arijit Singh","Tera Fitoor","Tips Industries Ltd",61,135,67,"1254282"
162,"spotify:track:18YHbIhrleUkKKj2DvEp79","Pritam, KK","Zara Sa","Sony Music Entertainment India Pvt. Ltd.",33,183,85,"1252126"
163,"spotify:track:4SJMuaIYcBS8ke96lDYOsw","Karan Aujla","On Top","Karan Aujla Music",17,-1,54,"1248827"
164,"spotify:track:54PRUdMOYzglMGnsg9kIta","Raghav Chaitanya, Manoj Muntashir, Pritam","Hua Main (From ""ANIMAL"")","T-Series",6,158,53,"1241930"
165,"spotify:track:7Imk0IG6S5GA5iYWkjmMW5","Palak Muchhal, Arijit Singh","Chahun Main Ya Naa (From ""Aashiqui 2"")","T-Series",108,156,53,"1240254"
166,"spotify:track:5DgY6Ab0vpyUMKnY9ubFOF","Anirudh Ravichander, Super Subu","Hukum - Thalaivar Alappara","Sun Pictures",1,164,65,"1239024"
167,"spotify:track:1wnozUBSe7OMpmZiTPJC5j","A.R. Rahman, Javed Ali, KIRTI SAGATHIA, Pooja AV","Tum Tak","Sony Music Entertainment India Pvt. Ltd.",167,200,2,"1230874"
168,"spotify:track:2HRqTpkrJO5ggZyyK6NPWz","Sabrina Carpenter","Espresso","Island Records",26,152,25,"1229040"
169,"spotify:track:1FEiijYPJtyswChfcpv3p0","Lana Del Rey","Summertime Sadness","Polydor Records",137,190,25,"1226415"
170,"spotify:track:2eAvDnpXP5W0cVtiI0PUxV","Ruth B.","Dandelions","Columbia",14,167,143,"1222565"
171,"spotify:track:2iNqdCchlUZEgjJbQyZf8T","Kailash Kher, Paresh Kamath, Naresh Kamath","Teri Deewani","Sony Music Entertainment India Pvt. Ltd.",145,171,12,"1219478"
172,"spotify:track:0UZLaEOSIc5kg0cc7eszqC","Vishal Mishra","Manjha","Desi Music Factory",16,153,125,"1216227"
173,"spotify:track:0snQrp1VaY5Pj1YIHRJpRJ","Aditya A","Chaand Baaliyan","Sony Music Entertainment India Pvt. Ltd.",2,165,139,"1206329"
174,"spotify:track:5Tkf5CbtVYHA1SiKo1NrJE","Sachin-Jigar, Arijit Singh, Amitabha Bhattacharya","Phir Aur Kya Chahiye (From ""Zara Hatke Zara Bachke"")","Saregama",1,186,73,"1204486"
175,"spotify:track:5W7DOVGQLTigu09afW7QMT","Sidhu Moose Wala","295","Sidhu Moose Wala",1,176,140,"1197798"
176,"spotify:track:1feANd8EfcDP5UqSvbheM3","Sachet Tandon, Sachet-Parampara","Bekhayali (From ""Kabir Singh"")","T-Series",1,174,249,"1193780"
177,"spotify:track:4OcvkkpF3xmyCGGY5IBlgi","Akhil Sachdeva, Tulsi Kumar","Tera Ban Jaunga (From ""Kabir Singh"")","T-Series",4,175,266,"1189861"
178,"spotify:track:1sbW5E7w8tnqpYk0Frx8QG","A.R. Rahman","Maahi Ve","T-Series",178,-1,1,"1188597"
179,"spotify:track:32765xcLM1fd6wQIpkN9A0","Ami Mishra, Kunaal Vermaa","Hasi - Male Version","Sony Music Entertainment India Pvt. Ltd.",77,172,68,"1176291"
180,"spotify:track:4MU4Kfkd9EnkArK2ocQyqK","Arijit Singh, Harshdeep Kaur","Zaalima","Zee Music Company",78,182,75,"1171862"
181,"spotify:track:08Isz2ETWSBhvIl8UpKYsp","Shubh","No Love","SHUBH",2,188,136,"1171127"
182,"spotify:track:7G5wpuR61ABrT7R1snos7C","Pritam, Arijit Singh","Kalank - Title Track","Zee Music Company",5,178,251,"1165194"
183,"spotify:track:3hB9lDLyAClYVZivMMl20N","Prateek Kuhad","Co2","Elektra (NEK)",177,177,4,"1163370"
184,"spotify:track:3tgdOveYac7YMEAQD9sGLf","Vishal-Shekhar, Papon, Irshad Kamil","Bulleya","YRF Music",184,-1,1,"1156422"
185,"spotify:track:7AAap8D4C4pTyNoMkM9vjG","Shankar-Ehsaan-Loy, Diljit Dosanjh","Ishq Di Baajiyaan","Sony Music Entertainment India Pvt. Ltd.",153,166,12,"1155861"
186,"spotify:track:2S6N9pbnkhQRyAx80HmF79","Mohammed Irfan","Banjaara (From ""Ek Villain"")","T-Series",146,180,35,"1152811"
187,"spotify:track:6GQK4G5o60E8YA18DGpAzv","Harshit Saxena","Hale Dil","T-Series",98,199,11,"1148640"
188,"spotify:track:46byBJVhgLiL7e9uedasdg","AP Dhillon, Shinda Kahlon, Jazzy B","315 (feat. Shinda Kahlon & Jazzy B)","AP Dhillon",188,193,2,"1146095"
189,"spotify:track:3hRV0jL3vUpRrcy398teAU","Lord Huron","The Night We Met","Play It Again Sam",126,-1,15,"1145369"
190,"spotify:track:0xIuPDzJSnJywALez8dwKR","AP Dhillon","With You","Mass Appeal India",2,187,62,"1144377"
