rank,uri,artist_names,track_name,source,peak_rank,previous_rank,weeks_on_chart,streams
1,"spotify:track:5AnWrUzsrFgBvhn6dUElnr","Sachin-Jigar, Amitabh Bhattacharya, Madhubanti Bagchi, Divya Kumar","Aaj Ki Raat (From ""Stree 2"")","Saregama India Ltd",1,4,4,"6938012"
2,"spotify:track:25Nxyrng0Z3jC5Q0hAibpw","Karan Aujla","Tauba Tauba (From ""Bad Newz"")","Saregama India Ltd",1,1,7,"6122757"
3,"spotify:track:5zCnGtCl5Ac5zlFHXaZmhy","Ram Sampath, Arijit Singh, Prashant Pandey","Sajni (From ""Laapataa Ladies"")","T-Series",1,3,16,"5527545"
4,"spotify:track:1mQUEvGR7Sbt2OCz2gFrdx","Amitabh Bhattacharya, Sachin-Jigar, Pawan Singh, Simran Choudhary","Aayi Nai (From ""Stree 2"")","Saregama India Ltd",4,82,2,"5275812"
5,"spotify:track:0OA00aPt3BV10qeMIs3meW","Hanumankind, Kalmi","Big Dawgs","Universal Music India Pvt Ltd.",2,2,4,"4972836"
6,"spotify:track:0MTdYgTZ25sLCO6kVnDoje","Sai Abhyankkar, Sai Smriti","Aasa Kooda - From ""Think Indie""","Think Music",3,5,9,"4327301"
7,"spotify:track:1bxzr3JK05fMTcweGAZUHp","Shilpa Rao, Anirudh Ravichander, Ramajogayya Sastry","Chuttamalle (From ""Devara Part 1"")","T-Series",7,10,3,"3887845"
8,"spotify:track:0XRb6eZE4dBIJdqwf1Mixu","Juss, MixSingh","Suniyan Suniyan","Mix It Up Studio",3,6,14,"3864950"
9,"spotify:track:7bzR0C8NhnBA79iTXUCJ7o","Vishal Mishra","Jaanam (From ""Bad Newz"")","Saregama India Ltd",7,7,6,"3792568"
10,"spotify:track:1hlbywc8Jhl1FFqJxAMabE","Faheem Abdullah, Rauhan Malik, Amir Ameer","Ishq","Artiste First",8,8,21,"3641773"
11,"spotify:track:1r6GbBLdtUK1Vl1IHT14wP","Mohammad Faiz, Jaani","Dekhha Tenu (From ""Mr. And Mrs. Mahi"")","Sony Music Entertainment India Pvt. Ltd.",2,9,14,"3405967"
12,"spotify:track:36N5awamOX6XX5pQn3aFXZ","Darshan Raval, Jonita Gandhi, Rochak Kohli, Gurpreet Saini","Soni Soni (From ""Ishq Vishk Rebound"")","Tips Industries Ltd",4,11,12,"3219960"
13,"spotify:track:3yHyiUDJdz02FZ6jfUbsmY","Arijit Singh, Shreyas Puranik, Siddharth - Garima","Satranga (From ""ANIMAL"")","T-Series",2,12,43,"3155671"
14,"spotify:track:0YQJoDL6f46J0n1rOVkpxJ","Karan Aujla, Ikky","Softly","WM Canada",4,19,53,"3115824"
15,"spotify:track:2Fv2injs4qAm8mJBGaxVKU","Arijit Singh, Mithoon","Tujhe Kitna Chahne Lage (From ""Kabir Singh"")","T-Series",2,17,273,"3099163"
16,"spotify:track:69Qzz3yyQSsA0T95jLDoPL","Gurnazar, Chet Singh","Dil Tu Jaan Tu","Mars Films / Jhankar Music",14,14,4,"3007410"
17,"spotify:track:1eZefeDb8uOsjvcbl1fJrG","Diljit Dosanjh, Badshah, Raj Ranjodh","Naina (From ""Crew"")","Tips Industries Ltd",3,20,24,"2868443"
18,"spotify:track:7yDHHVKLbvDmVw1XXhDDIO","Vishal Mishra, Raj Shekhar","Pehle Bhi Main","T-Series",1,15,38,"2854528"
19,"spotify:track:0TL0LFcwIBF5eX7arDIKxY","Anuv Jain","Husn","Universal Music India Pvt. Ltd. (on behalf of Anuv Jain)",1,13,38,"2844494"
20,"spotify:track:1a1xLj9W8libnO9PvJf6ao","Sushin Shyam, Dabzee, Vinayak Sasikumar","Illuminati","Think Music",3,16,20,"2831149"
21,"spotify:track:1WxzZoWBTmB68AtyA6ejBB","Sohail Sen, Monali Thakur, Kausar Munir","Haan Ke Haan","YRF Music",21,31,3,"2817046"
22,"spotify:track:0M0ANKNzmM4Odd7FNKghzW","Mitraz","Akhiyaan Gulaab (From ""Teri Baaton Mein Aisa Uljha Jiya"")","T-Series",2,22,30,"2785197"
23,"spotify:track:6bmmHeCvZI92pRiTHxEdTC","Pritam, Arijit Singh, Irshad Kamil","O Maahi","T-Series",4,23,36,"2767951"
24,"spotify:track:3xMHXmedL5Rvfxmiar9Ryv","Anirudh Ravichander, Arijit Singh, Shilpa Rao, Kumaar","Chaleya","T-Series",1,21,54,"2749143"
25,"spotify:track:7eQl3Yqv35ioqUfveKHitE","Pritam, Mohit Chauhan, Irshad Kamil","Tum Se Hi","T-Series",17,18,231,"2718407"
26,"spotify:track:5ZLkihi6DVsHwDL3B8ym1t","Shubh","One Love","SHUBH",3,29,53,"2677610"
27,"spotify:track:0645eBDehHcqfiF15hscQV","Vishal Mishra, Rashmeet Kaur","Janiye (from the Netflix Film ""Chor Nikal Ke Bhaga"")","Netflix Music",5,26,59,"2634451"
28,"spotify:track:5sUSbJo0brScvv48ZZ1HrQ","Atif Aslam, Jyotica Tangri","O Meri Laila","Zee Music Company",28,65,17,"2577655"
29,"spotify:track:1tf2iody5iRLYYPDSBpzRc","Badshah, Arijit Singh","Soulmate","Universal Music India Pvt Ltd.",2,27,22,"2532066"
30,"spotify:track:2ceeTJAzKy295Fm0VsaXtE","Sachin-Jigar, Raghav Chaitanya, Varun Jain, Indraneel","Tum Se (From ""Teri Baaton Mein Aisa Uljha Jiya"")","T-Series",10,28,28,"2513546"
31,"spotify:track:1hA697u7e1jX2XM8sWA6Uy","Sachin-Jigar, Arijit Singh, Amitabh Bhattacharya","Apna Bana Le","Zee Music Company",1,33,61,"2511471"
32,"spotify:track:5PUXKVVVQ74C3gl5vKy9Li","Jasleen Royal, Arijit Singh, Dulquer Salmaan","Heeriye (feat. Arijit Singh)","Warner Music India",1,30,56,"2462461"
33,"spotify:track:6egfWbtFFhMToV2DvmEzmo","Bunny, Hunny, Sagar","Tu Hain Toh (From ""Mr. And Mrs. Mahi"")","Sony Music Entertainment India Pvt. Ltd.",8,24,9,"2425275"
34,"spotify:track:3bmsaFp11I9pbicxzlStf3","Akshath","nadaaniyan","Universal Music India Pvt Ltd.",6,25,10,"2315590"
35,"spotify:track:3FqtduiaqnFYvBgKuc6QWQ","Karan Aujla, Mxrci","Winning Speech","Karan Aujla",8,32,14,"2312093"
36,"spotify:track:2PvaburAUlhNHxVhw5lvOq","Arijit Singh","Humdard (From ""Ek Villain"")","T-Series",28,45,214,"2244010"
37,"spotify:track:2tjWCe2W7sgvS3C8NHcdtI","Akhil, Dhvani Bhanushali, Kunaal Vermaa, Abhijit Vaghani","Duniyaa (From ""Luka Chuppi"")","T-Series",1,41,287,"2229444"
38,"spotify:track:62bOmKYxYg7dhrC6gH9vFn","*NSYNC","Bye Bye Bye - From Deadpool and Wolverine Soundtrack","Jive",28,34,4,"2214202"
39,"spotify:track:5npFBWhVs3VVlc0nY5xQMA","Sachin-Jigar, Arijit Singh","Tainu Khabar Nahi - From ""Munjya""","Zee Music Company",17,38,10,"2211572"
40,"spotify:track:4eBvRhTJ2AcxCsbfTUjoRp","Shubh","Cheques","SHUBH",1,40,65,"2201708"
41,"spotify:track:3zSSCPpLZ5Oc8nelhhGjKz","AUR","Tu hai kahan","Sony Music Entertainment",1,35,45,"2200517"
42,"spotify:track:1kDZSmw3mKQeAjcmPTLS3M","Pritam, Arijit Singh, Shreya Ghoshal, Amitabh Bhattacharya","Tum Kya Mile, Pt. 2","Saregama India Ltd",9,36,60,"2177974"
43,"spotify:track:1hHrBEkN0JIaeFPegy4Xak","A.R. Rahman, Santhosh Narayanan, Shweta Mohan, Gana Kadhar","Water Packet (From ""Raayan"")","Sun Pictures",43,43,4,"2140937"
44,"spotify:track:1y1rQTkWmrZdJmjwuK07GC","Vishal Mishra, Manoj Muntashir","Kaise Hua (From ""Kabir Singh"")","T-Series",5,44,271,"2122669"
45,"spotify:track:5ouREJYZCYqwF0p7VeUtfH","Karan Aujla","IDK HOW","Karan Aujla/Rehaan Records",7,39,8,"2102898"
46,"spotify:track:1o8YPl0hyGbpRcHplXNvsm","Vishal Mishra, Sachin-Jigar, Amitabh Bhattacharya","Khoobsurat (From ""Stree 2"")","Saregama India Ltd",46,-1,1,"2101983"
47,"spotify:track:7KQdgW7QzNd9oPoCzjCU76","Shubh","Bandana","Shubh",8,49,21,"2076072"
48,"spotify:track:6y5SuF4NxGkvwpAdqcAkD3","Pritam, Arijit Singh, Shreya Ghoshal, Shadab Faridi, Altamash Faridi, Amitabh Bhattacharya","Ve Kamleya","Saregama India Ltd",15,42,54,"2059726"
49,"spotify:track:45PA9lW7U5LYnlpGrdTyHY","Jasleen Royal, Ujjwal Kashyap","Sang Rahiyo (feat. Ujjwal Kashyap)","Warner Music India",21,48,24,"2021323"
50,"spotify:track:0rMeOAvbQZ2RTG4B6L1M4p","Darshan Raval","Asal Mein","Indie Music Label",21,54,169,"2015797"
51,"spotify:track:1418IuVKQPTYqt7QNJ9RXN","King","Maan Meri Jaan","Warner Music India",1,71,97,"1986122"
52,"spotify:track:5Ggb9pKiKcr5vNV9v1e1vs","Varun Jain, Shilpa Rao, Sachin-Jigar, Amitabh Bhattacharya","Tumhare Hi Rahenge Hum","Saregama India Ltd",52,-1,1,"1962442"
53,"spotify:track:6qtszUy5n1os6eLP337zZK","A.R. Rahman, Dhanush","Adangaatha Asuran (From ""Raayan"")","Sun Pictures",16,37,5,"1939581"
54,"spotify:track:7KmCQLSSde0UX5OqCgvGN9","Karan Aujla","ANTIDOTE","Karan Aujla/Rehaan Records",32,57,8,"1928251"
55,"spotify:track:5pPyvA03RKSJrAnnDcq0nh","Sachin-Jigar, Shreya Ghoshal, Tochi Raina","Saibo","Sony Music Entertainment India Pvt. Ltd.",31,52,199,"1885351"
56,"spotify:track:0UZLaEOSIc5kg0cc7eszqC","Vishal Mishra","Manjha","Desi Music Factory",16,50,117,"1881097"
57,"spotify:track:48Ix6ReYdJf2H4mKb3TIpj","Atif Aslam, Alisha Chinai, Pritam","Tera Hone Laga Hoon","Tips Industries Ltd",35,51,171,"1863354"
58,"spotify:track:2FCXQHugkoHE1K3tiDu8pu","Alka Yagnik, Arijit Singh","Agar Tum Saath Ho (From ""Tamasha"")","T-Series",4,47,273,"1852313"
59,"spotify:track:0rlLBWFFTQiOWi963SH9bb","The Local Train","Choo Lo","The Local Train",49,53,61,"1849279"
60,"spotify:track:4XxfOvudrnBRdlgzEaq1sd","Diljit Dosanjh","Born to Shine","FAMOUS STUDIOS INC",28,60,60,"1846854"
61,"spotify:track:4WLDaQ8AgSwUgFoPzJkAYK","AP Dhillon","Old Money","AP Dhillon",61,-1,1,"1835901"
62,"spotify:track:6t9KM2EQD4H2KbrTgHGYf3","Sachin-Jigar, Jasmine Sandlas, Amitabh Bhattacharya","Taras - From ""Munjya""","Zee Music Company",38,64,10,"1831549"
63,"spotify:track:3APdIdF8H0jsxSuGOqXedS","Rashid Ali","Kabhi Kabhi Aditi","T-Series",63,84,130,"1830654"
64,"spotify:track:56zZ48jdyY2oDXHVnwg5Di","Mithoon, Arijit Singh","Tum Hi Ho","T-Series",42,56,186,"1809363"
65,"spotify:track:52itZ0w0CydihB2JCZEIft","Pritam, Mohit Chauhan, Irshad Kamil","Pee Loon","T-Series",63,63,28,"1795086"
66,"spotify:track:2C6CJGFLbisteRuY6Plb7b","Danny, Avvy Sra, Sagar","Ve Haaniyaan","Dreamiyata Music",10,76,29,"1789508"
67,"spotify:track:6mTvwBzWTGDOVeCNQEqtOE","Amaal Mallik, Arijit Singh, Tulsi Kumar","Soch Na Sake","T-Series",46,72,86,"1778990"
68,"spotify:track:4UMIv5jd9gK98a39BQRD9X","Pritam, Arijit Singh, Amitabh Bhattacharya","Kesariya","Sony Music Entertainment India Pvt. Ltd.",1,55,110,"1762759"
69,"spotify:track:3nKQrVVlwbAQSnFbgZWdN0","Avvy Sra, Karan Aujla, Jaani","White Brown Black","Universal Music India Pvt Ltd. – Distribution",29,97,88,"1758790"
70,"spotify:track:1smFN2CLqGROu0J0UyvDfL","Pritam, Arijit Singh","Shayad","Sony Music Entertainment India Pvt. Ltd.",1,59,240,"1751680"
71,"spotify:track:5XeFesFbtLpXzIVDNQP22n","Arctic Monkeys","I Wanna Be Yours","Domino Recording Co",48,74,93,"1748115"
72,"spotify:track:7acH6yiK56etufZpUIv1YW","Shubh","Be Mine","Shubh",61,61,7,"1714174"
73,"spotify:track:2cPUB8EOT6AfJ8oxhyoNXL","Pritam, Javed Bashir","Ye Tune Kya Kiya","T-Series",68,68,27,"1696366"
74,"spotify:track:6c4Po8zyQjB4cR5XgLhcGb","Prabh Singh, Jay Trak, Rooh Sandhu","9:45","Prabh Singh Official",9,62,59,"1692855"
75,"spotify:track:0eCajpR75pDW0r64U6hP2x","Anuv Jain","Jo Tum Mere Ho","Universal Music India Pvt. Ltd. (on behalf of Anuv Jain)",75,144,2,"1670473"
76,"spotify:track:3qrdLVOClRU4yPkcXZ7c5u","Ayushmann Khurrana, Tanishk-Vayu","Mere Liye Tum Kaafi Ho (From ""Shubh Mangal Zyada Saavdhan"")","T-Series",11,93,228,"1664976"
77,"spotify:track:0TrsGqtFXMWCrF9pPMICY9","Jyoti Nooran, Jaani, Bunny","Paon Ki Jutti","Universal Music India Pvt Ltd. – Distribution",8,58,13,"1659435"
78,"spotify:track:5BKKKNwrebowaMoUdBaNby","King","Tu Aake Dekhle","Warner Music India",3,94,186,"1658883"
79,"spotify:track:4Pow6acOGSaXcs6Gd05SP5","Jasleen Royal, B Praak, Romy","Ranjha","Sony Music Entertainment India Pvt. Ltd.",1,66,159,"1657505"
80,"spotify:track:3HiobOOpSpMsi95WBKPBYk","Jeet Gannguli, Arijit Singh","Hamari Adhuri Kahani (Title Track)","Sony Music Entertainment India Pvt. Ltd.",56,78,145,"1624294"
81,"spotify:track:26elzgFl8tvajnDfeoY1YF","Darshan Raval, Prakriti Kakar","Mannat","Warner Music India",18,69,37,"1623941"
82,"spotify:track:2GXXZFUxYg2LvG8SR0byOE","Sachin-Jigar, Atif Aslam","Jeena Jeena","Eros Now Music",37,75,160,"1618183"
83,"spotify:track:1d5lpW3gUyq537iuyrb9Lf","Aditya Rikhari","Samjho Na","CollabX Productions",46,46,70,"1611538"
84,"spotify:track:2IoZMG3RqiTmsy7Li3zGFg","Sachet Tandon, Parampara Tandon, Sachet-Parampara","Mere Sohneya (From ""Kabir Singh"")","T-Series",4,86,227,"1606008"
85,"spotify:track:0gPgdRfB4jdGrlyXS0Vx78","Vishal-Shekhar, KK, Shilpa Rao, Anvita Dutt Guptan","Khuda Jaane","YRF Music",37,88,98,"1596143"
86,"spotify:track:0GQngE2rOYvlKwEQjTAsP8","Pritam, Sreeram, Shilpa Rao","Subhanallah","T-Series",67,67,72,"1588051"
87,"spotify:track:3ZGJhN4unVspOqpwGvUL2W","Diljit Dosanjh","Lemonade","DILJIT DOSANJH",26,113,108,"1585458"
88,"spotify:track:2qSkIjg1o9h3YT9RAgYN75","Sabrina Carpenter","Espresso","Island Records",26,80,17,"1562020"
89,"spotify:track:73K33p4Vyz9koXGqmL5eFs","Sachet Tandon, Parampara Tandon, Kumaar, Sachet-Parampara","Malang Sajna","T-Series",4,81,83,"1554423"
90,"spotify:track:6H7fLdt0AeWpuxUKXuXWrx","Hariharan","Shree Hanuman Chalisa","T-Series",39,85,106,"1536888"
91,"spotify:track:6ygiy70ujkNOYXM1tQuMNe","Karan Aujla, Ikky, Preston Pablo","Admirin' You (feat. Preston Pablo)","WM Canada",24,100,55,"1531405"
92,"spotify:track:0FBQ4NrrHUbR9kus7rzrOj","Atif Aslam","Dil Diyan Gallan","YRF Music",56,92,236,"1527662"
93,"spotify:track:0Jiaz0O4AqnJICa9PxHhaR","Darshan Raval","Mahiye Jinna Sohna","Warner Music India",2,79,61,"1515313"
94,"spotify:track:2IEhtVeM9TVql8fZdKdlo9","Atif Aslam, Chinmayi, Pritam","Main Rang Sharbaton Ka","Tips Industries Ltd",73,77,33,"1508785"
95,"spotify:track:5vGiuYFSGekGLgbxhV1rD5","Atif Aslam, Pritam","Tu Jaane Na","Tips Industries Ltd",73,108,151,"1499979"
96,"spotify:track:1zzejMGRYKP5XOa3FmzXfa","Sai Abhyankkar","Katchi Sera - From ""Think Indie""","Think Music",6,83,29,"1482338"
97,"spotify:track:3yV2c3cYhkAwSsxAq6nRiv","Gajendra Verma","Mann Mera","Sony Music / Eros Now Music",26,110,177,"1477064"
98,"spotify:track:6GQK4G5o60E8YA18DGpAzv","Harshit Saxena","Hale Dil","T-Series",98,130,3,"1474100"
99,"spotify:track:3WLJ7D5kh44K5eJ1NqZQ6W","Anuv Jain","Baarishein","Universal Music India Pvt. Ltd. (on behalf of Anuv Jain)",18,95,171,"1470021"
100,"spotify:track:5BQePe9rcCJozHK3oPayYk","Shubh","MVP","Shubh",24,73,15,"1467999"
101,"spotify:track:5WXQbgwGwyauXOqswlEeQY","Tanishk Bagchi, Arijit Singh, Asees Kaur","Bolna (From ""Kapoor & Sons (Since 1921)"")","Sony Music Entertainment India Pvt. Ltd.",59,89,78,"1464140"
102,"spotify:track:1BpvuKIG7jK5EiTp2tv5z8","Shubh","King Shit","SHUBH",5,106,33,"1439073"
103,"spotify:track:79hQvdTHNBkq2fp2ZrM8b2","Javed-Mohsin, Arijit Singh, Shreya Ghoshal, Kunaal Vermaa, Prashant Ingole","Pal","Sony Music Entertainment India Pvt. Ltd.",34,87,285,"1429367"
104,"spotify:track:4wIWWEhbdgKAxhR68eE0Ye","Arijit Singh, Chinmayi","Mast Magan (From ""2 States"")","T-Series",45,111,183,"1428929"
105,"spotify:track:3yxUi5nDZSWcYKi1C2xmLd","Udit Narayan, Alka Yagnik, Lijo George-Dj Chetas, Anu Malik, Javed Akhtar","Mere Mehboob Mere Sanam (From ""Bad Newz"")","Saregama India Ltd",46,70,5,"1424547"
106,"spotify:track:7tpuDHfin2ZewPYOHTi3Uw","Dabzee, Ribin Richard","Habibi Drip","Pauly Jr. Pictures",106,112,3,"1422838"
107,"spotify:track:2RgvvnMwtP0R2OkVZmFvnV","KK","Ajab Si (From ""Om Shanti Om"")","T-Series",34,103,137,"1422773"
108,"spotify:track:1YMLgvsQdE27r30q0fsLeV","Arijit Singh","Tera Fitoor","Tips Industries Ltd",61,125,59,"1421045"
109,"spotify:track:6IR6mzRO60hnMjNoq8rCPE","Raghav, Tanishk Bagchi, Asees Kaur","Teri Baaton Mein Aisa Uljha Jiya Title Song (From ""Teri Baaton Mein Aisa Uljha Jiya"")","T-Series",5,101,29,"1419480"
110,"spotify:track:3F3ZuXYFXGM1V6pk3b3zmi","Diljit Dosanjh, thiarajxtt","Kinni Kinni","DILJIT DOSANJH",24,96,41,"1413339"
111,"spotify:track:4bD9z9qa4qg9BhryvYWB7c","Pritam, Tochi Raina, Rekha Bhardwaj","Kabira","T-Series",31,91,258,"1410015"
112,"spotify:track:32VAw8DL9ixX5XSW2VLcZ4","Parmish Verma, PARDHAAN, Desi Crew","Aam Jahe Munde","Parmish Verma Films",20,114,59,"1402385"
113,"spotify:track:1UWacd8x8tPPwmrPB1MoBI","Pritam, Arijit Singh","Ae Dil Hai Mushkil Title Track","Sony Music Entertainment India Pvt. Ltd.",79,105,238,"1401896"
114,"spotify:track:4VsP4Dm8gsibRxB5I2hEkw","Kaifi Khalil","Kahani Suno 2.0","1944121 Records DK",1,98,88,"1393362"
115,"spotify:track:7F8RNvTQlvbeBLeenycvN6","A.R. Rahman, Javed Ali, Mohit Chauhan","Kun Faya Kun","T-Series",60,109,124,"1385742"
116,"spotify:track:5O2P9iiztwhomNh8xkR9lJ","One Direction","Night Changes","Syco Music",22,117,171,"1373991"
117,"spotify:track:29m79w9xPMH4YCD6r8JSmV","AP Dhillon, Gurinder Gill, Intense","Excuses","RUN-UP RECORDS",1,124,148,"1369379"
118,"spotify:track:4Tkb7zsDmsawB7S5TpKQV1","Atif Aslam, Shiraz Uppal","Pehli Dafa","T-Series",118,133,42,"1366572"
119,"spotify:track:209QxKVJzh2FLUmZHpYs4m","Badshah, Karan Aujla, Hiten","God Damn","Universal Music India Pvt Ltd.",15,120,22,"1365747"
120,"spotify:track:7MXVkk9YMctZqd1Srtv4MB","The Weeknd, Daft Punk","Starboy","Universal Republic Records",12,122,160,"1324958"
121,"spotify:track:54PRUdMOYzglMGnsg9kIta","Raghav Chaitanya, Manoj Muntashir, Pritam","Hua Main (From ""ANIMAL"")","T-Series",6,119,45,"1315757"
122,"spotify:track:7uNnlVit5qDvfOje0pqICF","Mohit Chauhan, Suzanne D'Mello","Tum Ho","T-Series",62,115,12,"1313844"
123,"spotify:track:0tgVpDi06FyKpA1z0VMD4v","Ed Sheeran","Perfect","Atlantic Records UK",29,123,227,"1306851"
124,"spotify:track:1kTEGyqUJFgstwdgJFLqz1","Akashdeep Sengupta, Laqshay Kapoor, Kausar Munir, Suvarna Tiwari","Dil Se Dil Tak (From ""Bawaal"")","T-Series",38,118,29,"1287358"
125,"spotify:track:5W7DOVGQLTigu09afW7QMT","Sidhu Moose Wala","295","Sidhu Moose Wala",1,136,132,"1285073"
126,"spotify:track:0l6g8Z8mqGbGXFOjigYetD","Pritam, Arijit Singh","Hawayein","Sony Music Entertainment India Pvt. Ltd.",51,107,150,"1281221"
127,"spotify:track:2KeUpfBTRy7RTHEdGUmOZU","Jubin Nautiyal, Abhijeet Srivastava, Shayra Apoorva","Rabb Warga (From ""Bad Newz"")","Saregama India Ltd",99,99,3,"1277234"
128,"spotify:track:0snQrp1VaY5Pj1YIHRJpRJ","Aditya A","Chaand Baaliyan","Sony Music Entertainment India Pvt. Ltd.",2,135,131,"1269809"
129,"spotify:track:0JBhoxPKHJc1ZeJrjSt0VO","Gajendra Verma","Tera Ghata","Virtual Planet Production Pvt. Ltd.",62,187,59,"1269140"
130,"spotify:track:7CyPwkp0oE8Ro9Dd5CUDjW","The Weeknd, JENNIE, Lily-Rose Depp","One Of The Girls (with JENNIE, Lily Rose Depp)","XO / Republic Records",98,121,33,"1266830"
131,"spotify:track:2YMxiPx0Mu7ap1TYcLtBKE","Paal Dabba, ofRO, Deva","Kaathu Mela - From ""Think Indie""","Think Music",90,90,3,"1265842"
132,"spotify:track:5thVzD79BxlDTYy0LfHzvu","Aparshakti Khurana, Savi Kahlon","Zaroor","Sony Music Entertainment India Pvt. Ltd.",132,142,3,"1249718"
133,"spotify:track:5llaVhaIoowKT3fqf2NfPO","Atif Aslam, Pritam","Pehli Nazar Mein","Tips Industries Ltd",126,139,24,"1249381"
134,"spotify:track:5jAi1HXmSUd5poIEOQkYSy","Pritam, Arijit Singh, Jonita Gandhi, Ranveer Singh, Amitabh Bhattacharya","What Jhumka ?","Saregama India Ltd",6,128,58,"1247723"
135,"spotify:track:11qnwt18ZckPqchzK2I3U7","Mithoon, Arijit Singh, Sayeed Quadri","Dil Jhoom","Zee Music Company",93,143,28,"1243134"
136,"spotify:track:5ivRSlOhVIXN2QMzqgsX0s","The Local Train","Aaoge Tum Kabhi","The Local Train",116,132,10,"1240034"
137,"spotify:track:2ZD4aIEepqZsdxPxLSuUhm","Pritam, Arijit Singh, Amitabh Bhattacharya, Nikhita Gandhi","Tere Pyaar Mein","T-Series",5,159,80,"1239654"
138,"spotify:track:3hRV0jL3vUpRrcy398teAU","Lord Huron","The Night We Met","Play It Again Sam",126,127,9,"1237237"
139,"spotify:track:2fsBaSK1551VvUD9Uvbb9Q","Darshan Raval, Prakriti Giri","Tu Hai","Warner Music India",47,116,16,"1229760"
140,"spotify:track:610keNiNVTIkYD0CqeSerg","Cheema Y, Gur Sidhu","California Love","Brown Town Music",27,134,65,"1229135"
141,"spotify:track:7fW9J3EpVWVN1ouv0slAs0","KK","Kya Mujhe Pyar Hai (From ""Woh Lamhe"")","T-Series",42,165,81,"1223438"
142,"spotify:track:0YxKKO272sacGBJKjf6FnB","Jaani, B Praak","Saari Duniya Jalaa Denge","T-Series",3,104,39,"1215551"
143,"spotify:track:5Tkf5CbtVYHA1SiKo1NrJE","Sachin-Jigar, Arijit Singh, Amitabha Bhattacharya","Phir Aur Kya Chahiye (From ""Zara Hatke Zara Bachke"")","Saregama",1,146,65,"1214830"
144,"spotify:track:6vuMdb0E8buJeSHArN3dXk","Amaal Mallik, Armaan Malik, Kunaal Vermaa","Chale Aana (From ""De De Pyaar De"")","T-Series",18,131,105,"1200871"
145,"spotify:track:7m4CgL81VVIHaaiSxyH922","Yo Yo Honey Singh","Desi Kalakaar","T-Series",13,191,31,"1196287"
146,"spotify:track:3f0wz6zcA7XkQiGm0qNF5r","Arijit Singh, Tanishk Bagchi","Thodi Jagah (From ""Marjaavaan"")","T-Series",15,140,68,"1193482"
147,"spotify:track:4RCd3Gdtt3dNedof64hqRD","Mohammed Irfan, Arijit Singh, Saim Bhat","Phir Mohabbat (From ""Murder 2"")","T-Series",135,141,25,"1191440"
148,"spotify:track:2oenSXLDbWVaaL7QjSGYj5","Diljit Dosanjh, Intense, Sultaan","Lalkara","DILJIT DOSANJH",22,168,46,"1186896"
149,"spotify:track:7tI8dRuH2Yc6RuoTjxo4dU","Jimin","Who","BIGHIT MUSIC",61,102,5,"1181442"
150,"spotify:track:3sqRODOZ1Z6hR4F2tnFAlg","Maninder Buttar","Sakhiyaan","Ishtar Punjabi",20,-1,223,"1169000"
151,"spotify:track:7Imk0IG6S5GA5iYWkjmMW5","Palak Muchhal, Arijit Singh","Chahun Main Ya Naa (From ""Aashiqui 2"")","T-Series",108,147,45,"1164661"
152,"spotify:track:0rk2X5TAhraBC5aCIXK2Rq","Jawad Ahmad, Shaarib Toshi, Arijit Singh, Shreya Ghoshal","Samjhawan","Sony Music Entertainment India Pvt. Ltd.",70,148,170,"1160967"
153,"spotify:track:37AGZMVr5V8mEMcCmGHroZ","Kailash Kher, Paresh Kamath, Naresh Kamath","Saiyyan","Sony Music Entertainment India Pvt. Ltd.",126,150,34,"1159477"
154,"spotify:track:4OcvkkpF3xmyCGGY5IBlgi","Akhil Sachdeva, Tulsi Kumar","Tera Ban Jaunga (From ""Kabir Singh"")","T-Series",4,156,258,"1154179"
155,"spotify:track:4uK0M8AI6gyFmyzUneQpbi","A.R. Rahman, Arijit Singh, Shashaa Tirupati","Rait Zara Si (From ""Atrangi Re"")","T-Series",12,163,133,"1150768"
156,"spotify:track:7G5wpuR61ABrT7R1snos7C","Pritam, Arijit Singh","Kalank - Title Track","Zee Music Company",5,151,243,"1149979"
157,"spotify:track:3xIyi0QRmcz0cBDbVPTNGd","Jasleen Royal, Intense, Aditya Sharma","Assi Sajna","Warner Music India",152,152,5,"1148869"
158,"spotify:track:0dJacN6K3mSGLE9p7QE0lO","KK","Beete Lamhein (From ""The Train"")","T-Series",75,145,20,"1143591"
159,"spotify:track:1L3Nsi7YXtBxTdnbqektia","Darshan Raval","Hawa Banke","Indie Music Label",26,126,81,"1143186"
160,"spotify:track:1FEiijYPJtyswChfcpv3p0","Lana Del Rey","Summertime Sadness","Polydor Records",137,161,19,"1141460"
161,"spotify:track:4VosVUajzm6nzGlSb6nP3L","Parmish Verma, Paradox","Check It Out","SDA Studios",19,166,58,"1141118"
162,"spotify:track:18YHbIhrleUkKKj2DvEp79","Pritam, KK","Zara Sa","Sony Music Entertainment India Pvt. Ltd.",33,153,78,"1139111"
163,"spotify:track:32765xcLM1fd6wQIpkN9A0","Ami Mishra, Kunaal Vermaa","Hasi - Male Version","Sony Music Entertainment India Pvt. Ltd.",77,149,60,"1137139"
164,"spotify:track:08Isz2ETWSBhvIl8UpKYsp","Shubh","No Love","SHUBH",2,169,128,"1136084"
165,"spotify:track:42VsgItocQwOQC3XWZ8JNA","Travis Scott, Playboi Carti","FE!N (feat. Playboi Carti)","Cactus Jack/Epic",88,138,15,"1128371"
166,"spotify:track:3qhlB30KknSejmIvZZLjOD","Djo","End of Beginning","Djo",105,158,22,"1120097"
167,"spotify:track:1feANd8EfcDP5UqSvbheM3","Sachet Tandon, Sachet-Parampara","Bekhayali (From ""Kabir Singh"")","T-Series",1,162,241,"1112866"
168,"spotify:track:6eCA1w1FBvYeMcFTD6BWzl","Navaan Sandhu, Homeboy, Kaater","Ambarsaria","Sky Digital",168,184,2,"1111986"
169,"spotify:track:0xIuPDzJSnJywALez8dwKR","AP Dhillon","With You","Mass Appeal India",2,171,54,"1106143"
170,"spotify:track:6fScgF2Y63ScU73nYju0ny","Atif Aslam, Arko","O Saathi","T-Series",58,182,108,"1099616"
171,"spotify:track:2k0D2OXWXwuwBPXLQQYmZx","Gurnazar, Rahat Fateh Ali Khan, Kartik Dev","Dost Banke","EYP Creation Pvt Ltd (Distro)",114,157,9,"1096251"
172,"spotify:track:567e29TDzLwZwfDuEpGTwo","The Kid LAROI, Justin Bieber","STAY (with Justin Bieber)","Columbia",1,183,147,"1095017"
173,"spotify:track:4u0D2jZ20wQaEMHBSqsDnZ","King","Tu Jaana Na Piya","Warner Music India",15,180,43,"1090354"
174,"spotify:track:7yyCCfalLx9F8TbMo5jH03","Rasraj Ji Maharaj","Bajrang Baan-Lofi","Vianet Media",89,160,27,"1088701"
175,"spotify:track:3bQsp4Vr9Rg4fNCx6HPOgX","Anuv Jain","Alag Aasmaan","Universal Music India Pvt. Ltd. (on behalf of Anuv Jain)",30,155,49,"1086489"
176,"spotify:track:5O932cZmzOZGOGZz9RHx20","Pritam, Arijit Singh","Khairiyat","T-Series",1,177,258,"1084189"
177,"spotify:track:4BTPzhEsyW3blWcxcuhLM0","Shankar-Ehsaan-Loy, Shankar Mahadevan, Caralisa Monteiro, Shafqat Amanat Ali","Mitwa","Sony Music Entertainment India Pvt. Ltd.",177,196,6,"1082805"
178,"spotify:track:2iNqdCchlUZEgjJbQyZf8T","Kailash Kher, Paresh Kamath, Naresh Kamath","Teri Deewani","Sony Music Entertainment India Pvt. Ltd.",178,186,4,"1079634"
179,"spotify:track:2S6N9pbnkhQRyAx80HmF79","Mohammed Irfan","Banjaara (From ""Ek Villain"")","T-Series",146,154,27,"1075142"
180,"spotify:track:7AAap8D4C4pTyNoMkM9vjG","Shankar-Ehsaan-Loy, Diljit Dosanjh","Ishq Di Baajiyaan","Sony Music Entertainment India Pvt. Ltd.",170,170,4,"1073796"
181,"spotify:track:0ojpEubhy4JNeVftmVuiN7","Vishal Mishra, Armaan Malik","Pehla Pyaar","T-Series",11,173,169,"1072766"
182,"spotify:track:2rOnSn2piaqLAlYjtfUBlY","Tanishk Bagchi, Jubin Nautiyal, Asees Kaur","Raataan Lambiyan (From ""Shershaah"")","Sony Music Entertainment India Pvt. Ltd.",1,178,160,"1068821"
183,"spotify:track:5N3hjp1WNayUPZrA8kJmJP","Sabrina Carpenter","Please Please Please","Island Records",74,164,10,"1066785"
184,"spotify:track:6oz1L5jcqZWYuId7nxvIan","Shubh","Still Rollin","SHUBH",4,175,66,"1061964"
185,"spotify:track:4blqlsA1uf2d2I40E90EUC","Pritam, Arijit Singh, Shilpa Rao","Tere Hawaale (From ""Laal Singh Chaddha"")","T-Series",11,174,78,"1048362"
186,"spotify:track:5a2Hoi1wuhCA6Ob7pbOlpW","Divya Kumar, Priya Saraiya","Sun Saathiya","Zee Music Company",121,172,15,"1042835"
187,"spotify:track:6zCQF5tu7HVwU9shhKqiuF","Jeet Gannguli, Arijit Singh","Khamoshiyan","Sony Music Entertainment India Pvt. Ltd.",90,179,69,"1031387"
188,"spotify:track:3ygfdwvBJ2Y5XhJiiHFFZE","Sachet Tandon","Maiyya Mainu","Zee Music Company",5,-1,94,"1030700"
189,"spotify:track:65c6VCikt7f5sAS1heoYQC","Bohemia, Sidhu Moose Wala","Same Beef","Saga Music",53,-1,82,"1029738"
190,"spotify:track:2kQ4qdEtzWR1scQBlsjl8M","Faris Shafi, Umair Butt, Gharvi Group","Blockbuster","Giraffe Music",151,193,6,"1027383"
191,"spotify:track:5DgY6Ab0vpyUMKnY9ubFOF","Anirudh Ravichander, Super Subu","Hukum - Thalaivar Alappara","Sun Pictures",1,189,58,"1023004"
