rank,uri,artist_names,track_name,source,peak_rank,previous_rank,weeks_on_chart,streams
193,"spotify:track:6cUOiOY5qh2FpIQWIYAd2h","Pritam, Darshan Raval, Antara Mitra","Mehrama","Sony Music Entertainment India Pvt. Ltd.",10,-1,186,"1029389"
194,"spotify:track:3USxtqRwSYz57Ewm6wWRMp","Glass Animals","Heat Waves","Polydor Records",3,126,122,"1024295"
195,"spotify:track:4MU4Kfkd9EnkArK2ocQyqK","Arijit Singh, Harshdeep Kaur","Zaalima","Zee Music Company",78,188,69,"1024204"
196,"spotify:track:2lX53kXvYnvpV8Vqfe4S7s","Aashir Wajahat, NAYEL, Nehaal Naseem","Sadqay","Sony Music Entertainment",15,162,18,"1023824"
197,"spotify:track:7H3mfOvtPNA8YDF3EdKy0L","Neeraj Shridhar, Kavita Seth, Pritam","Tum Hi Ho Bandhu","Eros Now Music",144,-1,22,"1023078"
198,"spotify:track:7mSzDKajY2wUtstQSLdzMK","Mohit Chauhan, Rochak Kohli","Rang Lageya","Saregama",35,193,72,"1021970"
199,"spotify:track:24MMjyA3NLqCsDJfsn51eg","Sharn, The Paul","Mi Amor","Desi Avenue",7,-1,75,"1021228"
200,"spotify:track:3JkVYvxNoGf2HCWJo61462","Sidhu Moose Wala, Sunny Malton, SOE","Never Fold","Sidhu Moose Wala",13,190,108,"1018828"
