rank,uri,artist_names,track_name,source,peak_rank,previous_rank,weeks_on_chart,streams
1,"spotify:track:0eCajpR75pDW0r64U6hP2x","Anuv Jain","Jo Tum Mere Ho","Universal Music India Pvt. Ltd. (on behalf of Anuv Jain)",1,1,20,"7358458"
2,"spotify:track:3vCzLB6kS2lGcIpm1OOUsy","Anurag Saikia, Raj Shekhar, Romy, Amarabha Banerjee, Varun Jain, Madhubanti Bagchi, Mismatched - Cast","Ishq Hai","Netflix Music",2,27,2,"5818540"
3,"spotify:track:4vHRQnzGcKEtqsLH70tAms","Sachet-Parampara, Parampara Tandon, Kausar Munir","Raanjhan (From ""Do Patti"")","T-Series",2,2,10,"5812451"
4,"spotify:track:2plbrEY59IikOBgBGLjaoe","Lady Gaga, Bruno Mars","Die With A Smile","Interscope",4,4,13,"5225657"
5,"spotify:track:1hlbywc8Jhl1FFqJxAMabE","Faheem Abdullah, Rauhan Malik, Amir Ameer","Ishq","Artiste First",2,3,39,"5002659"
6,"spotify:track:4ulroyDK6rN73nVkCkWhur","Jasleen Royal, Stebin Ben, Vijay Deverakonda, Radhikka Madan, Priya Saraiya, Aditya Sharma","Sahiba","Warner Music India",5,5,5,"4746415"
7,"spotify:track:4d2jV5fmX6hbRwaRbY39dt","Karan Aujla","Wavy","Karan Aujla Music",4,6,6,"4673806"
8,"spotify:track:5AnWrUzsrFgBvhn6dUElnr","Sachin-Jigar, Amitabh Bhattacharya, Madhubanti Bagchi, Divya Kumar","Aaj Ki Raat (From ""Stree 2"")","Saregama India Ltd",1,8,22,"4198158"
9,"spotify:track:5zCnGtCl5Ac5zlFHXaZmhy","Ram Sampath, Arijit Singh, Prashant Pandey","Sajni (From ""Laapataa Ladies"")","T-Series",1,7,34,"4098388"
10,"spotify:track:78BWCd70D1X6LMkDZm1UoF","Yo Yo Honey Singh","Millionaire","T-Series",3,11,17,"3971729"
11,"spotify:track:1hA697u7e1jX2XM8sWA6Uy","Sachin-Jigar, Arijit Singh, Amitabh Bhattacharya","Apna Bana Le","Zee Music Company",1,10,79,"3768142"
12,"spotify:track:1PALLCSlHwAI4upY3sMg8u","Aditya Rikhari, Tulsi Kumar, Lijo George-Dj Chetas","Jaana Samjho Na (From ""Bhool Bhulaiyaa 3"")","T-Series",9,9,8,"3617193"
13,"spotify:track:7DKWcqsUjsjBD56kbYvx50","Juss, MixSingh","Mera Mann","Times Music – Speed Records",12,12,3,"3447723"
14,"spotify:track:1dFrZr9eMUsFqeag04ClqD","Dhanda Nyoliwala","Russian Bandana","Universal Music India Pvt Ltd.",6,13,13,"3357128"
15,"spotify:track:0TL0LFcwIBF5eX7arDIKxY","Anuv Jain","Husn","Universal Music India Pvt. Ltd. (on behalf of Anuv Jain)",1,15,56,"3272041"
16,"spotify:track:2Fv2injs4qAm8mJBGaxVKU","Arijit Singh, Mithoon","Tujhe Kitna Chahne Lage (From ""Kabir Singh"")","T-Series",2,14,291,"3215859"
17,"spotify:track:76ZWOhRRQzmb4xMoZzTjJ9","Yo Yo Honey Singh, Paradox","Payal","T-Series",17,20,5,"3211636"
18,"spotify:track:1bxzr3JK05fMTcweGAZUHp","Shilpa Rao, Anirudh Ravichander, Ramajogayya Sastry","Chuttamalle (From ""Devara Part 1"")","T-Series",4,18,21,"3194058"
19,"spotify:track:0YQJoDL6f46J0n1rOVkpxJ","Karan Aujla, Ikky","Softly","WM Canada",4,22,71,"3117407"
20,"spotify:track:4wJ5Qq0jBN4ajy7ouZIV1c","ROSÉ, Bruno Mars","APT.","Atlantic Records",18,25,10,"3064879"
21,"spotify:track:3yHyiUDJdz02FZ6jfUbsmY","Arijit Singh, Shreyas Puranik, Siddharth - Garima","Satranga (From ""ANIMAL"")","T-Series",2,16,61,"3026263"
22,"spotify:track:1eZefeDb8uOsjvcbl1fJrG","Diljit Dosanjh, Badshah, Raj Ranjodh","Naina (From ""Crew"")","Tips Industries Ltd",3,21,42,"2979397"
23,"spotify:track:7eQl3Yqv35ioqUfveKHitE","Pritam, Mohit Chauhan, Irshad Kamil","Tum Se Hi","T-Series",14,23,249,"2942603"
24,"spotify:track:5FXMRdJjKq1BIX4e8Eg9mK","Vishal-Shekhar, KK","Ajab Si","T-Series",24,26,155,"2880534"
25,"spotify:track:7yDHHVKLbvDmVw1XXhDDIO","Vishal Mishra, Raj Shekhar","Pehle Bhi Main","T-Series",1,17,56,"2871060"
26,"spotify:track:25Nxyrng0Z3jC5Q0hAibpw","Karan Aujla","Tauba Tauba (From ""Bad Newz"")","Saregama India Ltd",1,32,25,"2759726"
27,"spotify:track:2PvaburAUlhNHxVhw5lvOq","Arijit Singh","Humdard (From ""Ek Villain"")","T-Series",24,24,232,"2714848"
28,"spotify:track:1mQUEvGR7Sbt2OCz2gFrdx","Amitabh Bhattacharya, Sachin-Jigar, Pawan Singh, Simran Choudhary","Aayi Nai (From ""Stree 2"")","Saregama India Ltd",2,29,20,"2710975"
29,"spotify:track:2cPUB8EOT6AfJ8oxhyoNXL","Pritam, Javed Bashir","Ye Tune Kya Kiya","T-Series",27,35,45,"2657756"
30,"spotify:track:2ceeTJAzKy295Fm0VsaXtE","Sachin-Jigar, Raghav Chaitanya, Varun Jain, Indraneel","Tum Se (From ""Teri Baaton Mein Aisa Uljha Jiya"")","T-Series",10,28,46,"2648335"
31,"spotify:track:4XxfOvudrnBRdlgzEaq1sd","Diljit Dosanjh","Born to Shine","FAMOUS STUDIOS INC",14,30,78,"2620685"
32,"spotify:track:1UEbsf5kGEIcSMiWexOkrZ","Khushi TDT, Lash curry, Audiocrackerr","Victory Anthem","Sony Music Entertainment India Pvt. Ltd.",17,33,7,"2585153"
33,"spotify:track:6reHcXJekQ2csk0UazSBV1","Shankarr Babu Kandukoori, Laxmi Dasa, Devi Sri Prasad, Chandra Bose, Siju Thuravoor","Peelings (From ""Pushpa 2 The Rule"") [TELUGU]","T-Series",19,19,3,"2570629"
34,"spotify:track:6uwfPoH4JwdtD9b4mjZeZz","Karan Aujla, Neha Kakkar, Jay Trak","Aaye Haaye (Feat. Nora Fatehi)","T-Series",34,98,3,"2562022"
35,"spotify:track:3WLJ7D5kh44K5eJ1NqZQ6W","Anuv Jain","Baarishein","Universal Music India Pvt. Ltd. (on behalf of Anuv Jain)",16,34,189,"2555287"
36,"spotify:track:45PA9lW7U5LYnlpGrdTyHY","Jasleen Royal, Ujjwal Kashyap","Sang Rahiyo (feat. Ujjwal Kashyap)","Warner Music India",21,37,42,"2542487"
37,"spotify:track:1r6GbBLdtUK1Vl1IHT14wP","Mohammad Faiz, Jaani","Dekhha Tenu (From ""Mr. And Mrs. Mahi"")","Sony Music Entertainment India Pvt. Ltd.",2,41,32,"2519561"
38,"spotify:track:0XRb6eZE4dBIJdqwf1Mixu","Juss, MixSingh","Suniyan Suniyan","Mix It Up Studio",3,42,32,"2516443"
39,"spotify:track:6bmmHeCvZI92pRiTHxEdTC","Pritam, Arijit Singh, Irshad Kamil","O Maahi","T-Series",4,46,54,"2496624"
40,"spotify:track:5PUXKVVVQ74C3gl5vKy9Li","Jasleen Royal, Arijit Singh, Dulquer Salmaan","Heeriye (feat. Arijit Singh)","Warner Music India",1,40,74,"2435337"
41,"spotify:track:3zSSCPpLZ5Oc8nelhhGjKz","AUR","Tu hai kahan","Sony Music Entertainment",1,39,63,"2427970"
42,"spotify:track:1o8YPl0hyGbpRcHplXNvsm","Vishal Mishra, Sachin-Jigar, Amitabh Bhattacharya","Khoobsurat (From ""Stree 2"")","Saregama India Ltd",5,31,19,"2399521"
43,"spotify:track:0M0ANKNzmM4Odd7FNKghzW","Mitraz","Akhiyaan Gulaab (From ""Teri Baaton Mein Aisa Uljha Jiya"")","T-Series",2,45,48,"2340331"
44,"spotify:track:1y1rQTkWmrZdJmjwuK07GC","Vishal Mishra, Manoj Muntashir","Kaise Hua (From ""Kabir Singh"")","T-Series",5,38,289,"2336090"
45,"spotify:track:2GXXZFUxYg2LvG8SR0byOE","Sachin-Jigar, Atif Aslam","Jeena Jeena","Eros Now Music",29,43,172,"2316569"
46,"spotify:track:5npFBWhVs3VVlc0nY5xQMA","Sachin-Jigar, Arijit Singh","Tainu Khabar Nahi - From ""Munjya""","Zee Music Company",17,44,28,"2300476"
47,"spotify:track:5ZLkihi6DVsHwDL3B8ym1t","Shubh","One Love","SHUBH",3,53,71,"2280248"
48,"spotify:track:2IoZMG3RqiTmsy7Li3zGFg","Sachet Tandon, Parampara Tandon, Sachet-Parampara","Mere Sohneya (From ""Kabir Singh"")","T-Series",4,47,245,"2275166"
49,"spotify:track:5ZjWYv5kOH1ywFmv5JjPNd","Sachin-Jigar, Shilpa Rao, Sachet Tandon, Priya Saraiya","Mere Mehboob","T-Series",29,50,12,"2200034"
50,"spotify:track:3jPLJbSL14oH6pcSLIaMGJ","Badshah, Sharvi Yadav","Morni","Saregama India Ltd",33,36,5,"2191922"
51,"spotify:track:5Ggb9pKiKcr5vNV9v1e1vs","Varun Jain, Shilpa Rao, Sachin-Jigar, Amitabh Bhattacharya","Tumhare Hi Rahenge Hum","Saregama India Ltd",8,51,19,"2167734"
52,"spotify:track:5VvkNZesG4T86mUULEG5Wp","Sachet-Parampara, Sachet Tandon, Parampara Tandon, Kausar Munir","Maiyya","T-Series",52,80,3,"2158325"
53,"spotify:track:3be9ACTxtcL6Zm4vJRUiPG","yung kai","blue","BMG Rights Management (US) LLC",53,97,3,"2154562"
54,"spotify:track:3nKQrVVlwbAQSnFbgZWdN0","Avvy Sra, Karan Aujla, Jaani","White Brown Black","Universal Music India Pvt Ltd. – Distribution",29,58,106,"2141166"
55,"spotify:track:2QophXhN2Ls2URfoPmiviC","Taaruk Raina, Mismatched - Cast","Kho Gaye","Netflix Music",8,-1,51,"2120714"
56,"spotify:track:0645eBDehHcqfiF15hscQV","Vishal Mishra, Rashmeet Kaur","Janiye (from the Netflix Film ""Chor Nikal Ke Bhaga"")","Netflix Music",5,48,77,"2101887"
57,"spotify:track:6fScgF2Y63ScU73nYju0ny","Atif Aslam, Arko","O Saathi","T-Series",56,56,126,"2093640"
58,"spotify:track:7KQdgW7QzNd9oPoCzjCU76","Shubh","Bandana","Shubh",8,64,39,"2077466"
59,"spotify:track:0n6NBNUZQmH1KGRt5J9Nkq","Haricharan, Shweta Mohan, G. V. Prakash, Karthik Netha","Hey Minnale (From ""Amaran"")","Saregama India Ltd",10,61,11,"2060785"
60,"spotify:track:2FCXQHugkoHE1K3tiDu8pu","Alka Yagnik, Arijit Singh","Agar Tum Saath Ho (From ""Tamasha"")","T-Series",4,57,291,"2047724"
61,"spotify:track:56zZ48jdyY2oDXHVnwg5Di","Mithoon, Arijit Singh","Tum Hi Ho","T-Series",42,63,204,"2025597"
62,"spotify:track:4OcvkkpF3xmyCGGY5IBlgi","Akhil Sachdeva, Tulsi Kumar","Tera Ban Jaunga (From ""Kabir Singh"")","T-Series",4,67,276,"1996849"
63,"spotify:track:0NXnuTqFQHDsbEIoKIAVCN","Josh Brar, Kinza Hashmi","Tere Bina Na Guzara E","Times Music – Speed Records",19,59,11,"1965117"
64,"spotify:track:0MTdYgTZ25sLCO6kVnDoje","Sai Abhyankkar, Sai Smriti","Aasa Kooda - From ""Think Indie""","Think Music",3,65,27,"1958607"
65,"spotify:track:5pPyvA03RKSJrAnnDcq0nh","Sachin-Jigar, Shreya Ghoshal, Tochi Raina","Saibo","Sony Music Entertainment India Pvt. Ltd.",31,60,217,"1958476"
66,"spotify:track:1d5lpW3gUyq537iuyrb9Lf","Aditya Rikhari","Samjho Na","CollabX Productions",23,49,88,"1957838"
67,"spotify:track:4Pow6acOGSaXcs6Gd05SP5","Jasleen Royal, B Praak, Romy","Ranjha","Sony Music Entertainment India Pvt. Ltd.",1,72,177,"1940235"
68,"spotify:track:0GQngE2rOYvlKwEQjTAsP8","Pritam, Sreeram, Shilpa Rao","Subhanallah","T-Series",41,66,90,"1934969"
69,"spotify:track:0FBQ4NrrHUbR9kus7rzrOj","Atif Aslam","Dil Diyan Gallan","YRF Music",53,55,254,"1917173"
70,"spotify:track:3CA9CjRf7IU2Ukz3GuYInP","Anirudh Ravichander, Malaysia Vasudevan, Deepthi Suresh, Yugendran Vasudevan","Manasilaayo","Sony Music Entertainment India Pvt. Ltd.",7,89,16,"1903599"
71,"spotify:track:7m4CgL81VVIHaaiSxyH922","Yo Yo Honey Singh","Desi Kalakaar","T-Series",13,88,49,"1902094"
72,"spotify:track:6mTvwBzWTGDOVeCNQEqtOE","Amaal Mallik, Arijit Singh, Tulsi Kumar","Soch Na Sake","T-Series",46,75,104,"1894809"
73,"spotify:track:5xlYVZxEwriP6hetG7QJw7","AP Dhillon","Old Money","AP Dhillon",13,79,19,"1868762"
74,"spotify:track:46ofwvDbks8GpQoLxGVD0o","Sublahshini, Devi Sri Prasad, Chandra Bose","Kissik (From ""Pushpa 2 The Rule"") [TELUGU]","T-Series",30,52,4,"1867124"
75,"spotify:track:1WxzZoWBTmB68AtyA6ejBB","Sohail Sen, Monali Thakur, Kausar Munir","Haan Ke Haan","YRF Music",9,69,21,"1864864"
76,"spotify:track:3FqtduiaqnFYvBgKuc6QWQ","Karan Aujla, Mxrci","Winning Speech","Karan Aujla",8,78,32,"1861637"
77,"spotify:track:4eBvRhTJ2AcxCsbfTUjoRp","Shubh","Cheques","SHUBH",1,68,83,"1852499"
78,"spotify:track:7aE1lfskJLMHQnzCCP1zsV","Akhil Sachdeva, Mansheel Gujral","Humsafar (From ""Badrinath Ki Dulhania"")","T-Series",78,95,49,"1849653"
79,"spotify:track:5zcfnScTSFGCHGY1yeXWke","Vishal-Shekhar, Kamal Khan","Ishq Sufiyana (Male)","T-Series",79,83,5,"1846967"
80,"spotify:track:6H7fLdt0AeWpuxUKXuXWrx","Hariharan","Shree Hanuman Chalisa","T-Series",39,71,124,"1834247"
81,"spotify:track:3xMHXmedL5Rvfxmiar9Ryv","Anirudh Ravichander, Arijit Singh, Shilpa Rao, Kumaar","Chaleya","T-Series",1,77,72,"1831473"
82,"spotify:track:0l6g8Z8mqGbGXFOjigYetD","Pritam, Arijit Singh","Hawayein","Sony Music Entertainment India Pvt. Ltd.",51,90,168,"1829076"
83,"spotify:track:3F3ZuXYFXGM1V6pk3b3zmi","Diljit Dosanjh, thiarajxtt","Kinni Kinni","DILJIT DOSANJH",24,86,59,"1824082"
84,"spotify:track:5thVzD79BxlDTYy0LfHzvu","Aparshakti Khurana, Savi Kahlon","Zaroor","Sony Music Entertainment India Pvt. Ltd.",13,74,21,"1819102"
85,"spotify:track:4UMIv5jd9gK98a39BQRD9X","Pritam, Arijit Singh, Amitabh Bhattacharya","Kesariya","Sony Music Entertainment India Pvt. Ltd.",1,87,128,"1816354"
86,"spotify:track:7wW9scVNLYFLsmBb1yAUmS","Yo Yo Honey Singh","Blue Eyes","T-Series",38,118,28,"1811554"
87,"spotify:track:1smFN2CLqGROu0J0UyvDfL","Pritam, Arijit Singh","Shayad","Sony Music Entertainment India Pvt. Ltd.",1,73,258,"1804075"
88,"spotify:track:2C6CJGFLbisteRuY6Plb7b","Danny, Avvy Sra, Sagar","Ve Haaniyaan","Dreamiyata Music",10,62,47,"1800997"
89,"spotify:track:52itZ0w0CydihB2JCZEIft","Pritam, Mohit Chauhan, Irshad Kamil","Pee Loon","T-Series",37,54,46,"1786271"
90,"spotify:track:48Ix6ReYdJf2H4mKb3TIpj","Atif Aslam, Alisha Chinai, Pritam","Tera Hone Laga Hoon","Tips Industries Ltd",33,70,189,"1786124"
91,"spotify:track:1tf2iody5iRLYYPDSBpzRc","Badshah, Arijit Singh","Soulmate","Universal Music India Pvt Ltd.",2,85,40,"1767314"
92,"spotify:track:1418IuVKQPTYqt7QNJ9RXN","King","Maan Meri Jaan","Warner Music India",1,76,115,"1766299"
93,"spotify:track:3yV2c3cYhkAwSsxAq6nRiv","Gajendra Verma","Mann Mera","Sony Music / Eros Now Music",26,92,193,"1756463"
94,"spotify:track:29m79w9xPMH4YCD6r8JSmV","AP Dhillon, Gurinder Gill, Intense","Excuses","RUN-UP RECORDS",1,94,166,"1752089"
95,"spotify:track:3ygfdwvBJ2Y5XhJiiHFFZE","Sachet Tandon","Maiyya Mainu","Zee Music Company",5,106,112,"1729015"
96,"spotify:track:4Tkb7zsDmsawB7S5TpKQV1","Atif Aslam, Shiraz Uppal","Pehli Dafa","T-Series",90,101,60,"1706817"
97,"spotify:track:3ZGJhN4unVspOqpwGvUL2W","Diljit Dosanjh","Lemonade","DILJIT DOSANJH",26,104,126,"1706137"
98,"spotify:track:5MrLQeEVCWueDR4XejhFNG","Devi Sri Prasad, Javed Ali, Shree Mani","Bujji Thalli (From ""Thandel"")","Aditya Music",80,81,4,"1701617"
99,"spotify:track:3HiobOOpSpMsi95WBKPBYk","Jeet Gannguli, Arijit Singh","Hamari Adhuri Kahani (Title Track)","Sony Music Entertainment India Pvt. Ltd.",56,93,163,"1690665"
100,"spotify:track:69Qzz3yyQSsA0T95jLDoPL","Gurnazar, Chet Singh","Dil Tu Jaan Tu","Mars Films / Jhankar Music",14,91,22,"1680794"
101,"spotify:track:1a1xLj9W8libnO9PvJf6ao","Sushin Shyam, Dabzee, Vinayak Sasikumar","Illuminati","Think Music",3,143,38,"1676618"
102,"spotify:track:1QZRCi2Z1DQQaR6bGAzhtN","Yo Yo Honey Singh","Love Dose","T-Series",32,126,33,"1659557"
103,"spotify:track:6egfWbtFFhMToV2DvmEzmo","Bunny, Hunny, Sagar","Tu Hain Toh (From ""Mr. And Mrs. Mahi"")","Sony Music Entertainment India Pvt. Ltd.",8,96,27,"1656962"
104,"spotify:track:3qrdLVOClRU4yPkcXZ7c5u","Ayushmann Khurrana, Tanishk-Vayu","Mere Liye Tum Kaafi Ho (From ""Shubh Mangal Zyada Saavdhan"")","T-Series",11,149,246,"1651800"
105,"spotify:track:4FeczSomVWVyU4FW7xDeAI","A.R. Rahman, Chinmayi, Murtuza Khan, Qadir Khan","Tere Bina","Sony Music Entertainment India Pvt. Ltd.",103,103,19,"1650447"
106,"spotify:track:0gPgdRfB4jdGrlyXS0Vx78","Vishal-Shekhar, KK, Shilpa Rao, Anvita Dutt Guptan","Khuda Jaane","YRF Music",37,112,116,"1646775"
107,"spotify:track:4kaLkst9lT3sQ5Crgxs3ic","Ayushmann Khurrana, Rochak Kohli","Pani Da Rang - Male Vocals","Eros Now Music",68,141,40,"1641375"
108,"spotify:track:5sUSbJo0brScvv48ZZ1HrQ","Atif Aslam, Jyotica Tangri","O Meri Laila","Zee Music Company",16,100,35,"1637679"
109,"spotify:track:0tgVpDi06FyKpA1z0VMD4v","Ed Sheeran","Perfect","Atlantic Records UK",29,108,245,"1630681"
110,"spotify:track:37AGZMVr5V8mEMcCmGHroZ","Kailash Kher, Paresh Kamath, Naresh Kamath","Saiyyan","Sony Music Entertainment India Pvt. Ltd.",103,115,52,"1629694"
111,"spotify:track:5XeFesFbtLpXzIVDNQP22n","Arctic Monkeys","I Wanna Be Yours","Domino Recording Co",48,99,111,"1613030"
112,"spotify:track:6ygiy70ujkNOYXM1tQuMNe","Karan Aujla, Ikky, Preston Pablo","Admirin' You (feat. Preston Pablo)","WM Canada",24,119,73,"1604315"
113,"spotify:track:0UZLaEOSIc5kg0cc7eszqC","Vishal Mishra","Manjha","Desi Music Factory",16,84,135,"1600769"
114,"spotify:track:209QxKVJzh2FLUmZHpYs4m","Badshah, Karan Aujla, Hiten","God Damn","Universal Music India Pvt Ltd.",15,124,40,"1583717"
115,"spotify:track:6t9KM2EQD4H2KbrTgHGYf3","Sachin-Jigar, Jasmine Sandlas, Amitabh Bhattacharya","Taras - From ""Munjya""","Zee Music Company",38,105,28,"1580802"
116,"spotify:track:2HRqTpkrJO5ggZyyK6NPWz","Sabrina Carpenter","Espresso","Island Records",26,127,35,"1570286"
117,"spotify:track:73K33p4Vyz9koXGqmL5eFs","Sachet Tandon, Parampara Tandon, Kumaar, Sachet-Parampara","Malang Sajna","T-Series",4,82,101,"1568270"
118,"spotify:track:4wIWWEhbdgKAxhR68eE0Ye","Arijit Singh, Chinmayi","Mast Magan (From ""2 States"")","T-Series",45,114,201,"1567800"
119,"spotify:track:1UWacd8x8tPPwmrPB1MoBI","Pritam, Arijit Singh","Ae Dil Hai Mushkil Title Track","Sony Music Entertainment India Pvt. Ltd.",79,129,256,"1567231"
120,"spotify:track:46QbY78ha62aiu6gBgC7lS","Diljit Dosanjh","G.O.A.T.","FAMOUS STUDIOS INC",1,117,54,"1556767"
121,"spotify:track:2E5kZ1qnB7V9bcwBEKvZv8","Arijit Singh, Prasad S, Kunaal Vermaa","Kasturi (From ""Amar Prem Ki Prem Kahani"")","Times Music",65,109,10,"1555931"
122,"spotify:track:2oenSXLDbWVaaL7QjSGYj5","Diljit Dosanjh, Intense, Sultaan","Lalkara","DILJIT DOSANJH",22,111,64,"1540299"
123,"spotify:track:2We0kZg7AZaIMsrBkqp2SI","Thaman S, Diljit Dosanjh, Dhee, Irshad Kamil","Nain Matakka - From ""Baby John""","Zee Music Company",123,132,3,"1536180"
124,"spotify:track:2gKNWPBrI2IRBl2RRUtoEb","Shreya Ghoshal, Devi Sri Prasad, Chandra Bose","Sooseki (From ""Pushpa 2 The Rule"") [TELUGU]","T-Series",89,116,9,"1514575"
125,"spotify:track:72CkpVdvmc8t28o8I9N32J","Atif Aslam, Manoj Muntashir","Tere Sang Yaara","Zee Music Company",125,164,24,"1512096"
126,"spotify:track:4VsP4Dm8gsibRxB5I2hEkw","Kaifi Khalil","Kahani Suno 2.0","1944121 Records DK",1,125,106,"1510007"
127,"spotify:track:7KmCQLSSde0UX5OqCgvGN9","Karan Aujla","ANTIDOTE","Karan Aujla/Rehaan Records",32,154,26,"1506627"
128,"spotify:track:5nIrIdLPPXeRMl8WXnnDv1","Dhanda Nyoliwala","Knife Brows","FarArmy Productions",80,122,7,"1497969"
129,"spotify:track:54PRUdMOYzglMGnsg9kIta","Raghav Chaitanya, Manoj Muntashir, Pritam","Hua Main (From ""ANIMAL"")","T-Series",6,123,63,"1489333"
130,"spotify:track:36N5awamOX6XX5pQn3aFXZ","Darshan Raval, Jonita Gandhi, Rochak Kohli, Gurpreet Saini","Soni Soni (From ""Ishq Vishk Rebound"")","Tips Industries Ltd",4,128,30,"1480241"
131,"spotify:track:32765xcLM1fd6wQIpkN9A0","Ami Mishra, Kunaal Vermaa","Hasi - Male Version","Sony Music Entertainment India Pvt. Ltd.",77,110,78,"1479725"
132,"spotify:track:4BTPzhEsyW3blWcxcuhLM0","Shankar-Ehsaan-Loy, Shankar Mahadevan, Caralisa Monteiro, Shafqat Amanat Ali","Mitwa","Sony Music Entertainment India Pvt. Ltd.",119,139,19,"1478442"
133,"spotify:track:2tjWCe2W7sgvS3C8NHcdtI","Akhil, Dhvani Bhanushali, Kunaal Vermaa, Abhijit Vaghani","Duniyaa (From ""Luka Chuppi"")","T-Series",1,121,305,"1475741"
134,"spotify:track:3E2alxlOoe5EURfec217Uu","Lothika, Sublahshini, Devi Sri Prasad, Raqueeb Alam","Kissik (From ""Pushpa 2 The Rule"") [HINDI]","T-Series",131,131,2,"1474817"
135,"spotify:track:4XTgFBxBHN6var1BzAgE1m","Maanu, Annural Khalid","Jhol","Giraffe Music",135,148,2,"1468509"
136,"spotify:track:3APdIdF8H0jsxSuGOqXedS","Rashid Ali","Kabhi Kabhi Aditi","T-Series",58,153,148,"1457885"
137,"spotify:track:7AAap8D4C4pTyNoMkM9vjG","Shankar-Ehsaan-Loy, Diljit Dosanjh","Ishq Di Baajiyaan","Sony Music Entertainment India Pvt. Ltd.",137,151,18,"1436828"
138,"spotify:track:5O2P9iiztwhomNh8xkR9lJ","One Direction","Night Changes","Syco Music",22,146,189,"1433027"
139,"spotify:track:6y5SuF4NxGkvwpAdqcAkD3","Pritam, Arijit Singh, Shreya Ghoshal, Shadab Faridi, Altamash Faridi, Amitabh Bhattacharya","Ve Kamleya","Saregama India Ltd",15,138,72,"1429673"
140,"spotify:track:7qiZfU4dY1lWllzX7mPBI3","Ed Sheeran","Shape of You","Atlantic Records UK",63,155,228,"1421638"
141,"spotify:track:4REtpfjRcdcC1uYfQrqfw7","Amaal Mallik, Shreya Ghoshal, Sameer Anjaan, Pritam","Ami Je Tomar 3.0","T-Series",47,130,7,"1419822"
142,"spotify:track:5pkOSmSeVo8RfC8555LRHT","Dhanda Nyoliwala","Up To U","FarArmy Productions",58,135,20,"1419336"
143,"spotify:track:32VAw8DL9ixX5XSW2VLcZ4","Parmish Verma, PARDHAAN, Desi Crew","Aam Jahe Munde","Parmish Verma Films",20,171,77,"1409862"
144,"spotify:track:1EZzUDV9IdzLVgmz7v86nx","Sunidhi Chauhan, Rusha & Blizza","AANKH","Warner Music India",144,-1,1,"1395584"
145,"spotify:track:5vGiuYFSGekGLgbxhV1rD5","Atif Aslam, Pritam","Tu Jaane Na","Tips Industries Ltd",71,136,169,"1391731"
146,"spotify:track:7CyPwkp0oE8Ro9Dd5CUDjW","The Weeknd, JENNIE, Lily-Rose Depp","One Of The Girls (with JENNIE, Lily Rose Depp)","XO / Republic Records",98,161,51,"1387765"
147,"spotify:track:7qchN9iUKSFijPsadG9m2w","Gajendra Verma","Tera Ghata","Virtual Planet Production Pvt. Ltd.",62,145,68,"1386212"
148,"spotify:track:0rlLBWFFTQiOWi963SH9bb","The Local Train","Choo Lo","The Local Train",49,137,79,"1385798"
149,"spotify:track:1fcCPXmH4vUzG6UQTTjZp5","Mithoon, Arijit Singh, Shashaa Tirupati","Phir Bhi Tumko Chaahunga","Zee Music Company",149,167,18,"1383496"
150,"spotify:track:6c4Po8zyQjB4cR5XgLhcGb","Prabh Singh, Jay Trak, Rooh Sandhu","9:45","Prabh Singh Official",9,156,77,"1378003"
151,"spotify:track:4bD9z9qa4qg9BhryvYWB7c","Pritam, Tochi Raina, Rekha Bhardwaj","Kabira","T-Series",31,140,276,"1377223"
152,"spotify:track:4r8JqkhpTb5tzSKKHnVJIJ","Vishal-Shekhar, Mohit Chauhan, Shekhar Ravjiani, Shruti Pathak","Tujhe Bhula Diya","T-Series",94,152,20,"1376899"
153,"spotify:track:72vuBPMhwFNlSYpTSf6fVD","Diljit Dosanjh, Sia, Greg Kurstin","Hass Hass","Warner Music India",5,133,57,"1368848"
154,"spotify:track:3bQsp4Vr9Rg4fNCx6HPOgX","Anuv Jain","Alag Aasmaan","Universal Music India Pvt. Ltd. (on behalf of Anuv Jain)",30,162,67,"1368287"
155,"spotify:track:4Dd5XLOdAAmURIZSLThPvH","Saindhavi, G. V. Prakash","Pirai Thedum","Gemini Audio/Gemini Entertainment & Mobile Media Services",107,107,3,"1365197"
156,"spotify:track:5Pqv6e52EWyqxeNyFYqDni","Kala Bhairava, Anirudh Ravichander, Ramajogayya Sastry","Ayudha Pooja [TELUGU]","T-Series",50,120,13,"1361943"
157,"spotify:track:2iNqdCchlUZEgjJbQyZf8T","Kailash Kher, Paresh Kamath, Naresh Kamath","Teri Deewani","Sony Music Entertainment India Pvt. Ltd.",145,198,21,"1355661"
158,"spotify:track:7bzR0C8NhnBA79iTXUCJ7o","Vishal Mishra","Jaanam (From ""Bad Newz"")","Saregama India Ltd",7,102,23,"1352275"
159,"spotify:track:1kDZSmw3mKQeAjcmPTLS3M","Pritam, Arijit Singh, Shreya Ghoshal, Amitabh Bhattacharya","Tum Kya Mile, Pt. 2","Saregama India Ltd",9,159,78,"1347308"
160,"spotify:track:2MvCNH9ua0CeOgUQfZf56z","Javed Ali","Guzarish","T-Series",148,178,11,"1341031"
161,"spotify:track:6uHuw5ynf6PFpJ2adWprxu","Dhibu Ninan Thomas, Gana Guna, Rokesh","Beer Song - From ""Diesel""","Think Music",161,186,3,"1337977"
162,"spotify:track:79hQvdTHNBkq2fp2ZrM8b2","Javed-Mohsin, Arijit Singh, Shreya Ghoshal, Kunaal Vermaa, Prashant Ingole","Pal","Sony Music Entertainment India Pvt. Ltd.",34,157,303,"1334070"
163,"spotify:track:5WXQbgwGwyauXOqswlEeQY","Tanishk Bagchi, Arijit Singh, Asees Kaur","Bolna (From ""Kapoor & Sons (Since 1921)"")","Sony Music Entertainment India Pvt. Ltd.",59,134,96,"1328391"
164,"spotify:track:4MU4Kfkd9EnkArK2ocQyqK","Arijit Singh, Harshdeep Kaur","Zaalima","Zee Music Company",78,-1,79,"1328014"
165,"spotify:track:7MXVkk9YMctZqd1Srtv4MB","The Weeknd, Daft Punk","Starboy","Universal Republic Records",12,165,178,"1327499"
166,"spotify:track:7Imk0IG6S5GA5iYWkjmMW5","Palak Muchhal, Arijit Singh","Chahun Main Ya Naa (From ""Aashiqui 2"")","T-Series",108,158,63,"1322204"
167,"spotify:track:1tCduDqB3J8r90FAxprLzO","Arko","Nazm Nazm","Zee Music Company",106,170,32,"1321400"
168,"spotify:track:4VosVUajzm6nzGlSb6nP3L","Parmish Verma, Paradox","Check It Out","SDA Studios",19,176,63,"1308014"
169,"spotify:track:1kTEGyqUJFgstwdgJFLqz1","Akashdeep Sengupta, Laqshay Kapoor, Kausar Munir, Suvarna Tiwari","Dil Se Dil Tak (From ""Bawaal"")","T-Series",38,144,33,"1299752"
170,"spotify:track:0loZn1c5heXie7OAtvK6nH","Jubin Nautiyal, Rocky - Shiv","Humnava Mere","T-Series",66,160,135,"1299310"
171,"spotify:track:5BKKKNwrebowaMoUdBaNby","King","Tu Aake Dekhle","Warner Music India",3,173,204,"1297768"
172,"spotify:track:6FjbAnaPRPwiP3sciEYctO","Pritam, Arijit Singh","Raabta","T-Series",41,185,116,"1297438"
173,"spotify:track:7G5wpuR61ABrT7R1snos7C","Pritam, Arijit Singh","Kalank - Title Track","Zee Music Company",5,-1,255,"1294479"
174,"spotify:track:5JCDVLwteSXuwVqjCa7SwH","Shankar-Ehsaan-Loy, Shreya Ghoshal, Javed Bashir, Yusuf Mohammed, Vajid Ali","O Rangrez","Sony Music Entertainment India Pvt. Ltd.",159,193,8,"1290142"
175,"spotify:track:6vuMdb0E8buJeSHArN3dXk","Amaal Mallik, Armaan Malik, Kunaal Vermaa","Chale Aana (From ""De De Pyaar De"")","T-Series",18,180,117,"1287880"
176,"spotify:track:7uNnlVit5qDvfOje0pqICF","Mohit Chauhan, Suzanne D'Mello","Tum Ho","T-Series",62,142,30,"1287422"
177,"spotify:track:18YHbIhrleUkKKj2DvEp79","Pritam, KK","Zara Sa","Sony Music Entertainment India Pvt. Ltd.",33,168,95,"1282124"
178,"spotify:track:0rMeOAvbQZ2RTG4B6L1M4p","Darshan Raval","Asal Mein","Indie Music Label",21,113,187,"1279782"
179,"spotify:track:1zzejMGRYKP5XOa3FmzXfa","Sai Abhyankkar","Katchi Sera - From ""Think Indie""","Think Music",6,200,45,"1277776"
180,"spotify:track:2ZDOzySC2g3YF1p26TPzBt","Shreya Ghoshal, Devi Sri Prasad, Raqueeb Alam","Angaaron (From ""Pushpa 2 The Rule"") [HINDI]","T-Series",37,192,10,"1272865"
181,"spotify:track:2Z6HgNji9cNlFLNORw6wDQ","Mansheel Gujral, Akhil Sachdeva","Channa Ve - From ""Bhoot - Part One: The Haunted Ship""","Zee Music Company",33,184,56,"1268585"
182,"spotify:track:6IR6mzRO60hnMjNoq8rCPE","Raghav, Tanishk Bagchi, Asees Kaur","Teri Baaton Mein Aisa Uljha Jiya Title Song (From ""Teri Baaton Mein Aisa Uljha Jiya"")","T-Series",5,195,45,"1267109"
183,"spotify:track:7mSzDKajY2wUtstQSLdzMK","Mohit Chauhan, Rochak Kohli","Rang Lageya","Saregama",35,181,76,"1260883"
184,"spotify:track:5KNuHsIeFtD0oukst77hBi","Roop Kumar Rathod","Maula Mere Maula","Saregama",135,194,23,"1259040"
185,"spotify:track:1EjxJHY9A6LMOlvyZdwDly","Pritam, Neeraj Shridhar","Tum Mile","Sony Music Entertainment India Pvt. Ltd.",177,190,4,"1258916"
186,"spotify:track:2tva3nN2kQhBjHMC7Zlty6","Javed Ali","Deewana Kar Raha Hai","T-Series",186,-1,1,"1249304"
