rank,uri,artist_names,track_name,source,peak_rank,previous_rank,weeks_on_chart,streams
1,"spotify:track:0eCajpR75pDW0r64U6hP2x","Anuv Jain","Jo Tum Mere Ho","Universal Music India Pvt. Ltd. (on behalf of Anuv Jain)",1,1,8,"10270928"
2,"spotify:track:5AnWrUzsrFgBvhn6dUElnr","Sachin-Jigar, Amitabh Bhattacharya, Madhubanti Bagchi, Divya Kumar","Aaj Ki Raat (From ""Stree 2"")","Saregama India Ltd",1,2,10,"6978469"
3,"spotify:track:1mQUEvGR7Sbt2OCz2gFrdx","Amitabh Bhattacharya, Sachin-Jigar, Pawan Singh, Simran Choudhary","Aayi Nai (From ""Stree 2"")","Saregama India Ltd",2,3,8,"5564408"
4,"spotify:track:1bxzr3JK05fMTcweGAZUHp","Shilpa Rao, Anirudh Ravichander, Ramajogayya Sastry","Chuttamalle (From ""Devara Part 1"")","T-Series",4,12,9,"5505465"
5,"spotify:track:78BWCd70D1X6LMkDZm1UoF","Yo Yo Honey Singh","Millionaire","T-Series",3,5,5,"4964354"
6,"spotify:track:5zCnGtCl5Ac5zlFHXaZmhy","Ram Sampath, Arijit Singh, Prashant Pandey","Sajni (From ""Laapataa Ladies"")","T-Series",1,4,22,"4871934"
7,"spotify:track:1hlbywc8Jhl1FFqJxAMabE","Faheem Abdullah, Rauhan Malik, Amir Ameer","Ishq","Artiste First",6,6,27,"4749498"
8,"spotify:track:7KB0zREYCrQU3refE5x0M3","Anirudh Ravichander, Malaysia Vasudevan, Deepthi Suresh, Yugendran Vasudevan","Manasilaayo (From ""Vettaiyan"")","Sony Music Entertainment India Pvt. Ltd.",7,7,4,"4641452"
9,"spotify:track:0TL0LFcwIBF5eX7arDIKxY","Anuv Jain","Husn","Universal Music India Pvt. Ltd. (on behalf of Anuv Jain)",1,9,44,"4478139"
10,"spotify:track:5Ggb9pKiKcr5vNV9v1e1vs","Varun Jain, Shilpa Rao, Sachin-Jigar, Amitabh Bhattacharya","Tumhare Hi Rahenge Hum","Saregama India Ltd",8,11,7,"3964094"
11,"spotify:track:25Nxyrng0Z3jC5Q0hAibpw","Karan Aujla","Tauba Tauba (From ""Bad Newz"")","Saregama India Ltd",1,8,13,"3725293"
12,"spotify:track:1o8YPl0hyGbpRcHplXNvsm","Vishal Mishra, Sachin-Jigar, Amitabh Bhattacharya","Khoobsurat (From ""Stree 2"")","Saregama India Ltd",5,10,7,"3611994"
13,"spotify:track:2Fv2injs4qAm8mJBGaxVKU","Arijit Singh, Mithoon","Tujhe Kitna Chahne Lage (From ""Kabir Singh"")","T-Series",2,14,279,"3484701"
14,"spotify:track:0xpeiTGSEchBhqrjDuIcSS","Dhibu Ninan Thomas, Vaikom Vijayalakshmi, Manu Manjith","Angu Vaana Konilu - From ""ARM""","Think Music",14,15,2,"3211651"
15,"spotify:track:0YQJoDL6f46J0n1rOVkpxJ","Karan Aujla, Ikky","Softly","WM Canada",4,21,59,"3210378"
16,"spotify:track:5thVzD79BxlDTYy0LfHzvu","Aparshakti Khurana, Savi Kahlon","Zaroor","Sony Music Entertainment India Pvt. Ltd.",13,13,9,"3131248"
17,"spotify:track:4XxfOvudrnBRdlgzEaq1sd","Diljit Dosanjh","Born to Shine","FAMOUS STUDIOS INC",17,18,66,"3077563"
18,"spotify:track:0XRb6eZE4dBIJdqwf1Mixu","Juss, MixSingh","Suniyan Suniyan","Mix It Up Studio",3,16,20,"3073687"
19,"spotify:track:7eQl3Yqv35ioqUfveKHitE","Pritam, Mohit Chauhan, Irshad Kamil","Tum Se Hi","T-Series",17,19,237,"3016666"
20,"spotify:track:1hA697u7e1jX2XM8sWA6Uy","Sachin-Jigar, Arijit Singh, Amitabh Bhattacharya","Apna Bana Le","Zee Music Company",1,26,67,"2976618"
21,"spotify:track:7yDHHVKLbvDmVw1XXhDDIO","Vishal Mishra, Raj Shekhar","Pehle Bhi Main","T-Series",1,28,44,"2973121"
22,"spotify:track:1WxzZoWBTmB68AtyA6ejBB","Sohail Sen, Monali Thakur, Kausar Munir","Haan Ke Haan","YRF Music",9,17,9,"2946473"
23,"spotify:track:5xlYVZxEwriP6hetG7QJw7","AP Dhillon","Old Money","AP Dhillon",13,20,7,"2931438"
24,"spotify:track:3yHyiUDJdz02FZ6jfUbsmY","Arijit Singh, Shreyas Puranik, Siddharth - Garima","Satranga (From ""ANIMAL"")","T-Series",2,23,49,"2893635"
25,"spotify:track:3WLJ7D5kh44K5eJ1NqZQ6W","Anuv Jain","Baarishein","Universal Music India Pvt. Ltd. (on behalf of Anuv Jain)",18,27,177,"2820902"
26,"spotify:track:69Qzz3yyQSsA0T95jLDoPL","Gurnazar, Chet Singh","Dil Tu Jaan Tu","Mars Films / Jhankar Music",14,25,10,"2714856"
27,"spotify:track:5sUSbJo0brScvv48ZZ1HrQ","Atif Aslam, Jyotica Tangri","O Meri Laila","Zee Music Company",16,24,23,"2668415"
28,"spotify:track:2ceeTJAzKy295Fm0VsaXtE","Sachin-Jigar, Raghav Chaitanya, Varun Jain, Indraneel","Tum Se (From ""Teri Baaton Mein Aisa Uljha Jiya"")","T-Series",10,30,34,"2620871"
29,"spotify:track:0MTdYgTZ25sLCO6kVnDoje","Sai Abhyankkar, Sai Smriti","Aasa Kooda - From ""Think Indie""","Think Music",3,29,15,"2620276"
30,"spotify:track:3zSSCPpLZ5Oc8nelhhGjKz","AUR","Tu hai kahan","Sony Music Entertainment",1,34,51,"2615873"
31,"spotify:track:7bzR0C8NhnBA79iTXUCJ7o","Vishal Mishra","Jaanam (From ""Bad Newz"")","Saregama India Ltd",7,22,12,"2560054"
32,"spotify:track:5npFBWhVs3VVlc0nY5xQMA","Sachin-Jigar, Arijit Singh","Tainu Khabar Nahi - From ""Munjya""","Zee Music Company",17,32,16,"2507203"
33,"spotify:track:2GXXZFUxYg2LvG8SR0byOE","Sachin-Jigar, Atif Aslam","Jeena Jeena","Eros Now Music",33,48,166,"2490663"
34,"spotify:track:3xMHXmedL5Rvfxmiar9Ryv","Anirudh Ravichander, Arijit Singh, Shilpa Rao, Kumaar","Chaleya","T-Series",1,35,60,"2467910"
35,"spotify:track:5ZLkihi6DVsHwDL3B8ym1t","Shubh","One Love","SHUBH",3,40,59,"2467888"
36,"spotify:track:7m4CgL81VVIHaaiSxyH922","Yo Yo Honey Singh","Desi Kalakaar","T-Series",13,37,37,"2453572"
37,"spotify:track:0M0ANKNzmM4Odd7FNKghzW","Mitraz","Akhiyaan Gulaab (From ""Teri Baaton Mein Aisa Uljha Jiya"")","T-Series",2,43,36,"2424621"
38,"spotify:track:1r6GbBLdtUK1Vl1IHT14wP","Mohammad Faiz, Jaani","Dekhha Tenu (From ""Mr. And Mrs. Mahi"")","Sony Music Entertainment India Pvt. Ltd.",2,36,20,"2423437"
39,"spotify:track:6bmmHeCvZI92pRiTHxEdTC","Pritam, Arijit Singh, Irshad Kamil","O Maahi","T-Series",4,33,42,"2399395"
40,"spotify:track:2PvaburAUlhNHxVhw5lvOq","Arijit Singh","Humdard (From ""Ek Villain"")","T-Series",28,38,220,"2392952"
41,"spotify:track:1a1xLj9W8libnO9PvJf6ao","Sushin Shyam, Dabzee, Vinayak Sasikumar","Illuminati","Think Music",3,49,26,"2362356"
42,"spotify:track:5PUXKVVVQ74C3gl5vKy9Li","Jasleen Royal, Arijit Singh, Dulquer Salmaan","Heeriye (feat. Arijit Singh)","Warner Music India",1,47,62,"2354933"
43,"spotify:track:45PA9lW7U5LYnlpGrdTyHY","Jasleen Royal, Ujjwal Kashyap","Sang Rahiyo (feat. Ujjwal Kashyap)","Warner Music India",21,42,30,"2345642"
44,"spotify:track:48Ix6ReYdJf2H4mKb3TIpj","Atif Aslam, Alisha Chinai, Pritam","Tera Hone Laga Hoon","Tips Industries Ltd",35,50,177,"2344689"
45,"spotify:track:0645eBDehHcqfiF15hscQV","Vishal Mishra, Rashmeet Kaur","Janiye (from the Netflix Film ""Chor Nikal Ke Bhaga"")","Netflix Music",5,39,65,"2328004"
46,"spotify:track:1eZefeDb8uOsjvcbl1fJrG","Diljit Dosanjh, Badshah, Raj Ranjodh","Naina (From ""Crew"")","Tips Industries Ltd",3,60,30,"2303852"
47,"spotify:track:3FqtduiaqnFYvBgKuc6QWQ","Karan Aujla, Mxrci","Winning Speech","Karan Aujla",8,46,20,"2292497"
48,"spotify:track:5pPyvA03RKSJrAnnDcq0nh","Sachin-Jigar, Shreya Ghoshal, Tochi Raina","Saibo","Sony Music Entertainment India Pvt. Ltd.",31,31,205,"2291366"
49,"spotify:track:1y1rQTkWmrZdJmjwuK07GC","Vishal Mishra, Manoj Muntashir","Kaise Hua (From ""Kabir Singh"")","T-Series",5,53,277,"2267108"
50,"spotify:track:36N5awamOX6XX5pQn3aFXZ","Darshan Raval, Jonita Gandhi, Rochak Kohli, Gurpreet Saini","Soni Soni (From ""Ishq Vishk Rebound"")","Tips Industries Ltd",4,41,18,"2250639"
51,"spotify:track:1d5lpW3gUyq537iuyrb9Lf","Aditya Rikhari","Samjho Na","CollabX Productions",46,52,76,"2218723"
52,"spotify:track:6b2WJDzGt5X8dYfpkWtvXW","Anirudh Ravichander, Ramajogayya Sastry","Fear Song (From ""Devara Part 1"") [Telugu]","T-Series",52,179,7,"2194741"
53,"spotify:track:0FBQ4NrrHUbR9kus7rzrOj","Atif Aslam","Dil Diyan Gallan","YRF Music",53,56,242,"2188986"
54,"spotify:track:4eBvRhTJ2AcxCsbfTUjoRp","Shubh","Cheques","SHUBH",1,55,71,"2159036"
55,"spotify:track:7Je0oWG9OjLhHEXd2eHsFF","Dhibu Ninan Thomas, K. S. Harisankar, Anila Rajeev","Kiliye - From ""ARM""","Think Music",55,65,2,"2147539"
56,"spotify:track:2tjWCe2W7sgvS3C8NHcdtI","Akhil, Dhvani Bhanushali, Kunaal Vermaa, Abhijit Vaghani","Duniyaa (From ""Luka Chuppi"")","T-Series",1,44,293,"2117588"
57,"spotify:track:56zZ48jdyY2oDXHVnwg5Di","Mithoon, Arijit Singh","Tum Hi Ho","T-Series",42,67,192,"2085397"
58,"spotify:track:0xN4nwgOWg59k0t94CJAj4","Yuvan Shankar Raja, Shenbagaraj, Velu, Sam, Narayanan Ravishankar","Matta (From ""The Greatest Of All Time"")","T-Series",29,45,4,"2084876"
59,"spotify:track:0rMeOAvbQZ2RTG4B6L1M4p","Darshan Raval","Asal Mein","Indie Music Label",21,51,175,"2082882"
60,"spotify:track:1QZRCi2Z1DQQaR6bGAzhtN","Yo Yo Honey Singh","Love Dose","T-Series",32,61,21,"2033689"
61,"spotify:track:3yV2c3cYhkAwSsxAq6nRiv","Gajendra Verma","Mann Mera","Sony Music / Eros Now Music",26,66,183,"1994582"
62,"spotify:track:0rlLBWFFTQiOWi963SH9bb","The Local Train","Choo Lo","The Local Train",49,63,67,"1987358"
63,"spotify:track:4Pow6acOGSaXcs6Gd05SP5","Jasleen Royal, B Praak, Romy","Ranjha","Sony Music Entertainment India Pvt. Ltd.",1,59,165,"1985622"
64,"spotify:track:0GQngE2rOYvlKwEQjTAsP8","Pritam, Sreeram, Shilpa Rao","Subhanallah","T-Series",54,62,78,"1975295"
65,"spotify:track:0gPgdRfB4jdGrlyXS0Vx78","Vishal-Shekhar, KK, Shilpa Rao, Anvita Dutt Guptan","Khuda Jaane","YRF Music",37,71,104,"1962088"
66,"spotify:track:0OA00aPt3BV10qeMIs3meW","Hanumankind, Kalmi","Big Dawgs","Universal Music India Pvt Ltd.",2,54,10,"1955815"
67,"spotify:track:2cPUB8EOT6AfJ8oxhyoNXL","Pritam, Javed Bashir","Ye Tune Kya Kiya","T-Series",64,74,33,"1952846"
68,"spotify:track:1smFN2CLqGROu0J0UyvDfL","Pritam, Arijit Singh","Shayad","Sony Music Entertainment India Pvt. Ltd.",1,69,246,"1947213"
69,"spotify:track:4UMIv5jd9gK98a39BQRD9X","Pritam, Arijit Singh, Amitabh Bhattacharya","Kesariya","Sony Music Entertainment India Pvt. Ltd.",1,68,116,"1911162"
70,"spotify:track:1tf2iody5iRLYYPDSBpzRc","Badshah, Arijit Singh","Soulmate","Universal Music India Pvt Ltd.",2,64,28,"1903763"
71,"spotify:track:2C6CJGFLbisteRuY6Plb7b","Danny, Avvy Sra, Sagar","Ve Haaniyaan","Dreamiyata Music",10,57,35,"1903377"
72,"spotify:track:2FCXQHugkoHE1K3tiDu8pu","Alka Yagnik, Arijit Singh","Agar Tum Saath Ho (From ""Tamasha"")","T-Series",4,73,279,"1902528"
73,"spotify:track:6egfWbtFFhMToV2DvmEzmo","Bunny, Hunny, Sagar","Tu Hain Toh (From ""Mr. And Mrs. Mahi"")","Sony Music Entertainment India Pvt. Ltd.",8,58,15,"1870545"
74,"spotify:track:62tJcdKJKBBGYbav0XHWAr","electronic kili, Vinayak Sasikumar","Eyy Banane - From ""Vaazha""","Think Music",74,95,3,"1863206"
75,"spotify:track:7KQdgW7QzNd9oPoCzjCU76","Shubh","Bandana","Shubh",8,76,27,"1856838"
76,"spotify:track:52itZ0w0CydihB2JCZEIft","Pritam, Mohit Chauhan, Irshad Kamil","Pee Loon","T-Series",63,75,34,"1854419"
77,"spotify:track:7wW9scVNLYFLsmBb1yAUmS","Yo Yo Honey Singh","Blue Eyes","T-Series",38,78,16,"1837888"
78,"spotify:track:5vGiuYFSGekGLgbxhV1rD5","Atif Aslam, Pritam","Tu Jaane Na","Tips Industries Ltd",73,84,157,"1826826"
79,"spotify:track:3ZGJhN4unVspOqpwGvUL2W","Diljit Dosanjh","Lemonade","DILJIT DOSANJH",26,70,114,"1812505"
80,"spotify:track:5Pqv6e52EWyqxeNyFYqDni","Kala Bhairava, Anirudh Ravichander, Ramajogayya Sastry","Ayudha Pooja [TELUGU]","T-Series",80,-1,1,"1779835"
81,"spotify:track:2IoZMG3RqiTmsy7Li3zGFg","Sachet Tandon, Parampara Tandon, Sachet-Parampara","Mere Sohneya (From ""Kabir Singh"")","T-Series",4,80,233,"1757124"
82,"spotify:track:1kDZSmw3mKQeAjcmPTLS3M","Pritam, Arijit Singh, Shreya Ghoshal, Amitabh Bhattacharya","Tum Kya Mile, Pt. 2","Saregama India Ltd",9,77,66,"1756631"
83,"spotify:track:5XeFesFbtLpXzIVDNQP22n","Arctic Monkeys","I Wanna Be Yours","Domino Recording Co",48,85,99,"1753065"
84,"spotify:track:1418IuVKQPTYqt7QNJ9RXN","King","Maan Meri Jaan","Warner Music India",1,83,103,"1750360"
85,"spotify:track:7acH6yiK56etufZpUIv1YW","Shubh","Be Mine","Shubh",61,81,13,"1730880"
86,"spotify:track:2RgvvnMwtP0R2OkVZmFvnV","KK","Ajab Si (From ""Om Shanti Om"")","T-Series",34,92,143,"1729792"
87,"spotify:track:3nKQrVVlwbAQSnFbgZWdN0","Avvy Sra, Karan Aujla, Jaani","White Brown Black","Universal Music India Pvt Ltd. – Distribution",29,89,94,"1725465"
88,"spotify:track:29YePgOxuPLfU7uZKxKf6w","Monali Thakur, Amit Trivedi","Sawaar Loon","T-Series",88,91,5,"1723704"
89,"spotify:track:3F3ZuXYFXGM1V6pk3b3zmi","Diljit Dosanjh, thiarajxtt","Kinni Kinni","DILJIT DOSANJH",24,90,47,"1713116"
90,"spotify:track:3APdIdF8H0jsxSuGOqXedS","Rashid Ali","Kabhi Kabhi Aditi","T-Series",58,87,136,"1707223"
91,"spotify:track:6H7fLdt0AeWpuxUKXuXWrx","Hariharan","Shree Hanuman Chalisa","T-Series",39,82,112,"1690288"
92,"spotify:track:6ygiy70ujkNOYXM1tQuMNe","Karan Aujla, Ikky, Preston Pablo","Admirin' You (feat. Preston Pablo)","WM Canada",24,104,61,"1673830"
93,"spotify:track:1hHrBEkN0JIaeFPegy4Xak","A.R. Rahman, Santhosh Narayanan, Shweta Mohan, Gana Kadhar","Water Packet (From ""Raayan"")","Sun Pictures",40,86,10,"1663585"
94,"spotify:track:0UZLaEOSIc5kg0cc7eszqC","Vishal Mishra","Manjha","Desi Music Factory",16,79,123,"1655337"
95,"spotify:track:5BKKKNwrebowaMoUdBaNby","King","Tu Aake Dekhle","Warner Music India",3,96,192,"1653245"
96,"spotify:track:73K33p4Vyz9koXGqmL5eFs","Sachet Tandon, Parampara Tandon, Kumaar, Sachet-Parampara","Malang Sajna","T-Series",4,112,89,"1649478"
97,"spotify:track:4VsP4Dm8gsibRxB5I2hEkw","Kaifi Khalil","Kahani Suno 2.0","1944121 Records DK",1,100,94,"1648208"
98,"spotify:track:3HiobOOpSpMsi95WBKPBYk","Jeet Gannguli, Arijit Singh","Hamari Adhuri Kahani (Title Track)","Sony Music Entertainment India Pvt. Ltd.",56,88,151,"1634320"
99,"spotify:track:6RUA84fCWd7hqtmofzU6l3","Nakash Aziz, AKASA, Anirudh Ravichander","Daavudi (From ""Devara Part 1"")","T-Series",99,148,3,"1633887"
100,"spotify:track:0loZn1c5heXie7OAtvK6nH","Jubin Nautiyal, Rocky - Shiv","Humnava Mere","T-Series",66,72,123,"1630901"
101,"spotify:track:29m79w9xPMH4YCD6r8JSmV","AP Dhillon, Gurinder Gill, Intense","Excuses","RUN-UP RECORDS",1,132,154,"1627257"
102,"spotify:track:3bQsp4Vr9Rg4fNCx6HPOgX","Anuv Jain","Alag Aasmaan","Universal Music India Pvt. Ltd. (on behalf of Anuv Jain)",30,97,55,"1613734"
103,"spotify:track:37AGZMVr5V8mEMcCmGHroZ","Kailash Kher, Paresh Kamath, Naresh Kamath","Saiyyan","Sony Music Entertainment India Pvt. Ltd.",103,117,40,"1612669"
104,"spotify:track:4bD9z9qa4qg9BhryvYWB7c","Pritam, Tochi Raina, Rekha Bhardwaj","Kabira","T-Series",31,108,264,"1611159"
105,"spotify:track:46QbY78ha62aiu6gBgC7lS","Diljit Dosanjh","G.O.A.T.","FAMOUS STUDIOS INC",1,99,42,"1557246"
106,"spotify:track:6fScgF2Y63ScU73nYju0ny","Atif Aslam, Arko","O Saathi","T-Series",58,123,114,"1539425"
107,"spotify:track:5WXQbgwGwyauXOqswlEeQY","Tanishk Bagchi, Arijit Singh, Asees Kaur","Bolna (From ""Kapoor & Sons (Since 1921)"")","Sony Music Entertainment India Pvt. Ltd.",59,101,84,"1527089"
108,"spotify:track:6c4Po8zyQjB4cR5XgLhcGb","Prabh Singh, Jay Trak, Rooh Sandhu","9:45","Prabh Singh Official",9,98,65,"1521625"
109,"spotify:track:4wIWWEhbdgKAxhR68eE0Ye","Arijit Singh, Chinmayi","Mast Magan (From ""2 States"")","T-Series",45,119,189,"1506484"
110,"spotify:track:6mTvwBzWTGDOVeCNQEqtOE","Amaal Mallik, Arijit Singh, Tulsi Kumar","Soch Na Sake","T-Series",46,102,92,"1506011"
111,"spotify:track:1UWacd8x8tPPwmrPB1MoBI","Pritam, Arijit Singh","Ae Dil Hai Mushkil Title Track","Sony Music Entertainment India Pvt. Ltd.",79,105,244,"1500238"
112,"spotify:track:4Tkb7zsDmsawB7S5TpKQV1","Atif Aslam, Shiraz Uppal","Pehli Dafa","T-Series",90,94,48,"1488406"
113,"spotify:track:6t9KM2EQD4H2KbrTgHGYf3","Sachin-Jigar, Jasmine Sandlas, Amitabh Bhattacharya","Taras - From ""Munjya""","Zee Music Company",38,106,16,"1482469"
114,"spotify:track:5Swyv8euhHEJu57t5qbGUs","Vishal Mishra","Aaj Bhi 2","Universal Music India Pvt Ltd.",114,-1,1,"1481843"
115,"spotify:track:7F8RNvTQlvbeBLeenycvN6","A.R. Rahman, Javed Ali, Mohit Chauhan","Kun Faya Kun","T-Series",60,124,130,"1466395"
116,"spotify:track:26elzgFl8tvajnDfeoY1YF","Darshan Raval, Prakriti Kakar","Mannat","Warner Music India",18,109,43,"1465594"
117,"spotify:track:6ivemTXTn27PwVjtd0oqDs","Anuv Jain","Gul","Universal Music India Pvt. Ltd. (on behalf of Anuv Jain)",76,114,49,"1462422"
118,"spotify:track:0l6g8Z8mqGbGXFOjigYetD","Pritam, Arijit Singh","Hawayein","Sony Music Entertainment India Pvt. Ltd.",51,134,156,"1462266"
119,"spotify:track:0tgVpDi06FyKpA1z0VMD4v","Ed Sheeran","Perfect","Atlantic Records UK",29,129,233,"1451382"
120,"spotify:track:3bmsaFp11I9pbicxzlStf3","Akshath","nadaaniyan","Universal Music India Pvt Ltd.",6,121,16,"1449150"
121,"spotify:track:7MXVkk9YMctZqd1Srtv4MB","The Weeknd, Daft Punk","Starboy","Universal Republic Records",12,118,166,"1441581"
122,"spotify:track:2IEhtVeM9TVql8fZdKdlo9","Atif Aslam, Chinmayi, Pritam","Main Rang Sharbaton Ka","Tips Industries Ltd",73,138,39,"1424519"
123,"spotify:track:5ivRSlOhVIXN2QMzqgsX0s","The Local Train","Aaoge Tum Kabhi","The Local Train",116,127,16,"1423788"
124,"spotify:track:7uNnlVit5qDvfOje0pqICF","Mohit Chauhan, Suzanne D'Mello","Tum Ho","T-Series",62,126,18,"1420693"
125,"spotify:track:0Jiaz0O4AqnJICa9PxHhaR","Darshan Raval","Mahiye Jinna Sohna","Warner Music India",2,130,67,"1416008"
126,"spotify:track:79hQvdTHNBkq2fp2ZrM8b2","Javed-Mohsin, Arijit Singh, Shreya Ghoshal, Kunaal Vermaa, Prashant Ingole","Pal","Sony Music Entertainment India Pvt. Ltd.",34,113,291,"1415466"
127,"spotify:track:3qrdLVOClRU4yPkcXZ7c5u","Ayushmann Khurrana, Tanishk-Vayu","Mere Liye Tum Kaafi Ho (From ""Shubh Mangal Zyada Saavdhan"")","T-Series",11,107,234,"1413421"
128,"spotify:track:4FeczSomVWVyU4FW7xDeAI","A.R. Rahman, Chinmayi, Murtuza Khan, Qadir Khan","Tere Bina","Sony Music Entertainment India Pvt. Ltd.",111,111,7,"1409199"
129,"spotify:track:5O2P9iiztwhomNh8xkR9lJ","One Direction","Night Changes","Syco Music",22,116,177,"1405633"
130,"spotify:track:6y5SuF4NxGkvwpAdqcAkD3","Pritam, Arijit Singh, Shreya Ghoshal, Shadab Faridi, Altamash Faridi, Amitabh Bhattacharya","Ve Kamleya","Saregama India Ltd",15,120,60,"1403425"
131,"spotify:track:7fW9J3EpVWVN1ouv0slAs0","KK","Kya Mujhe Pyar Hai (From ""Woh Lamhe"")","T-Series",42,125,87,"1395704"
132,"spotify:track:7tpuDHfin2ZewPYOHTi3Uw","Dabzee, Ribin Richard","Habibi Drip","Pauly Jr. Pictures",71,110,9,"1395004"
133,"spotify:track:2oenSXLDbWVaaL7QjSGYj5","Diljit Dosanjh, Intense, Sultaan","Lalkara","DILJIT DOSANJH",22,135,52,"1391632"
134,"spotify:track:2RelZc0EwHPsVwrW6B6taZ","Bombay the Artist, Charan","Vekh Sohneyaa - From ""Call Me Bae""","Sony Music Entertainment India Pvt. Ltd. / Amazon Seller Services Private Limited",122,122,2,"1365680"
135,"spotify:track:0snQrp1VaY5Pj1YIHRJpRJ","Aditya A","Chaand Baaliyan","Sony Music Entertainment India Pvt. Ltd.",2,133,137,"1351121"
136,"spotify:track:7CyPwkp0oE8Ro9Dd5CUDjW","The Weeknd, JENNIE, Lily-Rose Depp","One Of The Girls (with JENNIE, Lily Rose Depp)","XO / Republic Records",98,128,39,"1336939"
137,"spotify:track:5ouREJYZCYqwF0p7VeUtfH","Karan Aujla","IDK HOW","Karan Aujla/Rehaan Records",7,93,14,"1331362"
138,"spotify:track:2HRqTpkrJO5ggZyyK6NPWz","Sabrina Carpenter","Espresso","Island Records",26,115,23,"1326301"
139,"spotify:track:7Imk0IG6S5GA5iYWkjmMW5","Palak Muchhal, Arijit Singh","Chahun Main Ya Naa (From ""Aashiqui 2"")","T-Series",108,153,51,"1308861"
140,"spotify:track:610keNiNVTIkYD0CqeSerg","Cheema Y, Gur Sidhu","California Love","Brown Town Music",27,137,71,"1307998"
141,"spotify:track:7KmCQLSSde0UX5OqCgvGN9","Karan Aujla","ANTIDOTE","Karan Aujla/Rehaan Records",32,103,14,"1301982"
142,"spotify:track:32VAw8DL9ixX5XSW2VLcZ4","Parmish Verma, PARDHAAN, Desi Crew","Aam Jahe Munde","Parmish Verma Films",20,139,65,"1301145"
143,"spotify:track:4OcvkkpF3xmyCGGY5IBlgi","Akhil Sachdeva, Tulsi Kumar","Tera Ban Jaunga (From ""Kabir Singh"")","T-Series",4,140,264,"1298951"
144,"spotify:track:1hQia6rxgfM1ly2hE3StWp","Vishal-Shekhar, Shekhar Ravjiani, Salim Merchant, Neeti Mohan","Ishq Wala Love","Sony Music Entertainment India Pvt. Ltd.",100,152,74,"1289097"
145,"spotify:track:2iNqdCchlUZEgjJbQyZf8T","Kailash Kher, Paresh Kamath, Naresh Kamath","Teri Deewani","Sony Music Entertainment India Pvt. Ltd.",145,162,10,"1286460"
146,"spotify:track:1zzejMGRYKP5XOa3FmzXfa","Sai Abhyankkar","Katchi Sera - From ""Think Indie""","Think Music",6,186,35,"1280742"
147,"spotify:track:32765xcLM1fd6wQIpkN9A0","Ami Mishra, Kunaal Vermaa","Hasi - Male Version","Sony Music Entertainment India Pvt. Ltd.",77,143,66,"1279709"
148,"spotify:track:4kaLkst9lT3sQ5Crgxs3ic","Ayushmann Khurrana, Rochak Kohli","Pani Da Rang - Male Vocals","Eros Now Music",68,147,32,"1276809"
149,"spotify:track:1feANd8EfcDP5UqSvbheM3","Sachet Tandon, Sachet-Parampara","Bekhayali (From ""Kabir Singh"")","T-Series",1,142,247,"1275029"
150,"spotify:track:7qiZfU4dY1lWllzX7mPBI3","Ed Sheeran","Shape of You","Atlantic Records UK",63,-1,216,"1270445"
151,"spotify:track:6rFckZb1cuJYzsZiGHgqks","Karan Aujla, Ikky","52 Bars","Rehaan Records",12,176,19,"1263317"
152,"spotify:track:75IywzsrO67PjCrFHnA9tb","Anirudh Ravichander","Red Sea (From ""Devara Part 1"")","T-Series",152,-1,1,"1256918"
153,"spotify:track:1YMLgvsQdE27r30q0fsLeV","Arijit Singh","Tera Fitoor","Tips Industries Ltd",61,161,65,"1253143"
154,"spotify:track:72CkpVdvmc8t28o8I9N32J","Atif Aslam, Manoj Muntashir","Tere Sang Yaara","Zee Music Company",150,159,15,"1250572"
155,"spotify:track:5Tkf5CbtVYHA1SiKo1NrJE","Sachin-Jigar, Arijit Singh, Amitabha Bhattacharya","Phir Aur Kya Chahiye (From ""Zara Hatke Zara Bachke"")","Saregama",1,146,71,"1249225"
156,"spotify:track:72vuBPMhwFNlSYpTSf6fVD","Diljit Dosanjh, Sia, Greg Kurstin","Hass Hass","Warner Music India",5,157,45,"1249158"
157,"spotify:track:1dFrZr9eMUsFqeag04ClqD","Dhanda Nyoliwala","Russian Bandana","Universal Music India Pvt Ltd.",157,-1,1,"1247588"
158,"spotify:track:3h9UdkxpoUQxNqS8IeTC4Z","Anirudh Ravichander, Siddharth Basrur, Arivu","Hunter Vantaar (From ""Vettaiyan"")","Sony Music Entertainment India Pvt. Ltd.",158,-1,1,"1246830"
159,"spotify:track:5KNuHsIeFtD0oukst77hBi","Roop Kumar Rathod","Maula Mere Maula","Saregama",156,156,11,"1245151"
160,"spotify:track:209QxKVJzh2FLUmZHpYs4m","Badshah, Karan Aujla, Hiten","God Damn","Universal Music India Pvt Ltd.",15,155,28,"1242351"
161,"spotify:track:2eAvDnpXP5W0cVtiI0PUxV","Ruth B.","Dandelions","Columbia",14,136,141,"1238555"
162,"spotify:track:4r8JqkhpTb5tzSKKHnVJIJ","Vishal-Shekhar, Mohit Chauhan, Shekhar Ravjiani, Shruti Pathak","Tujhe Bhula Diya","T-Series",162,170,8,"1235778"
163,"spotify:track:61R3DMR4U2n25qgX9ryciJ","Yo Yo Honey Singh","Jatt Mehkma","T-Series",163,189,3,"1231395"
164,"spotify:track:6IR6mzRO60hnMjNoq8rCPE","Raghav, Tanishk Bagchi, Asees Kaur","Teri Baaton Mein Aisa Uljha Jiya Title Song (From ""Teri Baaton Mein Aisa Uljha Jiya"")","T-Series",5,171,35,"1230633"
165,"spotify:track:5W7DOVGQLTigu09afW7QMT","Sidhu Moose Wala","295","Sidhu Moose Wala",1,151,138,"1227204"
166,"spotify:track:1fcCPXmH4vUzG6UQTTjZp5","Mithoon, Arijit Singh, Shashaa Tirupati","Phir Bhi Tumko Chaahunga","Zee Music Company",160,160,6,"1225323"
167,"spotify:track:2plbrEY59IikOBgBGLjaoe","Lady Gaga, Bruno Mars","Die With A Smile","Interscope",167,-1,1,"1218950"
168,"spotify:track:6qtszUy5n1os6eLP337zZK","A.R. Rahman, Dhanush","Adangaatha Asuran (From ""Raayan"")","Sun Pictures",16,144,11,"1208460"
169,"spotify:track:2S6N9pbnkhQRyAx80HmF79","Mohammed Irfan","Banjaara (From ""Ek Villain"")","T-Series",146,178,33,"1201372"
170,"spotify:track:1BpvuKIG7jK5EiTp2tv5z8","Shubh","King Shit","SHUBH",5,185,39,"1199681"
171,"spotify:track:6EB454nVg2u6sbeCvWAPej","Sam C.S., Anirudh Ravichander, Shakthisree Gopalan","Yaanji - From ""Vikram Vedha""","Think Music",122,180,44,"1198278"
172,"spotify:track:5O932cZmzOZGOGZz9RHx20","Pritam, Arijit Singh","Khairiyat","T-Series",1,183,264,"1197603"
173,"spotify:track:7G5wpuR61ABrT7R1snos7C","Pritam, Arijit Singh","Kalank - Title Track","Zee Music Company",5,150,249,"1195127"
174,"spotify:track:4uK0M8AI6gyFmyzUneQpbi","A.R. Rahman, Arijit Singh, Shashaa Tirupati","Rait Zara Si (From ""Atrangi Re"")","T-Series",12,141,139,"1189386"
175,"spotify:track:0dJacN6K3mSGLE9p7QE0lO","KK","Beete Lamhein (From ""The Train"")","T-Series",75,168,26,"1182378"
176,"spotify:track:1FEiijYPJtyswChfcpv3p0","Lana Del Rey","Summertime Sadness","Polydor Records",137,-1,23,"1182216"
177,"spotify:track:5DgY6Ab0vpyUMKnY9ubFOF","Anirudh Ravichander, Super Subu","Hukum - Thalaivar Alappara","Sun Pictures",1,191,63,"1176937"
178,"spotify:track:3ygfdwvBJ2Y5XhJiiHFFZE","Sachet Tandon","Maiyya Mainu","Zee Music Company",5,177,100,"1165789"
179,"spotify:track:0ojpEubhy4JNeVftmVuiN7","Vishal Mishra, Armaan Malik","Pehla Pyaar","T-Series",11,167,175,"1164960"
180,"spotify:track:6GQK4G5o60E8YA18DGpAzv","Harshit Saxena","Hale Dil","T-Series",98,154,9,"1164611"
181,"spotify:track:2ZD4aIEepqZsdxPxLSuUhm","Pritam, Arijit Singh, Amitabh Bhattacharya, Nikhita Gandhi","Tere Pyaar Mein","T-Series",5,165,86,"1164505"
182,"spotify:track:54PRUdMOYzglMGnsg9kIta","Raghav Chaitanya, Manoj Muntashir, Pritam","Hua Main (From ""ANIMAL"")","T-Series",6,175,51,"1163032"
183,"spotify:track:11qnwt18ZckPqchzK2I3U7","Mithoon, Arijit Singh, Sayeed Quadri","Dil Jhoom","Zee Music Company",93,172,34,"1155063"
184,"spotify:track:0rk2X5TAhraBC5aCIXK2Rq","Jawad Ahmad, Shaarib Toshi, Arijit Singh, Shreya Ghoshal","Samjhawan","Sony Music Entertainment India Pvt. Ltd.",70,192,176,"1152500"
185,"spotify:track:18YHbIhrleUkKKj2DvEp79","Pritam, KK","Zara Sa","Sony Music Entertainment India Pvt. Ltd.",33,-1,83,"1152357"
186,"spotify:track:7AAap8D4C4pTyNoMkM9vjG","Shankar-Ehsaan-Loy, Diljit Dosanjh","Ishq Di Baajiyaan","Sony Music Entertainment India Pvt. Ltd.",153,174,10,"1144464"
187,"spotify:track:7tI8dRuH2Yc6RuoTjxo4dU","Jimin","Who","BIGHIT MUSIC",61,164,11,"1141948"
188,"spotify:track:1Es7AUAhQvapIcoh3qMKDL","The Weeknd, Playboi Carti","Timeless (feat. Playboi Carti)","XO / Republic Records",188,-1,1,"1141921"
189,"spotify:track:4BTPzhEsyW3blWcxcuhLM0","Shankar-Ehsaan-Loy, Shankar Mahadevan, Caralisa Monteiro, Shafqat Amanat Ali","Mitwa","Sony Music Entertainment India Pvt. Ltd.",169,169,10,"1137586"
