rank,uri,artist_names,track_name,source,peak_rank,previous_rank,weeks_on_chart,streams
1,"spotify:track:4ulroyDK6rN73nVkCkWhur","Jasleen Royal, Stebin Ben, Vijay Deverakonda, Radhikka Madan, Priya Saraiya, Aditya Sharma","Sahiba","Warner Music India",1,1,9,"7586260"
2,"spotify:track:3vCzLB6kS2lGcIpm1OOUsy","Anurag Saikia, Raj Shekhar, Romy, Amarabha Banerjee, Varun Jain, Madhubanti Bagchi, Mismatched - Cast","Ishq Hai","Netflix Music",1,2,6,"7181878"
3,"spotify:track:4vHRQnzGcKEtqsLH70tAms","Sachet-Parampara, Parampara Tandon, Kausar Munir","Raanjhan (From ""Do Patti"")","T-Series",2,4,14,"6386281"
4,"spotify:track:0eCajpR75pDW0r64U6hP2x","Anuv Jain","Jo Tum Mere Ho","Universal Music India Pvt. Ltd. (on behalf of Anuv Jain)",1,3,24,"6017678"
5,"spotify:track:2plbrEY59IikOBgBGLjaoe","Lady Gaga, Bruno Mars","Die With A Smile","Interscope",4,5,17,"5035845"
6,"spotify:track:1hlbywc8Jhl1FFqJxAMabE","Faheem Abdullah, Rauhan Malik, Amir Ameer","Ishq","Artiste First",2,6,43,"4830296"
7,"spotify:track:4d2jV5fmX6hbRwaRbY39dt","Karan Aujla","Wavy","Karan Aujla Music",4,9,10,"4045336"
8,"spotify:track:5AnWrUzsrFgBvhn6dUElnr","Sachin-Jigar, Amitabh Bhattacharya, Madhubanti Bagchi, Divya Kumar","Aaj Ki Raat (From ""Stree 2"")","Saregama India Ltd",1,8,26,"3966573"
9,"spotify:track:78BWCd70D1X6LMkDZm1UoF","Yo Yo Honey Singh","Millionaire","T-Series",3,7,21,"3866175"
10,"spotify:track:5zCnGtCl5Ac5zlFHXaZmhy","Ram Sampath, Arijit Singh, Prashant Pandey","Sajni (From ""Laapataa Ladies"")","T-Series",1,11,38,"3692016"
11,"spotify:track:1hA697u7e1jX2XM8sWA6Uy","Sachin-Jigar, Arijit Singh, Amitabh Bhattacharya","Apna Bana Le","Zee Music Company",1,10,83,"3592718"
12,"spotify:track:2Fv2injs4qAm8mJBGaxVKU","Arijit Singh, Mithoon","Tujhe Kitna Chahne Lage (From ""Kabir Singh"")","T-Series",2,15,295,"3304655"
13,"spotify:track:7eQl3Yqv35ioqUfveKHitE","Pritam, Mohit Chauhan, Irshad Kamil","Tum Se Hi","T-Series",13,17,253,"3255190"
14,"spotify:track:1dFrZr9eMUsFqeag04ClqD","Dhanda Nyoliwala","Russian Bandana","Universal Music India Pvt Ltd.",6,13,17,"3239254"
15,"spotify:track:76ZWOhRRQzmb4xMoZzTjJ9","Yo Yo Honey Singh, Paradox","Payal","T-Series",14,14,9,"3206226"
16,"spotify:track:1PALLCSlHwAI4upY3sMg8u","Aditya Rikhari, Tulsi Kumar, Lijo George-Dj Chetas","Jaana Samjho Na (From ""Bhool Bhulaiyaa 3"")","T-Series",9,12,12,"3146609"
17,"spotify:track:2ceeTJAzKy295Fm0VsaXtE","Sachin-Jigar, Raghav Chaitanya, Varun Jain, Indraneel","Tum Se (From ""Teri Baaton Mein Aisa Uljha Jiya"")","T-Series",10,19,50,"3018473"
18,"spotify:track:3be9ACTxtcL6Zm4vJRUiPG","yung kai","blue","BMG Rights Management (US) LLC",16,16,7,"2962617"
19,"spotify:track:2cPUB8EOT6AfJ8oxhyoNXL","Pritam, Javed Bashir","Ye Tune Kya Kiya","T-Series",19,24,49,"2949969"
20,"spotify:track:0TL0LFcwIBF5eX7arDIKxY","Anuv Jain","Husn","Universal Music India Pvt. Ltd. (on behalf of Anuv Jain)",1,20,60,"2769525"
21,"spotify:track:0YQJoDL6f46J0n1rOVkpxJ","Karan Aujla, Ikky","Softly","WM Canada",4,18,75,"2754419"
22,"spotify:track:3yHyiUDJdz02FZ6jfUbsmY","Arijit Singh, Shreyas Puranik, Siddharth - Garima","Satranga (From ""ANIMAL"")","T-Series",2,23,65,"2702082"
23,"spotify:track:45PA9lW7U5LYnlpGrdTyHY","Jasleen Royal, Ujjwal Kashyap","Sang Rahiyo (feat. Ujjwal Kashyap)","Warner Music India",21,25,46,"2675213"
24,"spotify:track:2PvaburAUlhNHxVhw5lvOq","Arijit Singh","Humdard (From ""Ek Villain"")","T-Series",24,30,236,"2673578"
25,"spotify:track:7yDHHVKLbvDmVw1XXhDDIO","Vishal Mishra, Raj Shekhar","Pehle Bhi Main","T-Series",1,26,60,"2651569"
26,"spotify:track:5npFBWhVs3VVlc0nY5xQMA","Sachin-Jigar, Arijit Singh","Tainu Khabar Nahi - From ""Munjya""","Zee Music Company",17,34,32,"2607718"
27,"spotify:track:1bxzr3JK05fMTcweGAZUHp","Shilpa Rao, Anirudh Ravichander, Ramajogayya Sastry","Chuttamalle (From ""Devara Part 1"")","T-Series",4,22,25,"2590393"
28,"spotify:track:1r6GbBLdtUK1Vl1IHT14wP","Mohammad Faiz, Jaani","Dekhha Tenu (From ""Mr. And Mrs. Mahi"")","Sony Music Entertainment India Pvt. Ltd.",2,27,36,"2581317"
29,"spotify:track:5FXMRdJjKq1BIX4e8Eg9mK","Vishal-Shekhar, KK","Ajab Si","T-Series",23,37,159,"2522673"
30,"spotify:track:2IoZMG3RqiTmsy7Li3zGFg","Sachet Tandon, Parampara Tandon, Sachet-Parampara","Mere Sohneya (From ""Kabir Singh"")","T-Series",4,31,249,"2517168"
31,"spotify:track:4wJ5Qq0jBN4ajy7ouZIV1c","ROSÉ, Bruno Mars","APT.","Atlantic Records",13,21,14,"2489539"
32,"spotify:track:6bmmHeCvZI92pRiTHxEdTC","Pritam, Arijit Singh, Irshad Kamil","O Maahi","T-Series",4,32,58,"2476847"
33,"spotify:track:25Nxyrng0Z3jC5Q0hAibpw","Karan Aujla","Tauba Tauba (From ""Bad Newz"")","Saregama India Ltd",1,29,29,"2464187"
34,"spotify:track:0GQngE2rOYvlKwEQjTAsP8","Pritam, Sreeram, Shilpa Rao","Subhanallah","T-Series",34,36,94,"2462402"
35,"spotify:track:1eZefeDb8uOsjvcbl1fJrG","Diljit Dosanjh, Badshah, Raj Ranjodh","Naina (From ""Crew"")","Tips Industries Ltd",3,35,46,"2456127"
36,"spotify:track:1mQUEvGR7Sbt2OCz2gFrdx","Amitabh Bhattacharya, Sachin-Jigar, Pawan Singh, Simran Choudhary","Aayi Nai (From ""Stree 2"")","Saregama India Ltd",2,28,24,"2396729"
37,"spotify:track:4XTgFBxBHN6var1BzAgE1m","Maanu, Annural Khalid","Jhol","Giraffe Music",37,57,6,"2386038"
38,"spotify:track:2GXXZFUxYg2LvG8SR0byOE","Sachin-Jigar, Atif Aslam","Jeena Jeena","Eros Now Music",29,43,176,"2379477"
39,"spotify:track:48Ix6ReYdJf2H4mKb3TIpj","Atif Aslam, Alisha Chinai, Pritam","Tera Hone Laga Hoon","Tips Industries Ltd",33,40,193,"2352960"
40,"spotify:track:0ibgjKZZ56aoelJ76o7OW9","Ramana Gogula, Madhupriya, Bheems Ceciroleo, Bhaskarabhatla","Godari Gattu Meedha (From ""Sankranthiki Vasthunam"")","T-Series",40,54,4,"2350490"
41,"spotify:track:1o8YPl0hyGbpRcHplXNvsm","Vishal Mishra, Sachin-Jigar, Amitabh Bhattacharya","Khoobsurat (From ""Stree 2"")","Saregama India Ltd",5,44,23,"2324909"
42,"spotify:track:3zSSCPpLZ5Oc8nelhhGjKz","AUR","Tu hai kahan","Sony Music Entertainment",1,45,67,"2268094"
43,"spotify:track:3WLJ7D5kh44K5eJ1NqZQ6W","Anuv Jain","Baarishein","Universal Music India Pvt. Ltd. (on behalf of Anuv Jain)",16,38,193,"2253872"
44,"spotify:track:5pPyvA03RKSJrAnnDcq0nh","Sachin-Jigar, Shreya Ghoshal, Tochi Raina","Saibo","Sony Music Entertainment India Pvt. Ltd.",31,49,221,"2245480"
45,"spotify:track:5PUXKVVVQ74C3gl5vKy9Li","Jasleen Royal, Arijit Singh, Dulquer Salmaan","Heeriye (feat. Arijit Singh)","Warner Music India",1,42,78,"2233364"
46,"spotify:track:6fScgF2Y63ScU73nYju0ny","Atif Aslam, Arko","O Saathi","T-Series",46,51,130,"2231003"
47,"spotify:track:4XxfOvudrnBRdlgzEaq1sd","Diljit Dosanjh","Born to Shine","FAMOUS STUDIOS INC",14,33,82,"2186045"
48,"spotify:track:5Ggb9pKiKcr5vNV9v1e1vs","Varun Jain, Shilpa Rao, Sachin-Jigar, Amitabh Bhattacharya","Tumhare Hi Rahenge Hum","Saregama India Ltd",8,68,23,"2183670"
49,"spotify:track:0XRb6eZE4dBIJdqwf1Mixu","Juss, MixSingh","Suniyan Suniyan","Mix It Up Studio",3,47,36,"2170765"
50,"spotify:track:2FCXQHugkoHE1K3tiDu8pu","Alka Yagnik, Arijit Singh","Agar Tum Saath Ho (From ""Tamasha"")","T-Series",4,61,295,"2162840"
51,"spotify:track:7DKWcqsUjsjBD56kbYvx50","Juss, MixSingh","Mera Mann","Times Music – Speed Records",12,41,7,"2153301"
52,"spotify:track:5VvkNZesG4T86mUULEG5Wp","Sachet-Parampara, Sachet Tandon, Parampara Tandon, Kausar Munir","Maiyya","T-Series",39,39,7,"2137099"
53,"spotify:track:72zHuDxFQTjbL51qJQSA7j","Jasleen Royal, B Praak, Romy","Ranjha (From ""Shershaah"")","Sony Music Entertainment India Pvt. Ltd.",1,46,181,"2133055"
54,"spotify:track:7aE1lfskJLMHQnzCCP1zsV","Akhil Sachdeva, Mansheel Gujral","Humsafar (From ""Badrinath Ki Dulhania"")","T-Series",52,52,53,"2111629"
55,"spotify:track:1y1rQTkWmrZdJmjwuK07GC","Vishal Mishra, Manoj Muntashir","Kaise Hua (From ""Kabir Singh"")","T-Series",5,50,293,"2087031"
56,"spotify:track:6H7fLdt0AeWpuxUKXuXWrx","Hariharan","Shree Hanuman Chalisa","T-Series",39,67,128,"2081830"
57,"spotify:track:4OcvkkpF3xmyCGGY5IBlgi","Akhil Sachdeva, Tulsi Kumar","Tera Ban Jaunga (From ""Kabir Singh"")","T-Series",4,60,280,"2041825"
58,"spotify:track:0M0ANKNzmM4Odd7FNKghzW","Mitraz","Akhiyaan Gulaab (From ""Teri Baaton Mein Aisa Uljha Jiya"")","T-Series",2,53,52,"2039634"
59,"spotify:track:5zcfnScTSFGCHGY1yeXWke","Vishal-Shekhar, Kamal Khan","Ishq Sufiyana (Male)","T-Series",59,72,9,"2029230"
60,"spotify:track:0FBQ4NrrHUbR9kus7rzrOj","Atif Aslam","Dil Diyan Gallan","YRF Music",53,64,258,"2018669"
61,"spotify:track:56zZ48jdyY2oDXHVnwg5Di","Mithoon, Arijit Singh","Tum Hi Ho","T-Series",42,63,208,"2007570"
62,"spotify:track:1UEbsf5kGEIcSMiWexOkrZ","Khushi TDT, Lash curry, Audiocrackerr","Victory Anthem","Sony Music Entertainment India Pvt. Ltd.",17,48,11,"1986370"
63,"spotify:track:7m4CgL81VVIHaaiSxyH922","Yo Yo Honey Singh","Desi Kalakaar","T-Series",13,58,53,"1977955"
64,"spotify:track:0645eBDehHcqfiF15hscQV","Vishal Mishra, Rashmeet Kaur","Janiye (from the Netflix Film ""Chor Nikal Ke Bhaga"")","Netflix Music",5,66,81,"1946203"
65,"spotify:track:6mTvwBzWTGDOVeCNQEqtOE","Amaal Mallik, Arijit Singh, Tulsi Kumar","Soch Na Sake","T-Series",46,74,108,"1942130"
66,"spotify:track:1EZzUDV9IdzLVgmz7v86nx","Sunidhi Chauhan, Rusha & Blizza","AANKH","Warner Music India",66,96,5,"1934635"
67,"spotify:track:5ZLkihi6DVsHwDL3B8ym1t","Shubh","One Love","SHUBH",3,55,75,"1929242"
68,"spotify:track:7wGgYAOMhhRObOGdWlJ9Hi","Talha Anjum, Umair","Departure Lane","Mass Appeal",68,82,3,"1906748"
69,"spotify:track:4Tkb7zsDmsawB7S5TpKQV1","Atif Aslam, Shiraz Uppal","Pehli Dafa","T-Series",69,75,64,"1903145"
70,"spotify:track:29m79w9xPMH4YCD6r8JSmV","AP Dhillon, Gurinder Gill, Intense","Excuses","RUN-UP RECORDS",1,69,170,"1895544"
71,"spotify:track:1WxzZoWBTmB68AtyA6ejBB","Sohail Sen, Monali Thakur, Kausar Munir","Haan Ke Haan","YRF Music",9,73,25,"1893241"
72,"spotify:track:3nKQrVVlwbAQSnFbgZWdN0","Avvy Sra, Karan Aujla, Jaani","White Brown Black","Universal Music India Pvt Ltd. – Distribution",29,65,110,"1874820"
73,"spotify:track:1LFNOKVaFVBFCiLwz8Ay4O","Kazinama, Musarrat Nazir","Ahista Ahista","Universal Music India Pvt Ltd.",73,173,2,"1873635"
74,"spotify:track:7KQdgW7QzNd9oPoCzjCU76","Shubh","Bandana","Shubh",8,70,43,"1872961"
75,"spotify:track:5KNuHsIeFtD0oukst77hBi","Roop Kumar Rathod","Maula Mere Maula","Saregama",75,78,27,"1872436"
76,"spotify:track:1smFN2CLqGROu0J0UyvDfL","Pritam, Arijit Singh","Shayad","Sony Music Entertainment India Pvt. Ltd.",1,71,262,"1860385"
77,"spotify:track:6uwfPoH4JwdtD9b4mjZeZz","Karan Aujla, Neha Kakkar, Jay Trak","Aaye Haaye (Feat. Nora Fatehi)","T-Series",32,59,7,"1842045"
78,"spotify:track:5MrLQeEVCWueDR4XejhFNG","Devi Sri Prasad, Javed Ali, Shree Mani","Bujji Thalli (From ""Thandel"")","Aditya Music",77,77,8,"1820927"
79,"spotify:track:3yV2c3cYhkAwSsxAq6nRiv","Gajendra Verma","Mann Mera","Sony Music / Eros Now Music",26,90,197,"1797998"
80,"spotify:track:5JCDVLwteSXuwVqjCa7SwH","Shankar-Ehsaan-Loy, Shreya Ghoshal, Javed Bashir, Yusuf Mohammed, Vajid Ali","O Rangrez","Sony Music Entertainment India Pvt. Ltd.",80,126,12,"1794977"
81,"spotify:track:2QophXhN2Ls2URfoPmiviC","Taaruk Raina, Mismatched - Cast","Kho Gaye","Netflix Music",8,62,55,"1789605"
82,"spotify:track:49KgyOphHcrubDxA3PaO55","Dhanda Nyoliwala","La La La","Universal Music India Pvt Ltd.",82,115,3,"1777847"
83,"spotify:track:37AGZMVr5V8mEMcCmGHroZ","Kailash Kher, Paresh Kamath, Naresh Kamath","Saiyyan","Sony Music Entertainment India Pvt. Ltd.",83,112,56,"1776429"
84,"spotify:track:3ygfdwvBJ2Y5XhJiiHFFZE","Sachet Tandon","Maiyya Mainu","Zee Music Company",5,79,116,"1775327"
85,"spotify:track:6egfWbtFFhMToV2DvmEzmo","Bunny, Hunny, Sagar","Tu Hain Toh (From ""Mr. And Mrs. Mahi"")","Sony Music Entertainment India Pvt. Ltd.",8,85,31,"1767277"
86,"spotify:track:6reHcXJekQ2csk0UazSBV1","Shankarr Babu Kandukoori, Laxmi Dasa, Devi Sri Prasad, Chandra Bose, Siju Thuravoor","Peelings (From ""Pushpa 2 The Rule"") [TELUGU]","T-Series",19,56,7,"1760890"
87,"spotify:track:5sUSbJo0brScvv48ZZ1HrQ","Atif Aslam, Jyotica Tangri","O Meri Laila","Zee Music Company",16,87,39,"1758473"
88,"spotify:track:2iNqdCchlUZEgjJbQyZf8T","Kailash Kher, Paresh Kamath, Naresh Kamath","Teri Deewani","Sony Music Entertainment India Pvt. Ltd.",88,150,25,"1747403"
89,"spotify:track:3jPLJbSL14oH6pcSLIaMGJ","Badshah, Sharvi Yadav","Morni","Saregama India Ltd",33,84,9,"1744146"
90,"spotify:track:0NXnuTqFQHDsbEIoKIAVCN","Josh Brar, Kinza Hashmi","Tere Bina Na Guzara E","Times Music – Speed Records",19,88,15,"1741622"
91,"spotify:track:3t3wsY5IdLVzB9WidegJSU","Atif Aslam, Shreya Ghoshal, Sachin-Jigar","Jeene Laga Hoon","Tips Industries Ltd",62,92,20,"1736525"
92,"spotify:track:6y5SuF4NxGkvwpAdqcAkD3","Pritam, Arijit Singh, Shreya Ghoshal, Shadab Faridi, Altamash Faridi, Amitabh Bhattacharya","Ve Kamleya","Saregama India Ltd",15,93,76,"1736041"
93,"spotify:track:4eBvRhTJ2AcxCsbfTUjoRp","Shubh","Cheques","SHUBH",1,81,87,"1734249"
94,"spotify:track:67oNO9GjcDn7NO08lg08jj","Achint, Arijit Singh, Anumita Nadesan, Varun Grover","Tenu Sang Rakhna (From ""Jigra"")","Saregama India Ltd",94,98,8,"1729214"
95,"spotify:track:1tf2iody5iRLYYPDSBpzRc","Badshah, Arijit Singh","Soulmate","Universal Music India Pvt Ltd.",2,80,44,"1721085"
96,"spotify:track:3HiobOOpSpMsi95WBKPBYk","Jeet Gannguli, Arijit Singh","Hamari Adhuri Kahani (Title Track)","Sony Music Entertainment India Pvt. Ltd.",56,105,167,"1711663"
97,"spotify:track:4FeczSomVWVyU4FW7xDeAI","A.R. Rahman, Chinmayi, Murtuza Khan, Qadir Khan","Tere Bina","Sony Music Entertainment India Pvt. Ltd.",97,101,23,"1711548"
98,"spotify:track:0MTdYgTZ25sLCO6kVnDoje","Sai Abhyankkar, Sai Smriti","Aasa Kooda - From ""Think Indie""","Think Music",3,76,31,"1704617"
99,"spotify:track:52itZ0w0CydihB2JCZEIft","Pritam, Mohit Chauhan, Irshad Kamil","Pee Loon","T-Series",37,97,50,"1699797"
100,"spotify:track:0l6g8Z8mqGbGXFOjigYetD","Pritam, Arijit Singh","Hawayein","Sony Music Entertainment India Pvt. Ltd.",51,110,172,"1693943"
101,"spotify:track:5vGiuYFSGekGLgbxhV1rD5","Atif Aslam, Pritam","Tu Jaane Na","Tips Industries Ltd",71,111,173,"1691264"
102,"spotify:track:32765xcLM1fd6wQIpkN9A0","Ami Mishra, Kunaal Vermaa","Hasi - Male Version","Sony Music Entertainment India Pvt. Ltd.",77,125,82,"1689694"
103,"spotify:track:4bD9z9qa4qg9BhryvYWB7c","Pritam, Tochi Raina, Rekha Bhardwaj","Kabira","T-Series",31,108,280,"1679701"
104,"spotify:track:36N5awamOX6XX5pQn3aFXZ","Darshan Raval, Jonita Gandhi, Rochak Kohli, Gurpreet Saini","Soni Soni (From ""Ishq Vishk Rebound"")","Tips Industries Ltd",4,100,34,"1677258"
105,"spotify:track:1d5lpW3gUyq537iuyrb9Lf","Aditya Rikhari","Samjho Na","CollabX Productions",23,83,92,"1675495"
106,"spotify:track:1YMLgvsQdE27r30q0fsLeV","Arijit Singh","Tera Fitoor","Tips Industries Ltd",61,95,78,"1671587"
107,"spotify:track:4UMIv5jd9gK98a39BQRD9X","Pritam, Arijit Singh, Amitabh Bhattacharya","Kesariya","Sony Music Entertainment India Pvt. Ltd.",1,89,132,"1668183"
108,"spotify:track:209QxKVJzh2FLUmZHpYs4m","Badshah, Karan Aujla, Hiten","God Damn","Universal Music India Pvt Ltd.",15,107,44,"1665979"
109,"spotify:track:4kaLkst9lT3sQ5Crgxs3ic","Ayushmann Khurrana, Rochak Kohli","Pani Da Rang - Male Vocals","Eros Now Music",68,135,44,"1664755"
110,"spotify:track:6vuMdb0E8buJeSHArN3dXk","Amaal Mallik, Armaan Malik, Kunaal Vermaa","Chale Aana (From ""De De Pyaar De"")","T-Series",18,124,121,"1664074"
111,"spotify:track:69Qzz3yyQSsA0T95jLDoPL","Gurnazar, Chet Singh","Dil Tu Jaan Tu","Mars Films / Jhankar Music",14,103,26,"1644565"
112,"spotify:track:4BTPzhEsyW3blWcxcuhLM0","Shankar-Ehsaan-Loy, Shankar Mahadevan, Caralisa Monteiro, Shafqat Amanat Ali","Mitwa","Sony Music Entertainment India Pvt. Ltd.",106,118,23,"1642397"
113,"spotify:track:1UWacd8x8tPPwmrPB1MoBI","Pritam, Arijit Singh","Ae Dil Hai Mushkil Title Track","Sony Music Entertainment India Pvt. Ltd.",79,117,260,"1640370"
114,"spotify:track:1QZRCi2Z1DQQaR6bGAzhtN","Yo Yo Honey Singh","Love Dose","T-Series",32,99,37,"1625646"
115,"spotify:track:3xMHXmedL5Rvfxmiar9Ryv","Anirudh Ravichander, Arijit Singh, Shilpa Rao, Kumaar","Chaleya","T-Series",1,116,76,"1621261"
116,"spotify:track:5cgKosPPj5Cs9a2JQufUc1","Pritam, Arijit Singh","Ilahi","T-Series",113,113,4,"1617726"
117,"spotify:track:7wW9scVNLYFLsmBb1yAUmS","Yo Yo Honey Singh","Blue Eyes","T-Series",38,86,32,"1616190"
118,"spotify:track:73K33p4Vyz9koXGqmL5eFs","Sachet Tandon, Parampara Tandon, Kumaar, Sachet-Parampara","Malang Sajna","T-Series",4,91,105,"1608348"
119,"spotify:track:1418IuVKQPTYqt7QNJ9RXN","King","Maan Meri Jaan","Warner Music India",1,136,119,"1605388"
120,"spotify:track:1fcCPXmH4vUzG6UQTTjZp5","Mithoon, Arijit Singh, Shashaa Tirupati","Phir Bhi Tumko Chaahunga","Zee Music Company",120,141,22,"1603216"
121,"spotify:track:6t9KM2EQD4H2KbrTgHGYf3","Sachin-Jigar, Jasmine Sandlas, Amitabh Bhattacharya","Taras - From ""Munjya""","Zee Music Company",38,128,32,"1600323"
122,"spotify:track:5thVzD79BxlDTYy0LfHzvu","Aparshakti Khurana, Savi Kahlon","Zaroor","Sony Music Entertainment India Pvt. Ltd.",13,109,25,"1592701"
123,"spotify:track:1kDZSmw3mKQeAjcmPTLS3M","Pritam, Arijit Singh, Shreya Ghoshal, Amitabh Bhattacharya","Tum Kya Mile, Pt. 2","Saregama India Ltd",9,120,82,"1579422"
124,"spotify:track:7AAap8D4C4pTyNoMkM9vjG","Shankar-Ehsaan-Loy, Diljit Dosanjh","Ishq Di Baajiyaan","Sony Music Entertainment India Pvt. Ltd.",114,114,22,"1577417"
125,"spotify:track:4wIWWEhbdgKAxhR68eE0Ye","Arijit Singh, Chinmayi","Mast Magan (From ""2 States"")","T-Series",45,122,205,"1574571"
126,"spotify:track:5xlYVZxEwriP6hetG7QJw7","AP Dhillon","Old Money","AP Dhillon",13,94,23,"1562777"
127,"spotify:track:72CkpVdvmc8t28o8I9N32J","Atif Aslam, Manoj Muntashir","Tere Sang Yaara","Zee Music Company",125,133,28,"1555017"
128,"spotify:track:7G5wpuR61ABrT7R1snos7C","Pritam, Arijit Singh","Kalank - Title Track","Zee Music Company",5,147,259,"1549555"
129,"spotify:track:5nIrIdLPPXeRMl8WXnnDv1","Dhanda Nyoliwala","Knife Brows","FarArmy Productions",80,138,11,"1546094"
130,"spotify:track:6ygiy70ujkNOYXM1tQuMNe","Karan Aujla, Ikky, Preston Pablo","Admirin' You (feat. Preston Pablo)","WM Canada",24,144,77,"1546046"
131,"spotify:track:4RCd3Gdtt3dNedof64hqRD","Mohammed Irfan, Arijit Singh, Saim Bhat","Phir Mohabbat (From ""Murder 2"")","T-Series",131,139,36,"1544818"
132,"spotify:track:5Tkf5CbtVYHA1SiKo1NrJE","Sachin-Jigar, Arijit Singh, Amitabha Bhattacharya","Phir Aur Kya Chahiye (From ""Zara Hatke Zara Bachke"")","Saregama",1,134,85,"1537180"
133,"spotify:track:4VsP4Dm8gsibRxB5I2hEkw","Kaifi Khalil","Kahani Suno 2.0","1944121 Records DK",1,132,110,"1536841"
134,"spotify:track:5XeFesFbtLpXzIVDNQP22n","Arctic Monkeys","I Wanna Be Yours","Domino Recording Co",48,131,115,"1536497"
135,"spotify:track:2E5kZ1qnB7V9bcwBEKvZv8","Arijit Singh, Prasad S, Kunaal Vermaa","Kasturi (From ""Amar Prem Ki Prem Kahani"")","Times Music",65,119,14,"1534486"
136,"spotify:track:1x7WnbDSvM6Z1JhKArajv4","Masoom Sharma, Manjeet Mor, Chahal Saab, Vikash Rajana","2 Khatole","Tuffan Music",136,151,3,"1533103"
137,"spotify:track:3FqtduiaqnFYvBgKuc6QWQ","Karan Aujla, Mxrci","Winning Speech","Karan Aujla",8,137,36,"1525884"
138,"spotify:track:5ZjWYv5kOH1ywFmv5JjPNd","Sachin-Jigar, Shilpa Rao, Sachet Tandon, Priya Saraiya","Mere Mehboob","T-Series",29,129,16,"1521320"
139,"spotify:track:0UZLaEOSIc5kg0cc7eszqC","Vishal Mishra","Manjha","Desi Music Factory",16,102,139,"1508894"
140,"spotify:track:5a11x5PUFvJEadMRqtNtTr","Atif Aslam, Shreya Ghoshal, Sachin-Jigar","Piya O Re Piya","Tips Industries Ltd",114,164,6,"1502585"
141,"spotify:track:4r8JqkhpTb5tzSKKHnVJIJ","Vishal-Shekhar, Mohit Chauhan, Shekhar Ravjiani, Shruti Pathak","Tujhe Bhula Diya","T-Series",94,165,24,"1490242"
142,"spotify:track:4Qu8LlchmRCaPBKBArcNsA","Shankar-Ehsaan-Loy, Shafqat Amanat Ali","Tere Naina","Sony Music Entertainment India Pvt. Ltd.",142,175,2,"1485539"
143,"spotify:track:0loZn1c5heXie7OAtvK6nH","Jubin Nautiyal, Rocky - Shiv","Humnava Mere","T-Series",66,149,139,"1477791"
144,"spotify:track:79hQvdTHNBkq2fp2ZrM8b2","Javed-Mohsin, Arijit Singh, Shreya Ghoshal, Kunaal Vermaa, Prashant Ingole","Pal","Sony Music Entertainment India Pvt. Ltd.",34,142,307,"1451862"
145,"spotify:track:7CyPwkp0oE8Ro9Dd5CUDjW","The Weeknd, JENNIE, Lily-Rose Depp","One Of The Girls (with JENNIE, Lily Rose Depp)","XO / Republic Records",98,146,55,"1446654"
146,"spotify:track:3tgdOveYac7YMEAQD9sGLf","Vishal-Shekhar, Papon, Irshad Kamil","Bulleya","YRF Music",146,-1,2,"1443922"
147,"spotify:track:2S6N9pbnkhQRyAx80HmF79","Mohammed Irfan","Banjaara (From ""Ek Villain"")","T-Series",146,160,41,"1440995"
148,"spotify:track:1Es7AUAhQvapIcoh3qMKDL","The Weeknd, Playboi Carti","Timeless (feat. Playboi Carti)","XO / Republic Records",148,167,6,"1440233"
149,"spotify:track:4MU4Kfkd9EnkArK2ocQyqK","Arijit Singh, Harshdeep Kaur","Zaalima","Zee Music Company",78,161,83,"1439491"
150,"spotify:track:6GQK4G5o60E8YA18DGpAzv","Harshit Saxena","Hale Dil","T-Series",98,183,15,"1437571"
151,"spotify:track:2C6CJGFLbisteRuY6Plb7b","Danny, Avvy Sra, Sagar","Ve Haaniyaan","Dreamiyata Music",10,121,51,"1430436"
152,"spotify:track:0gPgdRfB4jdGrlyXS0Vx78","Vishal-Shekhar, KK, Shilpa Rao, Anvita Dutt Guptan","Khuda Jaane","YRF Music",37,172,120,"1428100"
153,"spotify:track:1tCduDqB3J8r90FAxprLzO","Arko","Nazm Nazm","Zee Music Company",106,143,36,"1411477"
154,"spotify:track:5WXQbgwGwyauXOqswlEeQY","Tanishk Bagchi, Arijit Singh, Asees Kaur","Bolna (From ""Kapoor & Sons (Since 1921)"")","Sony Music Entertainment India Pvt. Ltd.",59,152,100,"1407723"
155,"spotify:track:0KSOLEBixnBYIKNHF1VbzF","Atif Aslam, Hadiqa Kiani","Hona Tha Pyar","Tips Industries Ltd",155,-1,1,"1406735"
156,"spotify:track:7Imk0IG6S5GA5iYWkjmMW5","Palak Muchhal, Arijit Singh","Chahun Main Ya Naa (From ""Aashiqui 2"")","T-Series",108,168,67,"1402637"
157,"spotify:track:3F3ZuXYFXGM1V6pk3b3zmi","Diljit Dosanjh, thiarajxtt","Kinni Kinni","DILJIT DOSANJH",24,123,63,"1400220"
158,"spotify:track:5pkOSmSeVo8RfC8555LRHT","Dhanda Nyoliwala","Up To U","FarArmy Productions",58,174,24,"1395631"
159,"spotify:track:0Vh3jGxKhm9KxzQgnfnIV6","Anirudh Ravichander, Anthony Daasan, Arivu","Sawadeeka (From ""Vidaamuyarchi"")","Sony Music Entertainment India Pvt. Ltd.",159,200,2,"1392462"
160,"spotify:track:3CA9CjRf7IU2Ukz3GuYInP","Anirudh Ravichander, Malaysia Vasudevan, Deepthi Suresh, Yugendran Vasudevan","Manasilaayo","Sony Music Entertainment India Pvt. Ltd.",7,104,20,"1388795"
161,"spotify:track:18YHbIhrleUkKKj2DvEp79","Pritam, KK","Zara Sa","Sony Music Entertainment India Pvt. Ltd.",33,162,99,"1387463"
162,"spotify:track:0n6NBNUZQmH1KGRt5J9Nkq","Haricharan, Shweta Mohan, G. V. Prakash, Karthik Netha","Hey Minnale (From ""Amaran"")","Saregama India Ltd",10,106,15,"1384695"
163,"spotify:track:54PRUdMOYzglMGnsg9kIta","Raghav Chaitanya, Manoj Muntashir, Pritam","Hua Main (From ""ANIMAL"")","T-Series",6,159,67,"1383704"
164,"spotify:track:2tva3nN2kQhBjHMC7Zlty6","Javed Ali","Deewana Kar Raha Hai","T-Series",164,-1,2,"1383551"
165,"spotify:track:2HRqTpkrJO5ggZyyK6NPWz","Sabrina Carpenter","Espresso","Island Records",26,145,39,"1377982"
166,"spotify:track:1a1xLj9W8libnO9PvJf6ao","Sushin Shyam, Dabzee, Vinayak Sasikumar","Illuminati","Think Music",3,130,42,"1374604"
167,"spotify:track:7bzR0C8NhnBA79iTXUCJ7o","Vishal Mishra","Jaanam (From ""Bad Newz"")","Saregama India Ltd",7,163,27,"1372972"
168,"spotify:track:0tgVpDi06FyKpA1z0VMD4v","Ed Sheeran","Perfect","Atlantic Records UK",29,166,249,"1370808"
169,"spotify:track:2MvCNH9ua0CeOgUQfZf56z","Javed Ali","Guzarish","T-Series",148,171,15,"1370409"
170,"spotify:track:7MXVkk9YMctZqd1Srtv4MB","The Weeknd, Daft Punk","Starboy","Universal Republic Records",12,176,182,"1364896"
171,"spotify:track:0rk2X5TAhraBC5aCIXK2Rq","Jawad Ahmad, Shaarib Toshi, Arijit Singh, Shreya Ghoshal","Samjhawan","Sony Music Entertainment India Pvt. Ltd.",70,177,187,"1354251"
172,"spotify:track:3ZGJhN4unVspOqpwGvUL2W","Diljit Dosanjh","Lemonade","DILJIT DOSANJH",26,140,130,"1347483"
173,"spotify:track:2oenSXLDbWVaaL7QjSGYj5","Diljit Dosanjh, Intense, Sultaan","Lalkara","DILJIT DOSANJH",22,148,68,"1343920"
174,"spotify:track:0dJacN6K3mSGLE9p7QE0lO","KK","Beete Lamhein (From ""The Train"")","T-Series",75,178,42,"1343349"
175,"spotify:track:2IEhtVeM9TVql8fZdKdlo9","Atif Aslam, Chinmayi, Pritam","Main Rang Sharbaton Ka","Tips Industries Ltd",73,153,52,"1342251"
176,"spotify:track:3HFjh7QljnUCBLsoTwMuTj","Pritam, KK, Neelesh Misra","Kya Mujhe Pyar Hai","T-Series",42,-1,99,"1341984"
177,"spotify:track:4y2sSEDG8aP4nDyXWnmPjw","Masoom Sharma, Swara Verma, Dev Chouhan, Pooja Saxena","Blender","GSC Music",177,194,3,"1338753"
178,"spotify:track:7KmCQLSSde0UX5OqCgvGN9","Karan Aujla","ANTIDOTE","Karan Aujla/Rehaan Records",32,156,30,"1318974"
179,"spotify:track:0rMeOAvbQZ2RTG4B6L1M4p","Darshan Raval","Asal Mein","Indie Music Label",21,169,191,"1309935"
180,"spotify:track:2Z6HgNji9cNlFLNORw6wDQ","Mansheel Gujral, Akhil Sachdeva","Channa Ve - From ""Bhoot - Part One: The Haunted Ship""","Zee Music Company",33,199,60,"1308258"
181,"spotify:track:0rlLBWFFTQiOWi963SH9bb","The Local Train","Choo Lo","The Local Train",49,191,83,"1307582"
182,"spotify:track:5O2P9iiztwhomNh8xkR9lJ","One Direction","Night Changes","Syco Music",22,190,193,"1301589"
183,"spotify:track:1kTEGyqUJFgstwdgJFLqz1","Akashdeep Sengupta, Laqshay Kapoor, Kausar Munir, Suvarna Tiwari","Dil Se Dil Tak (From ""Bawaal"")","T-Series",38,179,37,"1300762"
184,"spotify:track:6FjbAnaPRPwiP3sciEYctO","Pritam, Arijit Singh","Raabta","T-Series",41,154,120,"1299514"
185,"spotify:track:1wnozUBSe7OMpmZiTPJC5j","A.R. Rahman, Javed Ali, KIRTI SAGATHIA, Pooja AV","Tum Tak","Sony Music Entertainment India Pvt. Ltd.",167,-1,14,"1294679"
186,"spotify:track:1BpvuKIG7jK5EiTp2tv5z8","Shubh","King Shit","SHUBH",5,186,55,"1293497"
