rank,uri,artist_names,track_name,source,peak_rank,previous_rank,weeks_on_chart,streams
194,"spotify:track:3LlkD3AvhsR2UMVavf5cL8","Neelkamal Singh, Kalpana, Om Jha","Maroon Color Sadiya - From ""Fasal""","Worldwide Records",98,159,8,"1017316"
195,"spotify:track:3eSm4iAkLsn3BeggfiQOH9","Gaurav Chatterji, Aasa Singh, Hansika Pareek, Hrishi Giridhar, Pratik Gangavane","Kaise Ab Kahein - From ""Gutar Gu""","Sikhya Entertainment Records",78,157,33,"1011223"
196,"spotify:track:6wkHR8cU4INbp145hngbQO","Sukha, Chani Nattan, Prodgk, Gurlez Akhtar","8 ASLE","SODHI MUSIC INC.",53,148,26,"1010912"
197,"spotify:track:0GQngE2rOYvlKwEQjTAsP8","Pritam, Sreeram, Shilpa Rao","Subhanallah","T-Series",107,169,67,"1010907"
198,"spotify:track:6EB454nVg2u6sbeCvWAPej","Sam C.S., Anirudh Ravichander, Shakthisree Gopalan","Yaanji - From ""Vikram Vedha""","Think Music",122,-1,34,"1010184"
199,"spotify:track:3FbZoPzEaUBOD84l1FwFEH","Darshan Raval","Mujhe Peene Do","Indie Music Label",56,194,51,"1006442"
200,"spotify:track:3hRV0jL3vUpRrcy398teAU","Lord Huron","The Night We Met","Play It Again Sam",200,-1,1,"1004974"
